ID,TITLE,THUMBNAIL1,THUMBNAIL2,THUMBNAIL3
X4mZeqiGbT0,Punch Needle | إبرة النفاش ✒️,https://i.ytimg.com/vi/X4mZeqiGbT0/default.jpg,https://i.ytimg.com/vi/X4mZeqiGbT0/mqdefault.jpg,https://i.ytimg.com/vi/X4mZeqiGbT0/hqdefault.jpg
wNIV3Cm4KNs,ZARA ve DİĞER MARKALARDA ÇOK PAHALI,https://i.ytimg.com/vi/wNIV3Cm4KNs/default.jpg,https://i.ytimg.com/vi/wNIV3Cm4KNs/mqdefault.jpg,https://i.ytimg.com/vi/wNIV3Cm4KNs/hqdefault.jpg
cNMIx-1Qkmc,"How to Sew Panties *** Patterns, Tips, NO fancy machines, and...",https://i.ytimg.com/vi/cNMIx-1Qkmc/default.jpg,https://i.ytimg.com/vi/cNMIx-1Qkmc/mqdefault.jpg,https://i.ytimg.com/vi/cNMIx-1Qkmc/hqdefault.jpg
zyVLlNZIAh0,안 입는 오리털 점퍼나 패딩을 버리지 마세요 2 | 제 말 믿고 그냥 보시죠.,https://i.ytimg.com/vi/zyVLlNZIAh0/default.jpg,https://i.ytimg.com/vi/zyVLlNZIAh0/mqdefault.jpg,https://i.ytimg.com/vi/zyVLlNZIAh0/hqdefault.jpg
zszv0UpEYMA,أقوى مشروع مربح 100% مع 3 أفكار وحيل للخياطة /نصائح وحيل خياطة مفيدة للغاية لجعل مشروعك أسهل,https://i.ytimg.com/vi/zszv0UpEYMA/default.jpg,https://i.ytimg.com/vi/zszv0UpEYMA/mqdefault.jpg,https://i.ytimg.com/vi/zszv0UpEYMA/hqdefault.jpg
4yZZbRB7hU8,MÓVEIS FEITOS COM ROUPA || CRIE MÓVEIS A PARTIR DE LIXO,https://i.ytimg.com/vi/4yZZbRB7hU8/default.jpg,https://i.ytimg.com/vi/4yZZbRB7hU8/mqdefault.jpg,https://i.ytimg.com/vi/4yZZbRB7hU8/hqdefault.jpg
1mC3NO0a4F0,DIY Fabric Face Mask with your Favorite outfit | Fabric Mask Sewing Tutorial..,https://i.ytimg.com/vi/1mC3NO0a4F0/default.jpg,https://i.ytimg.com/vi/1mC3NO0a4F0/mqdefault.jpg,https://i.ytimg.com/vi/1mC3NO0a4F0/hqdefault.jpg
d_q7GPj7ZO4,43 DICAS DE COSTURA QUE VÃO FACILITAR SUA VIDA  BORDADO A MÃO FÁCIL,https://i.ytimg.com/vi/d_q7GPj7ZO4/default.jpg,https://i.ytimg.com/vi/d_q7GPj7ZO4/mqdefault.jpg,https://i.ytimg.com/vi/d_q7GPj7ZO4/hqdefault.jpg
TvE7OZ3q0ac,[59] More Pretty Cell Phone Stand Ideas 📞📱🤙🤳😍😍😍 Resin Tutorial!!!,https://i.ytimg.com/vi/TvE7OZ3q0ac/default.jpg,https://i.ytimg.com/vi/TvE7OZ3q0ac/mqdefault.jpg,https://i.ytimg.com/vi/TvE7OZ3q0ac/hqdefault.jpg
AvGDRUsf0bs,못 입는 바지들을 버리지 못하는 이유 | 바지들 속에서 놀라운 작품이 탄생합니다. 기대하셔도 좋습니다.,https://i.ytimg.com/vi/AvGDRUsf0bs/default.jpg,https://i.ytimg.com/vi/AvGDRUsf0bs/mqdefault.jpg,https://i.ytimg.com/vi/AvGDRUsf0bs/hqdefault.jpg
zWEUhbJU7rY,33 IDEIAS DE TRANSFORMAÇÃO E RESTAURAÇÃO DE ROUPAS VELHAS EM NOVAS,https://i.ytimg.com/vi/zWEUhbJU7rY/default.jpg,https://i.ytimg.com/vi/zWEUhbJU7rY/mqdefault.jpg,https://i.ytimg.com/vi/zWEUhbJU7rY/hqdefault.jpg
HVW8w6yicBE,낡아서 못입는 브래지어를 버리지 마세요 2 | 지금 당장 꺼내보시죠. 놀라운 일이 벌어집니다.,https://i.ytimg.com/vi/HVW8w6yicBE/default.jpg,https://i.ytimg.com/vi/HVW8w6yicBE/mqdefault.jpg,https://i.ytimg.com/vi/HVW8w6yicBE/hqdefault.jpg
oqX-Aiuz3hs,"❤️Удивительные швейные трюки, которые мало кто знает🔥❤️",https://i.ytimg.com/vi/oqX-Aiuz3hs/default.jpg,https://i.ytimg.com/vi/oqX-Aiuz3hs/mqdefault.jpg,https://i.ytimg.com/vi/oqX-Aiuz3hs/hqdefault.jpg
dJY3IxGEw_c,"DIY Earmuffs – How To Make Oreo, M&M's and YouTube Earmuffs",https://i.ytimg.com/vi/dJY3IxGEw_c/default.jpg,https://i.ytimg.com/vi/dJY3IxGEw_c/mqdefault.jpg,https://i.ytimg.com/vi/dJY3IxGEw_c/hqdefault.jpg
C3kPQhtZ45E,DIY Paw Pillow – How To Make A Pillow Shaped Like A Paw Out Of Old T-shirts,https://i.ytimg.com/vi/C3kPQhtZ45E/default.jpg,https://i.ytimg.com/vi/C3kPQhtZ45E/mqdefault.jpg,https://i.ytimg.com/vi/C3kPQhtZ45E/hqdefault.jpg
5nVdRKbpApg,5 Great Sewing Tips And Tricks ! Best Great Sewing Tips And Tricks #18 #diy #tricks #,https://i.ytimg.com/vi/5nVdRKbpApg/default.jpg,https://i.ytimg.com/vi/5nVdRKbpApg/mqdefault.jpg,https://i.ytimg.com/vi/5nVdRKbpApg/hqdefault.jpg
rWMaWOKV8Q0,Great tips for sewing lover | Sewing tips and tricks | Essential sewing tips for easier life,https://i.ytimg.com/vi/rWMaWOKV8Q0/default.jpg,https://i.ytimg.com/vi/rWMaWOKV8Q0/mqdefault.jpg,https://i.ytimg.com/vi/rWMaWOKV8Q0/hqdefault.jpg
eQUtmLNgKW0,How To Create a T-shirt Design in PowerPoint 🔥Print Ready 🔥,https://i.ytimg.com/vi/eQUtmLNgKW0/default.jpg,https://i.ytimg.com/vi/eQUtmLNgKW0/mqdefault.jpg,https://i.ytimg.com/vi/eQUtmLNgKW0/hqdefault.jpg
pZ6NlvFfefY,Project No. 1 mask recycling,https://i.ytimg.com/vi/pZ6NlvFfefY/default.jpg,https://i.ytimg.com/vi/pZ6NlvFfefY/mqdefault.jpg,https://i.ytimg.com/vi/pZ6NlvFfefY/hqdefault.jpg
SusCN90kwZ4,Mascarilla con  filtro/Sin niebla en las gafas/2 formas de poner el elástico/PATRÓN EN 3 TALLAS,https://i.ytimg.com/vi/SusCN90kwZ4/default.jpg,https://i.ytimg.com/vi/SusCN90kwZ4/mqdefault.jpg,https://i.ytimg.com/vi/SusCN90kwZ4/hqdefault.jpg
MYUAfD2BDuo,🧵CUBREBOCAS de Tela BORDADO a Mano🧵 Paso a Paso (2021),https://i.ytimg.com/vi/MYUAfD2BDuo/default.jpg,https://i.ytimg.com/vi/MYUAfD2BDuo/mqdefault.jpg,https://i.ytimg.com/vi/MYUAfD2BDuo/hqdefault.jpg
D1RTM226MZY,👕Cómo Bordar una CAMISETA | CON y SIN Bastidor❗ (FÁCIL) Bordado a Mano para PRINCIPIANTES #09,https://i.ytimg.com/vi/D1RTM226MZY/default.jpg,https://i.ytimg.com/vi/D1RTM226MZY/mqdefault.jpg,https://i.ytimg.com/vi/D1RTM226MZY/hqdefault.jpg
HoztmfGqiA0,⭐ Awesome sewing techniques for beginners | Sewing tips and tricks for sewing lovers,https://i.ytimg.com/vi/HoztmfGqiA0/default.jpg,https://i.ytimg.com/vi/HoztmfGqiA0/mqdefault.jpg,https://i.ytimg.com/vi/HoztmfGqiA0/hqdefault.jpg
F0oyv-NnTYM,"New idea!! handbag pattern, easy making.",https://i.ytimg.com/vi/F0oyv-NnTYM/default.jpg,https://i.ytimg.com/vi/F0oyv-NnTYM/mqdefault.jpg,https://i.ytimg.com/vi/F0oyv-NnTYM/hqdefault.jpg
gSqJwH7Jsvs,⭐️ 12 amazing sewing tips and tricks for beginners | Sewing techniques no overlock machine no serger,https://i.ytimg.com/vi/gSqJwH7Jsvs/default.jpg,https://i.ytimg.com/vi/gSqJwH7Jsvs/mqdefault.jpg,https://i.ytimg.com/vi/gSqJwH7Jsvs/hqdefault.jpg
xcguLbdYst0,Cómo Hacer DISEÑOS  para SUBLIMACIÓN + Como Hacer Diseños para Playeras + Cómo Usar INKSCAPE??,https://i.ytimg.com/vi/xcguLbdYst0/default.jpg,https://i.ytimg.com/vi/xcguLbdYst0/mqdefault.jpg,https://i.ytimg.com/vi/xcguLbdYst0/hqdefault.jpg
UTQgiXff5gY,"Уникальный способ обработки горловины. Красиво невероятно, убедитесь сами!",https://i.ytimg.com/vi/UTQgiXff5gY/default.jpg,https://i.ytimg.com/vi/UTQgiXff5gY/mqdefault.jpg,https://i.ytimg.com/vi/UTQgiXff5gY/hqdefault.jpg
-qdM6f0QcZI,30 TRUQUES DE COSTURA para manter suas roupas organizadas,https://i.ytimg.com/vi/-qdM6f0QcZI/default.jpg,https://i.ytimg.com/vi/-qdM6f0QcZI/mqdefault.jpg,https://i.ytimg.com/vi/-qdM6f0QcZI/hqdefault.jpg
Hi5eT5Rv7Gk,✳️7 Clever Sewing Tips and Tricks / Sewing Technique for Beginners #37,https://i.ytimg.com/vi/Hi5eT5Rv7Gk/default.jpg,https://i.ytimg.com/vi/Hi5eT5Rv7Gk/mqdefault.jpg,https://i.ytimg.com/vi/Hi5eT5Rv7Gk/hqdefault.jpg
SXodsHD9UAQ,30+ SCARF HACKS TO MAKE YOUR LOOK FRESH,https://i.ytimg.com/vi/SXodsHD9UAQ/default.jpg,https://i.ytimg.com/vi/SXodsHD9UAQ/mqdefault.jpg,https://i.ytimg.com/vi/SXodsHD9UAQ/hqdefault.jpg
UOXNT42xLQ0,Cómo hacer PARCHES PARA ROPA / DIY Chilling Adventures Of Sabrina | Ame Mayén,https://i.ytimg.com/vi/UOXNT42xLQ0/default.jpg,https://i.ytimg.com/vi/UOXNT42xLQ0/mqdefault.jpg,https://i.ytimg.com/vi/UOXNT42xLQ0/hqdefault.jpg
lTFMfS5cyN4,Mascarilla/ cubre boca casero de tela  // face mask,https://i.ytimg.com/vi/lTFMfS5cyN4/default.jpg,https://i.ytimg.com/vi/lTFMfS5cyN4/mqdefault.jpg,https://i.ytimg.com/vi/lTFMfS5cyN4/hqdefault.jpg
hcRyJoPfG_E,작아져서 못입는 청바지가 명품이 됩니다. | 놀라실 준비하시고 보시죠.,https://i.ytimg.com/vi/hcRyJoPfG_E/default.jpg,https://i.ytimg.com/vi/hcRyJoPfG_E/mqdefault.jpg,https://i.ytimg.com/vi/hcRyJoPfG_E/hqdefault.jpg
_zIzy0sfA6I,🔥🔥🔥 New hot !!! How to make an Automatic Thread Trimming equipment in just 30 seconds,https://i.ytimg.com/vi/_zIzy0sfA6I/default.jpg,https://i.ytimg.com/vi/_zIzy0sfA6I/mqdefault.jpg,https://i.ytimg.com/vi/_zIzy0sfA6I/hqdefault.jpg
3Czs02ujd9w,⭐️ 4 very useful Sewing Tips from Straws that you should know #36,https://i.ytimg.com/vi/3Czs02ujd9w/default.jpg,https://i.ytimg.com/vi/3Czs02ujd9w/mqdefault.jpg,https://i.ytimg.com/vi/3Czs02ujd9w/hqdefault.jpg
Ds1ydkusHNU,COMO HACER  PAPA NOEL O SANTA /MUÑECOS NAVIDEÑOS,https://i.ytimg.com/vi/Ds1ydkusHNU/default.jpg,https://i.ytimg.com/vi/Ds1ydkusHNU/mqdefault.jpg,https://i.ytimg.com/vi/Ds1ydkusHNU/hqdefault.jpg
O8jWWdiJ0yc,Tas Karakter Hello Kitty dari Jerigen Plastik Bekas ! | Best Out Of Waste | Jerry Can Craft Ideas,https://i.ytimg.com/vi/O8jWWdiJ0yc/default.jpg,https://i.ytimg.com/vi/O8jWWdiJ0yc/mqdefault.jpg,https://i.ytimg.com/vi/O8jWWdiJ0yc/hqdefault.jpg
_y0-z1R8-Sc,Basic and complex intelligent sewing tips and tricks #21,https://i.ytimg.com/vi/_y0-z1R8-Sc/default.jpg,https://i.ytimg.com/vi/_y0-z1R8-Sc/mqdefault.jpg,https://i.ytimg.com/vi/_y0-z1R8-Sc/hqdefault.jpg
WGW50i4o2ow,🔥🔥🔥 Good sewing tip from beer cans #35,https://i.ytimg.com/vi/WGW50i4o2ow/default.jpg,https://i.ytimg.com/vi/WGW50i4o2ow/mqdefault.jpg,https://i.ytimg.com/vi/WGW50i4o2ow/hqdefault.jpg
_BfgLosJ3RQ,Tenía 21 meses cuando el MONSTRUO de su padre le hizo algo TERRIBLE - DOCUMENTAL - Ryan Lawrence,https://i.ytimg.com/vi/_BfgLosJ3RQ/default.jpg,https://i.ytimg.com/vi/_BfgLosJ3RQ/mqdefault.jpg,https://i.ytimg.com/vi/_BfgLosJ3RQ/hqdefault.jpg
RXJAmXbLS-0,DIY Sun Hat | How to make a Sun Hat EASY | Sun hat for women | Beginners project,https://i.ytimg.com/vi/RXJAmXbLS-0/default.jpg,https://i.ytimg.com/vi/RXJAmXbLS-0/mqdefault.jpg,https://i.ytimg.com/vi/RXJAmXbLS-0/hqdefault.jpg
lQVSas3P6Tk,TRANSFORMA TU ROPA VIEJA A NUEVA ❤️5 IDEAS - Tutoriales Belen,https://i.ytimg.com/vi/lQVSas3P6Tk/default.jpg,https://i.ytimg.com/vi/lQVSas3P6Tk/mqdefault.jpg,https://i.ytimg.com/vi/lQVSas3P6Tk/hqdefault.jpg
Xosey9kgEtQ,How to Make a Roman Blind : Handy Makes #01,https://i.ytimg.com/vi/Xosey9kgEtQ/default.jpg,https://i.ytimg.com/vi/Xosey9kgEtQ/mqdefault.jpg,https://i.ytimg.com/vi/Xosey9kgEtQ/hqdefault.jpg
M18QieSB6PI,"Decorando Nuestra Casa. Cuartos de niños. ""Persiana de tela"" 2/5",https://i.ytimg.com/vi/M18QieSB6PI/default.jpg,https://i.ytimg.com/vi/M18QieSB6PI/mqdefault.jpg,https://i.ytimg.com/vi/M18QieSB6PI/hqdefault.jpg
3dsctkC4nRc,"Cómo hacer un Store, Paso a Paso.Parte 1 de 2💕",https://i.ytimg.com/vi/3dsctkC4nRc/default.jpg,https://i.ytimg.com/vi/3dsctkC4nRc/mqdefault.jpg,https://i.ytimg.com/vi/3dsctkC4nRc/hqdefault.jpg
ge2VSQ4NzYY,Cómo hacer CORTINAS ROMANAS FALSAS - Fabiana Marquesini - 50,https://i.ytimg.com/vi/ge2VSQ4NzYY/default.jpg,https://i.ytimg.com/vi/ge2VSQ4NzYY/mqdefault.jpg,https://i.ytimg.com/vi/ge2VSQ4NzYY/hqdefault.jpg
G5GvZx_tQxw,#28 ACABADOS PERFECTOS SIN OVERLOCK/ 5 TÉCNICAS FÁCILES,https://i.ytimg.com/vi/G5GvZx_tQxw/default.jpg,https://i.ytimg.com/vi/G5GvZx_tQxw/mqdefault.jpg,https://i.ytimg.com/vi/G5GvZx_tQxw/hqdefault.jpg
xkvSXhxmZWc,COMO FAZER BOLSA TRANSPORTE PARA CACHORRO,https://i.ytimg.com/vi/xkvSXhxmZWc/default.jpg,https://i.ytimg.com/vi/xkvSXhxmZWc/mqdefault.jpg,https://i.ytimg.com/vi/xkvSXhxmZWc/hqdefault.jpg
SSdUFneuBk8,7 Cosas Que HAS USADO MAL Toda Tu Vida | DeToxoMoroxo,https://i.ytimg.com/vi/SSdUFneuBk8/default.jpg,https://i.ytimg.com/vi/SSdUFneuBk8/mqdefault.jpg,https://i.ytimg.com/vi/SSdUFneuBk8/hqdefault.jpg
_JLxSdcFLOw,Cómo hacer Pantuflas infantiles/IDEA de negocio/2 modelos/Tutorial de costura infantil con Luzkita,https://i.ytimg.com/vi/_JLxSdcFLOw/default.jpg,https://i.ytimg.com/vi/_JLxSdcFLOw/mqdefault.jpg,https://i.ytimg.com/vi/_JLxSdcFLOw/hqdefault.jpg
NIDvC9TqwUI,ARMADO DEL MANIQUI DE PERRITO,https://i.ytimg.com/vi/NIDvC9TqwUI/default.jpg,https://i.ytimg.com/vi/NIDvC9TqwUI/mqdefault.jpg,https://i.ytimg.com/vi/NIDvC9TqwUI/hqdefault.jpg
lEvpS7NcJb0,COMO HACER UN MANIQUI DE PERRITOS,https://i.ytimg.com/vi/lEvpS7NcJb0/default.jpg,https://i.ytimg.com/vi/lEvpS7NcJb0/mqdefault.jpg,https://i.ytimg.com/vi/lEvpS7NcJb0/hqdefault.jpg
kun9kL94PTU,Tapabocas o cubrebocas con gorra reciclando camisas viejas,https://i.ytimg.com/vi/kun9kL94PTU/default.jpg,https://i.ytimg.com/vi/kun9kL94PTU/mqdefault.jpg,https://i.ytimg.com/vi/kun9kL94PTU/hqdefault.jpg
kun9kL94PTU,Tapabocas o cubrebocas con gorra reciclando camisas viejas,https://i.ytimg.com/vi/kun9kL94PTU/default.jpg,https://i.ytimg.com/vi/kun9kL94PTU/mqdefault.jpg,https://i.ytimg.com/vi/kun9kL94PTU/hqdefault.jpg
3HbqKUgRhLg,MANUALIDADES CON TELAS PARISINA RECICLAJE  MANUALIDADES,https://i.ytimg.com/vi/3HbqKUgRhLg/default.jpg,https://i.ytimg.com/vi/3HbqKUgRhLg/mqdefault.jpg,https://i.ytimg.com/vi/3HbqKUgRhLg/hqdefault.jpg
82-sLpPTTXk,"DIY 2-en-1 Vestido para Perritas, PRACTICO para sesion de fotos, Coton de tulear",https://i.ytimg.com/vi/82-sLpPTTXk/default.jpg,https://i.ytimg.com/vi/82-sLpPTTXk/mqdefault.jpg,https://i.ytimg.com/vi/82-sLpPTTXk/hqdefault.jpg
BCveXSduF_o,HERMOSO VESTIDO PARA PERRITA Y GATITA 💞🐶😸❤,https://i.ytimg.com/vi/BCveXSduF_o/default.jpg,https://i.ytimg.com/vi/BCveXSduF_o/mqdefault.jpg,https://i.ytimg.com/vi/BCveXSduF_o/hqdefault.jpg
zNgMrndtXJY,TIP: COMO HACER ROPA FACIL PARA PERRO  | ANIMALTIME🐾,https://i.ytimg.com/vi/zNgMrndtXJY/default.jpg,https://i.ytimg.com/vi/zNgMrndtXJY/mqdefault.jpg,https://i.ytimg.com/vi/zNgMrndtXJY/hqdefault.jpg
yIsuVdcaw98,IDEAS  SOBRE VESTIDOS PRECIOSOS PARA MASCOTAS,https://i.ytimg.com/vi/yIsuVdcaw98/default.jpg,https://i.ytimg.com/vi/yIsuVdcaw98/mqdefault.jpg,https://i.ytimg.com/vi/yIsuVdcaw98/hqdefault.jpg
DHNSakGmSb8,MOLDE DE VESTIDO. N° 3 PARA PERRITA Y GATITA,https://i.ytimg.com/vi/DHNSakGmSb8/default.jpg,https://i.ytimg.com/vi/DHNSakGmSb8/mqdefault.jpg,https://i.ytimg.com/vi/DHNSakGmSb8/hqdefault.jpg
bWDoVZX5Pz0,VESTIDO para PERRITA SIN costuras !!!,https://i.ytimg.com/vi/bWDoVZX5Pz0/default.jpg,https://i.ytimg.com/vi/bWDoVZX5Pz0/mqdefault.jpg,https://i.ytimg.com/vi/bWDoVZX5Pz0/hqdefault.jpg
iBJ-NACVQi0,VESTIDO BRILLANTE PARA PERRITA 🐶💞❤👗,https://i.ytimg.com/vi/iBJ-NACVQi0/default.jpg,https://i.ytimg.com/vi/iBJ-NACVQi0/mqdefault.jpg,https://i.ytimg.com/vi/iBJ-NACVQi0/hqdefault.jpg
uHJrLhxCwgU,TABLA DE MEDIDAS 2-Ropitas de Mascotas con Tiras  en Cuello y Panza.,https://i.ytimg.com/vi/uHJrLhxCwgU/default.jpg,https://i.ytimg.com/vi/uHJrLhxCwgU/mqdefault.jpg,https://i.ytimg.com/vi/uHJrLhxCwgU/hqdefault.jpg
GZqpViRP1_g,"DIY Reciclando ropa humana para hacer un vestido de Perrita , Coton de tulear",https://i.ytimg.com/vi/GZqpViRP1_g/default.jpg,https://i.ytimg.com/vi/GZqpViRP1_g/mqdefault.jpg,https://i.ytimg.com/vi/GZqpViRP1_g/hqdefault.jpg
Qq-bGEjBx24,HERMOSO VESTIDO PARA PERRITA SUPER FACIL DE HACER 💕🐶❤,https://i.ytimg.com/vi/Qq-bGEjBx24/default.jpg,https://i.ytimg.com/vi/Qq-bGEjBx24/mqdefault.jpg,https://i.ytimg.com/vi/Qq-bGEjBx24/hqdefault.jpg
pkhTNBRijqA,Vestidos para mascotas.¡Hágalo fácil!  2ª parte - Costura.,https://i.ytimg.com/vi/pkhTNBRijqA/default.jpg,https://i.ytimg.com/vi/pkhTNBRijqA/mqdefault.jpg,https://i.ytimg.com/vi/pkhTNBRijqA/hqdefault.jpg
rjDjkUViu78,VESTIDO MASCOTA MODELO JEAN CANESU RUFFLE Y FALDA TUTU - ROPA PERRO GATO DOG CAT DRESS,https://i.ytimg.com/vi/rjDjkUViu78/default.jpg,https://i.ytimg.com/vi/rjDjkUViu78/mqdefault.jpg,https://i.ytimg.com/vi/rjDjkUViu78/hqdefault.jpg
vEUIxG57X7M,como hacer vestidos para perros pequeños,https://i.ytimg.com/vi/vEUIxG57X7M/default.jpg,https://i.ytimg.com/vi/vEUIxG57X7M/mqdefault.jpg,https://i.ytimg.com/vi/vEUIxG57X7M/hqdefault.jpg
jw06BD7vl8I,vestido para perrita muy facil,https://i.ytimg.com/vi/jw06BD7vl8I/default.jpg,https://i.ytimg.com/vi/jw06BD7vl8I/mqdefault.jpg,https://i.ytimg.com/vi/jw06BD7vl8I/hqdefault.jpg
1tMXJ6j2sug,Ropa para perritos taller de costura para principiantes,https://i.ytimg.com/vi/1tMXJ6j2sug/default.jpg,https://i.ytimg.com/vi/1tMXJ6j2sug/mqdefault.jpg,https://i.ytimg.com/vi/1tMXJ6j2sug/hqdefault.jpg
EqnaK-6yBaE,Patrón Vestido para Mascota | Paso a paso | Vestido 🐩 | Dos formas de realizarlo| Costura con Nad |,https://i.ytimg.com/vi/EqnaK-6yBaE/default.jpg,https://i.ytimg.com/vi/EqnaK-6yBaE/mqdefault.jpg,https://i.ytimg.com/vi/EqnaK-6yBaE/hqdefault.jpg
9Mly3I9Satk,COMO HACER UN TUTU PARA PERROS- DIY-MASCOTAS,https://i.ytimg.com/vi/9Mly3I9Satk/default.jpg,https://i.ytimg.com/vi/9Mly3I9Satk/mqdefault.jpg,https://i.ytimg.com/vi/9Mly3I9Satk/hqdefault.jpg
C86wFOGFKAE,COMO HACER ESTE LINDO VESTIDO ESTILO ESCOCES PARA PERRITA-DIY,https://i.ytimg.com/vi/C86wFOGFKAE/default.jpg,https://i.ytimg.com/vi/C86wFOGFKAE/mqdefault.jpg,https://i.ytimg.com/vi/C86wFOGFKAE/hqdefault.jpg
k1gdpTFowbY,MOLDE DE VESTIDO HERMOSO PARA PERRITA Y GATITA SUPER FÁCIL 💞🐶😸❤,https://i.ytimg.com/vi/k1gdpTFowbY/default.jpg,https://i.ytimg.com/vi/k1gdpTFowbY/mqdefault.jpg,https://i.ytimg.com/vi/k1gdpTFowbY/hqdefault.jpg
X-vUTGjIRyU,Como hacer vestido para tu perrita /curiosidades de gina/,https://i.ytimg.com/vi/X-vUTGjIRyU/default.jpg,https://i.ytimg.com/vi/X-vUTGjIRyU/mqdefault.jpg,https://i.ytimg.com/vi/X-vUTGjIRyU/hqdefault.jpg
CtvVqSJ6ywk,VESTIDO HERMOSO PARA PERRITA DIY,https://i.ytimg.com/vi/CtvVqSJ6ywk/default.jpg,https://i.ytimg.com/vi/CtvVqSJ6ywk/mqdefault.jpg,https://i.ytimg.com/vi/CtvVqSJ6ywk/hqdefault.jpg
7jybasGzbLY,Como montar e costurar Roupa de cachorro modelo básico. #Tutorial,https://i.ytimg.com/vi/7jybasGzbLY/default.jpg,https://i.ytimg.com/vi/7jybasGzbLY/mqdefault.jpg,https://i.ytimg.com/vi/7jybasGzbLY/hqdefault.jpg
sYWigmMNujw,MOLDE BASICO PARA PERRO Y GATO PASO A PASO (talla 1 ),https://i.ytimg.com/vi/sYWigmMNujw/default.jpg,https://i.ytimg.com/vi/sYWigmMNujw/mqdefault.jpg,https://i.ytimg.com/vi/sYWigmMNujw/hqdefault.jpg
DIBlPCkq0b4,VESTIDO SUPER LINDO PARA PERRITA Y GATITA,https://i.ytimg.com/vi/DIBlPCkq0b4/default.jpg,https://i.ytimg.com/vi/DIBlPCkq0b4/mqdefault.jpg,https://i.ytimg.com/vi/DIBlPCkq0b4/hqdefault.jpg
Xj4KPyHWTSE,ACCESORIOS PARA TU MASCOTA ♥ - Yuya,https://i.ytimg.com/vi/Xj4KPyHWTSE/default.jpg,https://i.ytimg.com/vi/Xj4KPyHWTSE/mqdefault.jpg,https://i.ytimg.com/vi/Xj4KPyHWTSE/hqdefault.jpg
39j1GCedDWU,como hacer vestidos para perritas,https://i.ytimg.com/vi/39j1GCedDWU/default.jpg,https://i.ytimg.com/vi/39j1GCedDWU/mqdefault.jpg,https://i.ytimg.com/vi/39j1GCedDWU/hqdefault.jpg
dYaw9bcRgBM,HAZ ROPA PARA TU PERRITO - FACIL,https://i.ytimg.com/vi/dYaw9bcRgBM/default.jpg,https://i.ytimg.com/vi/dYaw9bcRgBM/mqdefault.jpg,https://i.ytimg.com/vi/dYaw9bcRgBM/hqdefault.jpg
d7BJ-T3cORQ,MOLDE BÁSICO DE VESTIDO TALLA 0 -Con tiras en cuello y panza.,https://i.ytimg.com/vi/d7BJ-T3cORQ/default.jpg,https://i.ytimg.com/vi/d7BJ-T3cORQ/mqdefault.jpg,https://i.ytimg.com/vi/d7BJ-T3cORQ/hqdefault.jpg
_2lBFcT2gTE,VESTIDO MANGA RANGLAN TIPO POLERA PARA PERRITA,https://i.ytimg.com/vi/_2lBFcT2gTE/default.jpg,https://i.ytimg.com/vi/_2lBFcT2gTE/mqdefault.jpg,https://i.ytimg.com/vi/_2lBFcT2gTE/hqdefault.jpg
XglUG8Mxrck,CÓMO HACER ESTE LINDO VESTIDO PARA TU PERRITA-DIY,https://i.ytimg.com/vi/XglUG8Mxrck/default.jpg,https://i.ytimg.com/vi/XglUG8Mxrck/mqdefault.jpg,https://i.ytimg.com/vi/XglUG8Mxrck/hqdefault.jpg
E6-dXnQmeq8,Vestido de Princesa para Perrita talla 0 - Molde y Confección.,https://i.ytimg.com/vi/E6-dXnQmeq8/default.jpg,https://i.ytimg.com/vi/E6-dXnQmeq8/mqdefault.jpg,https://i.ytimg.com/vi/E6-dXnQmeq8/hqdefault.jpg
-7lr-6-sOMs,Vestido Con Manga Ranglan Para Perritos-DIY.,https://i.ytimg.com/vi/-7lr-6-sOMs/default.jpg,https://i.ytimg.com/vi/-7lr-6-sOMs/mqdefault.jpg,https://i.ytimg.com/vi/-7lr-6-sOMs/hqdefault.jpg
NufnDAwR_YA,"ESSE MODELO DE ROUPA PET, VOCÊS VÃO VENDER BEM/ MOLDE NA DESCRIÇÃO",https://i.ytimg.com/vi/NufnDAwR_YA/default.jpg,https://i.ytimg.com/vi/NufnDAwR_YA/mqdefault.jpg,https://i.ytimg.com/vi/NufnDAwR_YA/hqdefault.jpg
6buT0eH-5s0,"Vestido para Perrita Candy, Coton de tulear, traje, pintado a mano I Lorentix",https://i.ytimg.com/vi/6buT0eH-5s0/default.jpg,https://i.ytimg.com/vi/6buT0eH-5s0/mqdefault.jpg,https://i.ytimg.com/vi/6buT0eH-5s0/hqdefault.jpg
ne8cyMcSUhQ,Vestido Pet com babado super fácil ♡ parte 1 (Molde gratis),https://i.ytimg.com/vi/ne8cyMcSUhQ/default.jpg,https://i.ytimg.com/vi/ne8cyMcSUhQ/mqdefault.jpg,https://i.ytimg.com/vi/ne8cyMcSUhQ/hqdefault.jpg
Y08PhH2C3fU,Cómo Hacer Un Pañal Para Cachorros,https://i.ytimg.com/vi/Y08PhH2C3fU/default.jpg,https://i.ytimg.com/vi/Y08PhH2C3fU/mqdefault.jpg,https://i.ytimg.com/vi/Y08PhH2C3fU/hqdefault.jpg
t2KziARNuMU,Vestido para Pet com Molde e Passo a Passo,https://i.ytimg.com/vi/t2KziARNuMU/default.jpg,https://i.ytimg.com/vi/t2KziARNuMU/mqdefault.jpg,https://i.ytimg.com/vi/t2KziARNuMU/hqdefault.jpg
7bnpHIDrNB4,MOLDE BÁSICO DE VESTIDO  PARA PERRITA Y GATITA  PASO A PASO,https://i.ytimg.com/vi/7bnpHIDrNB4/default.jpg,https://i.ytimg.com/vi/7bnpHIDrNB4/mqdefault.jpg,https://i.ytimg.com/vi/7bnpHIDrNB4/hqdefault.jpg
VYxsGPrldqk,Vestido Elegante para Perrita. Con Medidas,https://i.ytimg.com/vi/VYxsGPrldqk/default.jpg,https://i.ytimg.com/vi/VYxsGPrldqk/mqdefault.jpg,https://i.ytimg.com/vi/VYxsGPrldqk/hqdefault.jpg
__rBZa1y0o0,COMO HACER UN VESTIDO PARA PERRITA 🐶,https://i.ytimg.com/vi/__rBZa1y0o0/default.jpg,https://i.ytimg.com/vi/__rBZa1y0o0/mqdefault.jpg,https://i.ytimg.com/vi/__rBZa1y0o0/hqdefault.jpg
BAqlGRnEi6w,VESTIDO HERMOSO PARA PERRITA 🐶💞,https://i.ytimg.com/vi/BAqlGRnEi6w/default.jpg,https://i.ytimg.com/vi/BAqlGRnEi6w/mqdefault.jpg,https://i.ytimg.com/vi/BAqlGRnEi6w/hqdefault.jpg
FR-oYOLjHGI,Vestido para Perrita Fácil y Rápido. Incluye Patrón.,https://i.ytimg.com/vi/FR-oYOLjHGI/default.jpg,https://i.ytimg.com/vi/FR-oYOLjHGI/mqdefault.jpg,https://i.ytimg.com/vi/FR-oYOLjHGI/hqdefault.jpg
AGz8-mWF8sw,Vestidos para mascotas. ¡Hágalo fácil!  1ª parte-Molde base.,https://i.ytimg.com/vi/AGz8-mWF8sw/default.jpg,https://i.ytimg.com/vi/AGz8-mWF8sw/mqdefault.jpg,https://i.ytimg.com/vi/AGz8-mWF8sw/hqdefault.jpg
NeAZ_hunjb4,MOLDE BÁSICO DE  VESTIDO PARA PERRITO PASO A PASO 🐶😺😍,https://i.ytimg.com/vi/NeAZ_hunjb4/default.jpg,https://i.ytimg.com/vi/NeAZ_hunjb4/mqdefault.jpg,https://i.ytimg.com/vi/NeAZ_hunjb4/hqdefault.jpg
ZJoAudNWEFc,como hacer ropa para perros facil,https://i.ytimg.com/vi/ZJoAudNWEFc/default.jpg,https://i.ytimg.com/vi/ZJoAudNWEFc/mqdefault.jpg,https://i.ytimg.com/vi/ZJoAudNWEFc/hqdefault.jpg
vEX-ODW1Zbg,como hacer una hermosa falda con gola rotonda al costado/how to draft a raffe skrit,https://i.ytimg.com/vi/vEX-ODW1Zbg/default.jpg,https://i.ytimg.com/vi/vEX-ODW1Zbg/mqdefault.jpg,https://i.ytimg.com/vi/vEX-ODW1Zbg/hqdefault.jpg
S8iRCf5yPb0,Patrón Básico para Perro Mediano 🐕 | TALLA M |  Paso a paso | Costura con Nad |,https://i.ytimg.com/vi/S8iRCf5yPb0/default.jpg,https://i.ytimg.com/vi/S8iRCf5yPb0/mqdefault.jpg,https://i.ytimg.com/vi/S8iRCf5yPb0/hqdefault.jpg
wrTDks44wbk,MOLDE PARA SUETER DE PERRO ♥ / molde para sweater para perro |  ANIMALTIME🐾,https://i.ytimg.com/vi/wrTDks44wbk/default.jpg,https://i.ytimg.com/vi/wrTDks44wbk/mqdefault.jpg,https://i.ytimg.com/vi/wrTDks44wbk/hqdefault.jpg
9byN2ELK3AU,"TUTORIAL, COMO HACER ROPA PARA PERRITOS (a medida, con moldes)",https://i.ytimg.com/vi/9byN2ELK3AU/default.jpg,https://i.ytimg.com/vi/9byN2ELK3AU/mqdefault.jpg,https://i.ytimg.com/vi/9byN2ELK3AU/hqdefault.jpg
liD95b8w2Z4,COMO HACER-CHALECO PECHERA PARA CHIHUAHUA -DIY,https://i.ytimg.com/vi/liD95b8w2Z4/default.jpg,https://i.ytimg.com/vi/liD95b8w2Z4/mqdefault.jpg,https://i.ytimg.com/vi/liD95b8w2Z4/hqdefault.jpg
SnWLtj9qt8w,Molde Base de Polo Talla 1 para mascotas-DIY.,https://i.ytimg.com/vi/SnWLtj9qt8w/default.jpg,https://i.ytimg.com/vi/SnWLtj9qt8w/mqdefault.jpg,https://i.ytimg.com/vi/SnWLtj9qt8w/hqdefault.jpg
9FWMZGQ5TsE,HAZ UN SUETER PARA TU MASCOTA SIN COSER ♥ / DIY SUETER PARA PERRO SIN COSTURAS | ANIMALTIME🐾,https://i.ytimg.com/vi/9FWMZGQ5TsE/default.jpg,https://i.ytimg.com/vi/9FWMZGQ5TsE/mqdefault.jpg,https://i.ytimg.com/vi/9FWMZGQ5TsE/hqdefault.jpg
KfQ_aiSHHZo,"MOLDE BASE PARA PERRITO YORSHIRE , CHIHUAHUA Y POMERANIA TALLA XS (00)",https://i.ytimg.com/vi/KfQ_aiSHHZo/default.jpg,https://i.ytimg.com/vi/KfQ_aiSHHZo/mqdefault.jpg,https://i.ytimg.com/vi/KfQ_aiSHHZo/hqdefault.jpg
sbpKrWFGyuk,"VARIAS FORMAS DE HACER COPAS DE BUSTO || Corset, Brasier O Blusa",https://i.ytimg.com/vi/sbpKrWFGyuk/default.jpg,https://i.ytimg.com/vi/sbpKrWFGyuk/mqdefault.jpg,https://i.ytimg.com/vi/sbpKrWFGyuk/hqdefault.jpg
e3Cj-4pm9TI,COMO HACER UN MOLDE O PATRÓN PARA PIJAMA DE PERRITOS.,https://i.ytimg.com/vi/e3Cj-4pm9TI/default.jpg,https://i.ytimg.com/vi/e3Cj-4pm9TI/mqdefault.jpg,https://i.ytimg.com/vi/e3Cj-4pm9TI/hqdefault.jpg
XnPAGMYiwQA,Molde Para Ropita de Mascotas.DIY.,https://i.ytimg.com/vi/XnPAGMYiwQA/default.jpg,https://i.ytimg.com/vi/XnPAGMYiwQA/mqdefault.jpg,https://i.ytimg.com/vi/XnPAGMYiwQA/hqdefault.jpg
N4BaTxZ9kd4,Ropita para perro :: Capa de Inviernos para Perritos :: Chuladas Creativas,https://i.ytimg.com/vi/N4BaTxZ9kd4/default.jpg,https://i.ytimg.com/vi/N4BaTxZ9kd4/mqdefault.jpg,https://i.ytimg.com/vi/N4BaTxZ9kd4/hqdefault.jpg
RbhnouNCBXU,MOLDE DE POLO BÁSICO PARA PERRITOS-DIY.,https://i.ytimg.com/vi/RbhnouNCBXU/default.jpg,https://i.ytimg.com/vi/RbhnouNCBXU/mqdefault.jpg,https://i.ytimg.com/vi/RbhnouNCBXU/hqdefault.jpg
NuI2gbILBiM,Patrón Capa para Mascota 🐕 | Paso a paso | Capa | ¿Cómo sacar medidas? | Costura con Nad |,https://i.ytimg.com/vi/NuI2gbILBiM/default.jpg,https://i.ytimg.com/vi/NuI2gbILBiM/mqdefault.jpg,https://i.ytimg.com/vi/NuI2gbILBiM/hqdefault.jpg
pkNfbmPR75o,Como hacer ropita para perros|Oli♡ con moldes que no se como hice,https://i.ytimg.com/vi/pkNfbmPR75o/default.jpg,https://i.ytimg.com/vi/pkNfbmPR75o/mqdefault.jpg,https://i.ytimg.com/vi/pkNfbmPR75o/hqdefault.jpg
wx8yt7xbYxQ,MOLDE DE CAPA PARA PERRITOS y progresión de talles,https://i.ytimg.com/vi/wx8yt7xbYxQ/default.jpg,https://i.ytimg.com/vi/wx8yt7xbYxQ/mqdefault.jpg,https://i.ytimg.com/vi/wx8yt7xbYxQ/hqdefault.jpg
