ID,TITLE,THUMBNAIL1,THUMBNAIL2,THUMBNAIL3
yT-Hq7J5Sk8,REVIEW MIRABELLA BB CUSHION UV PROTECTION || BISA NUTUPIN BEKAS JERAWAT DI MUKA??,https://i.ytimg.com/vi/yT-Hq7J5Sk8/default.jpg,https://i.ytimg.com/vi/yT-Hq7J5Sk8/mqdefault.jpg,https://i.ytimg.com/vi/yT-Hq7J5Sk8/hqdefault.jpg
xDwQOZRgaxE,REVIEW LIPSTICK ARTIS: JEDAR COSMETIC VS ROSSA BEAUTY || MANA YANG TERBAIK YA??,https://i.ytimg.com/vi/xDwQOZRgaxE/default.jpg,https://i.ytimg.com/vi/xDwQOZRgaxE/mqdefault.jpg,https://i.ytimg.com/vi/xDwQOZRgaxE/hqdefault.jpg
0axQB6DxA7E,Review & Swatches Bubah X Rossa Velvet Lipstick || Semua Shades Cocok Buat Warna Kulit Indonesia,https://i.ytimg.com/vi/0axQB6DxA7E/default.jpg,https://i.ytimg.com/vi/0axQB6DxA7E/mqdefault.jpg,https://i.ytimg.com/vi/0axQB6DxA7E/hqdefault.jpg
-XAMhkKX_j8,Battle Lipstick Jedar Cosmetic vs Rossa Beauty,https://i.ytimg.com/vi/-XAMhkKX_j8/default.jpg,https://i.ytimg.com/vi/-XAMhkKX_j8/mqdefault.jpg,https://i.ytimg.com/vi/-XAMhkKX_j8/hqdefault.jpg
9J21CFKiWUQ,REVIEW WARDAH HYDRA ROSE TONER & SERUM || UPDATE 2 MINGGU PEMAKAIAN!,https://i.ytimg.com/vi/9J21CFKiWUQ/default.jpg,https://i.ytimg.com/vi/9J21CFKiWUQ/mqdefault.jpg,https://i.ytimg.com/vi/9J21CFKiWUQ/hqdefault.jpg
ER4rlq1yQVs,"WAJIB COBA! PENGALAMAN BELI LIPSTIK DI JD.ID, BISA LANGSUNG COBAIN SHADE LIPSTIK!",https://i.ytimg.com/vi/ER4rlq1yQVs/default.jpg,https://i.ytimg.com/vi/ER4rlq1yQVs/mqdefault.jpg,https://i.ytimg.com/vi/ER4rlq1yQVs/hqdefault.jpg
DBfyua271h8,5 KESALAHAN PENGGUNAAN MAKEUP YANG SERING DILAKUKAN PEMULA! || TIPS MAKEUP NATURAL,https://i.ytimg.com/vi/DBfyua271h8/default.jpg,https://i.ytimg.com/vi/DBfyua271h8/mqdefault.jpg,https://i.ytimg.com/vi/DBfyua271h8/hqdefault.jpg
G-TaIu7Ws1c,"REVIEW KUTEK GISELLA ANASTASIA || MADAME GIE NAIL MOJI, HANYA 8 RIBU",https://i.ytimg.com/vi/G-TaIu7Ws1c/default.jpg,https://i.ytimg.com/vi/G-TaIu7Ws1c/mqdefault.jpg,https://i.ytimg.com/vi/G-TaIu7Ws1c/hqdefault.jpg
7z_LgUc-VJU,MIRABELLA MOISTURE MATTE LIPSTICK || REVIEW & SWATCH,https://i.ytimg.com/vi/7z_LgUc-VJU/default.jpg,https://i.ytimg.com/vi/7z_LgUc-VJU/mqdefault.jpg,https://i.ytimg.com/vi/7z_LgUc-VJU/hqdefault.jpg
83X7IbO0Bww,4 Aksesoris Perempuan yang Harus Dimiliki,https://i.ytimg.com/vi/83X7IbO0Bww/default.jpg,https://i.ytimg.com/vi/83X7IbO0Bww/mqdefault.jpg,https://i.ytimg.com/vi/83X7IbO0Bww/hqdefault.jpg
K1awMIbndE4,"REVIEW A'PIEU JUICY PANG TINT DAN MOUSSE TINT, BEDANYA APA YAA?",https://i.ytimg.com/vi/K1awMIbndE4/default.jpg,https://i.ytimg.com/vi/K1awMIbndE4/mqdefault.jpg,https://i.ytimg.com/vi/K1awMIbndE4/hqdefault.jpg
-MdQhWbgmfg,"4 REKOMENDASI KUTEK HALAL, BISA DIPAKAI BUAT SHOLAT!",https://i.ytimg.com/vi/-MdQhWbgmfg/default.jpg,https://i.ytimg.com/vi/-MdQhWbgmfg/mqdefault.jpg,https://i.ytimg.com/vi/-MdQhWbgmfg/hqdefault.jpg
ryn7sCUaGdY,"Review Viva Cosmetic Hand Sanitizer Spray, Beneran Bikin Tangan Nggak Kering?",https://i.ytimg.com/vi/ryn7sCUaGdY/default.jpg,https://i.ytimg.com/vi/ryn7sCUaGdY/mqdefault.jpg,https://i.ytimg.com/vi/ryn7sCUaGdY/hqdefault.jpg
Iml371JGW28,Review Apieu Juicy Pang Water Blusher,https://i.ytimg.com/vi/Iml371JGW28/default.jpg,https://i.ytimg.com/vi/Iml371JGW28/mqdefault.jpg,https://i.ytimg.com/vi/Iml371JGW28/hqdefault.jpg
fFFCva-uRD4,"CARA MEMBUAT LIPSTICK MATTE MENJADI GLOSSY, CUMA PAKAI PURE PAW PAW! || HACKS LIP GLOSS",https://i.ytimg.com/vi/fFFCva-uRD4/default.jpg,https://i.ytimg.com/vi/fFFCva-uRD4/mqdefault.jpg,https://i.ytimg.com/vi/fFFCva-uRD4/hqdefault.jpg
PET-prE649U,"TUTORIAL EYESHADOW NATURAL UNTUK PEMULA, CUMA PAKAI LIPSTIK DAN HIGHLIGHTER!",https://i.ytimg.com/vi/PET-prE649U/default.jpg,https://i.ytimg.com/vi/PET-prE649U/mqdefault.jpg,https://i.ytimg.com/vi/PET-prE649U/hqdefault.jpg
4LDuPsCIiVA,Makeover Color Hypnose Creamy Lip Matte Review & Swatches,https://i.ytimg.com/vi/4LDuPsCIiVA/default.jpg,https://i.ytimg.com/vi/4LDuPsCIiVA/mqdefault.jpg,https://i.ytimg.com/vi/4LDuPsCIiVA/hqdefault.jpg
in1dsavvuak,TIPS & CARA MENGGUNAKAN MASCARA YANG BENAR! || BULU MATA LENTIK TANPA EXTENSION!,https://i.ytimg.com/vi/in1dsavvuak/default.jpg,https://i.ytimg.com/vi/in1dsavvuak/mqdefault.jpg,https://i.ytimg.com/vi/in1dsavvuak/hqdefault.jpg
2CoMb3PVQE8,"REVIEW MIRAEL SUGAR WAX || SOLUSI WAXING SENDIRI DI RUMAH, GAMPANG BANGET!",https://i.ytimg.com/vi/2CoMb3PVQE8/default.jpg,https://i.ytimg.com/vi/2CoMb3PVQE8/mqdefault.jpg,https://i.ytimg.com/vi/2CoMb3PVQE8/hqdefault.jpg
njENDhdFbrQ,SECRET KEY STARTING TREATMENT ESSENCE REVIEW || DUPE SK-II ?,https://i.ytimg.com/vi/njENDhdFbrQ/default.jpg,https://i.ytimg.com/vi/njENDhdFbrQ/mqdefault.jpg,https://i.ytimg.com/vi/njENDhdFbrQ/hqdefault.jpg
_MrBJ4v6e-s,CARA MEMBUAT TAS DARI KERUDUNG SEGI EMPAT || DIY KREASI TAS DARI KERUDUNG,https://i.ytimg.com/vi/_MrBJ4v6e-s/default.jpg,https://i.ytimg.com/vi/_MrBJ4v6e-s/mqdefault.jpg,https://i.ytimg.com/vi/_MrBJ4v6e-s/hqdefault.jpg
whVyMY8GzqI,"LACOCO ALOE VERA SOOTHING MIST REVIEW || CLEANSER, TONER, MOISTURIZER JADI 1?!",https://i.ytimg.com/vi/whVyMY8GzqI/default.jpg,https://i.ytimg.com/vi/whVyMY8GzqI/mqdefault.jpg,https://i.ytimg.com/vi/whVyMY8GzqI/hqdefault.jpg
cAzgqqhGxhk,"CARA CEPAT MENGHILANGKAN KETOMBE, TERNYATA MUDAH BANGET!",https://i.ytimg.com/vi/cAzgqqhGxhk/default.jpg,https://i.ytimg.com/vi/cAzgqqhGxhk/mqdefault.jpg,https://i.ytimg.com/vi/cAzgqqhGxhk/hqdefault.jpg
nh3vejXA7qI,REVIEW ESSENCE SECRET KEY KOREA,https://i.ytimg.com/vi/nh3vejXA7qI/default.jpg,https://i.ytimg.com/vi/nh3vejXA7qI/mqdefault.jpg,https://i.ytimg.com/vi/nh3vejXA7qI/hqdefault.jpg
Z9WlA5d-Gq8,membuat tas dari kerudung segiempat,https://i.ytimg.com/vi/Z9WlA5d-Gq8/default.jpg,https://i.ytimg.com/vi/Z9WlA5d-Gq8/mqdefault.jpg,https://i.ytimg.com/vi/Z9WlA5d-Gq8/hqdefault.jpg
K4fmBEDlh8o,MAKE OVER POWERSTAY COLOR CORRECTING PRIMER REVIEW (GREEN),https://i.ytimg.com/vi/K4fmBEDlh8o/default.jpg,https://i.ytimg.com/vi/K4fmBEDlh8o/mqdefault.jpg,https://i.ytimg.com/vi/K4fmBEDlh8o/hqdefault.jpg
WVqPTTvk8OY,REVIEW KLEVERU SEA BUCKTHORN CLEANSING GEL || COCOK BUAT KULIT SENSITIF!,https://i.ytimg.com/vi/WVqPTTvk8OY/default.jpg,https://i.ytimg.com/vi/WVqPTTvk8OY/mqdefault.jpg,https://i.ytimg.com/vi/WVqPTTvk8OY/hqdefault.jpg
NNF6t9kmKWY,"PERBEDAAN DEODORANT SPRAY VS DEODORANT ROLL ON, BAGUSAN YANG MANA?",https://i.ytimg.com/vi/NNF6t9kmKWY/default.jpg,https://i.ytimg.com/vi/NNF6t9kmKWY/mqdefault.jpg,https://i.ytimg.com/vi/NNF6t9kmKWY/hqdefault.jpg
HJc-_ajC77Y,REVIEW PURPLE SHAMPOO SHISEIDO || SHAMPOO KHUSUS RAMBUT BERWARNA,https://i.ytimg.com/vi/HJc-_ajC77Y/default.jpg,https://i.ytimg.com/vi/HJc-_ajC77Y/mqdefault.jpg,https://i.ytimg.com/vi/HJc-_ajC77Y/hqdefault.jpg
FJ8VVB36Kxw,CARA MEMBUAT SCRUB KOPI || DIY COFFEE SCRUB (SUPER GAMPANG!),https://i.ytimg.com/vi/FJ8VVB36Kxw/default.jpg,https://i.ytimg.com/vi/FJ8VVB36Kxw/mqdefault.jpg,https://i.ytimg.com/vi/FJ8VVB36Kxw/hqdefault.jpg
y8bKR2kni84,MANFAAT PUTIH TELUR UNTUK KULIT WAJAH || BISA JADI MASKER WAJAH!,https://i.ytimg.com/vi/y8bKR2kni84/default.jpg,https://i.ytimg.com/vi/y8bKR2kni84/mqdefault.jpg,https://i.ytimg.com/vi/y8bKR2kni84/hqdefault.jpg
sh63tJ_6eIU,REVIEW RABBIT HABIT BLUSHING MOON || CUSHION BLUSH BRAND LOKAL TERBARU,https://i.ytimg.com/vi/sh63tJ_6eIU/default.jpg,https://i.ytimg.com/vi/sh63tJ_6eIU/mqdefault.jpg,https://i.ytimg.com/vi/sh63tJ_6eIU/hqdefault.jpg
E9niv9IepVU,REVIEW NAIL POLISH FLORMAR PEARLY NAIL ENAMEL || NAIL POLISH ANTI PEEL OFF,https://i.ytimg.com/vi/E9niv9IepVU/default.jpg,https://i.ytimg.com/vi/E9niv9IepVU/mqdefault.jpg,https://i.ytimg.com/vi/E9niv9IepVU/hqdefault.jpg
bNRw9H1hjx4,Review Joylab Skin'o'tic Moisture Gel || Bagus Buat Base Makeup Juga?!,https://i.ytimg.com/vi/bNRw9H1hjx4/default.jpg,https://i.ytimg.com/vi/bNRw9H1hjx4/mqdefault.jpg,https://i.ytimg.com/vi/bNRw9H1hjx4/hqdefault.jpg
NudFnZufvgQ,REVIEW JOYLAB SKIN'O'TIC WATER ESSENCE! | SKINCARE LOKAL JOYLAB,https://i.ytimg.com/vi/NudFnZufvgQ/default.jpg,https://i.ytimg.com/vi/NudFnZufvgQ/mqdefault.jpg,https://i.ytimg.com/vi/NudFnZufvgQ/hqdefault.jpg
mJixip8KO6k,REVIEW RABBIT HABIT VELVETEEN MATTE LIP CREAM || BRAND LOKAL TERBARU!!!,https://i.ytimg.com/vi/mJixip8KO6k/default.jpg,https://i.ytimg.com/vi/mJixip8KO6k/mqdefault.jpg,https://i.ytimg.com/vi/mJixip8KO6k/hqdefault.jpg
YXf9Hky06kE,REVIEW RABBIT HABIT MOON GLOW - 2IN1 CUSHION FOUNDATION & CONCEALER,https://i.ytimg.com/vi/YXf9Hky06kE/default.jpg,https://i.ytimg.com/vi/YXf9Hky06kE/mqdefault.jpg,https://i.ytimg.com/vi/YXf9Hky06kE/hqdefault.jpg
ftdNN4W9Xuk,Rekomendasi Nail Polish Murah Anti Peel Off,https://i.ytimg.com/vi/ftdNN4W9Xuk/default.jpg,https://i.ytimg.com/vi/ftdNN4W9Xuk/mqdefault.jpg,https://i.ytimg.com/vi/ftdNN4W9Xuk/hqdefault.jpg
IJUlyb-G3HA,REKOMENDASI 3 LIPSTICK TRANSFERPROOF EDISI NEW NORMAL,https://i.ytimg.com/vi/IJUlyb-G3HA/default.jpg,https://i.ytimg.com/vi/IJUlyb-G3HA/mqdefault.jpg,https://i.ytimg.com/vi/IJUlyb-G3HA/hqdefault.jpg
4GM28wEc-xo,TUTORIAL MAKEUP MATA SEHARI-HARI SAAT PAKAI MASKER || TIPS EYE MAKEUP ON POINT!,https://i.ytimg.com/vi/4GM28wEc-xo/default.jpg,https://i.ytimg.com/vi/4GM28wEc-xo/mqdefault.jpg,https://i.ytimg.com/vi/4GM28wEc-xo/hqdefault.jpg
Pl4Wka-DUV4,"CARA AGAR KULIT GLOWING SEHARIAN, CUMA PAKAI 2 PRODUK INI! | TIPS KULIT GLOWING",https://i.ytimg.com/vi/Pl4Wka-DUV4/default.jpg,https://i.ytimg.com/vi/Pl4Wka-DUV4/mqdefault.jpg,https://i.ytimg.com/vi/Pl4Wka-DUV4/hqdefault.jpg
G-XeYNLwVDY,Rekomendasi 3 Lipstick Waterproof Edisi New Normal,https://i.ytimg.com/vi/G-XeYNLwVDY/default.jpg,https://i.ytimg.com/vi/G-XeYNLwVDY/mqdefault.jpg,https://i.ytimg.com/vi/G-XeYNLwVDY/hqdefault.jpg
ZC7YV_ShJTE,Makeup On Point Saat Pakai Masker,https://i.ytimg.com/vi/ZC7YV_ShJTE/default.jpg,https://i.ytimg.com/vi/ZC7YV_ShJTE/mqdefault.jpg,https://i.ytimg.com/vi/ZC7YV_ShJTE/hqdefault.jpg
cryGFXs6m6c,MASKER LOKAL CUMA 3 RIBUAN?! REVIEW MADAME GIE MINI READY PEEL OFF MASK!!!,https://i.ytimg.com/vi/cryGFXs6m6c/default.jpg,https://i.ytimg.com/vi/cryGFXs6m6c/mqdefault.jpg,https://i.ytimg.com/vi/cryGFXs6m6c/hqdefault.jpg
65sUTD22dnY,"4 Rekomendasi Outfit Ethnic untuk ke Kantor, Bisa dipakai buat Hangout juga loh!",https://i.ytimg.com/vi/65sUTD22dnY/default.jpg,https://i.ytimg.com/vi/65sUTD22dnY/mqdefault.jpg,https://i.ytimg.com/vi/65sUTD22dnY/hqdefault.jpg
2cbWMRHv1RA,REVIEW LANCOME GENIFIQUE LIGHT PEARL EYE SERUM || TES PEMAKAIAN SELAMA 7 HARI,https://i.ytimg.com/vi/2cbWMRHv1RA/default.jpg,https://i.ytimg.com/vi/2cbWMRHv1RA/mqdefault.jpg,https://i.ytimg.com/vi/2cbWMRHv1RA/hqdefault.jpg
eCvhh76SGyM,REVIEW CARL & CLAIRE PERFUME || PARFUM LOKAL DUPE JO MALONE?!,https://i.ytimg.com/vi/eCvhh76SGyM/default.jpg,https://i.ytimg.com/vi/eCvhh76SGyM/mqdefault.jpg,https://i.ytimg.com/vi/eCvhh76SGyM/hqdefault.jpg
eEyA-WXzAgM,Rekomendasi Serum untuk Mencerahkan Kulit Kusam di Bawah 100 Ribu,https://i.ytimg.com/vi/eEyA-WXzAgM/default.jpg,https://i.ytimg.com/vi/eEyA-WXzAgM/mqdefault.jpg,https://i.ytimg.com/vi/eEyA-WXzAgM/hqdefault.jpg
T1a7A_85MwY,4 Rekomendasi Busana Etnik Casual Ethnic Outfit Indonesia,https://i.ytimg.com/vi/T1a7A_85MwY/default.jpg,https://i.ytimg.com/vi/T1a7A_85MwY/mqdefault.jpg,https://i.ytimg.com/vi/T1a7A_85MwY/hqdefault.jpg
l2GsNj24Ep8,"4 Rekomendasi Dress Tenun Modern Kekinian, dikombinasi dengan Jeans!",https://i.ytimg.com/vi/l2GsNj24Ep8/default.jpg,https://i.ytimg.com/vi/l2GsNj24Ep8/mqdefault.jpg,https://i.ytimg.com/vi/l2GsNj24Ep8/hqdefault.jpg
nD9QMWVfjF0,Ketiak Cerah dan Bebas Bau Dengan Deodorant Natural Tanpa Aluminium | Review Crystal Deodorant,https://i.ytimg.com/vi/nD9QMWVfjF0/default.jpg,https://i.ytimg.com/vi/nD9QMWVfjF0/mqdefault.jpg,https://i.ytimg.com/vi/nD9QMWVfjF0/hqdefault.jpg
Gup7PpaYr3U,"REVIEW SUKIN BLEMISH CONTROL KIT, AMPUH UNTUK MENGHILANGKAN JERAWAT | SKINCARE ROUTINES",https://i.ytimg.com/vi/Gup7PpaYr3U/default.jpg,https://i.ytimg.com/vi/Gup7PpaYr3U/mqdefault.jpg,https://i.ytimg.com/vi/Gup7PpaYr3U/hqdefault.jpg
4Blhxk8Zzww,Membuat Eyeliner Cat Eye Anti Gagal Dengan LOreal Flash Cat Eye Eyeliner,https://i.ytimg.com/vi/4Blhxk8Zzww/default.jpg,https://i.ytimg.com/vi/4Blhxk8Zzww/mqdefault.jpg,https://i.ytimg.com/vi/4Blhxk8Zzww/hqdefault.jpg
4Blhxk8Zzww,Membuat Eyeliner Cat Eye Anti Gagal Dengan LOreal Flash Cat Eye Eyeliner,https://i.ytimg.com/vi/4Blhxk8Zzww/default.jpg,https://i.ytimg.com/vi/4Blhxk8Zzww/mqdefault.jpg,https://i.ytimg.com/vi/4Blhxk8Zzww/hqdefault.jpg
4Blhxk8Zzww,Membuat Eyeliner Cat Eye Anti Gagal Dengan LOreal Flash Cat Eye Eyeliner,https://i.ytimg.com/vi/4Blhxk8Zzww/default.jpg,https://i.ytimg.com/vi/4Blhxk8Zzww/mqdefault.jpg,https://i.ytimg.com/vi/4Blhxk8Zzww/hqdefault.jpg
ceP3aO97RDs,Review dan Swatch LOreal Rouge Signature Di Kulit Sawo Matang | Lip Cream Matte Ringan & Tahan Lama,https://i.ytimg.com/vi/ceP3aO97RDs/default.jpg,https://i.ytimg.com/vi/ceP3aO97RDs/mqdefault.jpg,https://i.ytimg.com/vi/ceP3aO97RDs/hqdefault.jpg
I45TUaq_ids,REVIEW MASCARA L'OREAL LASH PARADISE || AMPUH MEMBUAT BULU MATA CETAR,https://i.ytimg.com/vi/I45TUaq_ids/default.jpg,https://i.ytimg.com/vi/I45TUaq_ids/mqdefault.jpg,https://i.ytimg.com/vi/I45TUaq_ids/hqdefault.jpg
0I5XtINRMx4,"TUTORIAL MAKEUP NEW NORMAL! || DIJAMIN AWET, ANTI LUNTUR DAN TRANSFERPROOF",https://i.ytimg.com/vi/0I5XtINRMx4/default.jpg,https://i.ytimg.com/vi/0I5XtINRMx4/mqdefault.jpg,https://i.ytimg.com/vi/0I5XtINRMx4/hqdefault.jpg
0I5XtINRMx4,"TUTORIAL MAKEUP NEW NORMAL! || DIJAMIN AWET, ANTI LUNTUR DAN TRANSFERPROOF",https://i.ytimg.com/vi/0I5XtINRMx4/default.jpg,https://i.ytimg.com/vi/0I5XtINRMx4/mqdefault.jpg,https://i.ytimg.com/vi/0I5XtINRMx4/hqdefault.jpg
xsJ_6JISIwM,Ketahui Penyebab Ketiak Menjadi Hitam,https://i.ytimg.com/vi/xsJ_6JISIwM/default.jpg,https://i.ytimg.com/vi/xsJ_6JISIwM/mqdefault.jpg,https://i.ytimg.com/vi/xsJ_6JISIwM/hqdefault.jpg
xsJ_6JISIwM,Ketahui Penyebab Ketiak Menjadi Hitam,https://i.ytimg.com/vi/xsJ_6JISIwM/default.jpg,https://i.ytimg.com/vi/xsJ_6JISIwM/mqdefault.jpg,https://i.ytimg.com/vi/xsJ_6JISIwM/hqdefault.jpg
xsJ_6JISIwM,Ketahui Penyebab Ketiak Menjadi Hitam,https://i.ytimg.com/vi/xsJ_6JISIwM/default.jpg,https://i.ytimg.com/vi/xsJ_6JISIwM/mqdefault.jpg,https://i.ytimg.com/vi/xsJ_6JISIwM/hqdefault.jpg
33XpKuDSYDM,4 Rekomendasi Dress Pesta Bahan Brokat Untuk Tubuh Mungil / Petite,https://i.ytimg.com/vi/33XpKuDSYDM/default.jpg,https://i.ytimg.com/vi/33XpKuDSYDM/mqdefault.jpg,https://i.ytimg.com/vi/33XpKuDSYDM/hqdefault.jpg
YOjVvlUnwQ8,Koleksi Aksesoris Glamor Untuk Busana Kantor,https://i.ytimg.com/vi/YOjVvlUnwQ8/default.jpg,https://i.ytimg.com/vi/YOjVvlUnwQ8/mqdefault.jpg,https://i.ytimg.com/vi/YOjVvlUnwQ8/hqdefault.jpg
YOjVvlUnwQ8,Koleksi Aksesoris Glamor Untuk Busana Kantor,https://i.ytimg.com/vi/YOjVvlUnwQ8/default.jpg,https://i.ytimg.com/vi/YOjVvlUnwQ8/mqdefault.jpg,https://i.ytimg.com/vi/YOjVvlUnwQ8/hqdefault.jpg
hPfhwm6-7iY,Penyebab Wajah Tidak Sehat dan Glowing Walaupun Di Rumah Aja,https://i.ytimg.com/vi/hPfhwm6-7iY/default.jpg,https://i.ytimg.com/vi/hPfhwm6-7iY/mqdefault.jpg,https://i.ytimg.com/vi/hPfhwm6-7iY/hqdefault.jpg
hPfhwm6-7iY,Penyebab Wajah Tidak Sehat dan Glowing Walaupun Di Rumah Aja,https://i.ytimg.com/vi/hPfhwm6-7iY/default.jpg,https://i.ytimg.com/vi/hPfhwm6-7iY/mqdefault.jpg,https://i.ytimg.com/vi/hPfhwm6-7iY/hqdefault.jpg
hPfhwm6-7iY,Penyebab Wajah Tidak Sehat dan Glowing Walaupun Di Rumah Aja,https://i.ytimg.com/vi/hPfhwm6-7iY/default.jpg,https://i.ytimg.com/vi/hPfhwm6-7iY/mqdefault.jpg,https://i.ytimg.com/vi/hPfhwm6-7iY/hqdefault.jpg
uiRgGbmV5YY,Fungsi Lain Setting Spray Selain Untuk Membuat Makeup Awet,https://i.ytimg.com/vi/uiRgGbmV5YY/default.jpg,https://i.ytimg.com/vi/uiRgGbmV5YY/mqdefault.jpg,https://i.ytimg.com/vi/uiRgGbmV5YY/hqdefault.jpg
uiRgGbmV5YY,Fungsi Lain Setting Spray Selain Untuk Membuat Makeup Awet,https://i.ytimg.com/vi/uiRgGbmV5YY/default.jpg,https://i.ytimg.com/vi/uiRgGbmV5YY/mqdefault.jpg,https://i.ytimg.com/vi/uiRgGbmV5YY/hqdefault.jpg
uiRgGbmV5YY,Fungsi Lain Setting Spray Selain Untuk Membuat Makeup Awet,https://i.ytimg.com/vi/uiRgGbmV5YY/default.jpg,https://i.ytimg.com/vi/uiRgGbmV5YY/mqdefault.jpg,https://i.ytimg.com/vi/uiRgGbmV5YY/hqdefault.jpg
uiRgGbmV5YY,Fungsi Lain Setting Spray Selain Untuk Membuat Makeup Awet,https://i.ytimg.com/vi/uiRgGbmV5YY/default.jpg,https://i.ytimg.com/vi/uiRgGbmV5YY/mqdefault.jpg,https://i.ytimg.com/vi/uiRgGbmV5YY/hqdefault.jpg
NMAoVnxa-ws,Koleksi Masker Kain Rancangan Designer Indonesia Untuk Aktivitas New Normal,https://i.ytimg.com/vi/NMAoVnxa-ws/default.jpg,https://i.ytimg.com/vi/NMAoVnxa-ws/mqdefault.jpg,https://i.ytimg.com/vi/NMAoVnxa-ws/hqdefault.jpg
NMAoVnxa-ws,Koleksi Masker Kain Rancangan Designer Indonesia Untuk Aktivitas New Normal,https://i.ytimg.com/vi/NMAoVnxa-ws/default.jpg,https://i.ytimg.com/vi/NMAoVnxa-ws/mqdefault.jpg,https://i.ytimg.com/vi/NMAoVnxa-ws/hqdefault.jpg
NMAoVnxa-ws,Koleksi Masker Kain Rancangan Designer Indonesia Untuk Aktivitas New Normal,https://i.ytimg.com/vi/NMAoVnxa-ws/default.jpg,https://i.ytimg.com/vi/NMAoVnxa-ws/mqdefault.jpg,https://i.ytimg.com/vi/NMAoVnxa-ws/hqdefault.jpg
NMAoVnxa-ws,Koleksi Masker Kain Rancangan Designer Indonesia Untuk Aktivitas New Normal,https://i.ytimg.com/vi/NMAoVnxa-ws/default.jpg,https://i.ytimg.com/vi/NMAoVnxa-ws/mqdefault.jpg,https://i.ytimg.com/vi/NMAoVnxa-ws/hqdefault.jpg
4p2rr3-wpN8,Tips Blush On Tahan Lama Seharian Hingga 8 Jam Tanpa Touch Up,https://i.ytimg.com/vi/4p2rr3-wpN8/default.jpg,https://i.ytimg.com/vi/4p2rr3-wpN8/mqdefault.jpg,https://i.ytimg.com/vi/4p2rr3-wpN8/hqdefault.jpg
UkGsBLToodA,REKOMENDASI SUNSCREEN MURAH YANG AMPUH MEMBUAT KULIT LEMBAP || NIVEA SUNSCREEN,https://i.ytimg.com/vi/UkGsBLToodA/default.jpg,https://i.ytimg.com/vi/UkGsBLToodA/mqdefault.jpg,https://i.ytimg.com/vi/UkGsBLToodA/hqdefault.jpg
UkGsBLToodA,REKOMENDASI SUNSCREEN MURAH YANG AMPUH MEMBUAT KULIT LEMBAP || NIVEA SUNSCREEN,https://i.ytimg.com/vi/UkGsBLToodA/default.jpg,https://i.ytimg.com/vi/UkGsBLToodA/mqdefault.jpg,https://i.ytimg.com/vi/UkGsBLToodA/hqdefault.jpg
Xeh0QPO8CrU,Mengintip Gaya Kompak Ashanty dan Aurel Hermansyah Yang Super Modis,https://i.ytimg.com/vi/Xeh0QPO8CrU/default.jpg,https://i.ytimg.com/vi/Xeh0QPO8CrU/mqdefault.jpg,https://i.ytimg.com/vi/Xeh0QPO8CrU/hqdefault.jpg
Xeh0QPO8CrU,Mengintip Gaya Kompak Ashanty dan Aurel Hermansyah Yang Super Modis,https://i.ytimg.com/vi/Xeh0QPO8CrU/default.jpg,https://i.ytimg.com/vi/Xeh0QPO8CrU/mqdefault.jpg,https://i.ytimg.com/vi/Xeh0QPO8CrU/hqdefault.jpg
Xeh0QPO8CrU,Mengintip Gaya Kompak Ashanty dan Aurel Hermansyah Yang Super Modis,https://i.ytimg.com/vi/Xeh0QPO8CrU/default.jpg,https://i.ytimg.com/vi/Xeh0QPO8CrU/mqdefault.jpg,https://i.ytimg.com/vi/Xeh0QPO8CrU/hqdefault.jpg
HuV7Vd-ZAd8,REVIEW LIPSTICK MAX FACTOR LIPFINITIY YANG COCOK UNTUK DIGUNAKAN KE KANTOR,https://i.ytimg.com/vi/HuV7Vd-ZAd8/default.jpg,https://i.ytimg.com/vi/HuV7Vd-ZAd8/mqdefault.jpg,https://i.ytimg.com/vi/HuV7Vd-ZAd8/hqdefault.jpg
HuV7Vd-ZAd8,REVIEW LIPSTICK MAX FACTOR LIPFINITIY YANG COCOK UNTUK DIGUNAKAN KE KANTOR,https://i.ytimg.com/vi/HuV7Vd-ZAd8/default.jpg,https://i.ytimg.com/vi/HuV7Vd-ZAd8/mqdefault.jpg,https://i.ytimg.com/vi/HuV7Vd-ZAd8/hqdefault.jpg
pop6hx-47zU,FAKTA MENGEJUTKAN MENGENAI MICELLAR WATER || PILIH MICELLAR WATER ATAU MICELLAR GEL?,https://i.ytimg.com/vi/pop6hx-47zU/default.jpg,https://i.ytimg.com/vi/pop6hx-47zU/mqdefault.jpg,https://i.ytimg.com/vi/pop6hx-47zU/hqdefault.jpg
pop6hx-47zU,FAKTA MENGEJUTKAN MENGENAI MICELLAR WATER || PILIH MICELLAR WATER ATAU MICELLAR GEL?,https://i.ytimg.com/vi/pop6hx-47zU/default.jpg,https://i.ytimg.com/vi/pop6hx-47zU/mqdefault.jpg,https://i.ytimg.com/vi/pop6hx-47zU/hqdefault.jpg
Yq-SNO4Uyuk,EYE CREAM TERCEPAT YANG MAMPU MENGHILANGKAN MATA PANDA DAN KERUTAN HALUS DI AREA MATA,https://i.ytimg.com/vi/Yq-SNO4Uyuk/default.jpg,https://i.ytimg.com/vi/Yq-SNO4Uyuk/mqdefault.jpg,https://i.ytimg.com/vi/Yq-SNO4Uyuk/hqdefault.jpg
Yq-SNO4Uyuk,EYE CREAM TERCEPAT YANG MAMPU MENGHILANGKAN MATA PANDA DAN KERUTAN HALUS DI AREA MATA,https://i.ytimg.com/vi/Yq-SNO4Uyuk/default.jpg,https://i.ytimg.com/vi/Yq-SNO4Uyuk/mqdefault.jpg,https://i.ytimg.com/vi/Yq-SNO4Uyuk/hqdefault.jpg
qBJfXAMNyR8,Rekomendasi Serum Pemutih Dibawah 50 Ribu Rupiah,https://i.ytimg.com/vi/qBJfXAMNyR8/default.jpg,https://i.ytimg.com/vi/qBJfXAMNyR8/mqdefault.jpg,https://i.ytimg.com/vi/qBJfXAMNyR8/hqdefault.jpg
2dYgd9bdYaU,Rekomendasi Produk Terbaik dan Ampuh Untuk Masalah Rambut Rontok,https://i.ytimg.com/vi/2dYgd9bdYaU/default.jpg,https://i.ytimg.com/vi/2dYgd9bdYaU/mqdefault.jpg,https://i.ytimg.com/vi/2dYgd9bdYaU/hqdefault.jpg
2dYgd9bdYaU,Rekomendasi Produk Terbaik dan Ampuh Untuk Masalah Rambut Rontok,https://i.ytimg.com/vi/2dYgd9bdYaU/default.jpg,https://i.ytimg.com/vi/2dYgd9bdYaU/mqdefault.jpg,https://i.ytimg.com/vi/2dYgd9bdYaU/hqdefault.jpg
FgOoQjJjXJM,"Tips dan Cara Berpose Agar Terlihat Tinggi, Langsing, dan Jenjang di Depan Kamera Tanpa Edit",https://i.ytimg.com/vi/FgOoQjJjXJM/default.jpg,https://i.ytimg.com/vi/FgOoQjJjXJM/mqdefault.jpg,https://i.ytimg.com/vi/FgOoQjJjXJM/hqdefault.jpg
rXToXpu7RQs,4 MODEL BUSANA LEBARAN YANG SIMPEL NAMUN ELEGAN || COCOK UNTUK WANITA GEMUK BERISI,https://i.ytimg.com/vi/rXToXpu7RQs/default.jpg,https://i.ytimg.com/vi/rXToXpu7RQs/mqdefault.jpg,https://i.ytimg.com/vi/rXToXpu7RQs/hqdefault.jpg
rXToXpu7RQs,4 MODEL BUSANA LEBARAN YANG SIMPEL NAMUN ELEGAN || COCOK UNTUK WANITA GEMUK BERISI,https://i.ytimg.com/vi/rXToXpu7RQs/default.jpg,https://i.ytimg.com/vi/rXToXpu7RQs/mqdefault.jpg,https://i.ytimg.com/vi/rXToXpu7RQs/hqdefault.jpg
92qbZ_-DHRg,Koleksi Gamis Ratusan Juta Rupiah Nagita Slavina,https://i.ytimg.com/vi/92qbZ_-DHRg/default.jpg,https://i.ytimg.com/vi/92qbZ_-DHRg/mqdefault.jpg,https://i.ytimg.com/vi/92qbZ_-DHRg/hqdefault.jpg
92qbZ_-DHRg,Koleksi Gamis Ratusan Juta Rupiah Nagita Slavina,https://i.ytimg.com/vi/92qbZ_-DHRg/default.jpg,https://i.ytimg.com/vi/92qbZ_-DHRg/mqdefault.jpg,https://i.ytimg.com/vi/92qbZ_-DHRg/hqdefault.jpg
__9jUIeyNfI,Tips Touch Up Makeup dan Bagian Wajah yang Perlu Diperhatikan,https://i.ytimg.com/vi/__9jUIeyNfI/default.jpg,https://i.ytimg.com/vi/__9jUIeyNfI/mqdefault.jpg,https://i.ytimg.com/vi/__9jUIeyNfI/hqdefault.jpg
N3UGkrhL1KM,TUTORIAL 4 GAYA HIJAB SEGI EMPAT SIMPEL DAN ELEGAN UNTUK DIPAKAI SAAT BULAN PUASA MAUPUN LEBARAN,https://i.ytimg.com/vi/N3UGkrhL1KM/default.jpg,https://i.ytimg.com/vi/N3UGkrhL1KM/mqdefault.jpg,https://i.ytimg.com/vi/N3UGkrhL1KM/hqdefault.jpg
N3UGkrhL1KM,TUTORIAL 4 GAYA HIJAB SEGI EMPAT SIMPEL DAN ELEGAN UNTUK DIPAKAI SAAT BULAN PUASA MAUPUN LEBARAN,https://i.ytimg.com/vi/N3UGkrhL1KM/default.jpg,https://i.ytimg.com/vi/N3UGkrhL1KM/mqdefault.jpg,https://i.ytimg.com/vi/N3UGkrhL1KM/hqdefault.jpg
j0LwluNLh-4,Model Baju Lebaran 2020 dengan Kain Lilit Modern // Tutorial Kain Lilit // Cara Pakai Kain Batik,https://i.ytimg.com/vi/j0LwluNLh-4/default.jpg,https://i.ytimg.com/vi/j0LwluNLh-4/mqdefault.jpg,https://i.ytimg.com/vi/j0LwluNLh-4/hqdefault.jpg
j0LwluNLh-4,Model Baju Lebaran 2020 dengan Kain Lilit Modern // Tutorial Kain Lilit // Cara Pakai Kain Batik,https://i.ytimg.com/vi/j0LwluNLh-4/default.jpg,https://i.ytimg.com/vi/j0LwluNLh-4/mqdefault.jpg,https://i.ytimg.com/vi/j0LwluNLh-4/hqdefault.jpg
USjXcuVVxd0,DRESS HIJAB SIMPEL MODERN MOTIF PRINTING UNTUK LEBARAN | DESAINER HANNIE HANANTO |MODEST MOSLEM WEAR,https://i.ytimg.com/vi/USjXcuVVxd0/default.jpg,https://i.ytimg.com/vi/USjXcuVVxd0/mqdefault.jpg,https://i.ytimg.com/vi/USjXcuVVxd0/hqdefault.jpg
USjXcuVVxd0,DRESS HIJAB SIMPEL MODERN MOTIF PRINTING UNTUK LEBARAN | DESAINER HANNIE HANANTO |MODEST MOSLEM WEAR,https://i.ytimg.com/vi/USjXcuVVxd0/default.jpg,https://i.ytimg.com/vi/USjXcuVVxd0/mqdefault.jpg,https://i.ytimg.com/vi/USjXcuVVxd0/hqdefault.jpg
oVlP2apLmtg,Makeup Anti Pucat Untuk Kulit Sawo Matang | Tutorial Makeup Fresh Untuk Kulit Gelap,https://i.ytimg.com/vi/oVlP2apLmtg/default.jpg,https://i.ytimg.com/vi/oVlP2apLmtg/mqdefault.jpg,https://i.ytimg.com/vi/oVlP2apLmtg/hqdefault.jpg
oVlP2apLmtg,Makeup Anti Pucat Untuk Kulit Sawo Matang | Tutorial Makeup Fresh Untuk Kulit Gelap,https://i.ytimg.com/vi/oVlP2apLmtg/default.jpg,https://i.ytimg.com/vi/oVlP2apLmtg/mqdefault.jpg,https://i.ytimg.com/vi/oVlP2apLmtg/hqdefault.jpg
nNMC-AiNpwg,3 Gaya Catok Rambut Mudah | Tutorial Catok Rambut Simple,https://i.ytimg.com/vi/nNMC-AiNpwg/default.jpg,https://i.ytimg.com/vi/nNMC-AiNpwg/mqdefault.jpg,https://i.ytimg.com/vi/nNMC-AiNpwg/hqdefault.jpg
nNMC-AiNpwg,3 Gaya Catok Rambut Mudah | Tutorial Catok Rambut Simple,https://i.ytimg.com/vi/nNMC-AiNpwg/default.jpg,https://i.ytimg.com/vi/nNMC-AiNpwg/mqdefault.jpg,https://i.ytimg.com/vi/nNMC-AiNpwg/hqdefault.jpg
uRPf1VDOJzY,3 GAYA HIJAB SYAR'I GLAMOR MODERN NUANSA PASTEL UNTUK LEBARAN || BUSANA PILIHAN SI.SE.SA,https://i.ytimg.com/vi/uRPf1VDOJzY/default.jpg,https://i.ytimg.com/vi/uRPf1VDOJzY/mqdefault.jpg,https://i.ytimg.com/vi/uRPf1VDOJzY/hqdefault.jpg
uRPf1VDOJzY,3 GAYA HIJAB SYAR'I GLAMOR MODERN NUANSA PASTEL UNTUK LEBARAN || BUSANA PILIHAN SI.SE.SA,https://i.ytimg.com/vi/uRPf1VDOJzY/default.jpg,https://i.ytimg.com/vi/uRPf1VDOJzY/mqdefault.jpg,https://i.ytimg.com/vi/uRPf1VDOJzY/hqdefault.jpg
5VqmBFS13Vo,BELANJA MODEL BAJU LEBARAN 2020 YANG BISA DIPAKAI UNTUK KE KANTOR || DEPOK TOWN SQUARE,https://i.ytimg.com/vi/5VqmBFS13Vo/default.jpg,https://i.ytimg.com/vi/5VqmBFS13Vo/mqdefault.jpg,https://i.ytimg.com/vi/5VqmBFS13Vo/hqdefault.jpg
5VqmBFS13Vo,BELANJA MODEL BAJU LEBARAN 2020 YANG BISA DIPAKAI UNTUK KE KANTOR || DEPOK TOWN SQUARE,https://i.ytimg.com/vi/5VqmBFS13Vo/default.jpg,https://i.ytimg.com/vi/5VqmBFS13Vo/mqdefault.jpg,https://i.ytimg.com/vi/5VqmBFS13Vo/hqdefault.jpg
5VqmBFS13Vo,BELANJA MODEL BAJU LEBARAN 2020 YANG BISA DIPAKAI UNTUK KE KANTOR || DEPOK TOWN SQUARE,https://i.ytimg.com/vi/5VqmBFS13Vo/default.jpg,https://i.ytimg.com/vi/5VqmBFS13Vo/mqdefault.jpg,https://i.ytimg.com/vi/5VqmBFS13Vo/hqdefault.jpg
5VqmBFS13Vo,BELANJA MODEL BAJU LEBARAN 2020 YANG BISA DIPAKAI UNTUK KE KANTOR || DEPOK TOWN SQUARE,https://i.ytimg.com/vi/5VqmBFS13Vo/default.jpg,https://i.ytimg.com/vi/5VqmBFS13Vo/mqdefault.jpg,https://i.ytimg.com/vi/5VqmBFS13Vo/hqdefault.jpg
XtZbQlhvIaw,GAYA LIBURAN MEWAH SYAHRINI BERSAMA REINO BARACK,https://i.ytimg.com/vi/XtZbQlhvIaw/default.jpg,https://i.ytimg.com/vi/XtZbQlhvIaw/mqdefault.jpg,https://i.ytimg.com/vi/XtZbQlhvIaw/hqdefault.jpg
