ID,TITLE,THUMBNAIL1,THUMBNAIL2,THUMBNAIL3
oUFUho_h40M,Potato Face Pack For Clear Skin Tamil | உருளைக்கிழங்கு ஃபேஸ் பேக்,https://i.ytimg.com/vi/oUFUho_h40M/default.jpg,https://i.ytimg.com/vi/oUFUho_h40M/mqdefault.jpg,https://i.ytimg.com/vi/oUFUho_h40M/hqdefault.jpg
LxgyxKqoHIQ,Remove Blackheads And Whiteheads Tamil | கரும்புள்ளி மற்றும் வெண்புள்ளி போக,https://i.ytimg.com/vi/LxgyxKqoHIQ/default.jpg,https://i.ytimg.com/vi/LxgyxKqoHIQ/mqdefault.jpg,https://i.ytimg.com/vi/LxgyxKqoHIQ/hqdefault.jpg
n8CJjSC-_HE,"Face Pack For Oily, Normal Skin Tamil | முகத்தில் எண்ணை வடிதல் போக",https://i.ytimg.com/vi/n8CJjSC-_HE/default.jpg,https://i.ytimg.com/vi/n8CJjSC-_HE/mqdefault.jpg,https://i.ytimg.com/vi/n8CJjSC-_HE/hqdefault.jpg
H1u8qGGsh-Y,Coffee Mask For Under Eye Circle Tamil | காபி மாஸ்க் செய்வது எப்படி?,https://i.ytimg.com/vi/H1u8qGGsh-Y/default.jpg,https://i.ytimg.com/vi/H1u8qGGsh-Y/mqdefault.jpg,https://i.ytimg.com/vi/H1u8qGGsh-Y/hqdefault.jpg
UmCNtqSvb9Q,Remedy For Sun Tan Tamil | சன் டேன் நீக்குவது எப்படி?,https://i.ytimg.com/vi/UmCNtqSvb9Q/default.jpg,https://i.ytimg.com/vi/UmCNtqSvb9Q/mqdefault.jpg,https://i.ytimg.com/vi/UmCNtqSvb9Q/hqdefault.jpg
NoNkJvCZ-6w,Pimple Treatment At Home | முகப்பரு நீக்குவது எப்படி?,https://i.ytimg.com/vi/NoNkJvCZ-6w/default.jpg,https://i.ytimg.com/vi/NoNkJvCZ-6w/mqdefault.jpg,https://i.ytimg.com/vi/NoNkJvCZ-6w/hqdefault.jpg
eK6zhFAWcfI,Homemade Moisturizer Cream Tamil | வறட்சியான சருமத்திற்கு தீர்வு?,https://i.ytimg.com/vi/eK6zhFAWcfI/default.jpg,https://i.ytimg.com/vi/eK6zhFAWcfI/mqdefault.jpg,https://i.ytimg.com/vi/eK6zhFAWcfI/hqdefault.jpg
DSiVt1OCEsE,Multani Mitti & Oats Face Pack Tamil | முல்தானி மெட்டி & ஓட்ஸ் பயன்கள்?,https://i.ytimg.com/vi/DSiVt1OCEsE/default.jpg,https://i.ytimg.com/vi/DSiVt1OCEsE/mqdefault.jpg,https://i.ytimg.com/vi/DSiVt1OCEsE/hqdefault.jpg
Ef2eMTc2GpU,Orange Peel Scrub For Glowing Skin Tamil | ஆரஞ்சு பீல் ஃபேஸ் ஸ்க்ரப்!?,https://i.ytimg.com/vi/Ef2eMTc2GpU/default.jpg,https://i.ytimg.com/vi/Ef2eMTc2GpU/mqdefault.jpg,https://i.ytimg.com/vi/Ef2eMTc2GpU/hqdefault.jpg
RQGdSWIFypY,Amla And Cocoa Powder Face Pack Tamil | நெல்லி கோகோ ஃபேஸ் பேக்?,https://i.ytimg.com/vi/RQGdSWIFypY/default.jpg,https://i.ytimg.com/vi/RQGdSWIFypY/mqdefault.jpg,https://i.ytimg.com/vi/RQGdSWIFypY/hqdefault.jpg
li9R_dinE2k,Beetroot Face Pack Tamil | பீட்ரூட் ஃபேஸ் பேக் பயன்கள்?,https://i.ytimg.com/vi/li9R_dinE2k/default.jpg,https://i.ytimg.com/vi/li9R_dinE2k/mqdefault.jpg,https://i.ytimg.com/vi/li9R_dinE2k/hqdefault.jpg
zPJEDuQYgvU,Almond Face Cream Tamil | பாதாம் கிரீம் பயன்கள்?,https://i.ytimg.com/vi/zPJEDuQYgvU/default.jpg,https://i.ytimg.com/vi/zPJEDuQYgvU/mqdefault.jpg,https://i.ytimg.com/vi/zPJEDuQYgvU/hqdefault.jpg
0fIFWxXs0eA,Banana And Honey Face Pack Tamil | வறட்சியான சருமத்திற்கு தீர்வு?,https://i.ytimg.com/vi/0fIFWxXs0eA/default.jpg,https://i.ytimg.com/vi/0fIFWxXs0eA/mqdefault.jpg,https://i.ytimg.com/vi/0fIFWxXs0eA/hqdefault.jpg
bhxejlEm29M,2 Beauty Drinks For Flawless Skin Tamil | சருமத்தை பாதுகாப்பது எப்படி?,https://i.ytimg.com/vi/bhxejlEm29M/default.jpg,https://i.ytimg.com/vi/bhxejlEm29M/mqdefault.jpg,https://i.ytimg.com/vi/bhxejlEm29M/hqdefault.jpg
bJrlusM0-f4,Scrub For Tan Removel Tamil | சன் டேன் நீக்குவது எப்படி?,https://i.ytimg.com/vi/bJrlusM0-f4/default.jpg,https://i.ytimg.com/vi/bJrlusM0-f4/mqdefault.jpg,https://i.ytimg.com/vi/bJrlusM0-f4/hqdefault.jpg
paNwAd1Rk2M,Home Remedy For Dandruff Tamil | இயற்கை முறையில் பொடுகை போக்க?,https://i.ytimg.com/vi/paNwAd1Rk2M/default.jpg,https://i.ytimg.com/vi/paNwAd1Rk2M/mqdefault.jpg,https://i.ytimg.com/vi/paNwAd1Rk2M/hqdefault.jpg
2sheYy3v4NM,Make Tomato Honey Facepack Tamil | இளமை முகத்தோற்றம் பெற?,https://i.ytimg.com/vi/2sheYy3v4NM/default.jpg,https://i.ytimg.com/vi/2sheYy3v4NM/mqdefault.jpg,https://i.ytimg.com/vi/2sheYy3v4NM/hqdefault.jpg
gWK211nKo5w,Multani Mitti Face Pack For Nature Skin | இயற்கை ஃபேஸ் பேக் எப்படி செய்வது?,https://i.ytimg.com/vi/gWK211nKo5w/default.jpg,https://i.ytimg.com/vi/gWK211nKo5w/mqdefault.jpg,https://i.ytimg.com/vi/gWK211nKo5w/hqdefault.jpg
ns1_wFQ7Vl8,Orange Peel Face Pack For Glowing Skin | ஆரஞ்சு ஃபேஸ் பேக் செய்வது எப்படி?,https://i.ytimg.com/vi/ns1_wFQ7Vl8/default.jpg,https://i.ytimg.com/vi/ns1_wFQ7Vl8/mqdefault.jpg,https://i.ytimg.com/vi/ns1_wFQ7Vl8/hqdefault.jpg
7636KeaSPfU,How To Do Thin Eyebrows Naturally Tamil | மெல்லிய புருவம் அழகு குறிப்புகள்?,https://i.ytimg.com/vi/7636KeaSPfU/default.jpg,https://i.ytimg.com/vi/7636KeaSPfU/mqdefault.jpg,https://i.ytimg.com/vi/7636KeaSPfU/hqdefault.jpg
eutgHP_hu9o,Get Clear Skin Use Potato Face Pack Tamil | உருளைக்கிழங்கு பேஸ் பேக் செய்வது எப்படி?,https://i.ytimg.com/vi/eutgHP_hu9o/default.jpg,https://i.ytimg.com/vi/eutgHP_hu9o/mqdefault.jpg,https://i.ytimg.com/vi/eutgHP_hu9o/hqdefault.jpg
MoE7nmZ-j1M,Egg Aloevera Hair Mask Tamil | ஹேர் மாஸ்க் செய்வது எப்படி?,https://i.ytimg.com/vi/MoE7nmZ-j1M/default.jpg,https://i.ytimg.com/vi/MoE7nmZ-j1M/mqdefault.jpg,https://i.ytimg.com/vi/MoE7nmZ-j1M/hqdefault.jpg
15W9N00whAE,Red Sandal Wood Face Pack | வெயில் கால அழகு குறிப்புகள்?,https://i.ytimg.com/vi/15W9N00whAE/default.jpg,https://i.ytimg.com/vi/15W9N00whAE/mqdefault.jpg,https://i.ytimg.com/vi/15W9N00whAE/hqdefault.jpg
zQZoYOll1tU,Glowing Skin Use Lemon Chia Seed Juice Tamil | அழகிய முகத்தேற்றம் பெற?,https://i.ytimg.com/vi/zQZoYOll1tU/default.jpg,https://i.ytimg.com/vi/zQZoYOll1tU/mqdefault.jpg,https://i.ytimg.com/vi/zQZoYOll1tU/hqdefault.jpg
DMXgZUO-BRA,Watermelon Face Mask At Home | முக அழகு பெறுவது எப்படி?,https://i.ytimg.com/vi/DMXgZUO-BRA/default.jpg,https://i.ytimg.com/vi/DMXgZUO-BRA/mqdefault.jpg,https://i.ytimg.com/vi/DMXgZUO-BRA/hqdefault.jpg
9KUo6ADRRhQ,Super Face Pack For Acne Tamil | முகப்பருவை நீக்கும் ஃபேஸ் பேக்?,https://i.ytimg.com/vi/9KUo6ADRRhQ/default.jpg,https://i.ytimg.com/vi/9KUo6ADRRhQ/mqdefault.jpg,https://i.ytimg.com/vi/9KUo6ADRRhQ/hqdefault.jpg
a9anHviJDK4,Rose Water For Amazing Skin Tamil | ரோஸ் வாட்டர் பயன்கள்?,https://i.ytimg.com/vi/a9anHviJDK4/default.jpg,https://i.ytimg.com/vi/a9anHviJDK4/mqdefault.jpg,https://i.ytimg.com/vi/a9anHviJDK4/hqdefault.jpg
02gjR0-iCkY,Hair Growth Magical Formula Tamil | தலைமுடி அடர்த்தியாக வளர?,https://i.ytimg.com/vi/02gjR0-iCkY/default.jpg,https://i.ytimg.com/vi/02gjR0-iCkY/mqdefault.jpg,https://i.ytimg.com/vi/02gjR0-iCkY/hqdefault.jpg
Xwh2_0tw-gA,Honey Rice Flour Scrub For Dead Cells | இறந்த முக செல்களை நீக்க வேண்டுமா?,https://i.ytimg.com/vi/Xwh2_0tw-gA/default.jpg,https://i.ytimg.com/vi/Xwh2_0tw-gA/mqdefault.jpg,https://i.ytimg.com/vi/Xwh2_0tw-gA/hqdefault.jpg
8UFHqILCDec,Spray For Hair Setting Tamil | ஹேர் ஸ்ப்ரே செய்வது எப்படி?,https://i.ytimg.com/vi/8UFHqILCDec/default.jpg,https://i.ytimg.com/vi/8UFHqILCDec/mqdefault.jpg,https://i.ytimg.com/vi/8UFHqILCDec/hqdefault.jpg
YZyyiClLyT0,Beetroot Scrub For Dry Lips Tamil | உதடு வறட்சியாக உள்ளதா?,https://i.ytimg.com/vi/YZyyiClLyT0/default.jpg,https://i.ytimg.com/vi/YZyyiClLyT0/mqdefault.jpg,https://i.ytimg.com/vi/YZyyiClLyT0/hqdefault.jpg
EP4w9jtAH-I,Green Tea Summer Face Pack Tamil | முகத்தை பாதுகாப்பது எப்படி?,https://i.ytimg.com/vi/EP4w9jtAH-I/default.jpg,https://i.ytimg.com/vi/EP4w9jtAH-I/mqdefault.jpg,https://i.ytimg.com/vi/EP4w9jtAH-I/hqdefault.jpg
J2LDU5uSBEM,Worst Habits For Damage Skin Tamil | சருமம் பாதிக்க காரணம்?,https://i.ytimg.com/vi/J2LDU5uSBEM/default.jpg,https://i.ytimg.com/vi/J2LDU5uSBEM/mqdefault.jpg,https://i.ytimg.com/vi/J2LDU5uSBEM/hqdefault.jpg
s912zt7aF44,How To Make Coffee Soap Tamil | காபி சோப் செய்வது எப்படி?,https://i.ytimg.com/vi/s912zt7aF44/default.jpg,https://i.ytimg.com/vi/s912zt7aF44/mqdefault.jpg,https://i.ytimg.com/vi/s912zt7aF44/hqdefault.jpg
clteLChLOdY,3 Ways To Clear Dandruff | தலைமுடி பொடுகை போக்க என்ன வழி?,https://i.ytimg.com/vi/clteLChLOdY/default.jpg,https://i.ytimg.com/vi/clteLChLOdY/mqdefault.jpg,https://i.ytimg.com/vi/clteLChLOdY/hqdefault.jpg
LazERXiltOI,How To Get Rid Of Dark Neck Tamil | கழுத்துப் பகுதியின் கருமை நீக்க டிப்ஸ்?,https://i.ytimg.com/vi/LazERXiltOI/default.jpg,https://i.ytimg.com/vi/LazERXiltOI/mqdefault.jpg,https://i.ytimg.com/vi/LazERXiltOI/hqdefault.jpg
1hX5SssdWpI,Get Spotless Skin Use Potato Facial Tips | கண்ணாடி போன்ற முகம் வேண்டுமா?,https://i.ytimg.com/vi/1hX5SssdWpI/default.jpg,https://i.ytimg.com/vi/1hX5SssdWpI/mqdefault.jpg,https://i.ytimg.com/vi/1hX5SssdWpI/hqdefault.jpg
UEHO5OIm0Zw,Homemade Syrup For Hair Growth | தலைமுடி வளர்ச்சிக்கு டிப்ஸ்?,https://i.ytimg.com/vi/UEHO5OIm0Zw/default.jpg,https://i.ytimg.com/vi/UEHO5OIm0Zw/mqdefault.jpg,https://i.ytimg.com/vi/UEHO5OIm0Zw/hqdefault.jpg
DC4afD3agp8,Get Clear Face Use Aloe Vera Face Mask | கற்றாழை பேஸ் மாஸ்க் செய்வது எப்படி?,https://i.ytimg.com/vi/DC4afD3agp8/default.jpg,https://i.ytimg.com/vi/DC4afD3agp8/mqdefault.jpg,https://i.ytimg.com/vi/DC4afD3agp8/hqdefault.jpg
bGL4vGTP8tk,Make Coffee Cream For Clear Skin Tamil | முகத்திற்கு காபி கிரீம் செய்வது எப்படி?,https://i.ytimg.com/vi/bGL4vGTP8tk/default.jpg,https://i.ytimg.com/vi/bGL4vGTP8tk/mqdefault.jpg,https://i.ytimg.com/vi/bGL4vGTP8tk/hqdefault.jpg
WwWAZom--wE,Make Herbal Face Wash At Home | பேஸ் வாஷ் செய்வது எப்படி?,https://i.ytimg.com/vi/WwWAZom--wE/default.jpg,https://i.ytimg.com/vi/WwWAZom--wE/mqdefault.jpg,https://i.ytimg.com/vi/WwWAZom--wE/hqdefault.jpg
-S1CBtmKVCw,Hair Growth Problem Remedies Tamil | தலை முடி நன்றாக வளர வேண்டுமா?,https://i.ytimg.com/vi/-S1CBtmKVCw/default.jpg,https://i.ytimg.com/vi/-S1CBtmKVCw/mqdefault.jpg,https://i.ytimg.com/vi/-S1CBtmKVCw/hqdefault.jpg
KiOrv3gJ1HE,Multani Mitti For Dark Circle And dark Spots Tamil | வெண்மையான முகம் பெற?,https://i.ytimg.com/vi/KiOrv3gJ1HE/default.jpg,https://i.ytimg.com/vi/KiOrv3gJ1HE/mqdefault.jpg,https://i.ytimg.com/vi/KiOrv3gJ1HE/hqdefault.jpg
LFACI_9AuyE,Fenugreek For Beauty Skin Tamil | வெந்தயம் பயன்படுத்தி அழகு பெறுவது எப்படி?,https://i.ytimg.com/vi/LFACI_9AuyE/default.jpg,https://i.ytimg.com/vi/LFACI_9AuyE/mqdefault.jpg,https://i.ytimg.com/vi/LFACI_9AuyE/hqdefault.jpg
yl6sJZ-qwss,Full Body Polishing Scrub Tamil | ராகி ஸ்க்ரப்பர் செய்வது எப்படி?,https://i.ytimg.com/vi/yl6sJZ-qwss/default.jpg,https://i.ytimg.com/vi/yl6sJZ-qwss/mqdefault.jpg,https://i.ytimg.com/vi/yl6sJZ-qwss/hqdefault.jpg
i4hFSoZHRaM,Coffee Face Pack For Oily Skin Tamil | முகத்தில் எண்ணெய் வடிகிறதா?,https://i.ytimg.com/vi/i4hFSoZHRaM/default.jpg,https://i.ytimg.com/vi/i4hFSoZHRaM/mqdefault.jpg,https://i.ytimg.com/vi/i4hFSoZHRaM/hqdefault.jpg
iKZbPL7n_Co,Facepack To Remove Sun Tan Tamil | கருப்பான முகத்திற்கு?,https://i.ytimg.com/vi/iKZbPL7n_Co/default.jpg,https://i.ytimg.com/vi/iKZbPL7n_Co/mqdefault.jpg,https://i.ytimg.com/vi/iKZbPL7n_Co/hqdefault.jpg
CFpPequ3XL8,Drink Detox Water To Get Spotless Skin Tamil | உடல் கழிவுகளை நீக்குவது எப்படி?,https://i.ytimg.com/vi/CFpPequ3XL8/default.jpg,https://i.ytimg.com/vi/CFpPequ3XL8/mqdefault.jpg,https://i.ytimg.com/vi/CFpPequ3XL8/hqdefault.jpg
4yDCvo9wegQ,"Use Milk For Clear Skin Tamil | பால் சார்ந்த அழகு குறிப்புகள் செய்வது எப்படி,",https://i.ytimg.com/vi/4yDCvo9wegQ/default.jpg,https://i.ytimg.com/vi/4yDCvo9wegQ/mqdefault.jpg,https://i.ytimg.com/vi/4yDCvo9wegQ/hqdefault.jpg
ELyhUZ33ovU,Natural Shampoo For Thick Hair Tamil | இயற்கை ஷாம்ப் செய்வது எப்படி?,https://i.ytimg.com/vi/ELyhUZ33ovU/default.jpg,https://i.ytimg.com/vi/ELyhUZ33ovU/mqdefault.jpg,https://i.ytimg.com/vi/ELyhUZ33ovU/hqdefault.jpg
d0JlEDO4I1U,Summer Rose Pack For Glowing Skin Tamil | ஒளிரும் முகத்திற்கு ரோஜா இதழ்?,https://i.ytimg.com/vi/d0JlEDO4I1U/default.jpg,https://i.ytimg.com/vi/d0JlEDO4I1U/mqdefault.jpg,https://i.ytimg.com/vi/d0JlEDO4I1U/hqdefault.jpg
6oqXuXkKH60,Homemade Body Skin Scrub Making Tamil | உடலை வெண்மையாக்கும் ஸ்க்ரப்பர் செய்வது எப்படி,https://i.ytimg.com/vi/6oqXuXkKH60/default.jpg,https://i.ytimg.com/vi/6oqXuXkKH60/mqdefault.jpg,https://i.ytimg.com/vi/6oqXuXkKH60/hqdefault.jpg
E8I_hSSVKuU,Aloe Vera Sugar Scrub For Fair Skin | கற்றாழை ஸ்க்ரப்பர் செய்வது எப்படி,https://i.ytimg.com/vi/E8I_hSSVKuU/default.jpg,https://i.ytimg.com/vi/E8I_hSSVKuU/mqdefault.jpg,https://i.ytimg.com/vi/E8I_hSSVKuU/hqdefault.jpg
feLUO0i9avc,Tea Tree Oil Benefits Tamil | முகப் பருக்களை போக்குவது எப்படி,https://i.ytimg.com/vi/feLUO0i9avc/default.jpg,https://i.ytimg.com/vi/feLUO0i9avc/mqdefault.jpg,https://i.ytimg.com/vi/feLUO0i9avc/hqdefault.jpg
QJ1_nID809A,Easy Way To Remove Dark Neck Tamil | கழுத்துப் பகுதி கருமையை நிக்க வேண்டுமா,https://i.ytimg.com/vi/QJ1_nID809A/default.jpg,https://i.ytimg.com/vi/QJ1_nID809A/mqdefault.jpg,https://i.ytimg.com/vi/QJ1_nID809A/hqdefault.jpg
fVKduEurEJI,Remove Sun Tan Professionally Tamil | சன் டேனை நீக்க என்ன வழி,https://i.ytimg.com/vi/fVKduEurEJI/default.jpg,https://i.ytimg.com/vi/fVKduEurEJI/mqdefault.jpg,https://i.ytimg.com/vi/fVKduEurEJI/hqdefault.jpg
P3elI_GioTg,How To Remove Black And White Heads Tamil | சரும கரும்புள்ளியை போக்குவது எப்படி?,https://i.ytimg.com/vi/P3elI_GioTg/default.jpg,https://i.ytimg.com/vi/P3elI_GioTg/mqdefault.jpg,https://i.ytimg.com/vi/P3elI_GioTg/hqdefault.jpg
9bnVcRikHJ0,Banana Peel Benefits Tamil | வாழைப்பழ தோலின் பயன்கள்!,https://i.ytimg.com/vi/9bnVcRikHJ0/default.jpg,https://i.ytimg.com/vi/9bnVcRikHJ0/mqdefault.jpg,https://i.ytimg.com/vi/9bnVcRikHJ0/hqdefault.jpg
joDhCJwk1Vs,Home Remedy To Remove Dark Circles Tamil | கண் கருவளையம் மறைய வேண்டுமா?,https://i.ytimg.com/vi/joDhCJwk1Vs/default.jpg,https://i.ytimg.com/vi/joDhCJwk1Vs/mqdefault.jpg,https://i.ytimg.com/vi/joDhCJwk1Vs/hqdefault.jpg
h1UbXSf8h8U,Rice Water Benefits For Skin | வயதான தோற்றம் மறைய வேண்டுமா,https://i.ytimg.com/vi/h1UbXSf8h8U/default.jpg,https://i.ytimg.com/vi/h1UbXSf8h8U/mqdefault.jpg,https://i.ytimg.com/vi/h1UbXSf8h8U/hqdefault.jpg
YVM52zTjW2U,One Night Gel For All Skin Problems Tamil | நைட் ஜெல் செய்வது எப்படி?,https://i.ytimg.com/vi/YVM52zTjW2U/default.jpg,https://i.ytimg.com/vi/YVM52zTjW2U/mqdefault.jpg,https://i.ytimg.com/vi/YVM52zTjW2U/hqdefault.jpg
IuLAzhiYSJA,Make Face Glow Scrub At Home Tamil | பளிச்சிடும் முகத்தை பெற வேண்டுமா?,https://i.ytimg.com/vi/IuLAzhiYSJA/default.jpg,https://i.ytimg.com/vi/IuLAzhiYSJA/mqdefault.jpg,https://i.ytimg.com/vi/IuLAzhiYSJA/hqdefault.jpg
KEKeF_Gq5j8,Watermelon Benefits Tamil | தர்பூசணி பழத்தின் அழகு குறிப்புகள்?,https://i.ytimg.com/vi/KEKeF_Gq5j8/default.jpg,https://i.ytimg.com/vi/KEKeF_Gq5j8/mqdefault.jpg,https://i.ytimg.com/vi/KEKeF_Gq5j8/hqdefault.jpg
mTfXurw1pA8,Summer Face Pack At Home Tamil | சம்மர் ஃபேஸ் பேக் செய்வது எப்படி?,https://i.ytimg.com/vi/mTfXurw1pA8/default.jpg,https://i.ytimg.com/vi/mTfXurw1pA8/mqdefault.jpg,https://i.ytimg.com/vi/mTfXurw1pA8/hqdefault.jpg
0A-6OGM6RZM,How To Get Smooth Skin Tamil | உங்கள் சருமம் மென்மையாக வேண்டுமா?,https://i.ytimg.com/vi/0A-6OGM6RZM/default.jpg,https://i.ytimg.com/vi/0A-6OGM6RZM/mqdefault.jpg,https://i.ytimg.com/vi/0A-6OGM6RZM/hqdefault.jpg
OoxYQL24m7s,Get Tightening And Glowing Skin Tamil | முகச்சுருக்கத்தை போக்குவது எப்படி?,https://i.ytimg.com/vi/OoxYQL24m7s/default.jpg,https://i.ytimg.com/vi/OoxYQL24m7s/mqdefault.jpg,https://i.ytimg.com/vi/OoxYQL24m7s/hqdefault.jpg
9-KRh833s6k,Golden Night Pack For Skin Tamil | இரவு நேர ஃபேஸ் பேக் செய்வது எப்படி?,https://i.ytimg.com/vi/9-KRh833s6k/default.jpg,https://i.ytimg.com/vi/9-KRh833s6k/mqdefault.jpg,https://i.ytimg.com/vi/9-KRh833s6k/hqdefault.jpg
Qxf0RQiRoe0,Tomato For Face Clean And Scrub Tamil | முகத்தை சுத்தப்படுத்தும் தக்காளி ஸ்க்ரப்பர்!,https://i.ytimg.com/vi/Qxf0RQiRoe0/default.jpg,https://i.ytimg.com/vi/Qxf0RQiRoe0/mqdefault.jpg,https://i.ytimg.com/vi/Qxf0RQiRoe0/hqdefault.jpg
umYRu1nlkhg,How To Get Skin Brightness At Night Time  | இரவு நேர ஸ்கின் கிரீம் செய்வது எப்படி?,https://i.ytimg.com/vi/umYRu1nlkhg/default.jpg,https://i.ytimg.com/vi/umYRu1nlkhg/mqdefault.jpg,https://i.ytimg.com/vi/umYRu1nlkhg/hqdefault.jpg
VJw3bJ7Vn9A,Use Flax Seed For Hair Growth Tamil | அடர்த்தியான தலை முடி வளர வேண்டுமா?,https://i.ytimg.com/vi/VJw3bJ7Vn9A/default.jpg,https://i.ytimg.com/vi/VJw3bJ7Vn9A/mqdefault.jpg,https://i.ytimg.com/vi/VJw3bJ7Vn9A/hqdefault.jpg
WKzyBlamP-g,5 Simple Ways In Makeup Hacks Tamil | சீக்கீரம் மேக்கப் போடனும் எப்படி?,https://i.ytimg.com/vi/WKzyBlamP-g/default.jpg,https://i.ytimg.com/vi/WKzyBlamP-g/mqdefault.jpg,https://i.ytimg.com/vi/WKzyBlamP-g/hqdefault.jpg
-suYctzfKAc,How To Get Glowing Skin For Face Tamil | பளிச்சிடும் முகத்திற்கு என்ன செய்வது?,https://i.ytimg.com/vi/-suYctzfKAc/default.jpg,https://i.ytimg.com/vi/-suYctzfKAc/mqdefault.jpg,https://i.ytimg.com/vi/-suYctzfKAc/hqdefault.jpg
XT3mTCmv3PM,How To Get Rid Of Cracked Heel Tamil | கால் பாத வெடிப்பு போக்குவது எப்படி?,https://i.ytimg.com/vi/XT3mTCmv3PM/default.jpg,https://i.ytimg.com/vi/XT3mTCmv3PM/mqdefault.jpg,https://i.ytimg.com/vi/XT3mTCmv3PM/hqdefault.jpg
OYoX6P1swQw,Flawless Skin Beauty Pack Tamil | முகம் ஜொலிக்க என்ன செய்ய வேண்டும்?,https://i.ytimg.com/vi/OYoX6P1swQw/default.jpg,https://i.ytimg.com/vi/OYoX6P1swQw/mqdefault.jpg,https://i.ytimg.com/vi/OYoX6P1swQw/hqdefault.jpg
vdyvZtpDqcE,Tomato Facial For Skin Whitening Tamil | சருமம்  வெண்மை அழுகு பெற வேண்டுமா?,https://i.ytimg.com/vi/vdyvZtpDqcE/default.jpg,https://i.ytimg.com/vi/vdyvZtpDqcE/mqdefault.jpg,https://i.ytimg.com/vi/vdyvZtpDqcE/hqdefault.jpg
FzSJdEhe1yw,How To Make Skin Lightening Cream At Home | வெண்மையான சருமம் பெறுவது எப்படி?,https://i.ytimg.com/vi/FzSJdEhe1yw/default.jpg,https://i.ytimg.com/vi/FzSJdEhe1yw/mqdefault.jpg,https://i.ytimg.com/vi/FzSJdEhe1yw/hqdefault.jpg
ripf-_Yokoo,Get Fair Skin Within 7 Days Tamil | தோல் சிவப்பழகு பெற உடனடி தீர்வு?,https://i.ytimg.com/vi/ripf-_Yokoo/default.jpg,https://i.ytimg.com/vi/ripf-_Yokoo/mqdefault.jpg,https://i.ytimg.com/vi/ripf-_Yokoo/hqdefault.jpg
ZzINRJz0QJ0,Get Brightening Skin Use Almond Pack | பிரகாசிக்கும் சருமத்திற்கு பாதாம் கிரீம் செய்வது எப்படி?,https://i.ytimg.com/vi/ZzINRJz0QJ0/default.jpg,https://i.ytimg.com/vi/ZzINRJz0QJ0/mqdefault.jpg,https://i.ytimg.com/vi/ZzINRJz0QJ0/hqdefault.jpg
OlfrDSFKpzI,Tips For Whitening Skin Instantly At Home | உங்க முகம் சீக்கரம் வெண்மையாக வேண்டுமா?,https://i.ytimg.com/vi/OlfrDSFKpzI/default.jpg,https://i.ytimg.com/vi/OlfrDSFKpzI/mqdefault.jpg,https://i.ytimg.com/vi/OlfrDSFKpzI/hqdefault.jpg
ZQFQ6zKrDQk,How To Make Coriander Facepack Tamil | சம்மர் பேஸ்பேக் செய்வது எப்படி?,https://i.ytimg.com/vi/ZQFQ6zKrDQk/default.jpg,https://i.ytimg.com/vi/ZQFQ6zKrDQk/mqdefault.jpg,https://i.ytimg.com/vi/ZQFQ6zKrDQk/hqdefault.jpg
x_esnJRrI_U,Fish Oil Benefits For Skin Glowing Tamil | ஓமேகா 3 ஆயில் முகத்திற்கு தரும் நன்மைகள்?,https://i.ytimg.com/vi/x_esnJRrI_U/default.jpg,https://i.ytimg.com/vi/x_esnJRrI_U/mqdefault.jpg,https://i.ytimg.com/vi/x_esnJRrI_U/hqdefault.jpg
lgmE6lDNUWo,Skin Transformation Pack Tamil | முகம் கலராக என்ன செய்வது?,https://i.ytimg.com/vi/lgmE6lDNUWo/default.jpg,https://i.ytimg.com/vi/lgmE6lDNUWo/mqdefault.jpg,https://i.ytimg.com/vi/lgmE6lDNUWo/hqdefault.jpg
uU07dQQiBLI,Use Rose Petals For Softy Skin | சருமத்தை மெல்லயதாக மாற்ற? ரோஜா இதழை பயன்படுத்துங்க!,https://i.ytimg.com/vi/uU07dQQiBLI/default.jpg,https://i.ytimg.com/vi/uU07dQQiBLI/mqdefault.jpg,https://i.ytimg.com/vi/uU07dQQiBLI/hqdefault.jpg
vojx_O3H0Fc,How to Remove Blackheads at Home | முகத்தில் உள்ள கரும் புள்ளி நீக்குவது எப்படி?,https://i.ytimg.com/vi/vojx_O3H0Fc/default.jpg,https://i.ytimg.com/vi/vojx_O3H0Fc/mqdefault.jpg,https://i.ytimg.com/vi/vojx_O3H0Fc/hqdefault.jpg
pf_xTX67m2Q,How to Get Pink Lips Naturally Tamil | உதட்டை இயற்கை முறையில் அழகுபடுத்த!,https://i.ytimg.com/vi/pf_xTX67m2Q/default.jpg,https://i.ytimg.com/vi/pf_xTX67m2Q/mqdefault.jpg,https://i.ytimg.com/vi/pf_xTX67m2Q/hqdefault.jpg
PGetZI-PkPs,Instant Remedy for Skin Tightening | சருமத்தில் ஏற்படும் சுருக்கங்களை நீக்குவது எப்படி?,https://i.ytimg.com/vi/PGetZI-PkPs/default.jpg,https://i.ytimg.com/vi/PGetZI-PkPs/mqdefault.jpg,https://i.ytimg.com/vi/PGetZI-PkPs/hqdefault.jpg
vptVkMoo77s,Beetroot Powder for Skin Whitening | பீட்ரூட் மூலம் சருமம் அழகுபெறச் செய்வது எப்படி?,https://i.ytimg.com/vi/vptVkMoo77s/default.jpg,https://i.ytimg.com/vi/vptVkMoo77s/mqdefault.jpg,https://i.ytimg.com/vi/vptVkMoo77s/hqdefault.jpg
N1dxIc93mak,Rice Water Benefits for Skin | வயதான தோற்றம் மறைய வேண்டுமா? | Samayam Tamil,https://i.ytimg.com/vi/N1dxIc93mak/default.jpg,https://i.ytimg.com/vi/N1dxIc93mak/mqdefault.jpg,https://i.ytimg.com/vi/N1dxIc93mak/hqdefault.jpg
R15POnk1tTM,How to Grow Long Hair | நீளமாக முடி வளர்ப்பது எப்படி? | Samayam Tamil,https://i.ytimg.com/vi/R15POnk1tTM/default.jpg,https://i.ytimg.com/vi/R15POnk1tTM/mqdefault.jpg,https://i.ytimg.com/vi/R15POnk1tTM/hqdefault.jpg
hCF6gzVZIK8,How to Remove Blackheads at Home | முகத்தில் உள்ள கரும் புள்ளி நீக்குவது எப்படி? | Samayam Tamil,https://i.ytimg.com/vi/hCF6gzVZIK8/default.jpg,https://i.ytimg.com/vi/hCF6gzVZIK8/mqdefault.jpg,https://i.ytimg.com/vi/hCF6gzVZIK8/hqdefault.jpg
1D1qoTOXWkc,How to Make Tomato and Curd Face Pack | உங்க முகம் பளிச்சிட வேண்டுமா? | Samayam Tamil,https://i.ytimg.com/vi/1D1qoTOXWkc/default.jpg,https://i.ytimg.com/vi/1D1qoTOXWkc/mqdefault.jpg,https://i.ytimg.com/vi/1D1qoTOXWkc/hqdefault.jpg
