ID,TITLE,THUMBNAIL1,THUMBNAIL2,THUMBNAIL3
mdxk0yPu7TM,Hikers evacuated from Yosemite as fires burn,https://i.ytimg.com/vi/mdxk0yPu7TM/default.jpg,https://i.ytimg.com/vi/mdxk0yPu7TM/mqdefault.jpg,https://i.ytimg.com/vi/mdxk0yPu7TM/hqdefault.jpg
03RYXsoo7Gw,Ken Burns: Secrets of Hawaii Volcanoes National Park,https://i.ytimg.com/vi/03RYXsoo7Gw/default.jpg,https://i.ytimg.com/vi/03RYXsoo7Gw/mqdefault.jpg,https://i.ytimg.com/vi/03RYXsoo7Gw/hqdefault.jpg
LmZ9qCN4ajQ,Ken Burns' touching personal connection to Shenandoah,https://i.ytimg.com/vi/LmZ9qCN4ajQ/default.jpg,https://i.ytimg.com/vi/LmZ9qCN4ajQ/mqdefault.jpg,https://i.ytimg.com/vi/LmZ9qCN4ajQ/hqdefault.jpg
29IEygJqsUw,Breathtaking double rainbow shines over Colorado,https://i.ytimg.com/vi/29IEygJqsUw/default.jpg,https://i.ytimg.com/vi/29IEygJqsUw/mqdefault.jpg,https://i.ytimg.com/vi/29IEygJqsUw/hqdefault.jpg
de9Ys2Zkgxw,1000 foot 'slip and slide' cools down summer crowd,https://i.ytimg.com/vi/de9Ys2Zkgxw/default.jpg,https://i.ytimg.com/vi/de9Ys2Zkgxw/mqdefault.jpg,https://i.ytimg.com/vi/de9Ys2Zkgxw/hqdefault.jpg
v1ARSjdXkBQ,"Knee Defender fight may be moot, no legroom rights",https://i.ytimg.com/vi/v1ARSjdXkBQ/default.jpg,https://i.ytimg.com/vi/v1ARSjdXkBQ/mqdefault.jpg,https://i.ytimg.com/vi/v1ARSjdXkBQ/hqdefault.jpg
fNxQtW1ZQ0A,Explore these hidden lake caves from a kayak,https://i.ytimg.com/vi/fNxQtW1ZQ0A/default.jpg,https://i.ytimg.com/vi/fNxQtW1ZQ0A/mqdefault.jpg,https://i.ytimg.com/vi/fNxQtW1ZQ0A/hqdefault.jpg
KZaaG8QcVL0,Extremely rare blue lobster finds a new home,https://i.ytimg.com/vi/KZaaG8QcVL0/default.jpg,https://i.ytimg.com/vi/KZaaG8QcVL0/mqdefault.jpg,https://i.ytimg.com/vi/KZaaG8QcVL0/hqdefault.jpg
XaDCLEznHfU,Great white sharks & jellyfish lurking in East Coast waters,https://i.ytimg.com/vi/XaDCLEznHfU/default.jpg,https://i.ytimg.com/vi/XaDCLEznHfU/mqdefault.jpg,https://i.ytimg.com/vi/XaDCLEznHfU/hqdefault.jpg
JlOf7kp8kIY,Ken Burns: Glacier National Park in trouble,https://i.ytimg.com/vi/JlOf7kp8kIY/default.jpg,https://i.ytimg.com/vi/JlOf7kp8kIY/mqdefault.jpg,https://i.ytimg.com/vi/JlOf7kp8kIY/hqdefault.jpg
A-Wh6Bl-tbA,A look at the new World Trade Center Transportation Hub,https://i.ytimg.com/vi/A-Wh6Bl-tbA/default.jpg,https://i.ytimg.com/vi/A-Wh6Bl-tbA/mqdefault.jpg,https://i.ytimg.com/vi/A-Wh6Bl-tbA/hqdefault.jpg
33Xkxg4cFYE,Crew explores N.J. shipwreck that time nearly forgot,https://i.ytimg.com/vi/33Xkxg4cFYE/default.jpg,https://i.ytimg.com/vi/33Xkxg4cFYE/mqdefault.jpg,https://i.ytimg.com/vi/33Xkxg4cFYE/hqdefault.jpg
CxBoi7tPNGM,Ken Burns: Secrets of Great Smoky Mountains National Park,https://i.ytimg.com/vi/CxBoi7tPNGM/default.jpg,https://i.ytimg.com/vi/CxBoi7tPNGM/mqdefault.jpg,https://i.ytimg.com/vi/CxBoi7tPNGM/hqdefault.jpg
uyga0lZ4LiE,Is shark legend 'Old Hitler' real or just a fish tale?,https://i.ytimg.com/vi/uyga0lZ4LiE/default.jpg,https://i.ytimg.com/vi/uyga0lZ4LiE/mqdefault.jpg,https://i.ytimg.com/vi/uyga0lZ4LiE/hqdefault.jpg
FLGFJ7aegQU,Notice something missing from your hotel? This is why,https://i.ytimg.com/vi/FLGFJ7aegQU/default.jpg,https://i.ytimg.com/vi/FLGFJ7aegQU/mqdefault.jpg,https://i.ytimg.com/vi/FLGFJ7aegQU/hqdefault.jpg
VC0Pf3sE6hQ,Ken Burns: Secrets of Rocky Mountain National Park,https://i.ytimg.com/vi/VC0Pf3sE6hQ/default.jpg,https://i.ytimg.com/vi/VC0Pf3sE6hQ/mqdefault.jpg,https://i.ytimg.com/vi/VC0Pf3sE6hQ/hqdefault.jpg
2wh_ya9b8iE,Must-haves for the Shark Week superfan,https://i.ytimg.com/vi/2wh_ya9b8iE/default.jpg,https://i.ytimg.com/vi/2wh_ya9b8iE/mqdefault.jpg,https://i.ytimg.com/vi/2wh_ya9b8iE/hqdefault.jpg
5JI7pcCC9m4,These five dive spots will have you screaming 'Shark!',https://i.ytimg.com/vi/5JI7pcCC9m4/default.jpg,https://i.ytimg.com/vi/5JI7pcCC9m4/mqdefault.jpg,https://i.ytimg.com/vi/5JI7pcCC9m4/hqdefault.jpg
s9zKLOMSS64,Behind the scenes of Giada's first restaurant,https://i.ytimg.com/vi/s9zKLOMSS64/default.jpg,https://i.ytimg.com/vi/s9zKLOMSS64/mqdefault.jpg,https://i.ytimg.com/vi/s9zKLOMSS64/hqdefault.jpg
cqxKNbb7Ot8,Ken Burns: Secrets of Yosemite National Park,https://i.ytimg.com/vi/cqxKNbb7Ot8/default.jpg,https://i.ytimg.com/vi/cqxKNbb7Ot8/mqdefault.jpg,https://i.ytimg.com/vi/cqxKNbb7Ot8/hqdefault.jpg
pms0J68OGUg,10Best: The most fabulous girls' trip getaways,https://i.ytimg.com/vi/pms0J68OGUg/default.jpg,https://i.ytimg.com/vi/pms0J68OGUg/mqdefault.jpg,https://i.ytimg.com/vi/pms0J68OGUg/hqdefault.jpg
uhLTxaJk4D8,Disney Alaska cruise: Soar above a glacier in Juneau,https://i.ytimg.com/vi/uhLTxaJk4D8/default.jpg,https://i.ytimg.com/vi/uhLTxaJk4D8/mqdefault.jpg,https://i.ytimg.com/vi/uhLTxaJk4D8/hqdefault.jpg
OiyqtLFTLQw,Disney Alaska Cruise: Wildlife wonders in Ketchikan,https://i.ytimg.com/vi/OiyqtLFTLQw/default.jpg,https://i.ytimg.com/vi/OiyqtLFTLQw/mqdefault.jpg,https://i.ytimg.com/vi/OiyqtLFTLQw/hqdefault.jpg
R6h_-4GfLJw,"Finding thrills in Skagway, Alaska on a Disney cruise",https://i.ytimg.com/vi/R6h_-4GfLJw/default.jpg,https://i.ytimg.com/vi/R6h_-4GfLJw/mqdefault.jpg,https://i.ytimg.com/vi/R6h_-4GfLJw/hqdefault.jpg
VjwO0_LHjvk,Experience Alaska aboard a Disney cruise ship,https://i.ytimg.com/vi/VjwO0_LHjvk/default.jpg,https://i.ytimg.com/vi/VjwO0_LHjvk/mqdefault.jpg,https://i.ytimg.com/vi/VjwO0_LHjvk/hqdefault.jpg
pgFyX3KrAhI,"Wildlife, adventure tops on Disney's Alaska cruise",https://i.ytimg.com/vi/pgFyX3KrAhI/default.jpg,https://i.ytimg.com/vi/pgFyX3KrAhI/mqdefault.jpg,https://i.ytimg.com/vi/pgFyX3KrAhI/hqdefault.jpg
hKBrP6lHApY,Bring your workout with you while traveling,https://i.ytimg.com/vi/hKBrP6lHApY/default.jpg,https://i.ytimg.com/vi/hKBrP6lHApY/mqdefault.jpg,https://i.ytimg.com/vi/hKBrP6lHApY/hqdefault.jpg
bPe3CV_b9wE,"Have roller coasters, thrill rides gone too far?",https://i.ytimg.com/vi/bPe3CV_b9wE/default.jpg,https://i.ytimg.com/vi/bPe3CV_b9wE/mqdefault.jpg,https://i.ytimg.com/vi/bPe3CV_b9wE/hqdefault.jpg
JrgsWdNQ1KE,"10Best: Golf lovers, this list is for you!",https://i.ytimg.com/vi/JrgsWdNQ1KE/default.jpg,https://i.ytimg.com/vi/JrgsWdNQ1KE/mqdefault.jpg,https://i.ytimg.com/vi/JrgsWdNQ1KE/hqdefault.jpg
BWju6E3Uk9Y,Travel Q&A: Should I check my bag or carry it?,https://i.ytimg.com/vi/BWju6E3Uk9Y/default.jpg,https://i.ytimg.com/vi/BWju6E3Uk9Y/mqdefault.jpg,https://i.ytimg.com/vi/BWju6E3Uk9Y/hqdefault.jpg
abHe4qfczsY,Ukraine official: Malaysia MH17 shot down,https://i.ytimg.com/vi/abHe4qfczsY/default.jpg,https://i.ytimg.com/vi/abHe4qfczsY/mqdefault.jpg,https://i.ytimg.com/vi/abHe4qfczsY/hqdefault.jpg
ln-iB5z5D2g,"Ready, set, scream! World's tallest water slide open for business",https://i.ytimg.com/vi/ln-iB5z5D2g/default.jpg,https://i.ytimg.com/vi/ln-iB5z5D2g/mqdefault.jpg,https://i.ytimg.com/vi/ln-iB5z5D2g/hqdefault.jpg
swHBwub-zsA,"Heart rate soars on Verruckt, world's tallest water slide",https://i.ytimg.com/vi/swHBwub-zsA/default.jpg,https://i.ytimg.com/vi/swHBwub-zsA/mqdefault.jpg,https://i.ytimg.com/vi/swHBwub-zsA/hqdefault.jpg
eWixhuiiM0I,"Lifeguards take on Verruckt, world's tallest water slide",https://i.ytimg.com/vi/eWixhuiiM0I/default.jpg,https://i.ytimg.com/vi/eWixhuiiM0I/mqdefault.jpg,https://i.ytimg.com/vi/eWixhuiiM0I/hqdefault.jpg
x7PjRKPnI68,"Dare to ride Verruckt, world's tallest water slide?",https://i.ytimg.com/vi/x7PjRKPnI68/default.jpg,https://i.ytimg.com/vi/x7PjRKPnI68/mqdefault.jpg,https://i.ytimg.com/vi/x7PjRKPnI68/hqdefault.jpg
5vR3vm9_LMI,See Verruckt designer scream going down water slide,https://i.ytimg.com/vi/5vR3vm9_LMI/default.jpg,https://i.ytimg.com/vi/5vR3vm9_LMI/mqdefault.jpg,https://i.ytimg.com/vi/5vR3vm9_LMI/hqdefault.jpg
HVamHL4UfSc,Six Flags gives Batman the Ride a new twist,https://i.ytimg.com/vi/HVamHL4UfSc/default.jpg,https://i.ytimg.com/vi/HVamHL4UfSc/mqdefault.jpg,https://i.ytimg.com/vi/HVamHL4UfSc/hqdefault.jpg
oNMVPRpUXQ4,3 ways to outsmart a car rental company,https://i.ytimg.com/vi/oNMVPRpUXQ4/default.jpg,https://i.ytimg.com/vi/oNMVPRpUXQ4/mqdefault.jpg,https://i.ytimg.com/vi/oNMVPRpUXQ4/hqdefault.jpg
iTxw1PlNCxw,Verruckt: Ride the world's tallest water slide,https://i.ytimg.com/vi/iTxw1PlNCxw/default.jpg,https://i.ytimg.com/vi/iTxw1PlNCxw/mqdefault.jpg,https://i.ytimg.com/vi/iTxw1PlNCxw/hqdefault.jpg
5VqtQdXhxyA,10Best: Loyal football fans voted on best stadium,https://i.ytimg.com/vi/5VqtQdXhxyA/default.jpg,https://i.ytimg.com/vi/5VqtQdXhxyA/mqdefault.jpg,https://i.ytimg.com/vi/5VqtQdXhxyA/hqdefault.jpg
AbhyD5JkRG0,Don't bother bringing these when you travel,https://i.ytimg.com/vi/AbhyD5JkRG0/default.jpg,https://i.ytimg.com/vi/AbhyD5JkRG0/mqdefault.jpg,https://i.ytimg.com/vi/AbhyD5JkRG0/hqdefault.jpg
h4lvUyDBQts,Gringotts Ride puts muggles inside Harry's heist,https://i.ytimg.com/vi/h4lvUyDBQts/default.jpg,https://i.ytimg.com/vi/h4lvUyDBQts/mqdefault.jpg,https://i.ytimg.com/vi/h4lvUyDBQts/hqdefault.jpg
e0fr6Rmq0aY,Rocky Mountaineer train soars to new heights,https://i.ytimg.com/vi/e0fr6Rmq0aY/default.jpg,https://i.ytimg.com/vi/e0fr6Rmq0aY/mqdefault.jpg,https://i.ytimg.com/vi/e0fr6Rmq0aY/hqdefault.jpg
nDnP6pbzpWU,10Best: You won't guess the top romantic destination,https://i.ytimg.com/vi/nDnP6pbzpWU/default.jpg,https://i.ytimg.com/vi/nDnP6pbzpWU/mqdefault.jpg,https://i.ytimg.com/vi/nDnP6pbzpWU/hqdefault.jpg
bPon9stZNzY,Best Airport Hotels,https://i.ytimg.com/vi/bPon9stZNzY/default.jpg,https://i.ytimg.com/vi/bPon9stZNzY/mqdefault.jpg,https://i.ytimg.com/vi/bPon9stZNzY/hqdefault.jpg
-VPAnceh8IY,Exclusive peek inside Universal's new Harry Potter ride,https://i.ytimg.com/vi/-VPAnceh8IY/default.jpg,https://i.ytimg.com/vi/-VPAnceh8IY/mqdefault.jpg,https://i.ytimg.com/vi/-VPAnceh8IY/hqdefault.jpg
1izrqXy4oy4,10Best: Top bucket list destinations,https://i.ytimg.com/vi/1izrqXy4oy4/default.jpg,https://i.ytimg.com/vi/1izrqXy4oy4/mqdefault.jpg,https://i.ytimg.com/vi/1izrqXy4oy4/hqdefault.jpg
g76J9fp6CMc,Verruckt: world's tallest water slide is insane,https://i.ytimg.com/vi/g76J9fp6CMc/default.jpg,https://i.ytimg.com/vi/g76J9fp6CMc/mqdefault.jpg,https://i.ytimg.com/vi/g76J9fp6CMc/hqdefault.jpg
WyS72h1_uDs,Rare volcano found underwater in shipwreck search,https://i.ytimg.com/vi/WyS72h1_uDs/default.jpg,https://i.ytimg.com/vi/WyS72h1_uDs/mqdefault.jpg,https://i.ytimg.com/vi/WyS72h1_uDs/hqdefault.jpg
06gME-YZUns,"Forget the minibar, these luxury hotel perks will blow you away",https://i.ytimg.com/vi/06gME-YZUns/default.jpg,https://i.ytimg.com/vi/06gME-YZUns/mqdefault.jpg,https://i.ytimg.com/vi/06gME-YZUns/hqdefault.jpg
YAwTDCr8qq4,Verruckt is officially the world's tallest waterslide,https://i.ytimg.com/vi/YAwTDCr8qq4/default.jpg,https://i.ytimg.com/vi/YAwTDCr8qq4/mqdefault.jpg,https://i.ytimg.com/vi/YAwTDCr8qq4/hqdefault.jpg
p9WYmhqN0QM,Busch Gardens' 335-foot drop tower feels like skydiving,https://i.ytimg.com/vi/p9WYmhqN0QM/default.jpg,https://i.ytimg.com/vi/p9WYmhqN0QM/mqdefault.jpg,https://i.ytimg.com/vi/p9WYmhqN0QM/hqdefault.jpg
Wzn-JmToQgM,High Roller offers spectacular views of Las Vegas,https://i.ytimg.com/vi/Wzn-JmToQgM/default.jpg,https://i.ytimg.com/vi/Wzn-JmToQgM/mqdefault.jpg,https://i.ytimg.com/vi/Wzn-JmToQgM/hqdefault.jpg
2tKrFwuCV44,Swimming with whale sharks,https://i.ytimg.com/vi/2tKrFwuCV44/default.jpg,https://i.ytimg.com/vi/2tKrFwuCV44/mqdefault.jpg,https://i.ytimg.com/vi/2tKrFwuCV44/hqdefault.jpg
ZNbg9vhI38A,Twilight tours: How the book series has transformed a small town,https://i.ytimg.com/vi/ZNbg9vhI38A/default.jpg,https://i.ytimg.com/vi/ZNbg9vhI38A/mqdefault.jpg,https://i.ytimg.com/vi/ZNbg9vhI38A/hqdefault.jpg
CV7Zf9MPBpA,'Living The Experience',https://i.ytimg.com/vi/CV7Zf9MPBpA/default.jpg,https://i.ytimg.com/vi/CV7Zf9MPBpA/mqdefault.jpg,https://i.ytimg.com/vi/CV7Zf9MPBpA/hqdefault.jpg
oR6hi7oNrmo,Searching for emeralds in Colombia,https://i.ytimg.com/vi/oR6hi7oNrmo/default.jpg,https://i.ytimg.com/vi/oR6hi7oNrmo/mqdefault.jpg,https://i.ytimg.com/vi/oR6hi7oNrmo/hqdefault.jpg
yKCSsv3K69g,Yellowstone in winter,https://i.ytimg.com/vi/yKCSsv3K69g/default.jpg,https://i.ytimg.com/vi/yKCSsv3K69g/mqdefault.jpg,https://i.ytimg.com/vi/yKCSsv3K69g/hqdefault.jpg
azCWgAB27I8,Rainn Wilson talks about his recent trip to Haiti,https://i.ytimg.com/vi/azCWgAB27I8/default.jpg,https://i.ytimg.com/vi/azCWgAB27I8/mqdefault.jpg,https://i.ytimg.com/vi/azCWgAB27I8/hqdefault.jpg
YrEsP_mJFFo,Afternoon in New Mexico,https://i.ytimg.com/vi/YrEsP_mJFFo/default.jpg,https://i.ytimg.com/vi/YrEsP_mJFFo/mqdefault.jpg,https://i.ytimg.com/vi/YrEsP_mJFFo/hqdefault.jpg
POMusLUJ37M,Travel Channel Academy,https://i.ytimg.com/vi/POMusLUJ37M/default.jpg,https://i.ytimg.com/vi/POMusLUJ37M/mqdefault.jpg,https://i.ytimg.com/vi/POMusLUJ37M/hqdefault.jpg
Y_1NO5O2hks,"Tuskegee Airman on life, Obama",https://i.ytimg.com/vi/Y_1NO5O2hks/default.jpg,https://i.ytimg.com/vi/Y_1NO5O2hks/mqdefault.jpg,https://i.ytimg.com/vi/Y_1NO5O2hks/hqdefault.jpg
z3vIKSdbwcA,North Carolina Barbecue Trail (part 2),https://i.ytimg.com/vi/z3vIKSdbwcA/default.jpg,https://i.ytimg.com/vi/z3vIKSdbwcA/mqdefault.jpg,https://i.ytimg.com/vi/z3vIKSdbwcA/hqdefault.jpg
hQllZciurzM,North Carolina Barbecue Trail (part 1),https://i.ytimg.com/vi/hQllZciurzM/default.jpg,https://i.ytimg.com/vi/hQllZciurzM/mqdefault.jpg,https://i.ytimg.com/vi/hQllZciurzM/hqdefault.jpg
_zefrxQPqqY,Private video,https://i.ytimg.com/vi/_zefrxQPqqY/default.jpg,https://i.ytimg.com/vi/_zefrxQPqqY/mqdefault.jpg,https://i.ytimg.com/vi/_zefrxQPqqY/hqdefault.jpg
6pV4j_NnPXQ,Private video,https://i.ytimg.com/vi/6pV4j_NnPXQ/default.jpg,https://i.ytimg.com/vi/6pV4j_NnPXQ/mqdefault.jpg,https://i.ytimg.com/vi/6pV4j_NnPXQ/hqdefault.jpg
