ID,TITLE,THUMBNAIL1,THUMBNAIL2,THUMBNAIL3
djgwpNj65wg,Best Facial Massage For Puffy Face Tamil | நீர்கோர்த்த முகத்திற்கு சிறந்த மசாஜ்,https://i.ytimg.com/vi/djgwpNj65wg/default.jpg,https://i.ytimg.com/vi/djgwpNj65wg/mqdefault.jpg,https://i.ytimg.com/vi/djgwpNj65wg/hqdefault.jpg
q3wkIUs47KU,Best Sleeping Mask For Hair Problem | தலைமுடி பிரச்சனைக்கு தீர்வு தரும் ஹேர் மாஸ்க்,https://i.ytimg.com/vi/q3wkIUs47KU/default.jpg,https://i.ytimg.com/vi/q3wkIUs47KU/mqdefault.jpg,https://i.ytimg.com/vi/q3wkIUs47KU/hqdefault.jpg
Xv4uU2zeJh0,Best Cream For Anti Aging | வயதான முகத்தோற்றம் இனி வராமல் இருக்க வேண்டுமா?,https://i.ytimg.com/vi/Xv4uU2zeJh0/default.jpg,https://i.ytimg.com/vi/Xv4uU2zeJh0/mqdefault.jpg,https://i.ytimg.com/vi/Xv4uU2zeJh0/hqdefault.jpg
1a2Ic2Kh834,Face Mask For Oil Skin | முகத்தில் எண்ணெய் வடிகிறதா,https://i.ytimg.com/vi/1a2Ic2Kh834/default.jpg,https://i.ytimg.com/vi/1a2Ic2Kh834/mqdefault.jpg,https://i.ytimg.com/vi/1a2Ic2Kh834/hqdefault.jpg
ZiHPvFFndpY,Monsoon Routine Facepack Tamil | ஈரப்பதமான சூழ்நிலையிலும் சருமத்தை பாதுகாக்க வேண்டுமா,https://i.ytimg.com/vi/ZiHPvFFndpY/default.jpg,https://i.ytimg.com/vi/ZiHPvFFndpY/mqdefault.jpg,https://i.ytimg.com/vi/ZiHPvFFndpY/hqdefault.jpg
0BauKPex83E,Natural Oil For Hairfall Tamil | முடி கொட்டுவதை தடுத்து விரைவில் முடி வளர வேண்டுமா?,https://i.ytimg.com/vi/0BauKPex83E/default.jpg,https://i.ytimg.com/vi/0BauKPex83E/mqdefault.jpg,https://i.ytimg.com/vi/0BauKPex83E/hqdefault.jpg
fHzzo1EdHIY,"Face Cleanser For Acne And Oily Face | முகப்பரு, பிசுபிசுப்பை போக்கி பொலிவான முகத்தை பெற வேண்டுமா?",https://i.ytimg.com/vi/fHzzo1EdHIY/default.jpg,https://i.ytimg.com/vi/fHzzo1EdHIY/mqdefault.jpg,https://i.ytimg.com/vi/fHzzo1EdHIY/hqdefault.jpg
Erqbldf0VCs,Natural Remedy For Hairfall Tamil | முடி உதிர்வை இயற்கை முறையில் தடுப்பது எப்படி?,https://i.ytimg.com/vi/Erqbldf0VCs/default.jpg,https://i.ytimg.com/vi/Erqbldf0VCs/mqdefault.jpg,https://i.ytimg.com/vi/Erqbldf0VCs/hqdefault.jpg
ULS-f2Gkr_M,Remove Skin Pigmentation Easily Tamil | முக அழகை பாதிக்கும் மங்கு உடயே மறைய வேண்டுமா?,https://i.ytimg.com/vi/ULS-f2Gkr_M/default.jpg,https://i.ytimg.com/vi/ULS-f2Gkr_M/mqdefault.jpg,https://i.ytimg.com/vi/ULS-f2Gkr_M/hqdefault.jpg
j9Q0A31dpB8,Instant Face Pack For Tan Removal Tamil | சரும அழகை பாதிக்கும் சன் டேன் போக்குவது எப்படி?,https://i.ytimg.com/vi/j9Q0A31dpB8/default.jpg,https://i.ytimg.com/vi/j9Q0A31dpB8/mqdefault.jpg,https://i.ytimg.com/vi/j9Q0A31dpB8/hqdefault.jpg
w1OytOhnZ1E,Homemade Scrub For Skin Brightening Tamil | சருமத்திற்கு பொலிவைத்தரும் சூப்பர் ஃபேஸ் ஸ்க்ரப்,https://i.ytimg.com/vi/w1OytOhnZ1E/default.jpg,https://i.ytimg.com/vi/w1OytOhnZ1E/mqdefault.jpg,https://i.ytimg.com/vi/w1OytOhnZ1E/hqdefault.jpg
2bu0Y2OXmo8,Homemade Night Mask For Face Shining | முகத்தை பளிச்சிட செய்யும் நைட் மாஸ்க் எப்படி செய்வது?,https://i.ytimg.com/vi/2bu0Y2OXmo8/default.jpg,https://i.ytimg.com/vi/2bu0Y2OXmo8/mqdefault.jpg,https://i.ytimg.com/vi/2bu0Y2OXmo8/hqdefault.jpg
5ySA7x49viU,Steam Therapy For Face Shining Tamil | முகத்தை பளிச்சிட செய்யும் நீராவி எப்படி செய்வது?,https://i.ytimg.com/vi/5ySA7x49viU/default.jpg,https://i.ytimg.com/vi/5ySA7x49viU/mqdefault.jpg,https://i.ytimg.com/vi/5ySA7x49viU/hqdefault.jpg
Kabn69UA2ic,Mint Toner For Bright Face Tamil | முகத்தை பொலிவாக வைத்திருக்க உதவும் புதினா,https://i.ytimg.com/vi/Kabn69UA2ic/default.jpg,https://i.ytimg.com/vi/Kabn69UA2ic/mqdefault.jpg,https://i.ytimg.com/vi/Kabn69UA2ic/hqdefault.jpg
x8E0Dc4JCkA,Homemade Coffee Scrub For Tan Tamil | உங்கள் சருமத்தில் இருக்கும் டேன் உடனே மறைய?,https://i.ytimg.com/vi/x8E0Dc4JCkA/default.jpg,https://i.ytimg.com/vi/x8E0Dc4JCkA/mqdefault.jpg,https://i.ytimg.com/vi/x8E0Dc4JCkA/hqdefault.jpg
yM1EaTE9xkI,Homemade Green Tea Scrub | கிரீன் டீ ஸ்க்ரப் செய்வது எப்படி?,https://i.ytimg.com/vi/yM1EaTE9xkI/default.jpg,https://i.ytimg.com/vi/yM1EaTE9xkI/mqdefault.jpg,https://i.ytimg.com/vi/yM1EaTE9xkI/hqdefault.jpg
oUlMfy1fpi4,skin Brightening Face Pack | இயற்கை முறையில் முகம் ஜொலிக்க வேண்டுமா?,https://i.ytimg.com/vi/oUlMfy1fpi4/default.jpg,https://i.ytimg.com/vi/oUlMfy1fpi4/mqdefault.jpg,https://i.ytimg.com/vi/oUlMfy1fpi4/hqdefault.jpg
P-mggbgP1l0,Carrot Toner For Skin Glowing | சருமத்திற்கு பொலிவை தரும் கேரட் டோனர்,https://i.ytimg.com/vi/P-mggbgP1l0/default.jpg,https://i.ytimg.com/vi/P-mggbgP1l0/mqdefault.jpg,https://i.ytimg.com/vi/P-mggbgP1l0/hqdefault.jpg
MVz3OaMhddE,Easy Steps To Apply Hair Oil Tamil | தலைக்கு எண்ணெய் தேய்க்கும் எளிமையான முறை,https://i.ytimg.com/vi/MVz3OaMhddE/default.jpg,https://i.ytimg.com/vi/MVz3OaMhddE/mqdefault.jpg,https://i.ytimg.com/vi/MVz3OaMhddE/hqdefault.jpg
2UxHsRJUaFQ,Face Pack For Glowing Skin | சருமம் பளபளப்பாக இருக்க வேண்டுமா?,https://i.ytimg.com/vi/2UxHsRJUaFQ/default.jpg,https://i.ytimg.com/vi/2UxHsRJUaFQ/mqdefault.jpg,https://i.ytimg.com/vi/2UxHsRJUaFQ/hqdefault.jpg
lrVPZm1774o,Face Pack For Glowing Skin | பளபளக்கும் முகத்திற்கு வீட்டிலே செய்யும் ஃபேஸ் பேக்,https://i.ytimg.com/vi/lrVPZm1774o/default.jpg,https://i.ytimg.com/vi/lrVPZm1774o/mqdefault.jpg,https://i.ytimg.com/vi/lrVPZm1774o/hqdefault.jpg
lD00icDqY6c,Rose Petals For Glowing Skin | ரோஜா இதழ் சீரம் செய்யும் முறை,https://i.ytimg.com/vi/lD00icDqY6c/default.jpg,https://i.ytimg.com/vi/lD00icDqY6c/mqdefault.jpg,https://i.ytimg.com/vi/lD00icDqY6c/hqdefault.jpg
18TMcXvthIs,Best Face Toner For Glow Skin | சிறந்த அழகை தரும் சூப்பர் ஃபேஸ் டோனர்,https://i.ytimg.com/vi/18TMcXvthIs/default.jpg,https://i.ytimg.com/vi/18TMcXvthIs/mqdefault.jpg,https://i.ytimg.com/vi/18TMcXvthIs/hqdefault.jpg
H69TBcD1Ddk,Homemade Cucumber Toner Tamil | வீட்லையே செய்யலாம் natural toner எப்படி?,https://i.ytimg.com/vi/H69TBcD1Ddk/default.jpg,https://i.ytimg.com/vi/H69TBcD1Ddk/mqdefault.jpg,https://i.ytimg.com/vi/H69TBcD1Ddk/hqdefault.jpg
iljRsLgO2kA,Amla Face Pack For Glow And Natural Skin | இயற்கை முகப்பொலிவை பெற எளிமையா பேஸ் பேக்,https://i.ytimg.com/vi/iljRsLgO2kA/default.jpg,https://i.ytimg.com/vi/iljRsLgO2kA/mqdefault.jpg,https://i.ytimg.com/vi/iljRsLgO2kA/hqdefault.jpg
vns5PdsrjqY,Tomato Peel Mask For Glow Skin Tamil | முகப்பொலிவை தரும் தக்காளி ஃபேஸ் மாஸ்க் குறிப்புகள்,https://i.ytimg.com/vi/vns5PdsrjqY/default.jpg,https://i.ytimg.com/vi/vns5PdsrjqY/mqdefault.jpg,https://i.ytimg.com/vi/vns5PdsrjqY/hqdefault.jpg
RsW8XhlXwiQ,Carrot Cream For Bright And Glowing Skin | இயற்கை முறையில் முகம் மின்னிட வேண்டுமா?,https://i.ytimg.com/vi/RsW8XhlXwiQ/default.jpg,https://i.ytimg.com/vi/RsW8XhlXwiQ/mqdefault.jpg,https://i.ytimg.com/vi/RsW8XhlXwiQ/hqdefault.jpg
aOOOn6LBhjQ,"Juice For Clear And Bright Skin Tamil | சருமத்தை பளபளப்பாகவும், வெண்மையாகவும் வைத்திருக்க வேண்டுமா?",https://i.ytimg.com/vi/aOOOn6LBhjQ/default.jpg,https://i.ytimg.com/vi/aOOOn6LBhjQ/mqdefault.jpg,https://i.ytimg.com/vi/aOOOn6LBhjQ/hqdefault.jpg
57tpXcCB9Lc,3 Instant Tips For To Remove Sun Tan Tamil | முகத்தின் அழகை பாதிக்கும் சன் டேன் நீக்குவது எப்படி?,https://i.ytimg.com/vi/57tpXcCB9Lc/default.jpg,https://i.ytimg.com/vi/57tpXcCB9Lc/mqdefault.jpg,https://i.ytimg.com/vi/57tpXcCB9Lc/hqdefault.jpg
OJIKtVceeHE,3 Simple Ways To Remove Dark Neck | கழுத்துப் பகுதியில் இருக்கும் கருமை முழுமையாக நீக்கிட,https://i.ytimg.com/vi/OJIKtVceeHE/default.jpg,https://i.ytimg.com/vi/OJIKtVceeHE/mqdefault.jpg,https://i.ytimg.com/vi/OJIKtVceeHE/hqdefault.jpg
b1G_FbPxM_Y,3 Different Face Mask With In 5 Minutes | 5 நிமிடத்தில் முகம் பளிச்சென தெரிய வேண்டுமா?,https://i.ytimg.com/vi/b1G_FbPxM_Y/default.jpg,https://i.ytimg.com/vi/b1G_FbPxM_Y/mqdefault.jpg,https://i.ytimg.com/vi/b1G_FbPxM_Y/hqdefault.jpg
ybyiO5CZgYA,Coconut Water Face Mask For Glow Skin | சருமத்தை ஒளிரச் செய்யும் அழகு குறிப்புகள்,https://i.ytimg.com/vi/ybyiO5CZgYA/default.jpg,https://i.ytimg.com/vi/ybyiO5CZgYA/mqdefault.jpg,https://i.ytimg.com/vi/ybyiO5CZgYA/hqdefault.jpg
06PYBfoZ0iE,Homemade Hair Spray For Healthy Hair | கூந்தல் பிரச்சனையை உடனே போக்கும் ஹேர் சீரம்,https://i.ytimg.com/vi/06PYBfoZ0iE/default.jpg,https://i.ytimg.com/vi/06PYBfoZ0iE/mqdefault.jpg,https://i.ytimg.com/vi/06PYBfoZ0iE/hqdefault.jpg
-ogukYlHSSg,Charcoal Powder For Teeth Whitening | பற்களில் இருக்கும் மஞ்சள் கறை நீங்க வேண்டுமா?,https://i.ytimg.com/vi/-ogukYlHSSg/default.jpg,https://i.ytimg.com/vi/-ogukYlHSSg/mqdefault.jpg,https://i.ytimg.com/vi/-ogukYlHSSg/hqdefault.jpg
6cgaqVZKjXA,Homemade Natural Face Cleanser Tamil | முகத்தை பாதுகாக்க இயற்கையான வீட்டு வைத்தியம்,https://i.ytimg.com/vi/6cgaqVZKjXA/default.jpg,https://i.ytimg.com/vi/6cgaqVZKjXA/mqdefault.jpg,https://i.ytimg.com/vi/6cgaqVZKjXA/hqdefault.jpg
OnmpZPmaQ9o,Homemade Face Pack For Bright Skin | பிகாசிக்கும் முகத்திற்கு இயற்கையான ஃபேஸ் பேக் செய்வது எப்படி,https://i.ytimg.com/vi/OnmpZPmaQ9o/default.jpg,https://i.ytimg.com/vi/OnmpZPmaQ9o/mqdefault.jpg,https://i.ytimg.com/vi/OnmpZPmaQ9o/hqdefault.jpg
EEINol_HVSg,Instant Green Tea Face Pack | கிரீன் டீ ஃபேஸ் பேக் செய்வது எப்படி?,https://i.ytimg.com/vi/EEINol_HVSg/default.jpg,https://i.ytimg.com/vi/EEINol_HVSg/mqdefault.jpg,https://i.ytimg.com/vi/EEINol_HVSg/hqdefault.jpg
5aOQnyqh7Q0,Homemade Face Pack For All Type Skin | சருமத்தை பாதுகாக்கும் சூப்பர் ஃபேஸ் பேக்,https://i.ytimg.com/vi/5aOQnyqh7Q0/default.jpg,https://i.ytimg.com/vi/5aOQnyqh7Q0/mqdefault.jpg,https://i.ytimg.com/vi/5aOQnyqh7Q0/hqdefault.jpg
CWGmljpbrKA,Tulsi Face Pack For Skin Glowing | முகத்தை பளிச்சிட செய்யும் ஃபேஸ் பேக்,https://i.ytimg.com/vi/CWGmljpbrKA/default.jpg,https://i.ytimg.com/vi/CWGmljpbrKA/mqdefault.jpg,https://i.ytimg.com/vi/CWGmljpbrKA/hqdefault.jpg
lYcc_zuU22g,Homemade Green Tea Scrub | கிரீன் டீ ஸ்க்ரப் செய்வது எப்படி?,https://i.ytimg.com/vi/lYcc_zuU22g/default.jpg,https://i.ytimg.com/vi/lYcc_zuU22g/mqdefault.jpg,https://i.ytimg.com/vi/lYcc_zuU22g/hqdefault.jpg
_nNM6Z3OGfw,Remove Dark Lips | கருப்பாக இருக்கும் உதட்டை கலராக்க வேண்டுமா?,https://i.ytimg.com/vi/_nNM6Z3OGfw/default.jpg,https://i.ytimg.com/vi/_nNM6Z3OGfw/mqdefault.jpg,https://i.ytimg.com/vi/_nNM6Z3OGfw/hqdefault.jpg
yqs_fgAeT9I,Guava Face Toner For Fresh Face | உங்க முகம் எப்பவும் பொலிவா இருக்க?,https://i.ytimg.com/vi/yqs_fgAeT9I/default.jpg,https://i.ytimg.com/vi/yqs_fgAeT9I/mqdefault.jpg,https://i.ytimg.com/vi/yqs_fgAeT9I/hqdefault.jpg
aC53FWkKvU4,Natural Home Remedy For Hair fall Tamil | தலைமுடி கொட்டுவதை தடுப்பது எப்படி,https://i.ytimg.com/vi/aC53FWkKvU4/default.jpg,https://i.ytimg.com/vi/aC53FWkKvU4/mqdefault.jpg,https://i.ytimg.com/vi/aC53FWkKvU4/hqdefault.jpg
FgGl4ei2dHA,Coconut Milk For Skin Brightening | முகம் பளிச்சிட தேங்காய் பால் ஃபேஸ் பேக்,https://i.ytimg.com/vi/FgGl4ei2dHA/default.jpg,https://i.ytimg.com/vi/FgGl4ei2dHA/mqdefault.jpg,https://i.ytimg.com/vi/FgGl4ei2dHA/hqdefault.jpg
VfTRIJVeupY,Remove Darkness Around Mouth | வாயை சுற்றி இருக்கும் கருமையை போக்குவது எப்படி?,https://i.ytimg.com/vi/VfTRIJVeupY/default.jpg,https://i.ytimg.com/vi/VfTRIJVeupY/mqdefault.jpg,https://i.ytimg.com/vi/VfTRIJVeupY/hqdefault.jpg
1Jave_U1jWo,Natural Pack For Face Whitening | வீட்டிலேயே இயற்கையான சிவப்பழகை பெற வேண்டுமா?,https://i.ytimg.com/vi/1Jave_U1jWo/default.jpg,https://i.ytimg.com/vi/1Jave_U1jWo/mqdefault.jpg,https://i.ytimg.com/vi/1Jave_U1jWo/hqdefault.jpg
YhiQtEk16WQ,Guava Leaves For Skin Brightening | இயற்கை முறையில் முகப்பொலிவை பெற,https://i.ytimg.com/vi/YhiQtEk16WQ/default.jpg,https://i.ytimg.com/vi/YhiQtEk16WQ/mqdefault.jpg,https://i.ytimg.com/vi/YhiQtEk16WQ/hqdefault.jpg
2qWNCLGkk4c,Best Under Eye Pack At Home | கருவளையம் இருக்கா கவலை படாதிங்க,https://i.ytimg.com/vi/2qWNCLGkk4c/default.jpg,https://i.ytimg.com/vi/2qWNCLGkk4c/mqdefault.jpg,https://i.ytimg.com/vi/2qWNCLGkk4c/hqdefault.jpg
ierfMj0ny_Y,How To Lighten Your Elbows | கருப்பாக இருக்கும் கை முட்டியை போக்குவது எப்படி?,https://i.ytimg.com/vi/ierfMj0ny_Y/default.jpg,https://i.ytimg.com/vi/ierfMj0ny_Y/mqdefault.jpg,https://i.ytimg.com/vi/ierfMj0ny_Y/hqdefault.jpg
fCwwSYtryDo,coffee Pack For Oily Skin | ஆயில் சருமத்தை உடனே விரட்டும் ஃபேஸ் பேக்,https://i.ytimg.com/vi/fCwwSYtryDo/default.jpg,https://i.ytimg.com/vi/fCwwSYtryDo/mqdefault.jpg,https://i.ytimg.com/vi/fCwwSYtryDo/hqdefault.jpg
L47YMI0eHY0,How To Remove Sun Tan | சன் டேனை நீக்கும் ஃபேஸ் பேக்,https://i.ytimg.com/vi/L47YMI0eHY0/default.jpg,https://i.ytimg.com/vi/L47YMI0eHY0/mqdefault.jpg,https://i.ytimg.com/vi/L47YMI0eHY0/hqdefault.jpg
e3d1V-fn3Zs,Rose Quartz Roller For Face Shine Tamil | இரத்த ஓட்டத்தை அதிகரித்து முகத்தை அழகாக்க வேண்டுமா?,https://i.ytimg.com/vi/e3d1V-fn3Zs/default.jpg,https://i.ytimg.com/vi/e3d1V-fn3Zs/mqdefault.jpg,https://i.ytimg.com/vi/e3d1V-fn3Zs/hqdefault.jpg
st5KJmbj1XU,Make Under Eye Cream Tips | கருவளையம் உடனே மறைந்திட வேண்டுமா?,https://i.ytimg.com/vi/st5KJmbj1XU/default.jpg,https://i.ytimg.com/vi/st5KJmbj1XU/mqdefault.jpg,https://i.ytimg.com/vi/st5KJmbj1XU/hqdefault.jpg
tnSMr4eljB0,Best Scrub For Pink Lips | உதட்டை கலராக்கும் ஸ்க்ரப் செய்வது எப்படி?,https://i.ytimg.com/vi/tnSMr4eljB0/default.jpg,https://i.ytimg.com/vi/tnSMr4eljB0/mqdefault.jpg,https://i.ytimg.com/vi/tnSMr4eljB0/hqdefault.jpg
JyaMT-kbDTY,Make Guava Leaves Mouth Wash | வீட்டிலேயே செய்யலாம் கொய்யா மவுத் வாஷ்,https://i.ytimg.com/vi/JyaMT-kbDTY/default.jpg,https://i.ytimg.com/vi/JyaMT-kbDTY/mqdefault.jpg,https://i.ytimg.com/vi/JyaMT-kbDTY/hqdefault.jpg
GbcNb9Y3LLg,Easy Remedies For Itchy Eyes | கண் எரிச்சலில் இருந்து முழுமையாக விடுபட வேண்டுமா?,https://i.ytimg.com/vi/GbcNb9Y3LLg/default.jpg,https://i.ytimg.com/vi/GbcNb9Y3LLg/mqdefault.jpg,https://i.ytimg.com/vi/GbcNb9Y3LLg/hqdefault.jpg
t6ptSYivzb8,Instant Pack For Under Eye | கண் கருவளையத்தை நீக்கிட செய்யும் கீரிம்,https://i.ytimg.com/vi/t6ptSYivzb8/default.jpg,https://i.ytimg.com/vi/t6ptSYivzb8/mqdefault.jpg,https://i.ytimg.com/vi/t6ptSYivzb8/hqdefault.jpg
XahpzArweBA,Bridal Facepack At Home Tamil | திருமணத்திற்கு முன் வீட்டிலேயே செய்ய வேண்டிய ஃபேஸ் பேக்,https://i.ytimg.com/vi/XahpzArweBA/default.jpg,https://i.ytimg.com/vi/XahpzArweBA/mqdefault.jpg,https://i.ytimg.com/vi/XahpzArweBA/hqdefault.jpg
Ms9qx-0pBSg,Sandalwood Face Pack For Sun Tan | சருமத்தில் ஏற்படும் கருமையை போக்கும் ஃபேஸ் பேக்,https://i.ytimg.com/vi/Ms9qx-0pBSg/default.jpg,https://i.ytimg.com/vi/Ms9qx-0pBSg/mqdefault.jpg,https://i.ytimg.com/vi/Ms9qx-0pBSg/hqdefault.jpg
hQcVDjiE5Sc,Best Face Pack For Sun Tan | சருமத்திலுள்ள கருமையை நீக்கிடும் ஃபேஸ் பேக்,https://i.ytimg.com/vi/hQcVDjiE5Sc/default.jpg,https://i.ytimg.com/vi/hQcVDjiE5Sc/mqdefault.jpg,https://i.ytimg.com/vi/hQcVDjiE5Sc/hqdefault.jpg
PuSO9QJqG7Y,Homemade Guava Face Pack | கொய்யா ஃபேஸ் பேக் செய்வது எப்படி?,https://i.ytimg.com/vi/PuSO9QJqG7Y/default.jpg,https://i.ytimg.com/vi/PuSO9QJqG7Y/mqdefault.jpg,https://i.ytimg.com/vi/PuSO9QJqG7Y/hqdefault.jpg
zi6Q1l75oFg,Benefits Of Rose Essential Oil Tamil | Rose essential oil இனி இல்லணு சொல்லாதிங்க,https://i.ytimg.com/vi/zi6Q1l75oFg/default.jpg,https://i.ytimg.com/vi/zi6Q1l75oFg/mqdefault.jpg,https://i.ytimg.com/vi/zi6Q1l75oFg/hqdefault.jpg
ojqHd92koKg,Skin Brightening Face Pack Tamil | பிரகாசிக்கும் முக அழகை பெற வேண்டுமா?,https://i.ytimg.com/vi/ojqHd92koKg/default.jpg,https://i.ytimg.com/vi/ojqHd92koKg/mqdefault.jpg,https://i.ytimg.com/vi/ojqHd92koKg/hqdefault.jpg
I1QRjhT5edE,Facial Massage For Young Skin | இளமையை தக்கவைக்கும் ஃபேசியல் மசாஜ்,https://i.ytimg.com/vi/I1QRjhT5edE/default.jpg,https://i.ytimg.com/vi/I1QRjhT5edE/mqdefault.jpg,https://i.ytimg.com/vi/I1QRjhT5edE/hqdefault.jpg
FX8ICfymaiw,Cinnamon Nature Face Pack Tamil | இலவங்கப்பட்டையிலும் ஃபேஸ் பேக் செய்ய முடியுமா?,https://i.ytimg.com/vi/FX8ICfymaiw/default.jpg,https://i.ytimg.com/vi/FX8ICfymaiw/mqdefault.jpg,https://i.ytimg.com/vi/FX8ICfymaiw/hqdefault.jpg
kea-g2fGCHc,Green Tea For Under Eye Wrinkles | கண் சுருக்கத்தை உடனே போக்க வேண்டுமா?,https://i.ytimg.com/vi/kea-g2fGCHc/default.jpg,https://i.ytimg.com/vi/kea-g2fGCHc/mqdefault.jpg,https://i.ytimg.com/vi/kea-g2fGCHc/hqdefault.jpg
SUuui8FUGc4,Grapes Scrub Remove Dead Skin Cells Tamil | முகத்தில் இறந்த செல்களை நீக்கும் திராட்சை ஸ்க்ரப்,https://i.ytimg.com/vi/SUuui8FUGc4/default.jpg,https://i.ytimg.com/vi/SUuui8FUGc4/mqdefault.jpg,https://i.ytimg.com/vi/SUuui8FUGc4/hqdefault.jpg
5cZ5qTVHtV0,Make Face Cleanser Easily At Home | உங்களின் முக அழகை பாதுகாக்கும் க்ளென்சர்,https://i.ytimg.com/vi/5cZ5qTVHtV0/default.jpg,https://i.ytimg.com/vi/5cZ5qTVHtV0/mqdefault.jpg,https://i.ytimg.com/vi/5cZ5qTVHtV0/hqdefault.jpg
MBgrE1eX7vA,Natural Hair Mask At Home | என்றும் நீங்காத இளமையான கூந்தலை பெற,https://i.ytimg.com/vi/MBgrE1eX7vA/default.jpg,https://i.ytimg.com/vi/MBgrE1eX7vA/mqdefault.jpg,https://i.ytimg.com/vi/MBgrE1eX7vA/hqdefault.jpg
2TDgb5cErW0,Peel Of Lipstick At Home | கருமையான உதட்டிற்கு உடனடி தீர்வு,https://i.ytimg.com/vi/2TDgb5cErW0/default.jpg,https://i.ytimg.com/vi/2TDgb5cErW0/mqdefault.jpg,https://i.ytimg.com/vi/2TDgb5cErW0/hqdefault.jpg
stNIWxccNDk,Indian Traditional Festive Look 2021| இந்தியாவின் பாரம்பரிய அழகு குறிப்புகள்,https://i.ytimg.com/vi/stNIWxccNDk/default.jpg,https://i.ytimg.com/vi/stNIWxccNDk/mqdefault.jpg,https://i.ytimg.com/vi/stNIWxccNDk/hqdefault.jpg
6p7Cr-IvvXw,Green Tea Toner For Fresh Face | முகத்திற்கு தெளிவை தரும் கிரீன் டீ டோனர்,https://i.ytimg.com/vi/6p7Cr-IvvXw/default.jpg,https://i.ytimg.com/vi/6p7Cr-IvvXw/mqdefault.jpg,https://i.ytimg.com/vi/6p7Cr-IvvXw/hqdefault.jpg
ubUJ8g7y6bs,Party Makeup Blog special | Cocktail Party Makeup Tutorial | Samayam Tamil,https://i.ytimg.com/vi/ubUJ8g7y6bs/default.jpg,https://i.ytimg.com/vi/ubUJ8g7y6bs/mqdefault.jpg,https://i.ytimg.com/vi/ubUJ8g7y6bs/hqdefault.jpg
Ut6BhmXwcSw,Beetroot Scrub For Beauty Lips | உதட்டை அழகாக்கும் பீட்ரூட் ஸ்க்ரப்,https://i.ytimg.com/vi/Ut6BhmXwcSw/default.jpg,https://i.ytimg.com/vi/Ut6BhmXwcSw/mqdefault.jpg,https://i.ytimg.com/vi/Ut6BhmXwcSw/hqdefault.jpg
5SYM8Voe-iw,Homemade Skin Moisturizer | ஈஸியா செய்யலாம் Skin moisturizer,https://i.ytimg.com/vi/5SYM8Voe-iw/default.jpg,https://i.ytimg.com/vi/5SYM8Voe-iw/mqdefault.jpg,https://i.ytimg.com/vi/5SYM8Voe-iw/hqdefault.jpg
GCJ-9i6QkSI,Pre Bridal Face Pack At Home Tamil | கல்யாணத்திற்கு முன் முக அழகை பெறுவது எப்படி,https://i.ytimg.com/vi/GCJ-9i6QkSI/default.jpg,https://i.ytimg.com/vi/GCJ-9i6QkSI/mqdefault.jpg,https://i.ytimg.com/vi/GCJ-9i6QkSI/hqdefault.jpg
LakCMvX23eE,Homemade Hand Lotion For Dry Skin | ஹேண்ட் லோஷன் செய்வது எப்படி?,https://i.ytimg.com/vi/LakCMvX23eE/default.jpg,https://i.ytimg.com/vi/LakCMvX23eE/mqdefault.jpg,https://i.ytimg.com/vi/LakCMvX23eE/hqdefault.jpg
aZSx0PYzKIU,Facial Massage To Get Beautiful Cheekbones | உங்களின் கன்னம் மற்றவர்களை கவர வேண்டுமா?,https://i.ytimg.com/vi/aZSx0PYzKIU/default.jpg,https://i.ytimg.com/vi/aZSx0PYzKIU/mqdefault.jpg,https://i.ytimg.com/vi/aZSx0PYzKIU/hqdefault.jpg
W1yHWlWjGME,Coffee Powder Hand Mask | சரும பிரச்சனைக்கு தீர்வு தரும் காபி பவுடர்,https://i.ytimg.com/vi/W1yHWlWjGME/default.jpg,https://i.ytimg.com/vi/W1yHWlWjGME/mqdefault.jpg,https://i.ytimg.com/vi/W1yHWlWjGME/hqdefault.jpg
kpNMUF-J28M,Easy Exercises For Droopy Eyelids | தொங்கும் கண் இமையா கவலையா விடுங்க,https://i.ytimg.com/vi/kpNMUF-J28M/default.jpg,https://i.ytimg.com/vi/kpNMUF-J28M/mqdefault.jpg,https://i.ytimg.com/vi/kpNMUF-J28M/hqdefault.jpg
1Gjvoj7MKJo,Neem Cream For All Type Of Skin | சரும பிரச்சனைக்கு சிறந்த வேப்பிலை கிரீம்,https://i.ytimg.com/vi/1Gjvoj7MKJo/default.jpg,https://i.ytimg.com/vi/1Gjvoj7MKJo/mqdefault.jpg,https://i.ytimg.com/vi/1Gjvoj7MKJo/hqdefault.jpg
5etvdmaqvzQ,Home Remedy For Healthy And Long Hair Tamil | தலைமுடி சார்ந்த பிரச்சனைக்கு உடனடி தீர்வு?,https://i.ytimg.com/vi/5etvdmaqvzQ/default.jpg,https://i.ytimg.com/vi/5etvdmaqvzQ/mqdefault.jpg,https://i.ytimg.com/vi/5etvdmaqvzQ/hqdefault.jpg
KGf4dugeuDY,Chubby Cheeks Facial Exercise Tamil | கொழு கொழு கன்னத்தை பெற வேண்டுமா?,https://i.ytimg.com/vi/KGf4dugeuDY/default.jpg,https://i.ytimg.com/vi/KGf4dugeuDY/mqdefault.jpg,https://i.ytimg.com/vi/KGf4dugeuDY/hqdefault.jpg
oxdbhK6Pczw,Night Cream For Face Whitening | முகத்திற்கு சிவப்பழகை தரும் நைட் கிரீம்,https://i.ytimg.com/vi/oxdbhK6Pczw/default.jpg,https://i.ytimg.com/vi/oxdbhK6Pczw/mqdefault.jpg,https://i.ytimg.com/vi/oxdbhK6Pczw/hqdefault.jpg
wbTFhvr5B6k,Rose Tea For Young Skin | இளமையான சருமத்திற்கு உடனடி தீர்வு,https://i.ytimg.com/vi/wbTFhvr5B6k/default.jpg,https://i.ytimg.com/vi/wbTFhvr5B6k/mqdefault.jpg,https://i.ytimg.com/vi/wbTFhvr5B6k/hqdefault.jpg
