ID,TITLE,THUMBNAIL1,THUMBNAIL2,THUMBNAIL3
cEyBXkqhT7Q,Pence rips Biden's weak leadership on a global scale,https://i.ytimg.com/vi/cEyBXkqhT7Q/default.jpg,https://i.ytimg.com/vi/cEyBXkqhT7Q/mqdefault.jpg,https://i.ytimg.com/vi/cEyBXkqhT7Q/hqdefault.jpg
EAxFJRqQq1Y,Kudlow: Biden’s policy obsession is reversing everything Trump achieved,https://i.ytimg.com/vi/EAxFJRqQq1Y/default.jpg,https://i.ytimg.com/vi/EAxFJRqQq1Y/mqdefault.jpg,https://i.ytimg.com/vi/EAxFJRqQq1Y/hqdefault.jpg
gA3lNa-CaWc,"True Story about suicide attempt by hanging, ... but what happens then!",https://i.ytimg.com/vi/gA3lNa-CaWc/default.jpg,https://i.ytimg.com/vi/gA3lNa-CaWc/mqdefault.jpg,https://i.ytimg.com/vi/gA3lNa-CaWc/hqdefault.jpg
hGGej9GRxDI,17 missionaries kidnapped in Haiti l GMA,https://i.ytimg.com/vi/hGGej9GRxDI/default.jpg,https://i.ytimg.com/vi/hGGej9GRxDI/mqdefault.jpg,https://i.ytimg.com/vi/hGGej9GRxDI/hqdefault.jpg
XfeNCH9v-gk,Tucker: Nothing like this has ever happened in our country,https://i.ytimg.com/vi/XfeNCH9v-gk/default.jpg,https://i.ytimg.com/vi/XfeNCH9v-gk/mqdefault.jpg,https://i.ytimg.com/vi/XfeNCH9v-gk/hqdefault.jpg
laUB0TCWq1o,Dave Rubin: Every single thing out of the Biden admin is a lie,https://i.ytimg.com/vi/laUB0TCWq1o/default.jpg,https://i.ytimg.com/vi/laUB0TCWq1o/mqdefault.jpg,https://i.ytimg.com/vi/laUB0TCWq1o/hqdefault.jpg
Kgrko-IYnPI,'Bring Your Goods Here': DeSantis Says He Will Address Supply Chain Crisis,https://i.ytimg.com/vi/Kgrko-IYnPI/default.jpg,https://i.ytimg.com/vi/Kgrko-IYnPI/mqdefault.jpg,https://i.ytimg.com/vi/Kgrko-IYnPI/hqdefault.jpg
paZPiSxldUA,Lindsey Graham: What I saw at the border broke my heart,https://i.ytimg.com/vi/paZPiSxldUA/default.jpg,https://i.ytimg.com/vi/paZPiSxldUA/mqdefault.jpg,https://i.ytimg.com/vi/paZPiSxldUA/hqdefault.jpg
e4W41b822sI,Leaked Border Patrol docs show Biden admin ‘lying’ about immigration: Tom Homan,https://i.ytimg.com/vi/e4W41b822sI/default.jpg,https://i.ytimg.com/vi/e4W41b822sI/mqdefault.jpg,https://i.ytimg.com/vi/e4W41b822sI/hqdefault.jpg
VLuVpBFOeaE,Gen. Jack Keane: Will the US come to Taiwan's defense?,https://i.ytimg.com/vi/VLuVpBFOeaE/default.jpg,https://i.ytimg.com/vi/VLuVpBFOeaE/mqdefault.jpg,https://i.ytimg.com/vi/VLuVpBFOeaE/hqdefault.jpg
EdZJXX4rRQ8,Steve Hilton calls for 'complete economic disengagement' from China,https://i.ytimg.com/vi/EdZJXX4rRQ8/default.jpg,https://i.ytimg.com/vi/EdZJXX4rRQ8/mqdefault.jpg,https://i.ytimg.com/vi/EdZJXX4rRQ8/hqdefault.jpg
uMU3cqNypAw,"Bank of America CEO talks earnings, bottlenecks, economy",https://i.ytimg.com/vi/uMU3cqNypAw/default.jpg,https://i.ytimg.com/vi/uMU3cqNypAw/mqdefault.jpg,https://i.ytimg.com/vi/uMU3cqNypAw/hqdefault.jpg
c8cXgy3XUIg,Everyone’s a Gangster Until He Enters the Room | Movie Story Recapped,https://i.ytimg.com/vi/c8cXgy3XUIg/default.jpg,https://i.ytimg.com/vi/c8cXgy3XUIg/mqdefault.jpg,https://i.ytimg.com/vi/c8cXgy3XUIg/hqdefault.jpg
bjERPUiCZek,Is cancel culture ruining comedy?,https://i.ytimg.com/vi/bjERPUiCZek/default.jpg,https://i.ytimg.com/vi/bjERPUiCZek/mqdefault.jpg,https://i.ytimg.com/vi/bjERPUiCZek/hqdefault.jpg
mEMYXsW99rU,Morgan Ortagus dubs Biden administration troubles as 'crisis of leadership',https://i.ytimg.com/vi/mEMYXsW99rU/default.jpg,https://i.ytimg.com/vi/mEMYXsW99rU/mqdefault.jpg,https://i.ytimg.com/vi/mEMYXsW99rU/hqdefault.jpg
w_6qCWgbhrw,Dueling crisis on the border,https://i.ytimg.com/vi/w_6qCWgbhrw/default.jpg,https://i.ytimg.com/vi/w_6qCWgbhrw/mqdefault.jpg,https://i.ytimg.com/vi/w_6qCWgbhrw/hqdefault.jpg
pk9vfat6RGY,Gov. Abbott address border crisis,https://i.ytimg.com/vi/pk9vfat6RGY/default.jpg,https://i.ytimg.com/vi/pk9vfat6RGY/mqdefault.jpg,https://i.ytimg.com/vi/pk9vfat6RGY/hqdefault.jpg
s2uFtDTk6N0,One Man Responsible For All Worlds Wars,https://i.ytimg.com/vi/s2uFtDTk6N0/default.jpg,https://i.ytimg.com/vi/s2uFtDTk6N0/mqdefault.jpg,https://i.ytimg.com/vi/s2uFtDTk6N0/hqdefault.jpg
LxpMaShqQXA,"Blac Chyna Screams at Folks in Airport to Get Vaccinated, Its giving Tokyo Toni (Full Video)😱🗣️💉",https://i.ytimg.com/vi/LxpMaShqQXA/default.jpg,https://i.ytimg.com/vi/LxpMaShqQXA/mqdefault.jpg,https://i.ytimg.com/vi/LxpMaShqQXA/hqdefault.jpg
lw8upyLoycg,Man With 23 personalities The 24th Is The Beast & Needs To Be Fed Humans,https://i.ytimg.com/vi/lw8upyLoycg/default.jpg,https://i.ytimg.com/vi/lw8upyLoycg/mqdefault.jpg,https://i.ytimg.com/vi/lw8upyLoycg/hqdefault.jpg
ovdO6Vdx3nU,Man Is Isolated In A Room For 15 Years By A Unknown Jailer,https://i.ytimg.com/vi/ovdO6Vdx3nU/default.jpg,https://i.ytimg.com/vi/ovdO6Vdx3nU/mqdefault.jpg,https://i.ytimg.com/vi/ovdO6Vdx3nU/hqdefault.jpg
DxbxIPjjCi8,"Somewhere In The Sky, There's A School For Superpowered Teens",https://i.ytimg.com/vi/DxbxIPjjCi8/default.jpg,https://i.ytimg.com/vi/DxbxIPjjCi8/mqdefault.jpg,https://i.ytimg.com/vi/DxbxIPjjCi8/hqdefault.jpg
uzCwlFgLlUY,"20 People, but Only 10 Spots In The Bunker",https://i.ytimg.com/vi/uzCwlFgLlUY/default.jpg,https://i.ytimg.com/vi/uzCwlFgLlUY/mqdefault.jpg,https://i.ytimg.com/vi/uzCwlFgLlUY/hqdefault.jpg
IHKmqW9vOVM,Diabetic shoes | Benjamin Marble DPM,https://i.ytimg.com/vi/IHKmqW9vOVM/default.jpg,https://i.ytimg.com/vi/IHKmqW9vOVM/mqdefault.jpg,https://i.ytimg.com/vi/IHKmqW9vOVM/hqdefault.jpg
gyYt1Eq88qs,Footwear for Diabetics  - Dr. Sanjay Sharma | Doctors'Circle,https://i.ytimg.com/vi/gyYt1Eq88qs/default.jpg,https://i.ytimg.com/vi/gyYt1Eq88qs/mqdefault.jpg,https://i.ytimg.com/vi/gyYt1Eq88qs/hqdefault.jpg
e1-C7yKHD_w,Veteran says Biden failed the Black community: People are 'waking up',https://i.ytimg.com/vi/e1-C7yKHD_w/default.jpg,https://i.ytimg.com/vi/e1-C7yKHD_w/mqdefault.jpg,https://i.ytimg.com/vi/e1-C7yKHD_w/hqdefault.jpg
1vmRzz8pN6E,Milwaukee joining Gun Safety Consortium | FOX6 News Milwaukee,https://i.ytimg.com/vi/1vmRzz8pN6E/default.jpg,https://i.ytimg.com/vi/1vmRzz8pN6E/mqdefault.jpg,https://i.ytimg.com/vi/1vmRzz8pN6E/hqdefault.jpg
cAwCVuprr9k,U.S. religious group says 17 missionaries were kidnapped in Haiti,https://i.ytimg.com/vi/cAwCVuprr9k/default.jpg,https://i.ytimg.com/vi/cAwCVuprr9k/mqdefault.jpg,https://i.ytimg.com/vi/cAwCVuprr9k/hqdefault.jpg
bQJQmyPRcIQ,Kamala Harris struggles to overcome wave of blunders,https://i.ytimg.com/vi/bQJQmyPRcIQ/default.jpg,https://i.ytimg.com/vi/bQJQmyPRcIQ/mqdefault.jpg,https://i.ytimg.com/vi/bQJQmyPRcIQ/hqdefault.jpg
oh2Sj_QpZOA,SPECIAL INVESTIGATION: What Really Happened in Wuhan,https://i.ytimg.com/vi/oh2Sj_QpZOA/default.jpg,https://i.ytimg.com/vi/oh2Sj_QpZOA/mqdefault.jpg,https://i.ytimg.com/vi/oh2Sj_QpZOA/hqdefault.jpg
9rDkHyomg7o,Made in China – China’s Tech Revolution,https://i.ytimg.com/vi/9rDkHyomg7o/default.jpg,https://i.ytimg.com/vi/9rDkHyomg7o/mqdefault.jpg,https://i.ytimg.com/vi/9rDkHyomg7o/hqdefault.jpg
bfr82RB72U8,Can Sea Water Desalination Save The World?,https://i.ytimg.com/vi/bfr82RB72U8/default.jpg,https://i.ytimg.com/vi/bfr82RB72U8/mqdefault.jpg,https://i.ytimg.com/vi/bfr82RB72U8/hqdefault.jpg
StW7oGSR_Mg,How 156 years of British rule shaped Hong Kong,https://i.ytimg.com/vi/StW7oGSR_Mg/default.jpg,https://i.ytimg.com/vi/StW7oGSR_Mg/mqdefault.jpg,https://i.ytimg.com/vi/StW7oGSR_Mg/hqdefault.jpg
gUc5oN_ffRo,The future of work: is your job safe? | The Economist,https://i.ytimg.com/vi/gUc5oN_ffRo/default.jpg,https://i.ytimg.com/vi/gUc5oN_ffRo/mqdefault.jpg,https://i.ytimg.com/vi/gUc5oN_ffRo/hqdefault.jpg
zgDLl1tXd0s,China’s economy: what’s its weak spot? | The Economist,https://i.ytimg.com/vi/zgDLl1tXd0s/default.jpg,https://i.ytimg.com/vi/zgDLl1tXd0s/mqdefault.jpg,https://i.ytimg.com/vi/zgDLl1tXd0s/hqdefault.jpg
l554kV12Wuo,Prisoners In Finland Live In Open Prisons Where They Learn Tech Skills | On The Ground,https://i.ytimg.com/vi/l554kV12Wuo/default.jpg,https://i.ytimg.com/vi/l554kV12Wuo/mqdefault.jpg,https://i.ytimg.com/vi/l554kV12Wuo/hqdefault.jpg
ERvh0hZ6uP8,'What if Finland's Great Teachers Taught in Your Schools?' Pasi Sahlberg - WISE 2013 Focus,https://i.ytimg.com/vi/ERvh0hZ6uP8/default.jpg,https://i.ytimg.com/vi/ERvh0hZ6uP8/mqdefault.jpg,https://i.ytimg.com/vi/ERvh0hZ6uP8/hqdefault.jpg
okpg-lVWLbE,6 Problems with our School System,https://i.ytimg.com/vi/okpg-lVWLbE/default.jpg,https://i.ytimg.com/vi/okpg-lVWLbE/mqdefault.jpg,https://i.ytimg.com/vi/okpg-lVWLbE/hqdefault.jpg
kGoWpcIdfds,"Jesse Watters hits the streets to find out, 'Who is Kamala Harris?'",https://i.ytimg.com/vi/kGoWpcIdfds/default.jpg,https://i.ytimg.com/vi/kGoWpcIdfds/mqdefault.jpg,https://i.ytimg.com/vi/kGoWpcIdfds/hqdefault.jpg
7xCe2m0kiSg,Why Finland's schools outperform most others across the developed world | 7.30,https://i.ytimg.com/vi/7xCe2m0kiSg/default.jpg,https://i.ytimg.com/vi/7xCe2m0kiSg/mqdefault.jpg,https://i.ytimg.com/vi/7xCe2m0kiSg/hqdefault.jpg
AxqOYUUcGeE,Ingraham: The Biden who stole Christmas ... and everything else,https://i.ytimg.com/vi/AxqOYUUcGeE/default.jpg,https://i.ytimg.com/vi/AxqOYUUcGeE/mqdefault.jpg,https://i.ytimg.com/vi/AxqOYUUcGeE/hqdefault.jpg
sCrek-sC38s,Sen. Johnson rips Democrats for 'living in a fantasy world',https://i.ytimg.com/vi/sCrek-sC38s/default.jpg,https://i.ytimg.com/vi/sCrek-sC38s/mqdefault.jpg,https://i.ytimg.com/vi/sCrek-sC38s/hqdefault.jpg
8V-obiNmhoE,Superman’s new motto replaces ‘American way’ with ‘a better tomorrow’,https://i.ytimg.com/vi/8V-obiNmhoE/default.jpg,https://i.ytimg.com/vi/8V-obiNmhoE/mqdefault.jpg,https://i.ytimg.com/vi/8V-obiNmhoE/hqdefault.jpg
JJRKfuHA5Fo,‘Unsinkable’ Biden administration ‘sinking like the Titanic’,https://i.ytimg.com/vi/JJRKfuHA5Fo/default.jpg,https://i.ytimg.com/vi/JJRKfuHA5Fo/mqdefault.jpg,https://i.ytimg.com/vi/JJRKfuHA5Fo/hqdefault.jpg
POXfgPtDoOE,‘Hilarious’ Trump impersonator criticises ‘Bare Shelves Biden’,https://i.ytimg.com/vi/POXfgPtDoOE/default.jpg,https://i.ytimg.com/vi/POXfgPtDoOE/mqdefault.jpg,https://i.ytimg.com/vi/POXfgPtDoOE/hqdefault.jpg
6RRvSXJ1JHs,China believes Biden is ‘incompetent at best: John Ratcliffe,https://i.ytimg.com/vi/6RRvSXJ1JHs/default.jpg,https://i.ytimg.com/vi/6RRvSXJ1JHs/mqdefault.jpg,https://i.ytimg.com/vi/6RRvSXJ1JHs/hqdefault.jpg
6v6M5HpSZ8w,Border Patrol Council president: Why isn’t Kamala Harris here?,https://i.ytimg.com/vi/6v6M5HpSZ8w/default.jpg,https://i.ytimg.com/vi/6v6M5HpSZ8w/mqdefault.jpg,https://i.ytimg.com/vi/6v6M5HpSZ8w/hqdefault.jpg
RDrbQ2zV1RU,Gingrich blasts ‘cultural war’ imposed on the American people by the Left,https://i.ytimg.com/vi/RDrbQ2zV1RU/default.jpg,https://i.ytimg.com/vi/RDrbQ2zV1RU/mqdefault.jpg,https://i.ytimg.com/vi/RDrbQ2zV1RU/hqdefault.jpg
Z5NkrkQltUQ,Why Are Millions Of Americans Quitting Their Jobs And Not Getting New Ones?,https://i.ytimg.com/vi/Z5NkrkQltUQ/default.jpg,https://i.ytimg.com/vi/Z5NkrkQltUQ/mqdefault.jpg,https://i.ytimg.com/vi/Z5NkrkQltUQ/hqdefault.jpg
IMvnmotBKAk,Cynthia Nixon says the poor should be allowed to steal from stores,https://i.ytimg.com/vi/IMvnmotBKAk/default.jpg,https://i.ytimg.com/vi/IMvnmotBKAk/mqdefault.jpg,https://i.ytimg.com/vi/IMvnmotBKAk/hqdefault.jpg
94PSIX9xpDI,'Outnumbered' rips Biden admin's incompetence: 'All the president's mess',https://i.ytimg.com/vi/94PSIX9xpDI/default.jpg,https://i.ytimg.com/vi/94PSIX9xpDI/mqdefault.jpg,https://i.ytimg.com/vi/94PSIX9xpDI/hqdefault.jpg
GS9sK0BWzH8,Dave Ramsey: Student loan forgiveness is a scam,https://i.ytimg.com/vi/GS9sK0BWzH8/default.jpg,https://i.ytimg.com/vi/GS9sK0BWzH8/mqdefault.jpg,https://i.ytimg.com/vi/GS9sK0BWzH8/hqdefault.jpg
GkgdR2aDOPA,Flashback shows what Biden blamed food shortages on in 2020,https://i.ytimg.com/vi/GkgdR2aDOPA/default.jpg,https://i.ytimg.com/vi/GkgdR2aDOPA/mqdefault.jpg,https://i.ytimg.com/vi/GkgdR2aDOPA/hqdefault.jpg
ZiEN7MDKq-E,Texas sheriff: A secure border is fundamental for a country,https://i.ytimg.com/vi/ZiEN7MDKq-E/default.jpg,https://i.ytimg.com/vi/ZiEN7MDKq-E/mqdefault.jpg,https://i.ytimg.com/vi/ZiEN7MDKq-E/hqdefault.jpg
jRpd2NhkWTw,Marine Lt. Col. Stuart Scheller's parents speak out after son's hearing following brig confinement,https://i.ytimg.com/vi/jRpd2NhkWTw/default.jpg,https://i.ytimg.com/vi/jRpd2NhkWTw/mqdefault.jpg,https://i.ytimg.com/vi/jRpd2NhkWTw/hqdefault.jpg
-SCVzgg2q0k,Biden presidency is unlike anything we've ever seen: Victor Davis Hanson,https://i.ytimg.com/vi/-SCVzgg2q0k/default.jpg,https://i.ytimg.com/vi/-SCVzgg2q0k/mqdefault.jpg,https://i.ytimg.com/vi/-SCVzgg2q0k/hqdefault.jpg
04bKGq23nkc,Middle-class migrants reportedly being dropped off at US border,https://i.ytimg.com/vi/04bKGq23nkc/default.jpg,https://i.ytimg.com/vi/04bKGq23nkc/mqdefault.jpg,https://i.ytimg.com/vi/04bKGq23nkc/hqdefault.jpg
4t619nAqUgc,Portland struggles as crime surges: 'The city is at a breaking point',https://i.ytimg.com/vi/4t619nAqUgc/default.jpg,https://i.ytimg.com/vi/4t619nAqUgc/mqdefault.jpg,https://i.ytimg.com/vi/4t619nAqUgc/hqdefault.jpg
C_JiP-j2FwM,Why U.S. Malls Are Disappearing,https://i.ytimg.com/vi/C_JiP-j2FwM/default.jpg,https://i.ytimg.com/vi/C_JiP-j2FwM/mqdefault.jpg,https://i.ytimg.com/vi/C_JiP-j2FwM/hqdefault.jpg
l6WSoijb8cY,How to buy a car without getting ripped off (Marketplace),https://i.ytimg.com/vi/l6WSoijb8cY/default.jpg,https://i.ytimg.com/vi/l6WSoijb8cY/mqdefault.jpg,https://i.ytimg.com/vi/l6WSoijb8cY/hqdefault.jpg
vSn3hlkEHOA,Texas safety official says cartels using social media to get drivers to smuggle migrants,https://i.ytimg.com/vi/vSn3hlkEHOA/default.jpg,https://i.ytimg.com/vi/vSn3hlkEHOA/mqdefault.jpg,https://i.ytimg.com/vi/vSn3hlkEHOA/hqdefault.jpg
qkk6D66kSWA,Lightfoot and Foxx Argument Over Four Corner Hustlers Gang Members,https://i.ytimg.com/vi/qkk6D66kSWA/default.jpg,https://i.ytimg.com/vi/qkk6D66kSWA/mqdefault.jpg,https://i.ytimg.com/vi/qkk6D66kSWA/hqdefault.jpg
QR4lEM41piE,Tom Homan slams Biden slow rolling ‘Remain in Mexico’ policy,https://i.ytimg.com/vi/QR4lEM41piE/default.jpg,https://i.ytimg.com/vi/QR4lEM41piE/mqdefault.jpg,https://i.ytimg.com/vi/QR4lEM41piE/hqdefault.jpg
4F3zeTAsv8c,Rep. Katko warns supply chain crisis is national security issue,https://i.ytimg.com/vi/4F3zeTAsv8c/default.jpg,https://i.ytimg.com/vi/4F3zeTAsv8c/mqdefault.jpg,https://i.ytimg.com/vi/4F3zeTAsv8c/hqdefault.jpg
ftDCEMhA334,Obama to Romney: 'You Invest In Companies That Ship Jobs Overseas',https://i.ytimg.com/vi/ftDCEMhA334/default.jpg,https://i.ytimg.com/vi/ftDCEMhA334/mqdefault.jpg,https://i.ytimg.com/vi/ftDCEMhA334/hqdefault.jpg
IjJSYJV4P9A,Investigating the violence in Chicago and what's being done about it,https://i.ytimg.com/vi/IjJSYJV4P9A/default.jpg,https://i.ytimg.com/vi/IjJSYJV4P9A/mqdefault.jpg,https://i.ytimg.com/vi/IjJSYJV4P9A/hqdefault.jpg
1sO6WDSHc-o,'The Five' agree Americans are right to be 'fed up' with government,https://i.ytimg.com/vi/1sO6WDSHc-o/default.jpg,https://i.ytimg.com/vi/1sO6WDSHc-o/mqdefault.jpg,https://i.ytimg.com/vi/1sO6WDSHc-o/hqdefault.jpg
4LMtmrtA1c4,Tony Gonzales: The cartel is exploiting the southern border,https://i.ytimg.com/vi/4LMtmrtA1c4/default.jpg,https://i.ytimg.com/vi/4LMtmrtA1c4/mqdefault.jpg,https://i.ytimg.com/vi/4LMtmrtA1c4/hqdefault.jpg
E7t5yj1rScI,What’s Causing The Container Ship Traffic Jam Clogging Up Global Trade,https://i.ytimg.com/vi/E7t5yj1rScI/default.jpg,https://i.ytimg.com/vi/E7t5yj1rScI/mqdefault.jpg,https://i.ytimg.com/vi/E7t5yj1rScI/hqdefault.jpg
82qzeyD3njo,Lawrence Jones rips Biden admin: 'Get down here and do your job',https://i.ytimg.com/vi/82qzeyD3njo/default.jpg,https://i.ytimg.com/vi/82qzeyD3njo/mqdefault.jpg,https://i.ytimg.com/vi/82qzeyD3njo/hqdefault.jpg
9RdmfE462ps,Karl Rove: This will be a 'train wreck of a massive proportion',https://i.ytimg.com/vi/9RdmfE462ps/default.jpg,https://i.ytimg.com/vi/9RdmfE462ps/mqdefault.jpg,https://i.ytimg.com/vi/9RdmfE462ps/hqdefault.jpg
5vtOABLhTGQ,Gen. Keane: China’s potential takeover of Taiwan ‘getting closer’,https://i.ytimg.com/vi/5vtOABLhTGQ/default.jpg,https://i.ytimg.com/vi/5vtOABLhTGQ/mqdefault.jpg,https://i.ytimg.com/vi/5vtOABLhTGQ/hqdefault.jpg
RyBaJuevRj0,Heartless Bank Robber Kills His Kids To Avoid Prison | The FBI Files S6 EP12 | Real Crime,https://i.ytimg.com/vi/RyBaJuevRj0/default.jpg,https://i.ytimg.com/vi/RyBaJuevRj0/mqdefault.jpg,https://i.ytimg.com/vi/RyBaJuevRj0/hqdefault.jpg
PHqOGL2zVqo,Panic Buying Frenzy Sweeps Across China: A Rush To Hoard Energy Supplies Has Begun,https://i.ytimg.com/vi/PHqOGL2zVqo/default.jpg,https://i.ytimg.com/vi/PHqOGL2zVqo/mqdefault.jpg,https://i.ytimg.com/vi/PHqOGL2zVqo/hqdefault.jpg
9ukKEec_LsI,A Florida sheriff's Brief But Spectacular take on mental illness in county jails,https://i.ytimg.com/vi/9ukKEec_LsI/default.jpg,https://i.ytimg.com/vi/9ukKEec_LsI/mqdefault.jpg,https://i.ytimg.com/vi/9ukKEec_LsI/hqdefault.jpg
ChAzY_mGnb0,Biden administration following kidnapping of missionaries in Haiti l GMA,https://i.ytimg.com/vi/ChAzY_mGnb0/default.jpg,https://i.ytimg.com/vi/ChAzY_mGnb0/mqdefault.jpg,https://i.ytimg.com/vi/ChAzY_mGnb0/hqdefault.jpg
Flnw_glHftw,"Man Wins Police Brutality Settlement, Dies Before Pay-Out",https://i.ytimg.com/vi/Flnw_glHftw/default.jpg,https://i.ytimg.com/vi/Flnw_glHftw/mqdefault.jpg,https://i.ytimg.com/vi/Flnw_glHftw/hqdefault.jpg
eWe6HUkShA8,Hannity reveals why 'Let's go Brandon' chants are breaking out nationwide,https://i.ytimg.com/vi/eWe6HUkShA8/default.jpg,https://i.ytimg.com/vi/eWe6HUkShA8/mqdefault.jpg,https://i.ytimg.com/vi/eWe6HUkShA8/hqdefault.jpg
L3BmPWYWfgs,Ex-Walmart CEO: Biden supply chain is a ‘mess from start to finish’,https://i.ytimg.com/vi/L3BmPWYWfgs/default.jpg,https://i.ytimg.com/vi/L3BmPWYWfgs/mqdefault.jpg,https://i.ytimg.com/vi/L3BmPWYWfgs/hqdefault.jpg
EMh1OxjtAis,Tucker: Airline employees have more power than they realize,https://i.ytimg.com/vi/EMh1OxjtAis/default.jpg,https://i.ytimg.com/vi/EMh1OxjtAis/mqdefault.jpg,https://i.ytimg.com/vi/EMh1OxjtAis/hqdefault.jpg
2thwVRZm1S8,Ingraham: Biden's policies to fire America will haunt businesses for years,https://i.ytimg.com/vi/2thwVRZm1S8/default.jpg,https://i.ytimg.com/vi/2thwVRZm1S8/mqdefault.jpg,https://i.ytimg.com/vi/2thwVRZm1S8/hqdefault.jpg
BzH0Pa6PfFQ,'The Five' knocks Janet Yellen for 'lying' about IRS spying,https://i.ytimg.com/vi/BzH0Pa6PfFQ/default.jpg,https://i.ytimg.com/vi/BzH0Pa6PfFQ/mqdefault.jpg,https://i.ytimg.com/vi/BzH0Pa6PfFQ/hqdefault.jpg
2TV0RZJaaCk,Policy expert: Biden admin doesn't understand economics 101,https://i.ytimg.com/vi/2TV0RZJaaCk/default.jpg,https://i.ytimg.com/vi/2TV0RZJaaCk/mqdefault.jpg,https://i.ytimg.com/vi/2TV0RZJaaCk/hqdefault.jpg
xrBDH7hCc1o,Lara Trump: I can't believe this story is real,https://i.ytimg.com/vi/xrBDH7hCc1o/default.jpg,https://i.ytimg.com/vi/xrBDH7hCc1o/mqdefault.jpg,https://i.ytimg.com/vi/xrBDH7hCc1o/hqdefault.jpg
yNSV-JeSGA0,Tucker: What is the point of having a government?,https://i.ytimg.com/vi/yNSV-JeSGA0/default.jpg,https://i.ytimg.com/vi/yNSV-JeSGA0/mqdefault.jpg,https://i.ytimg.com/vi/yNSV-JeSGA0/hqdefault.jpg
s-EV-DkBjQ0,Surviving a serial killer: The story of Tiffany Taylor,https://i.ytimg.com/vi/s-EV-DkBjQ0/default.jpg,https://i.ytimg.com/vi/s-EV-DkBjQ0/mqdefault.jpg,https://i.ytimg.com/vi/s-EV-DkBjQ0/hqdefault.jpg
Eum8r_2fKyc,A Royal Family Christmas 2021 | Lifetime Movies Based On True Story (2021),https://i.ytimg.com/vi/Eum8r_2fKyc/default.jpg,https://i.ytimg.com/vi/Eum8r_2fKyc/mqdefault.jpg,https://i.ytimg.com/vi/Eum8r_2fKyc/hqdefault.jpg
oJA410zapc4,An Engineer's Invention Causes a Time Loop During a Home Invasion,https://i.ytimg.com/vi/oJA410zapc4/default.jpg,https://i.ytimg.com/vi/oJA410zapc4/mqdefault.jpg,https://i.ytimg.com/vi/oJA410zapc4/hqdefault.jpg
w4fZ-l2cLdw,UPDATE: SEXUAL PREDATOR ARRESTED! | Steve Wilkos,https://i.ytimg.com/vi/w4fZ-l2cLdw/default.jpg,https://i.ytimg.com/vi/w4fZ-l2cLdw/mqdefault.jpg,https://i.ytimg.com/vi/w4fZ-l2cLdw/hqdefault.jpg
ntVSQeFhi_M,SMOKE - Rainy night (Puts you in the mood for love),https://i.ytimg.com/vi/ntVSQeFhi_M/default.jpg,https://i.ytimg.com/vi/ntVSQeFhi_M/mqdefault.jpg,https://i.ytimg.com/vi/ntVSQeFhi_M/hqdefault.jpg
HQEbfrh0P7k,Girl Captures Robber And Decides To Seduce Him,https://i.ytimg.com/vi/HQEbfrh0P7k/default.jpg,https://i.ytimg.com/vi/HQEbfrh0P7k/mqdefault.jpg,https://i.ytimg.com/vi/HQEbfrh0P7k/hqdefault.jpg
2AWurY6ztzE,Imagine Finding Yourself In A Country And all People There Are Trying To KILL You. No Escape,https://i.ytimg.com/vi/2AWurY6ztzE/default.jpg,https://i.ytimg.com/vi/2AWurY6ztzE/mqdefault.jpg,https://i.ytimg.com/vi/2AWurY6ztzE/hqdefault.jpg
yATDMbuR-G8,20 TIPS FOR STYLING A BIG BUST // Full Chest Style Guide + Recommendations ♡,https://i.ytimg.com/vi/yATDMbuR-G8/default.jpg,https://i.ytimg.com/vi/yATDMbuR-G8/mqdefault.jpg,https://i.ytimg.com/vi/yATDMbuR-G8/hqdefault.jpg
NW8mxAc9ZT8,Metro Detroit woman gifts car to total stranger riding the bus,https://i.ytimg.com/vi/NW8mxAc9ZT8/default.jpg,https://i.ytimg.com/vi/NW8mxAc9ZT8/mqdefault.jpg,https://i.ytimg.com/vi/NW8mxAc9ZT8/hqdefault.jpg
8ZKsZJ0BLGA,I’ve been living a double life…And you need to know! | The Maury Show,https://i.ytimg.com/vi/8ZKsZJ0BLGA/default.jpg,https://i.ytimg.com/vi/8ZKsZJ0BLGA/mqdefault.jpg,https://i.ytimg.com/vi/8ZKsZJ0BLGA/hqdefault.jpg
sRpKqxd_FII,'Spike' in natural gas prices expected to lead to higher energy bills,https://i.ytimg.com/vi/sRpKqxd_FII/default.jpg,https://i.ytimg.com/vi/sRpKqxd_FII/mqdefault.jpg,https://i.ytimg.com/vi/sRpKqxd_FII/hqdefault.jpg
eG405inBlxI,It's Just A Lesbian Phase | Jerry Springer,https://i.ytimg.com/vi/eG405inBlxI/default.jpg,https://i.ytimg.com/vi/eG405inBlxI/mqdefault.jpg,https://i.ytimg.com/vi/eG405inBlxI/hqdefault.jpg
HvVRDffFwq8,"""Perfect World"" With No Sadness, But Also No Love Or Any Emotion",https://i.ytimg.com/vi/HvVRDffFwq8/default.jpg,https://i.ytimg.com/vi/HvVRDffFwq8/mqdefault.jpg,https://i.ytimg.com/vi/HvVRDffFwq8/hqdefault.jpg
e8tHa7VWCKM,Babes With Baguettes | Jerry Springer,https://i.ytimg.com/vi/e8tHa7VWCKM/default.jpg,https://i.ytimg.com/vi/e8tHa7VWCKM/mqdefault.jpg,https://i.ytimg.com/vi/e8tHa7VWCKM/hqdefault.jpg
K-viqvBTdlo,Bisexual Betrayals 🏳️‍🌈 The Jerry Springer Show Full Episode,https://i.ytimg.com/vi/K-viqvBTdlo/default.jpg,https://i.ytimg.com/vi/K-viqvBTdlo/mqdefault.jpg,https://i.ytimg.com/vi/K-viqvBTdlo/hqdefault.jpg
RF-4jd82MgE,Lesbian Love Triangle!!!  (The Jerry Springer Show),https://i.ytimg.com/vi/RF-4jd82MgE/default.jpg,https://i.ytimg.com/vi/RF-4jd82MgE/mqdefault.jpg,https://i.ytimg.com/vi/RF-4jd82MgE/hqdefault.jpg
8-OFX8dgA8M,Greatest Fight Night Of All Time (The Jerry Springer Show),https://i.ytimg.com/vi/8-OFX8dgA8M/default.jpg,https://i.ytimg.com/vi/8-OFX8dgA8M/mqdefault.jpg,https://i.ytimg.com/vi/8-OFX8dgA8M/hqdefault.jpg
6azVszZe2Rg,Man Receives A Robot That Takes Care Of His Every Need But Soon Starts To Commit Crimes With It,https://i.ytimg.com/vi/6azVszZe2Rg/default.jpg,https://i.ytimg.com/vi/6azVszZe2Rg/mqdefault.jpg,https://i.ytimg.com/vi/6azVszZe2Rg/hqdefault.jpg
Vu8IAl5hO1o,The Day The Sun Heat Can Melt Bridges !!,https://i.ytimg.com/vi/Vu8IAl5hO1o/default.jpg,https://i.ytimg.com/vi/Vu8IAl5hO1o/mqdefault.jpg,https://i.ytimg.com/vi/Vu8IAl5hO1o/hqdefault.jpg
QFe9hpKV-U0,"Girl Implanted A Chip That Censors Violent Images, This is What Happens When She Grows Up...",https://i.ytimg.com/vi/QFe9hpKV-U0/default.jpg,https://i.ytimg.com/vi/QFe9hpKV-U0/mqdefault.jpg,https://i.ytimg.com/vi/QFe9hpKV-U0/hqdefault.jpg
RHe3ZG1US1Q,Beautiful Girls Are Raised & Sold To The Rich In This Facility,https://i.ytimg.com/vi/RHe3ZG1US1Q/default.jpg,https://i.ytimg.com/vi/RHe3ZG1US1Q/mqdefault.jpg,https://i.ytimg.com/vi/RHe3ZG1US1Q/hqdefault.jpg
3mXP89KV9qU,Teens Discover Telekinesis They Become Too Powerful And Things Get Out Of Hand,https://i.ytimg.com/vi/3mXP89KV9qU/default.jpg,https://i.ytimg.com/vi/3mXP89KV9qU/mqdefault.jpg,https://i.ytimg.com/vi/3mXP89KV9qU/hqdefault.jpg
8-sBbV7_7V4,Passengers Struggle to Survive After an Infected Girl Enters The Train During a Zombie Outbreak,https://i.ytimg.com/vi/8-sBbV7_7V4/default.jpg,https://i.ytimg.com/vi/8-sBbV7_7V4/mqdefault.jpg,https://i.ytimg.com/vi/8-sBbV7_7V4/hqdefault.jpg
aFK_ve1X5G4,Waking Up 28 Days After Human Extinction,https://i.ytimg.com/vi/aFK_ve1X5G4/default.jpg,https://i.ytimg.com/vi/aFK_ve1X5G4/mqdefault.jpg,https://i.ytimg.com/vi/aFK_ve1X5G4/hqdefault.jpg
i2CNwiooFkQ,Mini Humans and Cities Are Found In A Freezer,https://i.ytimg.com/vi/i2CNwiooFkQ/default.jpg,https://i.ytimg.com/vi/i2CNwiooFkQ/mqdefault.jpg,https://i.ytimg.com/vi/i2CNwiooFkQ/hqdefault.jpg
AN2kLVVjo3k,"In 2154, The Rich Create Their Own Luxurious Planet",https://i.ytimg.com/vi/AN2kLVVjo3k/default.jpg,https://i.ytimg.com/vi/AN2kLVVjo3k/mqdefault.jpg,https://i.ytimg.com/vi/AN2kLVVjo3k/hqdefault.jpg
hrMeNE2a8co,Rich Man Forces Poor People To Play A Twisted Game,https://i.ytimg.com/vi/hrMeNE2a8co/default.jpg,https://i.ytimg.com/vi/hrMeNE2a8co/mqdefault.jpg,https://i.ytimg.com/vi/hrMeNE2a8co/hqdefault.jpg
uKjaCZZClSY,John Deere workers on strike: ‘They can’t take our money’,https://i.ytimg.com/vi/uKjaCZZClSY/default.jpg,https://i.ytimg.com/vi/uKjaCZZClSY/mqdefault.jpg,https://i.ytimg.com/vi/uKjaCZZClSY/hqdefault.jpg
Txt0AVCkrmE,Girls Get Sent To A Island To Make Them Obedient,https://i.ytimg.com/vi/Txt0AVCkrmE/default.jpg,https://i.ytimg.com/vi/Txt0AVCkrmE/mqdefault.jpg,https://i.ytimg.com/vi/Txt0AVCkrmE/hqdefault.jpg
1cZ0zDBd3Fo,Deleted video,https://i.ytimg.com/vi/1cZ0zDBd3Fo/default.jpg,https://i.ytimg.com/vi/1cZ0zDBd3Fo/mqdefault.jpg,https://i.ytimg.com/vi/1cZ0zDBd3Fo/hqdefault.jpg
HDEteBhdYGw,Big MEECH “CHECKS” Bleu Davinci FRM DA FEDS BMF 50CENT!,https://i.ytimg.com/vi/HDEteBhdYGw/default.jpg,https://i.ytimg.com/vi/HDEteBhdYGw/mqdefault.jpg,https://i.ytimg.com/vi/HDEteBhdYGw/hqdefault.jpg
k3qTNxSZZEc,"In Future, You Can ""Block"" Others From Your Life; Blocked Person Will Appear As Anonymous Shape",https://i.ytimg.com/vi/k3qTNxSZZEc/default.jpg,https://i.ytimg.com/vi/k3qTNxSZZEc/mqdefault.jpg,https://i.ytimg.com/vi/k3qTNxSZZEc/hqdefault.jpg
