ID,TITLE,THUMBNAIL1,THUMBNAIL2,THUMBNAIL3
gIvrCjtSGyM,My 600-lb Life Guests Who Were OBSESSED WITH FAST FOOD!,https://i.ytimg.com/vi/gIvrCjtSGyM/default.jpg,https://i.ytimg.com/vi/gIvrCjtSGyM/mqdefault.jpg,https://i.ytimg.com/vi/gIvrCjtSGyM/hqdefault.jpg
Gfixa5IU-s8,I Was Blinded By A Bomb In Afghanistan Aged 20 | Minutes With | @LADbible TV,https://i.ytimg.com/vi/Gfixa5IU-s8/default.jpg,https://i.ytimg.com/vi/Gfixa5IU-s8/mqdefault.jpg,https://i.ytimg.com/vi/Gfixa5IU-s8/hqdefault.jpg
lumq0NCzRcc,MEGAN THEE STALLION FREESTYLES Pt.1,https://i.ytimg.com/vi/lumq0NCzRcc/default.jpg,https://i.ytimg.com/vi/lumq0NCzRcc/mqdefault.jpg,https://i.ytimg.com/vi/lumq0NCzRcc/hqdefault.jpg
5chsXhe3374,Unique Approach to Lowering Blood Sugar,https://i.ytimg.com/vi/5chsXhe3374/default.jpg,https://i.ytimg.com/vi/5chsXhe3374/mqdefault.jpg,https://i.ytimg.com/vi/5chsXhe3374/hqdefault.jpg
sgQPIuAWN7I,Halle Berry Breaks Down 12 Looks From 1986 to Now | Life in Looks | Vogue,https://i.ytimg.com/vi/sgQPIuAWN7I/default.jpg,https://i.ytimg.com/vi/sgQPIuAWN7I/mqdefault.jpg,https://i.ytimg.com/vi/sgQPIuAWN7I/hqdefault.jpg
aifIZasgnXY,Alternate World Where Math Is Different. 2+2= 22 And Not 4,https://i.ytimg.com/vi/aifIZasgnXY/default.jpg,https://i.ytimg.com/vi/aifIZasgnXY/mqdefault.jpg,https://i.ytimg.com/vi/aifIZasgnXY/hqdefault.jpg
V1wSbquXyiM,"'This is serious': Parent, student react to Oxford High School shooting",https://i.ytimg.com/vi/V1wSbquXyiM/default.jpg,https://i.ytimg.com/vi/V1wSbquXyiM/mqdefault.jpg,https://i.ytimg.com/vi/V1wSbquXyiM/hqdefault.jpg
h-ksRooSLs0,"Year 2274, People Not Allowed To Live Past 30 Years Old",https://i.ytimg.com/vi/h-ksRooSLs0/default.jpg,https://i.ytimg.com/vi/h-ksRooSLs0/mqdefault.jpg,https://i.ytimg.com/vi/h-ksRooSLs0/hqdefault.jpg
aeXR_NEm63Y,A Cursed Game That If You Don't Pass The Level You Will Die As Exactly The Same As In The Game,https://i.ytimg.com/vi/aeXR_NEm63Y/default.jpg,https://i.ytimg.com/vi/aeXR_NEm63Y/mqdefault.jpg,https://i.ytimg.com/vi/aeXR_NEm63Y/hqdefault.jpg
Sq8BdP8rPG0,You Are / Not the Father (Black People Version) PART 2,https://i.ytimg.com/vi/Sq8BdP8rPG0/default.jpg,https://i.ytimg.com/vi/Sq8BdP8rPG0/mqdefault.jpg,https://i.ytimg.com/vi/Sq8BdP8rPG0/hqdefault.jpg
77tn4vOpS00,Breakout: China’s economic miracle is ending,https://i.ytimg.com/vi/77tn4vOpS00/default.jpg,https://i.ytimg.com/vi/77tn4vOpS00/mqdefault.jpg,https://i.ytimg.com/vi/77tn4vOpS00/hqdefault.jpg
PKeBA2bXbyU,"Murder Trial Begins For Keith Smith, Man Who Claimed Baltimore Panhandler Killed His Wife",https://i.ytimg.com/vi/PKeBA2bXbyU/default.jpg,https://i.ytimg.com/vi/PKeBA2bXbyU/mqdefault.jpg,https://i.ytimg.com/vi/PKeBA2bXbyU/hqdefault.jpg
2F5YyoGSFfM,Everyone Thinks She is a Real Person,https://i.ytimg.com/vi/2F5YyoGSFfM/default.jpg,https://i.ytimg.com/vi/2F5YyoGSFfM/mqdefault.jpg,https://i.ytimg.com/vi/2F5YyoGSFfM/hqdefault.jpg
iUCqWEjt-pw,9 Best Low Carb Pastas 2018,https://i.ytimg.com/vi/iUCqWEjt-pw/default.jpg,https://i.ytimg.com/vi/iUCqWEjt-pw/mqdefault.jpg,https://i.ytimg.com/vi/iUCqWEjt-pw/hqdefault.jpg
kDlEW-dLnms,Mother Thinks Her Son Is an Imposter | True Story,https://i.ytimg.com/vi/kDlEW-dLnms/default.jpg,https://i.ytimg.com/vi/kDlEW-dLnms/mqdefault.jpg,https://i.ytimg.com/vi/kDlEW-dLnms/hqdefault.jpg
hOD7WDix20k,Top 10 Worst Foods For Diabetics,https://i.ytimg.com/vi/hOD7WDix20k/default.jpg,https://i.ytimg.com/vi/hOD7WDix20k/mqdefault.jpg,https://i.ytimg.com/vi/hOD7WDix20k/hqdefault.jpg
vHXQUmZy-ec,Fat Bomb Pasta | Low Carb Pasta Recipe Video | How to Cook Shirataki Noodles | Keto Meals,https://i.ytimg.com/vi/vHXQUmZy-ec/default.jpg,https://i.ytimg.com/vi/vHXQUmZy-ec/mqdefault.jpg,https://i.ytimg.com/vi/vHXQUmZy-ec/hqdefault.jpg
PfM5xDRXUGM,"In World War II, A Girl Finds Solace By Stealing BOOKS And Sharing Them With A Jewish Refugee",https://i.ytimg.com/vi/PfM5xDRXUGM/default.jpg,https://i.ytimg.com/vi/PfM5xDRXUGM/mqdefault.jpg,https://i.ytimg.com/vi/PfM5xDRXUGM/hqdefault.jpg
fthIe5dR0dc,"After Briefly Dying, He Discovers That Now he Has an Annoying Ability to See Ghosts",https://i.ytimg.com/vi/fthIe5dR0dc/default.jpg,https://i.ytimg.com/vi/fthIe5dR0dc/mqdefault.jpg,https://i.ytimg.com/vi/fthIe5dR0dc/hqdefault.jpg
JwJ4m8Ngxjk,In a Dystopian Future People Are Kept Inside Bunkers as Earth is Too Contaminated For Human Life,https://i.ytimg.com/vi/JwJ4m8Ngxjk/default.jpg,https://i.ytimg.com/vi/JwJ4m8Ngxjk/mqdefault.jpg,https://i.ytimg.com/vi/JwJ4m8Ngxjk/hqdefault.jpg
EjeH6gKD1kg,How A Dropout Student Becomes a Millionaire at the Age of 21 | Movie Story Recapped,https://i.ytimg.com/vi/EjeH6gKD1kg/default.jpg,https://i.ytimg.com/vi/EjeH6gKD1kg/mqdefault.jpg,https://i.ytimg.com/vi/EjeH6gKD1kg/hqdefault.jpg
tZRnUqFAHhM,Killer Deceived Her Until The Very End,https://i.ytimg.com/vi/tZRnUqFAHhM/default.jpg,https://i.ytimg.com/vi/tZRnUqFAHhM/mqdefault.jpg,https://i.ytimg.com/vi/tZRnUqFAHhM/hqdefault.jpg
NIEhIZQwqmE,Man Can Open Any Kind Even The Hardest Safes And Locks Easily,https://i.ytimg.com/vi/NIEhIZQwqmE/default.jpg,https://i.ytimg.com/vi/NIEhIZQwqmE/mqdefault.jpg,https://i.ytimg.com/vi/NIEhIZQwqmE/hqdefault.jpg
kA_w4-dr_FM,Whoever Use This Road WILL SUFFER | Movie Recap,https://i.ytimg.com/vi/kA_w4-dr_FM/default.jpg,https://i.ytimg.com/vi/kA_w4-dr_FM/mqdefault.jpg,https://i.ytimg.com/vi/kA_w4-dr_FM/hqdefault.jpg
qSBUXiZuhgM,Humans Created a Space Prison in Order to Keep The Most Dangerous Criminals Away From Earth,https://i.ytimg.com/vi/qSBUXiZuhgM/default.jpg,https://i.ytimg.com/vi/qSBUXiZuhgM/mqdefault.jpg,https://i.ytimg.com/vi/qSBUXiZuhgM/hqdefault.jpg
ws47oIpuiVI,"The World Is Coming To An End, And This Girl Discovers A Map That Can Save Mankind",https://i.ytimg.com/vi/ws47oIpuiVI/default.jpg,https://i.ytimg.com/vi/ws47oIpuiVI/mqdefault.jpg,https://i.ytimg.com/vi/ws47oIpuiVI/hqdefault.jpg
Gar0OvJA1M8,Only .01% Of Humans Have This Gene Making Them Superior To Others,https://i.ytimg.com/vi/Gar0OvJA1M8/default.jpg,https://i.ytimg.com/vi/Gar0OvJA1M8/mqdefault.jpg,https://i.ytimg.com/vi/Gar0OvJA1M8/hqdefault.jpg
bIS1MNjP7s0,Houston Chiropractor Dr Gregory Johnson Helps Man From Oklahoma With Dowagers Hump-FHP Posture,https://i.ytimg.com/vi/bIS1MNjP7s0/default.jpg,https://i.ytimg.com/vi/bIS1MNjP7s0/mqdefault.jpg,https://i.ytimg.com/vi/bIS1MNjP7s0/hqdefault.jpg
KWuuYDRiJdM,"Macy's CEO on staffing shortages, inflation and supply chain problems this holiday season",https://i.ytimg.com/vi/KWuuYDRiJdM/default.jpg,https://i.ytimg.com/vi/KWuuYDRiJdM/mqdefault.jpg,https://i.ytimg.com/vi/KWuuYDRiJdM/hqdefault.jpg
X1coZlJRrx8,"How Piano ""Rhythm Patterns"" Work (plus learn 2 patterns)",https://i.ytimg.com/vi/X1coZlJRrx8/default.jpg,https://i.ytimg.com/vi/X1coZlJRrx8/mqdefault.jpg,https://i.ytimg.com/vi/X1coZlJRrx8/hqdefault.jpg
LT5diBn_Q8U,Congressman criticizes Biden’s spending package as it heads to the Senate,https://i.ytimg.com/vi/LT5diBn_Q8U/default.jpg,https://i.ytimg.com/vi/LT5diBn_Q8U/mqdefault.jpg,https://i.ytimg.com/vi/LT5diBn_Q8U/hqdefault.jpg
ulzTaCG68d4,Pressing a Button Grants You $1 Million But a Random Person Will Die,https://i.ytimg.com/vi/ulzTaCG68d4/default.jpg,https://i.ytimg.com/vi/ulzTaCG68d4/mqdefault.jpg,https://i.ytimg.com/vi/ulzTaCG68d4/hqdefault.jpg
W5ESi5qDxCY,Malfunction Woke up a Man 90 Years Earlier But He Can't Stand To Be Alone,https://i.ytimg.com/vi/W5ESi5qDxCY/default.jpg,https://i.ytimg.com/vi/W5ESi5qDxCY/mqdefault.jpg,https://i.ytimg.com/vi/W5ESi5qDxCY/hqdefault.jpg
68UniwzX2KE,Man Moves 10x Slower Than Ordinary People,https://i.ytimg.com/vi/68UniwzX2KE/default.jpg,https://i.ytimg.com/vi/68UniwzX2KE/mqdefault.jpg,https://i.ytimg.com/vi/68UniwzX2KE/hqdefault.jpg
atQs7pp4Rh8,Why Some Get Neuropathy Before Becoming Diabetic,https://i.ytimg.com/vi/atQs7pp4Rh8/default.jpg,https://i.ytimg.com/vi/atQs7pp4Rh8/mqdefault.jpg,https://i.ytimg.com/vi/atQs7pp4Rh8/hqdefault.jpg
fUi0d5ZmosU,Karl Rove brings receipts in epic takedown of Biden plan on gas prices,https://i.ytimg.com/vi/fUi0d5ZmosU/default.jpg,https://i.ytimg.com/vi/fUi0d5ZmosU/mqdefault.jpg,https://i.ytimg.com/vi/fUi0d5ZmosU/hqdefault.jpg
yknYy7Vv9SM,Girl Gets Trapped In An Elevator With A Stranger As Things Turn Out For Worse,https://i.ytimg.com/vi/yknYy7Vv9SM/default.jpg,https://i.ytimg.com/vi/yknYy7Vv9SM/mqdefault.jpg,https://i.ytimg.com/vi/yknYy7Vv9SM/hqdefault.jpg
OM6UaVknGQo,School Teacher Has An Affair With A Student And Gets In Trouble,https://i.ytimg.com/vi/OM6UaVknGQo/default.jpg,https://i.ytimg.com/vi/OM6UaVknGQo/mqdefault.jpg,https://i.ytimg.com/vi/OM6UaVknGQo/hqdefault.jpg
Kbq9Vi-yRs8,"Almost 80 years since the first one, Las Vegas casino buffets are still the ultimate feast fest",https://i.ytimg.com/vi/Kbq9Vi-yRs8/default.jpg,https://i.ytimg.com/vi/Kbq9Vi-yRs8/mqdefault.jpg,https://i.ytimg.com/vi/Kbq9Vi-yRs8/hqdefault.jpg
0DIYd08H0dc,How People In the Roaring 20's Spent Their Free Time,https://i.ytimg.com/vi/0DIYd08H0dc/default.jpg,https://i.ytimg.com/vi/0DIYd08H0dc/mqdefault.jpg,https://i.ytimg.com/vi/0DIYd08H0dc/hqdefault.jpg
0U1LB28urC8,"Your Mom And I Had Sex In 6th Grade, I’m Not Your Dad! | Maury Show",https://i.ytimg.com/vi/0U1LB28urC8/default.jpg,https://i.ytimg.com/vi/0U1LB28urC8/mqdefault.jpg,https://i.ytimg.com/vi/0U1LB28urC8/hqdefault.jpg
lWdRRedj28w,'The Five' knock Biden for releasing oil from US reserves,https://i.ytimg.com/vi/lWdRRedj28w/default.jpg,https://i.ytimg.com/vi/lWdRRedj28w/mqdefault.jpg,https://i.ytimg.com/vi/lWdRRedj28w/hqdefault.jpg
5ud-ZOmBWUA,Epidemic That Caused Every Parent Want To K1LL Their Children | Movie Recap,https://i.ytimg.com/vi/5ud-ZOmBWUA/default.jpg,https://i.ytimg.com/vi/5ud-ZOmBWUA/mqdefault.jpg,https://i.ytimg.com/vi/5ud-ZOmBWUA/hqdefault.jpg
FuMhRKwGOqU,"In Future, Students Banned From Studying & Books Burnt",https://i.ytimg.com/vi/FuMhRKwGOqU/default.jpg,https://i.ytimg.com/vi/FuMhRKwGOqU/mqdefault.jpg,https://i.ytimg.com/vi/FuMhRKwGOqU/hqdefault.jpg
p_x2XvOf5L4,Movie Recap | The Uncle (2018) Mystery Movie Recap | Korean movie recap,https://i.ytimg.com/vi/p_x2XvOf5L4/default.jpg,https://i.ytimg.com/vi/p_x2XvOf5L4/mqdefault.jpg,https://i.ytimg.com/vi/p_x2XvOf5L4/hqdefault.jpg
bEgNMq-4xB0,[我的人只能我欺負]💖瓔珞被貴妃按在地上灌牛乳，皇帝火冒三丈，立馬下令懲治貴妃！ #瓔珞的皇家愛情 #令妃傳 #小乔追劇 #中國電視劇,https://i.ytimg.com/vi/bEgNMq-4xB0/default.jpg,https://i.ytimg.com/vi/bEgNMq-4xB0/mqdefault.jpg,https://i.ytimg.com/vi/bEgNMq-4xB0/hqdefault.jpg
saEcc__zXQo,Girl Raised by a Robot Tries to Escape But Soon Finds The Truth About The Outside World,https://i.ytimg.com/vi/saEcc__zXQo/default.jpg,https://i.ytimg.com/vi/saEcc__zXQo/mqdefault.jpg,https://i.ytimg.com/vi/saEcc__zXQo/hqdefault.jpg
rawvLnKaAOE,(College Football Player Murdered By His Own Teammate?) What Happened to Bryan Pata?,https://i.ytimg.com/vi/rawvLnKaAOE/default.jpg,https://i.ytimg.com/vi/rawvLnKaAOE/mqdefault.jpg,https://i.ytimg.com/vi/rawvLnKaAOE/hqdefault.jpg
3pHXIJdj0ck,33 Year Old Psycho Lady Pretends To Be 12 Year Old To Seduce A Family,https://i.ytimg.com/vi/3pHXIJdj0ck/default.jpg,https://i.ytimg.com/vi/3pHXIJdj0ck/mqdefault.jpg,https://i.ytimg.com/vi/3pHXIJdj0ck/hqdefault.jpg
-NbU16qwTVM,"TRUE STORY! 44 Students Take Advantage Of Her, And She Gets Blam3d For It",https://i.ytimg.com/vi/-NbU16qwTVM/default.jpg,https://i.ytimg.com/vi/-NbU16qwTVM/mqdefault.jpg,https://i.ytimg.com/vi/-NbU16qwTVM/hqdefault.jpg
i0TSk3xlM8M,Is Makeda's Cookie shop owners lying about what happened to Young Dolph ?,https://i.ytimg.com/vi/i0TSk3xlM8M/default.jpg,https://i.ytimg.com/vi/i0TSk3xlM8M/mqdefault.jpg,https://i.ytimg.com/vi/i0TSk3xlM8M/hqdefault.jpg
Zm28Qc7Srig,Cold Case - Why Does It Always Rain on Me,https://i.ytimg.com/vi/Zm28Qc7Srig/default.jpg,https://i.ytimg.com/vi/Zm28Qc7Srig/mqdefault.jpg,https://i.ytimg.com/vi/Zm28Qc7Srig/hqdefault.jpg
19GoHzP2pxk,SELF SABOTAGE: How JaMarcus Russell Became The 'Biggest' Bust Of All Time! Stunted Growth,https://i.ytimg.com/vi/19GoHzP2pxk/default.jpg,https://i.ytimg.com/vi/19GoHzP2pxk/mqdefault.jpg,https://i.ytimg.com/vi/19GoHzP2pxk/hqdefault.jpg
VlpdsOQ96Js,Family Sues Funeral Home Over Alleged Body Mix-Up,https://i.ytimg.com/vi/VlpdsOQ96Js/default.jpg,https://i.ytimg.com/vi/VlpdsOQ96Js/mqdefault.jpg,https://i.ytimg.com/vi/VlpdsOQ96Js/hqdefault.jpg
AJcAmXP07No,If Black People Were In SQUID GAME,https://i.ytimg.com/vi/AJcAmXP07No/default.jpg,https://i.ytimg.com/vi/AJcAmXP07No/mqdefault.jpg,https://i.ytimg.com/vi/AJcAmXP07No/hqdefault.jpg
cS2U914IpKA,The God Of Death Kills Anyone Whos Name Is Written In His Book,https://i.ytimg.com/vi/cS2U914IpKA/default.jpg,https://i.ytimg.com/vi/cS2U914IpKA/mqdefault.jpg,https://i.ytimg.com/vi/cS2U914IpKA/hqdefault.jpg
O1xeOq8sdAA,Future Where Roles Of Men And Women Are Reversed,https://i.ytimg.com/vi/O1xeOq8sdAA/default.jpg,https://i.ytimg.com/vi/O1xeOq8sdAA/mqdefault.jpg,https://i.ytimg.com/vi/O1xeOq8sdAA/hqdefault.jpg
k55c4HctGq0,Detroit mom gets 3-15 years in prison for drunk driving crash that killed 3-year-old son,https://i.ytimg.com/vi/k55c4HctGq0/default.jpg,https://i.ytimg.com/vi/k55c4HctGq0/mqdefault.jpg,https://i.ytimg.com/vi/k55c4HctGq0/hqdefault.jpg
cm8MQa_RO-s,A Mother Finds Her Lost Child After A 40-year Search: 'She Was Always There',https://i.ytimg.com/vi/cm8MQa_RO-s/default.jpg,https://i.ytimg.com/vi/cm8MQa_RO-s/mqdefault.jpg,https://i.ytimg.com/vi/cm8MQa_RO-s/hqdefault.jpg
z1SHLsQMtZk,Sniper Marries Her Twin's Groom and Assassinates Him | Movie Story Recapped,https://i.ytimg.com/vi/z1SHLsQMtZk/default.jpg,https://i.ytimg.com/vi/z1SHLsQMtZk/mqdefault.jpg,https://i.ytimg.com/vi/z1SHLsQMtZk/hqdefault.jpg
dYv5JmRlCOU,Deleted video,https://i.ytimg.com/vi/dYv5JmRlCOU/default.jpg,https://i.ytimg.com/vi/dYv5JmRlCOU/mqdefault.jpg,https://i.ytimg.com/vi/dYv5JmRlCOU/hqdefault.jpg
JgpnJYLqEWY,Carnivorous Beach Devours Anyone Touching The Sand,https://i.ytimg.com/vi/JgpnJYLqEWY/default.jpg,https://i.ytimg.com/vi/JgpnJYLqEWY/mqdefault.jpg,https://i.ytimg.com/vi/JgpnJYLqEWY/hqdefault.jpg
OmeXSIF6cUM,Sexually Frustrated Nuns Just Can't Hold Themselves Back Anymore..,https://i.ytimg.com/vi/OmeXSIF6cUM/default.jpg,https://i.ytimg.com/vi/OmeXSIF6cUM/mqdefault.jpg,https://i.ytimg.com/vi/OmeXSIF6cUM/hqdefault.jpg
RVPvwhJY8Xk,Waukesha mayor offers sympathies on 'senseless act' after vehicle plows through parade,https://i.ytimg.com/vi/RVPvwhJY8Xk/default.jpg,https://i.ytimg.com/vi/RVPvwhJY8Xk/mqdefault.jpg,https://i.ytimg.com/vi/RVPvwhJY8Xk/hqdefault.jpg
VnADtzIS4Z4,Lightfoot calls for accountability to combat violence,https://i.ytimg.com/vi/VnADtzIS4Z4/default.jpg,https://i.ytimg.com/vi/VnADtzIS4Z4/mqdefault.jpg,https://i.ytimg.com/vi/VnADtzIS4Z4/hqdefault.jpg
G4Rke8ljhfE,African American Identity in Early Photography,https://i.ytimg.com/vi/G4Rke8ljhfE/default.jpg,https://i.ytimg.com/vi/G4Rke8ljhfE/mqdefault.jpg,https://i.ytimg.com/vi/G4Rke8ljhfE/hqdefault.jpg
CiYpoozBn9U,Megan: Tired Of Girls Who Just Woke Up On Instagram Deciding They Wanted To Be A Rapper Today,https://i.ytimg.com/vi/CiYpoozBn9U/default.jpg,https://i.ytimg.com/vi/CiYpoozBn9U/mqdefault.jpg,https://i.ytimg.com/vi/CiYpoozBn9U/hqdefault.jpg
C0WP0KGVIkw,Pregnant Housewife Develops a Strange Obsession to Swallow Dangerous Objects,https://i.ytimg.com/vi/C0WP0KGVIkw/default.jpg,https://i.ytimg.com/vi/C0WP0KGVIkw/mqdefault.jpg,https://i.ytimg.com/vi/C0WP0KGVIkw/hqdefault.jpg
7TJmNzUm-mo,Squid Game: Season 2 | Trailer | Netflix 2023,https://i.ytimg.com/vi/7TJmNzUm-mo/default.jpg,https://i.ytimg.com/vi/7TJmNzUm-mo/mqdefault.jpg,https://i.ytimg.com/vi/7TJmNzUm-mo/hqdefault.jpg
kAshsi1ZemY,How I got HIV and a better understanding on HIV,https://i.ytimg.com/vi/kAshsi1ZemY/default.jpg,https://i.ytimg.com/vi/kAshsi1ZemY/mqdefault.jpg,https://i.ytimg.com/vi/kAshsi1ZemY/hqdefault.jpg
W7eJGNvGm14,Women on Death Row,https://i.ytimg.com/vi/W7eJGNvGm14/default.jpg,https://i.ytimg.com/vi/W7eJGNvGm14/mqdefault.jpg,https://i.ytimg.com/vi/W7eJGNvGm14/hqdefault.jpg
jKiwOB_UGaw,SQUID GAME Ending Explained | All Death Games Explained | Season 1 Full Recap,https://i.ytimg.com/vi/jKiwOB_UGaw/default.jpg,https://i.ytimg.com/vi/jKiwOB_UGaw/mqdefault.jpg,https://i.ytimg.com/vi/jKiwOB_UGaw/hqdefault.jpg
3LHyc0zvED0,"Michelle Obama opens up about miscarriage, new memoir 'Becoming'",https://i.ytimg.com/vi/3LHyc0zvED0/default.jpg,https://i.ytimg.com/vi/3LHyc0zvED0/mqdefault.jpg,https://i.ytimg.com/vi/3LHyc0zvED0/hqdefault.jpg
TGAAL2q4ul8,What did Strong mommy chrissy's brother say about her??|Mukbang,https://i.ytimg.com/vi/TGAAL2q4ul8/default.jpg,https://i.ytimg.com/vi/TGAAL2q4ul8/mqdefault.jpg,https://i.ytimg.com/vi/TGAAL2q4ul8/hqdefault.jpg
Vqv5sn_xxYE,Trump-era Opportunity Zones meant to help low-income communities exploited by investors,https://i.ytimg.com/vi/Vqv5sn_xxYE/default.jpg,https://i.ytimg.com/vi/Vqv5sn_xxYE/mqdefault.jpg,https://i.ytimg.com/vi/Vqv5sn_xxYE/hqdefault.jpg
uUr1dYVZZLE,Diana Ross Diamond Jubilee birthday party || 2019,https://i.ytimg.com/vi/uUr1dYVZZLE/default.jpg,https://i.ytimg.com/vi/uUr1dYVZZLE/mqdefault.jpg,https://i.ytimg.com/vi/uUr1dYVZZLE/hqdefault.jpg
Q84m_VaTuSI,Helping People Who Have Diabetes Improve Health and Reduce Complications,https://i.ytimg.com/vi/Q84m_VaTuSI/default.jpg,https://i.ytimg.com/vi/Q84m_VaTuSI/mqdefault.jpg,https://i.ytimg.com/vi/Q84m_VaTuSI/hqdefault.jpg
K6SUsWizytA,"Learn Spanish Verbs: Present, past, and future of SER, ESTAR, TENER, IR",https://i.ytimg.com/vi/K6SUsWizytA/default.jpg,https://i.ytimg.com/vi/K6SUsWizytA/mqdefault.jpg,https://i.ytimg.com/vi/K6SUsWizytA/hqdefault.jpg
uirINayrSJs,Smokers lungs versus healthy lungs,https://i.ytimg.com/vi/uirINayrSJs/default.jpg,https://i.ytimg.com/vi/uirINayrSJs/mqdefault.jpg,https://i.ytimg.com/vi/uirINayrSJs/hqdefault.jpg
GKZq5mf02-Q,"Earth In 2031, Temperature Rises To 70°C, Killing Humans",https://i.ytimg.com/vi/GKZq5mf02-Q/default.jpg,https://i.ytimg.com/vi/GKZq5mf02-Q/mqdefault.jpg,https://i.ytimg.com/vi/GKZq5mf02-Q/hqdefault.jpg
havBX7NqfLI,BONE TOMAHAWK (2015) Explained | Movie Recap,https://i.ytimg.com/vi/havBX7NqfLI/default.jpg,https://i.ytimg.com/vi/havBX7NqfLI/mqdefault.jpg,https://i.ytimg.com/vi/havBX7NqfLI/hqdefault.jpg
mNKFJlUWvzI,SHE HAS BECOME SUCH THAT! ( Homeless Awareness - Amazing Transformations ),https://i.ytimg.com/vi/mNKFJlUWvzI/default.jpg,https://i.ytimg.com/vi/mNKFJlUWvzI/mqdefault.jpg,https://i.ytimg.com/vi/mNKFJlUWvzI/hqdefault.jpg
ybuIunDcTJw,Mother Killed in Freeway Shooting Near Bay Bridge Toll Plaza,https://i.ytimg.com/vi/ybuIunDcTJw/default.jpg,https://i.ytimg.com/vi/ybuIunDcTJw/mqdefault.jpg,https://i.ytimg.com/vi/ybuIunDcTJw/hqdefault.jpg
xGmM-qApkos,Killer Couples: Mirinda Boob and Ron Heichel Ep02,https://i.ytimg.com/vi/xGmM-qApkos/default.jpg,https://i.ytimg.com/vi/xGmM-qApkos/mqdefault.jpg,https://i.ytimg.com/vi/xGmM-qApkos/hqdefault.jpg
6oo8d4iqbRc,Julius Jones Case Analysis | Innocent on Death Row?,https://i.ytimg.com/vi/6oo8d4iqbRc/default.jpg,https://i.ytimg.com/vi/6oo8d4iqbRc/mqdefault.jpg,https://i.ytimg.com/vi/6oo8d4iqbRc/hqdefault.jpg
beGNVFMXNKA,Kid Gets Bullied In School But A Criminal Helps Him Stand Up For Himself,https://i.ytimg.com/vi/beGNVFMXNKA/default.jpg,https://i.ytimg.com/vi/beGNVFMXNKA/mqdefault.jpg,https://i.ytimg.com/vi/beGNVFMXNKA/hqdefault.jpg
olMOUuyqUSo,"Supply chain logjam stretches from China's factories to U.S. ports, warehouses and stores",https://i.ytimg.com/vi/olMOUuyqUSo/default.jpg,https://i.ytimg.com/vi/olMOUuyqUSo/mqdefault.jpg,https://i.ytimg.com/vi/olMOUuyqUSo/hqdefault.jpg
hTOtAniwC18,China is Coming: Observations from an Expert | In Depth,https://i.ytimg.com/vi/hTOtAniwC18/default.jpg,https://i.ytimg.com/vi/hTOtAniwC18/mqdefault.jpg,https://i.ytimg.com/vi/hTOtAniwC18/hqdefault.jpg
cssofncp7cA,Americans are 'irate' over Biden's border policies: Texas AG candidate,https://i.ytimg.com/vi/cssofncp7cA/default.jpg,https://i.ytimg.com/vi/cssofncp7cA/mqdefault.jpg,https://i.ytimg.com/vi/cssofncp7cA/hqdefault.jpg
oH42gMjvQHU,Inflation hitting Americans hard,https://i.ytimg.com/vi/oH42gMjvQHU/default.jpg,https://i.ytimg.com/vi/oH42gMjvQHU/mqdefault.jpg,https://i.ytimg.com/vi/oH42gMjvQHU/hqdefault.jpg
Wnakj2G99ds,How China Is Affecting The Supply Chain Crunch In US,https://i.ytimg.com/vi/Wnakj2G99ds/default.jpg,https://i.ytimg.com/vi/Wnakj2G99ds/mqdefault.jpg,https://i.ytimg.com/vi/Wnakj2G99ds/hqdefault.jpg
GUx7a0pCnAM,Hannity: Biden got 'bullied' by China,https://i.ytimg.com/vi/GUx7a0pCnAM/default.jpg,https://i.ytimg.com/vi/GUx7a0pCnAM/mqdefault.jpg,https://i.ytimg.com/vi/GUx7a0pCnAM/hqdefault.jpg
wGUJP2Ul1mI,Texas rep. blasts Biden on immigration: Blood is on his hands,https://i.ytimg.com/vi/wGUJP2Ul1mI/default.jpg,https://i.ytimg.com/vi/wGUJP2Ul1mI/mqdefault.jpg,https://i.ytimg.com/vi/wGUJP2Ul1mI/hqdefault.jpg
EgDyD_suwWs,Number of container ships stuck off LA ports hits new record,https://i.ytimg.com/vi/EgDyD_suwWs/default.jpg,https://i.ytimg.com/vi/EgDyD_suwWs/mqdefault.jpg,https://i.ytimg.com/vi/EgDyD_suwWs/hqdefault.jpg
hYriEVLKPCs,White House says rising gas prices make case for green energy,https://i.ytimg.com/vi/hYriEVLKPCs/default.jpg,https://i.ytimg.com/vi/hYriEVLKPCs/mqdefault.jpg,https://i.ytimg.com/vi/hYriEVLKPCs/hqdefault.jpg
9MpVjxxpExM,Globalization and Trade and Poverty: Crash Course Economics #16,https://i.ytimg.com/vi/9MpVjxxpExM/default.jpg,https://i.ytimg.com/vi/9MpVjxxpExM/mqdefault.jpg,https://i.ytimg.com/vi/9MpVjxxpExM/hqdefault.jpg
KJhlo6DtJIk,Will covid kill globalisation? | The Economist,https://i.ytimg.com/vi/KJhlo6DtJIk/default.jpg,https://i.ytimg.com/vi/KJhlo6DtJIk/mqdefault.jpg,https://i.ytimg.com/vi/KJhlo6DtJIk/hqdefault.jpg
I_jubEP7Tlo,Relaxed travel restrictions put strain on security at southern border,https://i.ytimg.com/vi/I_jubEP7Tlo/default.jpg,https://i.ytimg.com/vi/I_jubEP7Tlo/mqdefault.jpg,https://i.ytimg.com/vi/I_jubEP7Tlo/hqdefault.jpg
wOmP8oo4m4k,USC professor refuses to take down Blue Lives Matter flag,https://i.ytimg.com/vi/wOmP8oo4m4k/default.jpg,https://i.ytimg.com/vi/wOmP8oo4m4k/mqdefault.jpg,https://i.ytimg.com/vi/wOmP8oo4m4k/hqdefault.jpg
qmpqKJoC_4c,Michigan pipeline shutdown could double gas prices: State Sen. Theis,https://i.ytimg.com/vi/qmpqKJoC_4c/default.jpg,https://i.ytimg.com/vi/qmpqKJoC_4c/mqdefault.jpg,https://i.ytimg.com/vi/qmpqKJoC_4c/hqdefault.jpg
7NfOv3qcyUI,'The Five' rip Biden plan to monitor bank transactions over $600,https://i.ytimg.com/vi/7NfOv3qcyUI/default.jpg,https://i.ytimg.com/vi/7NfOv3qcyUI/mqdefault.jpg,https://i.ytimg.com/vi/7NfOv3qcyUI/hqdefault.jpg
fwtzvjDdeLw,Mike Pence rips 'stupid' Biden proposal of reparations for illegal immigrants,https://i.ytimg.com/vi/fwtzvjDdeLw/default.jpg,https://i.ytimg.com/vi/fwtzvjDdeLw/mqdefault.jpg,https://i.ytimg.com/vi/fwtzvjDdeLw/hqdefault.jpg
lLSGFsd1qQ0,Jim Jordan: Dems' 'reckless spending' led to 'record inflation',https://i.ytimg.com/vi/lLSGFsd1qQ0/default.jpg,https://i.ytimg.com/vi/lLSGFsd1qQ0/mqdefault.jpg,https://i.ytimg.com/vi/lLSGFsd1qQ0/hqdefault.jpg
89-Qiz8g4Zc,Tucker: Why did they let Kenosha burn?,https://i.ytimg.com/vi/89-Qiz8g4Zc/default.jpg,https://i.ytimg.com/vi/89-Qiz8g4Zc/mqdefault.jpg,https://i.ytimg.com/vi/89-Qiz8g4Zc/hqdefault.jpg
2MAKTOE9e1A,Joe Concha blasts liberal media for being racially divisive,https://i.ytimg.com/vi/2MAKTOE9e1A/default.jpg,https://i.ytimg.com/vi/2MAKTOE9e1A/mqdefault.jpg,https://i.ytimg.com/vi/2MAKTOE9e1A/hqdefault.jpg
aqhjNJkvC9w,Why Outsource?,https://i.ytimg.com/vi/aqhjNJkvC9w/default.jpg,https://i.ytimg.com/vi/aqhjNJkvC9w/mqdefault.jpg,https://i.ytimg.com/vi/aqhjNJkvC9w/hqdefault.jpg
-Sq54CDkSdA,"Gabbard sounds off on Democrats 'racialization' of politics, society",https://i.ytimg.com/vi/-Sq54CDkSdA/default.jpg,https://i.ytimg.com/vi/-Sq54CDkSdA/mqdefault.jpg,https://i.ytimg.com/vi/-Sq54CDkSdA/hqdefault.jpg
eILJTgWsJxc,WISDOT provides roadside service in construction zones free of charge to drivers,https://i.ytimg.com/vi/eILJTgWsJxc/default.jpg,https://i.ytimg.com/vi/eILJTgWsJxc/mqdefault.jpg,https://i.ytimg.com/vi/eILJTgWsJxc/hqdefault.jpg
OPMtt8wXVog,"'The Five' react to claim racism built into US roads, interstates",https://i.ytimg.com/vi/OPMtt8wXVog/default.jpg,https://i.ytimg.com/vi/OPMtt8wXVog/mqdefault.jpg,https://i.ytimg.com/vi/OPMtt8wXVog/hqdefault.jpg
GAP_cXtEDQc,Truck driver claps back at MSNBC's Tiffany Cross,https://i.ytimg.com/vi/GAP_cXtEDQc/default.jpg,https://i.ytimg.com/vi/GAP_cXtEDQc/mqdefault.jpg,https://i.ytimg.com/vi/GAP_cXtEDQc/hqdefault.jpg
NJyWdkS8tWQ,Hannity: This is what happens when powerful people rush to judgment,https://i.ytimg.com/vi/NJyWdkS8tWQ/default.jpg,https://i.ytimg.com/vi/NJyWdkS8tWQ/mqdefault.jpg,https://i.ytimg.com/vi/NJyWdkS8tWQ/hqdefault.jpg
m5rQzfN-VW8,Chinese immigrant rips 'woke' left: 'I am not going anywhere',https://i.ytimg.com/vi/m5rQzfN-VW8/default.jpg,https://i.ytimg.com/vi/m5rQzfN-VW8/mqdefault.jpg,https://i.ytimg.com/vi/m5rQzfN-VW8/hqdefault.jpg
-Uf60o7dUSw,City of West Allis launches deterrence campaign to combat reckless driving,https://i.ytimg.com/vi/-Uf60o7dUSw/default.jpg,https://i.ytimg.com/vi/-Uf60o7dUSw/mqdefault.jpg,https://i.ytimg.com/vi/-Uf60o7dUSw/hqdefault.jpg
N1GKF7nCmBU,Sen. Blackburn: Biden is 'determined' to open the border,https://i.ytimg.com/vi/N1GKF7nCmBU/default.jpg,https://i.ytimg.com/vi/N1GKF7nCmBU/mqdefault.jpg,https://i.ytimg.com/vi/N1GKF7nCmBU/hqdefault.jpg
dhwYa0iT014,Trump has had success with North Korea: Condoleezza Rice,https://i.ytimg.com/vi/dhwYa0iT014/default.jpg,https://i.ytimg.com/vi/dhwYa0iT014/mqdefault.jpg,https://i.ytimg.com/vi/dhwYa0iT014/hqdefault.jpg
CcuKp2AHEPo,Grandma selling tamales to pay for husband's medical treatment stunned with a Secret Santa surprise,https://i.ytimg.com/vi/CcuKp2AHEPo/default.jpg,https://i.ytimg.com/vi/CcuKp2AHEPo/mqdefault.jpg,https://i.ytimg.com/vi/CcuKp2AHEPo/hqdefault.jpg
