ID,TITLE,THUMBNAIL1,THUMBNAIL2,THUMBNAIL3
mZF371FmraU,Deleted video,https://i.ytimg.com/vi/mZF371FmraU/default.jpg,https://i.ytimg.com/vi/mZF371FmraU/mqdefault.jpg,https://i.ytimg.com/vi/mZF371FmraU/hqdefault.jpg
m1uhiXRnk0I,"Hand Embroidery, Easy Flower Embroidery Trick with tooth pick",https://i.ytimg.com/vi/m1uhiXRnk0I/default.jpg,https://i.ytimg.com/vi/m1uhiXRnk0I/mqdefault.jpg,https://i.ytimg.com/vi/m1uhiXRnk0I/hqdefault.jpg
1DpdCamZMXA,Hand embroidery designs. Beads work.,https://i.ytimg.com/vi/1DpdCamZMXA/default.jpg,https://i.ytimg.com/vi/1DpdCamZMXA/mqdefault.jpg,https://i.ytimg.com/vi/1DpdCamZMXA/hqdefault.jpg
hGYoWSU2Drk,"Como bordar en pedrería, 1° parte, how to embroider in rhinestones",https://i.ytimg.com/vi/hGYoWSU2Drk/default.jpg,https://i.ytimg.com/vi/hGYoWSU2Drk/mqdefault.jpg,https://i.ytimg.com/vi/hGYoWSU2Drk/hqdefault.jpg
zZi0j280-GU,Q&A BORDADO - ¿QUÉ NECESITAS PARA BORDAR?,https://i.ytimg.com/vi/zZi0j280-GU/default.jpg,https://i.ytimg.com/vi/zZi0j280-GU/mqdefault.jpg,https://i.ytimg.com/vi/zZi0j280-GU/hqdefault.jpg
EEYv1mjO1aE,12 SIMPLE EMBROIDERY HACKS AND TECHNIQUES,https://i.ytimg.com/vi/EEYv1mjO1aE/default.jpg,https://i.ytimg.com/vi/EEYv1mjO1aE/mqdefault.jpg,https://i.ytimg.com/vi/EEYv1mjO1aE/hqdefault.jpg
pC2d7wl7Zjg,11 Folding and Organization Hacks! | Clever DIY Clothes and Bedding Folding Hacksby Blossom,https://i.ytimg.com/vi/pC2d7wl7Zjg/default.jpg,https://i.ytimg.com/vi/pC2d7wl7Zjg/mqdefault.jpg,https://i.ytimg.com/vi/pC2d7wl7Zjg/hqdefault.jpg
laW24NgVAqI,Como Estampar camisetas en casa super fácil y rápido 💙 | Margari,https://i.ytimg.com/vi/laW24NgVAqI/default.jpg,https://i.ytimg.com/vi/laW24NgVAqI/mqdefault.jpg,https://i.ytimg.com/vi/laW24NgVAqI/hqdefault.jpg
476v1C1KIQc,como seguir patrones alpha en macrame,https://i.ytimg.com/vi/476v1C1KIQc/default.jpg,https://i.ytimg.com/vi/476v1C1KIQc/mqdefault.jpg,https://i.ytimg.com/vi/476v1C1KIQc/hqdefault.jpg
PlTQjCyuhOc,nudos basicos macrame | nudo feston cordon o cavandoli,https://i.ytimg.com/vi/PlTQjCyuhOc/default.jpg,https://i.ytimg.com/vi/PlTQjCyuhOc/mqdefault.jpg,https://i.ytimg.com/vi/PlTQjCyuhOc/hqdefault.jpg
9uJx-kG1IqE,pulsera macrame ojo de dios,https://i.ytimg.com/vi/9uJx-kG1IqE/default.jpg,https://i.ytimg.com/vi/9uJx-kG1IqE/mqdefault.jpg,https://i.ytimg.com/vi/9uJx-kG1IqE/hqdefault.jpg
lWKwwU10AAo,pulsera de los deseos pulseras de hilo fáciles de hacer,https://i.ytimg.com/vi/lWKwwU10AAo/default.jpg,https://i.ytimg.com/vi/lWKwwU10AAo/mqdefault.jpg,https://i.ytimg.com/vi/lWKwwU10AAo/hqdefault.jpg
gqmupfTBIn8,tutorial pulsera macrame finas y faciles,https://i.ytimg.com/vi/gqmupfTBIn8/default.jpg,https://i.ytimg.com/vi/gqmupfTBIn8/mqdefault.jpg,https://i.ytimg.com/vi/gqmupfTBIn8/hqdefault.jpg
Upt-OKOQWHg,nudos basicos del macrame nudos feston,https://i.ytimg.com/vi/Upt-OKOQWHg/default.jpg,https://i.ytimg.com/vi/Upt-OKOQWHg/mqdefault.jpg,https://i.ytimg.com/vi/Upt-OKOQWHg/hqdefault.jpg
Nx2jlSPyS2o,PARCHES PARA ROPA BORDADOS / PERSONALIZA TU ROPA Y ACCESORIOS,https://i.ytimg.com/vi/Nx2jlSPyS2o/default.jpg,https://i.ytimg.com/vi/Nx2jlSPyS2o/mqdefault.jpg,https://i.ytimg.com/vi/Nx2jlSPyS2o/hqdefault.jpg
_J_nFyC8caY,18 MANERAS ECONÓMICAS Y FÁCILES DE HACER QUE TU ROPA VIEJA BRILLE NUEVAMENTE,https://i.ytimg.com/vi/_J_nFyC8caY/default.jpg,https://i.ytimg.com/vi/_J_nFyC8caY/mqdefault.jpg,https://i.ytimg.com/vi/_J_nFyC8caY/hqdefault.jpg
LcfxgDLOBwg,RECICLAR JEANS - SANDALIAS DE JEANS VIEJOS - DIY: REUSE/ RECYCLE OLD JEANS - TRANSFORM YOUR CLOTHES,https://i.ytimg.com/vi/LcfxgDLOBwg/default.jpg,https://i.ytimg.com/vi/LcfxgDLOBwg/mqdefault.jpg,https://i.ytimg.com/vi/LcfxgDLOBwg/hqdefault.jpg
kZHcCMNHZdc,Recorta un triángulo en la entrepierna de tus pantalones. ¡No creerás lo que saldrá de ahí!,https://i.ytimg.com/vi/kZHcCMNHZdc/default.jpg,https://i.ytimg.com/vi/kZHcCMNHZdc/mqdefault.jpg,https://i.ytimg.com/vi/kZHcCMNHZdc/hqdefault.jpg
cKmYaRc9Uw4,Falda doble circular larga,https://i.ytimg.com/vi/cKmYaRc9Uw4/default.jpg,https://i.ytimg.com/vi/cKmYaRc9Uw4/mqdefault.jpg,https://i.ytimg.com/vi/cKmYaRc9Uw4/hqdefault.jpg
N6fU-LIFJS0,Felt Tulip - #DIY How to Make Tulip Felt Flowers || S Nuraeni,https://i.ytimg.com/vi/N6fU-LIFJS0/default.jpg,https://i.ytimg.com/vi/N6fU-LIFJS0/mqdefault.jpg,https://i.ytimg.com/vi/N6fU-LIFJS0/hqdefault.jpg
a2PnVjCKECY,91 Clases de Bordado: Relleno de figuras con chaquira,https://i.ytimg.com/vi/a2PnVjCKECY/default.jpg,https://i.ytimg.com/vi/a2PnVjCKECY/mqdefault.jpg,https://i.ytimg.com/vi/a2PnVjCKECY/hqdefault.jpg
uDuL2-Cmjw0,Hand Embroidery - Herringbone Stitch Flower design | buttonhole stitch | brazilian stitch,https://i.ytimg.com/vi/uDuL2-Cmjw0/default.jpg,https://i.ytimg.com/vi/uDuL2-Cmjw0/mqdefault.jpg,https://i.ytimg.com/vi/uDuL2-Cmjw0/hqdefault.jpg
deMUH41lFBs,Borda en una máquina de coser casera,https://i.ytimg.com/vi/deMUH41lFBs/default.jpg,https://i.ytimg.com/vi/deMUH41lFBs/mqdefault.jpg,https://i.ytimg.com/vi/deMUH41lFBs/hqdefault.jpg
DXTVfvHAZKw,"Hand Embroidery, Easy Flower Embroidery, Whipped spiderweb Stitch",https://i.ytimg.com/vi/DXTVfvHAZKw/default.jpg,https://i.ytimg.com/vi/DXTVfvHAZKw/mqdefault.jpg,https://i.ytimg.com/vi/DXTVfvHAZKw/hqdefault.jpg
gsEGn8OJzcU,Hand Embroidery;Beautiful Flower With BeadsPearl,https://i.ytimg.com/vi/gsEGn8OJzcU/default.jpg,https://i.ytimg.com/vi/gsEGn8OJzcU/mqdefault.jpg,https://i.ytimg.com/vi/gsEGn8OJzcU/hqdefault.jpg
jRorK_11Vyo,40 TRUCOS ELEGANTES PARA LUCIR ESPECTACULAR CON TU VIEJA ROPA,https://i.ytimg.com/vi/jRorK_11Vyo/default.jpg,https://i.ytimg.com/vi/jRorK_11Vyo/mqdefault.jpg,https://i.ytimg.com/vi/jRorK_11Vyo/hqdefault.jpg
RL3R80RlejU,13 CONSEJOS DE BORDADO SIMPLES,https://i.ytimg.com/vi/RL3R80RlejU/default.jpg,https://i.ytimg.com/vi/RL3R80RlejU/mqdefault.jpg,https://i.ytimg.com/vi/RL3R80RlejU/hqdefault.jpg
nqk2RLQpZJ8,FLORES AZULES PUNTADA LARGA,https://i.ytimg.com/vi/nqk2RLQpZJ8/default.jpg,https://i.ytimg.com/vi/nqk2RLQpZJ8/mqdefault.jpg,https://i.ytimg.com/vi/nqk2RLQpZJ8/hqdefault.jpg
jX9qjRaNZ1A,Hand embroidery苏绣(苏州刺绣针法教程) 刺繍,https://i.ytimg.com/vi/jX9qjRaNZ1A/default.jpg,https://i.ytimg.com/vi/jX9qjRaNZ1A/mqdefault.jpg,https://i.ytimg.com/vi/jX9qjRaNZ1A/hqdefault.jpg
ZF6ddlzrNPk,fantasy flower with beads hand embroidery| beaded embroidery design for dress,https://i.ytimg.com/vi/ZF6ddlzrNPk/default.jpg,https://i.ytimg.com/vi/ZF6ddlzrNPk/mqdefault.jpg,https://i.ytimg.com/vi/ZF6ddlzrNPk/hqdefault.jpg
l8SealoF_Bg,hoja trenzada con adicional,https://i.ytimg.com/vi/l8SealoF_Bg/default.jpg,https://i.ytimg.com/vi/l8SealoF_Bg/mqdefault.jpg,https://i.ytimg.com/vi/l8SealoF_Bg/hqdefault.jpg
u6v2Xv1hLUo,How to make a storage box - Jewellery box with woolen and newspaper,https://i.ytimg.com/vi/u6v2Xv1hLUo/default.jpg,https://i.ytimg.com/vi/u6v2Xv1hLUo/mqdefault.jpg,https://i.ytimg.com/vi/u6v2Xv1hLUo/hqdefault.jpg
YOwSIkhe2p8,Woolen Craft Idea/Best Out of Waste Woolen Door Hanging/How To Make Wall Hanging for Room Decor,https://i.ytimg.com/vi/YOwSIkhe2p8/default.jpg,https://i.ytimg.com/vi/YOwSIkhe2p8/mqdefault.jpg,https://i.ytimg.com/vi/YOwSIkhe2p8/hqdefault.jpg
QD7aEMaDspQ,"Bordanto Tenango o Mexicano, Combinando colores, VIDEO 29",https://i.ytimg.com/vi/QD7aEMaDspQ/default.jpg,https://i.ytimg.com/vi/QD7aEMaDspQ/mqdefault.jpg,https://i.ytimg.com/vi/QD7aEMaDspQ/hqdefault.jpg
q_7A06_KKbQ,Deleted video,https://i.ytimg.com/vi/q_7A06_KKbQ/default.jpg,https://i.ytimg.com/vi/q_7A06_KKbQ/mqdefault.jpg,https://i.ytimg.com/vi/q_7A06_KKbQ/hqdefault.jpg
fn4VqMeDM9Q,Вышивка рококо: вышиваем розу,https://i.ytimg.com/vi/fn4VqMeDM9Q/default.jpg,https://i.ytimg.com/vi/fn4VqMeDM9Q/mqdefault.jpg,https://i.ytimg.com/vi/fn4VqMeDM9Q/hqdefault.jpg
Dd5B6_bGPb8,Cómo hacer un cojín bordado a mano estilo ayacuchano,https://i.ytimg.com/vi/Dd5B6_bGPb8/default.jpg,https://i.ytimg.com/vi/Dd5B6_bGPb8/mqdefault.jpg,https://i.ytimg.com/vi/Dd5B6_bGPb8/hqdefault.jpg
wEbhoWGzyt4,Punto rococo bordado ROCOCO STITCH,https://i.ytimg.com/vi/wEbhoWGzyt4/default.jpg,https://i.ytimg.com/vi/wEbhoWGzyt4/mqdefault.jpg,https://i.ytimg.com/vi/wEbhoWGzyt4/hqdefault.jpg
Tjk8JKwvxo4,Sewing Hack with Ice Cream Stick| Hand Embroidery amazing Tricks #11|super easy embroidery trick,https://i.ytimg.com/vi/Tjk8JKwvxo4/default.jpg,https://i.ytimg.com/vi/Tjk8JKwvxo4/mqdefault.jpg,https://i.ytimg.com/vi/Tjk8JKwvxo4/hqdefault.jpg
8ubrqyfJlcQ,37 CONSEJOS Y TRUCOS DE BORDADO A MANO,https://i.ytimg.com/vi/8ubrqyfJlcQ/default.jpg,https://i.ytimg.com/vi/8ubrqyfJlcQ/mqdefault.jpg,https://i.ytimg.com/vi/8ubrqyfJlcQ/hqdefault.jpg
rfOhyLT9Mns,Bordar flores punto de telaraña  STITCH SPIDER WEB,https://i.ytimg.com/vi/rfOhyLT9Mns/default.jpg,https://i.ytimg.com/vi/rfOhyLT9Mns/mqdefault.jpg,https://i.ytimg.com/vi/rfOhyLT9Mns/hqdefault.jpg
a7Ejj5gpbLA,Bordar flores 3D paso a paso,https://i.ytimg.com/vi/a7Ejj5gpbLA/default.jpg,https://i.ytimg.com/vi/a7Ejj5gpbLA/mqdefault.jpg,https://i.ytimg.com/vi/a7Ejj5gpbLA/hqdefault.jpg
Gf3eziSThx0,12 TRUCOS Y TÉCNICAS SIMPLES DE BORDADO,https://i.ytimg.com/vi/Gf3eziSThx0/default.jpg,https://i.ytimg.com/vi/Gf3eziSThx0/mqdefault.jpg,https://i.ytimg.com/vi/Gf3eziSThx0/hqdefault.jpg
A2faJq3aiAU,Atrapa sueños mini con borde tejido a crochet,https://i.ytimg.com/vi/A2faJq3aiAU/default.jpg,https://i.ytimg.com/vi/A2faJq3aiAU/mqdefault.jpg,https://i.ytimg.com/vi/A2faJq3aiAU/hqdefault.jpg
BVxEvhculjI,Gorro caído con visera tejido en dos agujas y crochet!,https://i.ytimg.com/vi/BVxEvhculjI/default.jpg,https://i.ytimg.com/vi/BVxEvhculjI/mqdefault.jpg,https://i.ytimg.com/vi/BVxEvhculjI/hqdefault.jpg
wCPohBcsJIU,Abrigos para perritos tejidos en dos agujas en dos tallas!,https://i.ytimg.com/vi/wCPohBcsJIU/default.jpg,https://i.ytimg.com/vi/wCPohBcsJIU/mqdefault.jpg,https://i.ytimg.com/vi/wCPohBcsJIU/hqdefault.jpg
nMuSDF5jCt0,Boina en punto garbanzo o puff tejida a crochet - Crochet puff stitch beret,https://i.ytimg.com/vi/nMuSDF5jCt0/default.jpg,https://i.ytimg.com/vi/nMuSDF5jCt0/mqdefault.jpg,https://i.ytimg.com/vi/nMuSDF5jCt0/hqdefault.jpg
9HHzfyyxxBM,Poncho con mangas tejido en dos agujas para niñas,https://i.ytimg.com/vi/9HHzfyyxxBM/default.jpg,https://i.ytimg.com/vi/9HHzfyyxxBM/mqdefault.jpg,https://i.ytimg.com/vi/9HHzfyyxxBM/hqdefault.jpg
DC-4QMykhQw,Chal Esperanza tejido a crochet - Tejiendo Perú,https://i.ytimg.com/vi/DC-4QMykhQw/default.jpg,https://i.ytimg.com/vi/DC-4QMykhQw/mqdefault.jpg,https://i.ytimg.com/vi/DC-4QMykhQw/hqdefault.jpg
kjRQYNbOXKs,Chaqueta con cuello doblado y mangas largas tejido a crochet en 3 tallas: S M L,https://i.ytimg.com/vi/kjRQYNbOXKs/default.jpg,https://i.ytimg.com/vi/kjRQYNbOXKs/mqdefault.jpg,https://i.ytimg.com/vi/kjRQYNbOXKs/hqdefault.jpg
gHYgogUId2M,Chaqueta fantasía turquesa tejida de un rectángulo a crochet - Tejiendo Perú,https://i.ytimg.com/vi/gHYgogUId2M/default.jpg,https://i.ytimg.com/vi/gHYgogUId2M/mqdefault.jpg,https://i.ytimg.com/vi/gHYgogUId2M/hqdefault.jpg
lmigdTGV0yw,Chal (shawl) de granny imitación horquilla tejido a crochet - Tejiendo Perú!,https://i.ytimg.com/vi/lmigdTGV0yw/default.jpg,https://i.ytimg.com/vi/lmigdTGV0yw/mqdefault.jpg,https://i.ytimg.com/vi/lmigdTGV0yw/hqdefault.jpg
ldXxbOLhwwI,Punto frijol tejido a crochet: bello y reversible! / Crochet bean stitch! -Tejiendo Perú,https://i.ytimg.com/vi/ldXxbOLhwwI/default.jpg,https://i.ytimg.com/vi/ldXxbOLhwwI/mqdefault.jpg,https://i.ytimg.com/vi/ldXxbOLhwwI/hqdefault.jpg
EbpaL0FQyso,Cómo empezar el tejido a crochet ¡SIN CADENA DE INICIO! - Tejiendo Perú,https://i.ytimg.com/vi/EbpaL0FQyso/default.jpg,https://i.ytimg.com/vi/EbpaL0FQyso/mqdefault.jpg,https://i.ytimg.com/vi/EbpaL0FQyso/hqdefault.jpg
kl4yvb4BsW8,6 nudos útiles para unir hebras al tejer - Tejiendo Perú,https://i.ytimg.com/vi/kl4yvb4BsW8/default.jpg,https://i.ytimg.com/vi/kl4yvb4BsW8/mqdefault.jpg,https://i.ytimg.com/vi/kl4yvb4BsW8/hqdefault.jpg
OMPj0FYI6OU,Bolsos a crochet con asa de corazones - Tejiendo Perú,https://i.ytimg.com/vi/OMPj0FYI6OU/default.jpg,https://i.ytimg.com/vi/OMPj0FYI6OU/mqdefault.jpg,https://i.ytimg.com/vi/OMPj0FYI6OU/hqdefault.jpg
ErKVK1Fvs38,Chal corazón con abanicos de puntos puff tejido a crochet - Tejiendo Perú,https://i.ytimg.com/vi/ErKVK1Fvs38/default.jpg,https://i.ytimg.com/vi/ErKVK1Fvs38/mqdefault.jpg,https://i.ytimg.com/vi/ErKVK1Fvs38/hqdefault.jpg
UZCpHYAn-1k,Encaje de Brujas: tapete redondo con flores popcorn tejido a crochet - Tejiendo Perú,https://i.ytimg.com/vi/UZCpHYAn-1k/default.jpg,https://i.ytimg.com/vi/UZCpHYAn-1k/mqdefault.jpg,https://i.ytimg.com/vi/UZCpHYAn-1k/hqdefault.jpg
puWUgii56Xw,Rama con hojas marcador de libros tejida a crochet - Tejiendo Perú,https://i.ytimg.com/vi/puWUgii56Xw/default.jpg,https://i.ytimg.com/vi/puWUgii56Xw/mqdefault.jpg,https://i.ytimg.com/vi/puWUgii56Xw/hqdefault.jpg
VgB5nBGSJa0,Bufanda trenzada de colores tejida a crochet - Tejiendo Perú,https://i.ytimg.com/vi/VgB5nBGSJa0/default.jpg,https://i.ytimg.com/vi/VgB5nBGSJa0/mqdefault.jpg,https://i.ytimg.com/vi/VgB5nBGSJa0/hqdefault.jpg
SSx6yTCwpRY,Lazos o moños tejidos a crochet en punto puff elástico - Tejiendo Perú,https://i.ytimg.com/vi/SSx6yTCwpRY/default.jpg,https://i.ytimg.com/vi/SSx6yTCwpRY/mqdefault.jpg,https://i.ytimg.com/vi/SSx6yTCwpRY/hqdefault.jpg
Nyf1jN7-5eY,Blusa mariposa tejida a dos agujas para niñas - Tejiendo Perú,https://i.ytimg.com/vi/Nyf1jN7-5eY/default.jpg,https://i.ytimg.com/vi/Nyf1jN7-5eY/mqdefault.jpg,https://i.ytimg.com/vi/Nyf1jN7-5eY/hqdefault.jpg
YHOnku90zLI,Poncho abierto en punto fantasía tejido a dos agujas en 3 tallas / Tejiendo Perú,https://i.ytimg.com/vi/YHOnku90zLI/default.jpg,https://i.ytimg.com/vi/YHOnku90zLI/mqdefault.jpg,https://i.ytimg.com/vi/YHOnku90zLI/hqdefault.jpg
LqzK_LAUpXw,"Chaleco o bolero redondo tejido con los dedos a ""crochet"" 😁 / Tejiendo Perú",https://i.ytimg.com/vi/LqzK_LAUpXw/default.jpg,https://i.ytimg.com/vi/LqzK_LAUpXw/mqdefault.jpg,https://i.ytimg.com/vi/LqzK_LAUpXw/hqdefault.jpg
NknK9_fKXTw,Bufanda infinita en punto RED de nudos Salomón de 1 ovillo tejida a crochet - Tejiendo Perú,https://i.ytimg.com/vi/NknK9_fKXTw/default.jpg,https://i.ytimg.com/vi/NknK9_fKXTw/mqdefault.jpg,https://i.ytimg.com/vi/NknK9_fKXTw/hqdefault.jpg
7fUSOI_b8MA,Gorro en punto Pop Up Puff o granizado tejido a crochet (3 tallas) / Tejiendo Perú,https://i.ytimg.com/vi/7fUSOI_b8MA/default.jpg,https://i.ytimg.com/vi/7fUSOI_b8MA/mqdefault.jpg,https://i.ytimg.com/vi/7fUSOI_b8MA/hqdefault.jpg
eYcSq5FVJmc,Capa corta de mi mamá tejida a dos agujas o palitos / Tejiendo Perú,https://i.ytimg.com/vi/eYcSq5FVJmc/default.jpg,https://i.ytimg.com/vi/eYcSq5FVJmc/mqdefault.jpg,https://i.ytimg.com/vi/eYcSq5FVJmc/hqdefault.jpg
CUN5BBcymsU,"Monedero mini maleta, bolso o neceser con broche o boquilla tejido a crochet / Tejiendo Perú",https://i.ytimg.com/vi/CUN5BBcymsU/default.jpg,https://i.ytimg.com/vi/CUN5BBcymsU/mqdefault.jpg,https://i.ytimg.com/vi/CUN5BBcymsU/hqdefault.jpg
kVq5iEEOSzk,"Neceser, bolsito o clutch Jazmín de 1 sola pieza tejido a crochet / Tejiendo Perú",https://i.ytimg.com/vi/kVq5iEEOSzk/default.jpg,https://i.ytimg.com/vi/kVq5iEEOSzk/mqdefault.jpg,https://i.ytimg.com/vi/kVq5iEEOSzk/hqdefault.jpg
kq2athaATUs,Capa campana agogó tejida a crochet en 3 tallas / Tejiendo Perú,https://i.ytimg.com/vi/kq2athaATUs/default.jpg,https://i.ytimg.com/vi/kq2athaATUs/mqdefault.jpg,https://i.ytimg.com/vi/kq2athaATUs/hqdefault.jpg
6Zm4jvr7jEI,Aplique de manzana calada tejido a crochet / Tejiendo Perú,https://i.ytimg.com/vi/6Zm4jvr7jEI/default.jpg,https://i.ytimg.com/vi/6Zm4jvr7jEI/mqdefault.jpg,https://i.ytimg.com/vi/6Zm4jvr7jEI/hqdefault.jpg
zyUJpK5lvp4,Poncho / Chal (Ponchal) con abanicos tejido a crochet - Tejiendo Perú,https://i.ytimg.com/vi/zyUJpK5lvp4/default.jpg,https://i.ytimg.com/vi/zyUJpK5lvp4/mqdefault.jpg,https://i.ytimg.com/vi/zyUJpK5lvp4/hqdefault.jpg
sQqW59NhPkI,"Bufanda corta o cuello BICOLOR en punto ""elástico"" de tricot tejido a crochet / Tejiendo Perú",https://i.ytimg.com/vi/sQqW59NhPkI/default.jpg,https://i.ytimg.com/vi/sQqW59NhPkI/mqdefault.jpg,https://i.ytimg.com/vi/sQqW59NhPkI/hqdefault.jpg
ALGagUpOhUg,"Chaleco con capucha de UNA pieza tejido a crochet en ""punto elástico tricot""/ Tejiendo Perú",https://i.ytimg.com/vi/ALGagUpOhUg/default.jpg,https://i.ytimg.com/vi/ALGagUpOhUg/mqdefault.jpg,https://i.ytimg.com/vi/ALGagUpOhUg/hqdefault.jpg
dsr0ZhppQk0,Bolso o cartera clutch tejido en crochet XL con trapillo / Tejiendo Perú,https://i.ytimg.com/vi/dsr0ZhppQk0/default.jpg,https://i.ytimg.com/vi/dsr0ZhppQk0/mqdefault.jpg,https://i.ytimg.com/vi/dsr0ZhppQk0/hqdefault.jpg
osLSHkSFhBI,Granny margarita o hexágono tejido a crochet / Tejiendo Perú,https://i.ytimg.com/vi/osLSHkSFhBI/default.jpg,https://i.ytimg.com/vi/osLSHkSFhBI/mqdefault.jpg,https://i.ytimg.com/vi/osLSHkSFhBI/hqdefault.jpg
JH-kues2c9s,Bolso atado o nudo japonés XL tejido a crochet / Tejiendo Perú,https://i.ytimg.com/vi/JH-kues2c9s/default.jpg,https://i.ytimg.com/vi/JH-kues2c9s/mqdefault.jpg,https://i.ytimg.com/vi/JH-kues2c9s/hqdefault.jpg
JABuI_IbeEI,Poncho irregular en punto pavo real tejido a crochet (2 rectángulos) / Tejiendo Perú,https://i.ytimg.com/vi/JABuI_IbeEI/default.jpg,https://i.ytimg.com/vi/JABuI_IbeEI/mqdefault.jpg,https://i.ytimg.com/vi/JABuI_IbeEI/hqdefault.jpg
HI1QEoNarQ8,Chal con nuditos tejido a dos agujas / Tejiendo Perú 🤩,https://i.ytimg.com/vi/HI1QEoNarQ8/default.jpg,https://i.ytimg.com/vi/HI1QEoNarQ8/mqdefault.jpg,https://i.ytimg.com/vi/HI1QEoNarQ8/hqdefault.jpg
A47aBbUaipg,DIY Round Macramé Coasters | Boho Room Decor | Curly Made,https://i.ytimg.com/vi/A47aBbUaipg/default.jpg,https://i.ytimg.com/vi/A47aBbUaipg/mqdefault.jpg,https://i.ytimg.com/vi/A47aBbUaipg/hqdefault.jpg
fzQkfuiCJws,Amazing Sewing  Trick | Make All Over Design Hand Stitch | Sewing Hack,https://i.ytimg.com/vi/fzQkfuiCJws/default.jpg,https://i.ytimg.com/vi/fzQkfuiCJws/mqdefault.jpg,https://i.ytimg.com/vi/fzQkfuiCJws/hqdefault.jpg
I-aStl11Hik,Tutorial SANDWICH de fomi en forma de BOLSA DIY Inerya viris,https://i.ytimg.com/vi/I-aStl11Hik/default.jpg,https://i.ytimg.com/vi/I-aStl11Hik/mqdefault.jpg,https://i.ytimg.com/vi/I-aStl11Hik/hqdefault.jpg
kpX1t_GQLGo,beads embroidery flower |hand embroidery fancy flower design,https://i.ytimg.com/vi/kpX1t_GQLGo/default.jpg,https://i.ytimg.com/vi/kpX1t_GQLGo/mqdefault.jpg,https://i.ytimg.com/vi/kpX1t_GQLGo/hqdefault.jpg
mfYDfsRvZBY,25 COOL T-SHIRT HACKS YOU CAN DIY IN 5 MINUTES,https://i.ytimg.com/vi/mfYDfsRvZBY/default.jpg,https://i.ytimg.com/vi/mfYDfsRvZBY/mqdefault.jpg,https://i.ytimg.com/vi/mfYDfsRvZBY/hqdefault.jpg
6GrlOh3l5Mg,Restos de hilos de tejer?  Haz estas lindas mariposas!,https://i.ytimg.com/vi/6GrlOh3l5Mg/default.jpg,https://i.ytimg.com/vi/6GrlOh3l5Mg/mqdefault.jpg,https://i.ytimg.com/vi/6GrlOh3l5Mg/hqdefault.jpg
IcW4B1wOFiw,All Over Design for Dress/Kurti using Embroidery Hack (Hand Embroidery Work),https://i.ytimg.com/vi/IcW4B1wOFiw/default.jpg,https://i.ytimg.com/vi/IcW4B1wOFiw/mqdefault.jpg,https://i.ytimg.com/vi/IcW4B1wOFiw/hqdefault.jpg
Sh3y1TMvikM,刺繍☆立体な蝶＊butterfly embroidery,https://i.ytimg.com/vi/Sh3y1TMvikM/default.jpg,https://i.ytimg.com/vi/Sh3y1TMvikM/mqdefault.jpg,https://i.ytimg.com/vi/Sh3y1TMvikM/hqdefault.jpg
H5PdBL7D8B0,[프랑스자수 ] Cherry Blossom embroidery 벚꽃 자수,https://i.ytimg.com/vi/H5PdBL7D8B0/default.jpg,https://i.ytimg.com/vi/H5PdBL7D8B0/mqdefault.jpg,https://i.ytimg.com/vi/H5PdBL7D8B0/hqdefault.jpg
lmf063bIcqk,[ENG/KOR]헤어스타일자수 2 올림머리 Hairstyle Embroidery,https://i.ytimg.com/vi/lmf063bIcqk/default.jpg,https://i.ytimg.com/vi/lmf063bIcqk/mqdefault.jpg,https://i.ytimg.com/vi/lmf063bIcqk/hqdefault.jpg
Q-SXQC5FlLM,"[프랑스자수]Mother's Day gift. Carnation brooch, mirror making. 어버이날 선물. 카네이션 거울, 브로치 만들기",https://i.ytimg.com/vi/Q-SXQC5FlLM/default.jpg,https://i.ytimg.com/vi/Q-SXQC5FlLM/mqdefault.jpg,https://i.ytimg.com/vi/Q-SXQC5FlLM/hqdefault.jpg
qWU7pD6EUso,[ENG/KOR]헤어스타일 자수 1 묶음머리 Hairstyle Embroidery,https://i.ytimg.com/vi/qWU7pD6EUso/default.jpg,https://i.ytimg.com/vi/qWU7pD6EUso/mqdefault.jpg,https://i.ytimg.com/vi/qWU7pD6EUso/hqdefault.jpg
B9FgF9hqrD8,¡NO LO TIRES! MANUALIDADES RECICLADAS  Ideas para regalar en 5 minutos/ COMO HACER UN BOLSO DE JEANS,https://i.ytimg.com/vi/B9FgF9hqrD8/default.jpg,https://i.ytimg.com/vi/B9FgF9hqrD8/mqdefault.jpg,https://i.ytimg.com/vi/B9FgF9hqrD8/hqdefault.jpg
Qb0iduifUr0,Manualidades fáciles para hacer en casa; SIN COSER ideas para regalar,https://i.ytimg.com/vi/Qb0iduifUr0/default.jpg,https://i.ytimg.com/vi/Qb0iduifUr0/mqdefault.jpg,https://i.ytimg.com/vi/Qb0iduifUr0/hqdefault.jpg
Dzgcx4WmKgM,"Manualidades con material reciclado, fáciles y económicas | DIARIO DE OLGA",https://i.ytimg.com/vi/Dzgcx4WmKgM/default.jpg,https://i.ytimg.com/vi/Dzgcx4WmKgM/mqdefault.jpg,https://i.ytimg.com/vi/Dzgcx4WmKgM/hqdefault.jpg
8LmJ_GkPOPw,[프랑스자수] 울사로 만드는 카네이션 꽃 자수 Carnation (clove gillyflower) embroidery flower making wool yarn,https://i.ytimg.com/vi/8LmJ_GkPOPw/default.jpg,https://i.ytimg.com/vi/8LmJ_GkPOPw/mqdefault.jpg,https://i.ytimg.com/vi/8LmJ_GkPOPw/hqdefault.jpg
eYpZGsNi-Tk,SUPER DIYs OLD CLOTH RECYCLE INTO CUTE BAGS & T-SHIRT // Cool DIY Bag Tutorials,https://i.ytimg.com/vi/eYpZGsNi-Tk/default.jpg,https://i.ytimg.com/vi/eYpZGsNi-Tk/mqdefault.jpg,https://i.ytimg.com/vi/eYpZGsNi-Tk/hqdefault.jpg
3A-phNcGim8,Private video,https://i.ytimg.com/vi/3A-phNcGim8/default.jpg,https://i.ytimg.com/vi/3A-phNcGim8/mqdefault.jpg,https://i.ytimg.com/vi/3A-phNcGim8/hqdefault.jpg
1cIVkZ_LqJ8,"Hand Embroidery:Wow Amazing Sewing Hack Trick Make Flower With Pencil,Easy Fluffy Flower Embroidery",https://i.ytimg.com/vi/1cIVkZ_LqJ8/default.jpg,https://i.ytimg.com/vi/1cIVkZ_LqJ8/mqdefault.jpg,https://i.ytimg.com/vi/1cIVkZ_LqJ8/hqdefault.jpg
X77wF9PMvaA,Private video,https://i.ytimg.com/vi/X77wF9PMvaA/default.jpg,https://i.ytimg.com/vi/X77wF9PMvaA/mqdefault.jpg,https://i.ytimg.com/vi/X77wF9PMvaA/hqdefault.jpg
Slh_Hnxo4AI,Modatelas presenta a Cositas - Tutorial paso a paso cómo hacer un hipopótamo de tela,https://i.ytimg.com/vi/Slh_Hnxo4AI/default.jpg,https://i.ytimg.com/vi/Slh_Hnxo4AI/mqdefault.jpg,https://i.ytimg.com/vi/Slh_Hnxo4AI/hqdefault.jpg
6J_NMlAleR0,24 CLOTHES HACKS FOR SMART MOMS,https://i.ytimg.com/vi/6J_NMlAleR0/default.jpg,https://i.ytimg.com/vi/6J_NMlAleR0/mqdefault.jpg,https://i.ytimg.com/vi/6J_NMlAleR0/hqdefault.jpg
OGmflu_s5p4,COMPILATION 30 IDÉES DIY HABITS FACILE - NE JETER PLUS RIEN ! CUSTOMISER  [HD] [2018],https://i.ytimg.com/vi/OGmflu_s5p4/default.jpg,https://i.ytimg.com/vi/OGmflu_s5p4/mqdefault.jpg,https://i.ytimg.com/vi/OGmflu_s5p4/hqdefault.jpg
A2Rv1cidMEk,HAZ COLLARES PARA TUS MASCOTAS ❤️ 3 IDEAS PARA TUS PERROS Y GATOS - Tutoriales Belen,https://i.ytimg.com/vi/A2Rv1cidMEk/default.jpg,https://i.ytimg.com/vi/A2Rv1cidMEk/mqdefault.jpg,https://i.ytimg.com/vi/A2Rv1cidMEk/hqdefault.jpg
HLdOWkkHbgU,Nudo de Cirujano para Unir Lanas. Nudo indestructible.,https://i.ytimg.com/vi/HLdOWkkHbgU/default.jpg,https://i.ytimg.com/vi/HLdOWkkHbgU/mqdefault.jpg,https://i.ytimg.com/vi/HLdOWkkHbgU/hqdefault.jpg
Fyaz4zfmh6w,Nudo del cirujano - Tejiendo Perú,https://i.ytimg.com/vi/Fyaz4zfmh6w/default.jpg,https://i.ytimg.com/vi/Fyaz4zfmh6w/mqdefault.jpg,https://i.ytimg.com/vi/Fyaz4zfmh6w/hqdefault.jpg
vgD0Lzqjhz4,22 FÁCILES IDEAS DE DECORACIÓN PARA TUS CAMISETAS,https://i.ytimg.com/vi/vgD0Lzqjhz4/default.jpg,https://i.ytimg.com/vi/vgD0Lzqjhz4/mqdefault.jpg,https://i.ytimg.com/vi/vgD0Lzqjhz4/hqdefault.jpg
yzmWsFxaJ2I,17 ZINGY CLOTHES DECORATING TRICKS ANYONE WILL APPRECIATE,https://i.ytimg.com/vi/yzmWsFxaJ2I/default.jpg,https://i.ytimg.com/vi/yzmWsFxaJ2I/mqdefault.jpg,https://i.ytimg.com/vi/yzmWsFxaJ2I/hqdefault.jpg
sg6_rpnmsec,hand embroidery ;hand embroidery tutorial;Scroll stitch.,https://i.ytimg.com/vi/sg6_rpnmsec/default.jpg,https://i.ytimg.com/vi/sg6_rpnmsec/mqdefault.jpg,https://i.ytimg.com/vi/sg6_rpnmsec/hqdefault.jpg
Ikiy2UGVqhY,Twisted Turban Hat Sewing Pattern - Turban Hat DIY,https://i.ytimg.com/vi/Ikiy2UGVqhY/default.jpg,https://i.ytimg.com/vi/Ikiy2UGVqhY/mqdefault.jpg,https://i.ytimg.com/vi/Ikiy2UGVqhY/hqdefault.jpg
PqymuZyZ42w,"DIYS DISNEY 🖤 Ideias Inspiradas no Mickey e Minnie 🎀 Almofada, Luminária e Porta Recados",https://i.ytimg.com/vi/PqymuZyZ42w/default.jpg,https://i.ytimg.com/vi/PqymuZyZ42w/mqdefault.jpg,https://i.ytimg.com/vi/PqymuZyZ42w/hqdefault.jpg
7pMN2yWmLT4,4 puntadas que debes conocer,https://i.ytimg.com/vi/7pMN2yWmLT4/default.jpg,https://i.ytimg.com/vi/7pMN2yWmLT4/mqdefault.jpg,https://i.ytimg.com/vi/7pMN2yWmLT4/hqdefault.jpg
oIeJMt52lwk,COMO HACER UNA ALMOHADA ANTIESTRES MODELO HUESITO | TIPS DE CONFECCIÓN,https://i.ytimg.com/vi/oIeJMt52lwk/default.jpg,https://i.ytimg.com/vi/oIeJMt52lwk/mqdefault.jpg,https://i.ytimg.com/vi/oIeJMt52lwk/hqdefault.jpg
qaovpBrwBug,hand embroidery: beautiful flower with beads| modern flower embroidery,https://i.ytimg.com/vi/qaovpBrwBug/default.jpg,https://i.ytimg.com/vi/qaovpBrwBug/mqdefault.jpg,https://i.ytimg.com/vi/qaovpBrwBug/hqdefault.jpg
k_UKRRXOiDg,✂😍COMO HACER UNA BOLSA TRANSPORTADORA PARA PERRO/CURIOSIDADES DE GINA,https://i.ytimg.com/vi/k_UKRRXOiDg/default.jpg,https://i.ytimg.com/vi/k_UKRRXOiDg/mqdefault.jpg,https://i.ytimg.com/vi/k_UKRRXOiDg/hqdefault.jpg
ne-6xPeO3nY,"HAZLO TU MISMO / DIY BOLSO PARA MASCOTAS - fácil, rápido y económico / DSARA",https://i.ytimg.com/vi/ne-6xPeO3nY/default.jpg,https://i.ytimg.com/vi/ne-6xPeO3nY/mqdefault.jpg,https://i.ytimg.com/vi/ne-6xPeO3nY/hqdefault.jpg
F-ClJ6cwsds,Deleted video,https://i.ytimg.com/vi/F-ClJ6cwsds/default.jpg,https://i.ytimg.com/vi/F-ClJ6cwsds/mqdefault.jpg,https://i.ytimg.com/vi/F-ClJ6cwsds/hqdefault.jpg
Rvav1uUfnEI,"COMO FAZER UM PESO DE PORTA DE CACHORRO,NO ARTESANATO COSTURADO",https://i.ytimg.com/vi/Rvav1uUfnEI/default.jpg,https://i.ytimg.com/vi/Rvav1uUfnEI/mqdefault.jpg,https://i.ytimg.com/vi/Rvav1uUfnEI/hqdefault.jpg
