ID,TITLE,THUMBNAIL1,THUMBNAIL2,THUMBNAIL3
SNRieh154uk,Battle Body Lotion Scarlett Whitening VS Cathy Doll,https://i.ytimg.com/vi/SNRieh154uk/default.jpg,https://i.ytimg.com/vi/SNRieh154uk/mqdefault.jpg,https://i.ytimg.com/vi/SNRieh154uk/hqdefault.jpg
FlmjfY6y78c,"BATTLE MICELLAR WATER SENKA VS GARNIER, MANA YANG LEBIH BISA MENGHAPUS PRODUK WATERPROOF",https://i.ytimg.com/vi/FlmjfY6y78c/default.jpg,https://i.ytimg.com/vi/FlmjfY6y78c/mqdefault.jpg,https://i.ytimg.com/vi/FlmjfY6y78c/hqdefault.jpg
b0VHATH33qg,"REVIEW AZARINE HYDRASOOTHE SUNSCREEN GEL SPF 45, BISA JADI PELEMBAP JUGA?!",https://i.ytimg.com/vi/b0VHATH33qg/default.jpg,https://i.ytimg.com/vi/b0VHATH33qg/mqdefault.jpg,https://i.ytimg.com/vi/b0VHATH33qg/hqdefault.jpg
LEoZtJadLp4,"ROLLOVER REACTION SUEDE LIP AND CHEEK CREAM, PRODUK 2-IN-1 UNDERRATED!",https://i.ytimg.com/vi/LEoZtJadLp4/default.jpg,https://i.ytimg.com/vi/LEoZtJadLp4/mqdefault.jpg,https://i.ytimg.com/vi/LEoZtJadLp4/hqdefault.jpg
hi5_bZNyJtM,REVIEW ROLLOVER REACTION SLICKED LIP GLASS || LIP GLOSS LOKAL YANG UNDERRATED?!!,https://i.ytimg.com/vi/hi5_bZNyJtM/default.jpg,https://i.ytimg.com/vi/hi5_bZNyJtM/mqdefault.jpg,https://i.ytimg.com/vi/hi5_bZNyJtM/hqdefault.jpg
VXfQJuoFAXY,"REVIEW MAYBELLINE THE FALSIES LASH LIFT MASCARA, BENERAN BISA TAHAN LAMA?",https://i.ytimg.com/vi/VXfQJuoFAXY/default.jpg,https://i.ytimg.com/vi/VXfQJuoFAXY/mqdefault.jpg,https://i.ytimg.com/vi/VXfQJuoFAXY/hqdefault.jpg
S44tO8kozUM,CARA MEMBUAT EYELINER SUPER MUDAH! HACKS EYELINER PAKAI PENJEPIT BULU MATA,https://i.ytimg.com/vi/S44tO8kozUM/default.jpg,https://i.ytimg.com/vi/S44tO8kozUM/mqdefault.jpg,https://i.ytimg.com/vi/S44tO8kozUM/hqdefault.jpg
BFfDATmsTt4,Tutorial Jahit Bulu Mata Super Mudah! Hasilnya Seperti Eyelash Extension!,https://i.ytimg.com/vi/BFfDATmsTt4/default.jpg,https://i.ytimg.com/vi/BFfDATmsTt4/mqdefault.jpg,https://i.ytimg.com/vi/BFfDATmsTt4/hqdefault.jpg
TA9V6ZWQ_6U,3 Rekomendasi Skincare yang Mengandung Bakuchiol untuk Anti Aging!,https://i.ytimg.com/vi/TA9V6ZWQ_6U/default.jpg,https://i.ytimg.com/vi/TA9V6ZWQ_6U/mqdefault.jpg,https://i.ytimg.com/vi/TA9V6ZWQ_6U/hqdefault.jpg
9SR5pxeaunA,"Review N'pure Cica Clear Pad Untuk Menghilangkan Bekas Jerawat, Beneran Ada Hasilnya Ga Sih?",https://i.ytimg.com/vi/9SR5pxeaunA/default.jpg,https://i.ytimg.com/vi/9SR5pxeaunA/mqdefault.jpg,https://i.ytimg.com/vi/9SR5pxeaunA/hqdefault.jpg
_sTz8IfLguU,3 Serum Vitamin C Ampuh Menghilangkan Flek Hitam dan Kulit Kusam di Bawah 150 Ribu Rupiah,https://i.ytimg.com/vi/_sTz8IfLguU/default.jpg,https://i.ytimg.com/vi/_sTz8IfLguU/mqdefault.jpg,https://i.ytimg.com/vi/_sTz8IfLguU/hqdefault.jpg
5NWCrG3Cnnw,3 KOLEKSI TAS MUNGIL AMANDA MANOPO DI SINETRON IKATAN CINTA || HARGANYA BENERAN INI?!,https://i.ytimg.com/vi/5NWCrG3Cnnw/default.jpg,https://i.ytimg.com/vi/5NWCrG3Cnnw/mqdefault.jpg,https://i.ytimg.com/vi/5NWCrG3Cnnw/hqdefault.jpg
8D2tiYEeC60,REKOMENDASI SABUN MANDI PENGHILANG BAU BADAN DIBAWAH 50 RIBU RUPIAH || TIDAK MUDAH BAU BADAN!!!,https://i.ytimg.com/vi/8D2tiYEeC60/default.jpg,https://i.ytimg.com/vi/8D2tiYEeC60/mqdefault.jpg,https://i.ytimg.com/vi/8D2tiYEeC60/hqdefault.jpg
SCDTQ3YtqXg,Review Laneige Lip Sleeping Mask Selama 1 Minggu Pemakaian,https://i.ytimg.com/vi/SCDTQ3YtqXg/default.jpg,https://i.ytimg.com/vi/SCDTQ3YtqXg/mqdefault.jpg,https://i.ytimg.com/vi/SCDTQ3YtqXg/hqdefault.jpg
sdsSpSPv4r0,Review Sukin Signature Natural Deodorant Bisa Hilangin Bau Badan dengan Cepat!,https://i.ytimg.com/vi/sdsSpSPv4r0/default.jpg,https://i.ytimg.com/vi/sdsSpSPv4r0/mqdefault.jpg,https://i.ytimg.com/vi/sdsSpSPv4r0/hqdefault.jpg
cS1tPnVUUwI,Review 6 Shades Lip Cream OMG Oh My Glam Untuk Kulit Kuning Langsat dan Putih,https://i.ytimg.com/vi/cS1tPnVUUwI/default.jpg,https://i.ytimg.com/vi/cS1tPnVUUwI/mqdefault.jpg,https://i.ytimg.com/vi/cS1tPnVUUwI/hqdefault.jpg
7ZnuRZkyaLw,Review L'Oreal Paris UV Defender UV Serum Protector Sunscreen Untuk Kulit Berminyak,https://i.ytimg.com/vi/7ZnuRZkyaLw/default.jpg,https://i.ytimg.com/vi/7ZnuRZkyaLw/mqdefault.jpg,https://i.ytimg.com/vi/7ZnuRZkyaLw/hqdefault.jpg
mRI0K3kNJb0,4 Tutorial Hijab Simpel Elegan Ala Hijabers Turki,https://i.ytimg.com/vi/mRI0K3kNJb0/default.jpg,https://i.ytimg.com/vi/mRI0K3kNJb0/mqdefault.jpg,https://i.ytimg.com/vi/mRI0K3kNJb0/hqdefault.jpg
aLt0uvSKGGY,"3 Tutorial Pashmina Simpel untuk Pipi Chubby, Mudah Banget!",https://i.ytimg.com/vi/aLt0uvSKGGY/default.jpg,https://i.ytimg.com/vi/aLt0uvSKGGY/mqdefault.jpg,https://i.ytimg.com/vi/aLt0uvSKGGY/hqdefault.jpg
RQIbXG1APgc,TIPS PAKAI MASCARA AGAR BULU MATA LEBIH LENTIK DAN TAHAN LAMA || MASCARA HACKS,https://i.ytimg.com/vi/RQIbXG1APgc/default.jpg,https://i.ytimg.com/vi/RQIbXG1APgc/mqdefault.jpg,https://i.ytimg.com/vi/RQIbXG1APgc/hqdefault.jpg
D7oOyOFuoaQ,"COBAIN TREATMENT IPL LASER REJUVENATION DI DERMALOUNGE, WORTH IT GAK YA?",https://i.ytimg.com/vi/D7oOyOFuoaQ/default.jpg,https://i.ytimg.com/vi/D7oOyOFuoaQ/mqdefault.jpg,https://i.ytimg.com/vi/D7oOyOFuoaQ/hqdefault.jpg
6vnhzdd4iUY,REVIEW & SWATCHES REVLON SUPER LUSTROUS MATTE LIPSTICK,https://i.ytimg.com/vi/6vnhzdd4iUY/default.jpg,https://i.ytimg.com/vi/6vnhzdd4iUY/mqdefault.jpg,https://i.ytimg.com/vi/6vnhzdd4iUY/hqdefault.jpg
G1cDdbX5HPs,REVIEW NUTRIHAIR DARI NUTRISHE || HAIR OIL LOKAL COCOK BUAT MELEMBUTKAN RAMBUT!,https://i.ytimg.com/vi/G1cDdbX5HPs/default.jpg,https://i.ytimg.com/vi/G1cDdbX5HPs/mqdefault.jpg,https://i.ytimg.com/vi/G1cDdbX5HPs/hqdefault.jpg
rqSyG_4ODkI,Cara Mengakali Agar Heels Tidak Kebesaran Atau Tidak Bikin Lecet Di Kaki,https://i.ytimg.com/vi/rqSyG_4ODkI/default.jpg,https://i.ytimg.com/vi/rqSyG_4ODkI/mqdefault.jpg,https://i.ytimg.com/vi/rqSyG_4ODkI/hqdefault.jpg
l9qRQWm5-Aw,2 REKOMENDASI HAIR CARE UNTUK RAMBUT KERING DAN RUSAK || MURAH DAN BIKIN RAMBUT LEMBUT!,https://i.ytimg.com/vi/l9qRQWm5-Aw/default.jpg,https://i.ytimg.com/vi/l9qRQWm5-Aw/mqdefault.jpg,https://i.ytimg.com/vi/l9qRQWm5-Aw/hqdefault.jpg
B6b0hglP-yg,HACKS EYELINER TERMUDAH! BIKIN EYELINER PAKAI COTTON BUD! || GIMANA CARANYA?!,https://i.ytimg.com/vi/B6b0hglP-yg/default.jpg,https://i.ytimg.com/vi/B6b0hglP-yg/mqdefault.jpg,https://i.ytimg.com/vi/B6b0hglP-yg/hqdefault.jpg
oi2yfFHTpcI,Review 6 Shades Lip Cream OMG Oh My Glam untuk Kulit Sawo Matang!,https://i.ytimg.com/vi/oi2yfFHTpcI/default.jpg,https://i.ytimg.com/vi/oi2yfFHTpcI/mqdefault.jpg,https://i.ytimg.com/vi/oi2yfFHTpcI/hqdefault.jpg
-YX-ceo-jgs,4 REKOMENDASI BUSANA HIJAB BAHAN LACE UNTUK LEBARAN || OUTFIT LEBARAN 2021,https://i.ytimg.com/vi/-YX-ceo-jgs/default.jpg,https://i.ytimg.com/vi/-YX-ceo-jgs/mqdefault.jpg,https://i.ytimg.com/vi/-YX-ceo-jgs/hqdefault.jpg
CjpMBiV49fE,4 OUTFIT HIJAB POLA A-LINE & H-LINE SIMPLE! BADAN DIJAMIN TERLIHAT LANGSING PAKAI INI!,https://i.ytimg.com/vi/CjpMBiV49fE/default.jpg,https://i.ytimg.com/vi/CjpMBiV49fE/mqdefault.jpg,https://i.ytimg.com/vi/CjpMBiV49fE/hqdefault.jpg
Fr41bKQEl-w,4 KOLEKSI OUTFIT HIJAB MOTIF SHIBORI YANG KEKINIAN! || INSPIRASI OUTFIT LEBARAN 2021,https://i.ytimg.com/vi/Fr41bKQEl-w/default.jpg,https://i.ytimg.com/vi/Fr41bKQEl-w/mqdefault.jpg,https://i.ytimg.com/vi/Fr41bKQEl-w/hqdefault.jpg
BNrU1bZ14SM,"3 Rekomendasi Sunscreen untuk Kulit Kering, di Bawah 100 Ribu!",https://i.ytimg.com/vi/BNrU1bZ14SM/default.jpg,https://i.ytimg.com/vi/BNrU1bZ14SM/mqdefault.jpg,https://i.ytimg.com/vi/BNrU1bZ14SM/hqdefault.jpg
wbtsqi3HbOU,4 PILIHAN FACE MIST LIDAH BUAYA UNTUK KULIT SEGAR SEPANJANG HARI,https://i.ytimg.com/vi/wbtsqi3HbOU/default.jpg,https://i.ytimg.com/vi/wbtsqi3HbOU/mqdefault.jpg,https://i.ytimg.com/vi/wbtsqi3HbOU/hqdefault.jpg
QfbsLU2UyC8,"REVIEW RAIKU HYDRATING MIST, BIKIN HASIL MAKEUP JADI GLOWING! PRODUK LOKAL!!!",https://i.ytimg.com/vi/QfbsLU2UyC8/default.jpg,https://i.ytimg.com/vi/QfbsLU2UyC8/mqdefault.jpg,https://i.ytimg.com/vi/QfbsLU2UyC8/hqdefault.jpg
VPjfZnTQY5w,"3 Rekomendasi Sunscreen Untuk Kulit Berminyak, Cuma 50ribuan!",https://i.ytimg.com/vi/VPjfZnTQY5w/default.jpg,https://i.ytimg.com/vi/VPjfZnTQY5w/mqdefault.jpg,https://i.ytimg.com/vi/VPjfZnTQY5w/hqdefault.jpg
Osj2wp3jbTc,"REVIEW AZARINE ALOE VERA GEL ALL IN ONE, GEL LOKAL MULTIFUNGSI DIBAWAH 50 RIBU!",https://i.ytimg.com/vi/Osj2wp3jbTc/default.jpg,https://i.ytimg.com/vi/Osj2wp3jbTc/mqdefault.jpg,https://i.ytimg.com/vi/Osj2wp3jbTc/hqdefault.jpg
KNcfPq0GSx8,Cara Mudah Mengatasi Maskara Yang Menggumpal Agar Bulu Mata Bisa Lentik,https://i.ytimg.com/vi/KNcfPq0GSx8/default.jpg,https://i.ytimg.com/vi/KNcfPq0GSx8/mqdefault.jpg,https://i.ytimg.com/vi/KNcfPq0GSx8/hqdefault.jpg
i-er-q0IV_4,BIKIN OMBRE LIPS PAKAI MASCARA?! GIMANA CARANYA?,https://i.ytimg.com/vi/i-er-q0IV_4/default.jpg,https://i.ytimg.com/vi/i-er-q0IV_4/mqdefault.jpg,https://i.ytimg.com/vi/i-er-q0IV_4/hqdefault.jpg
nz4YotB507w,Cobain Teknik Curly Rambut Yang Ada Di Fyp Tiktok,https://i.ytimg.com/vi/nz4YotB507w/default.jpg,https://i.ytimg.com/vi/nz4YotB507w/mqdefault.jpg,https://i.ytimg.com/vi/nz4YotB507w/hqdefault.jpg
CZCQBPpc7dc,CARA MEMBUAT ALIS YANG TEPAT DAN MUDAH DARI VIDEO TIKTOK! WAJIB COBA!,https://i.ytimg.com/vi/CZCQBPpc7dc/default.jpg,https://i.ytimg.com/vi/CZCQBPpc7dc/mqdefault.jpg,https://i.ytimg.com/vi/CZCQBPpc7dc/hqdefault.jpg
yJOQr80g5iQ,Review Mustika Ratu Body Scrub Olive Zaitun di Kulit Tubuh yang Sensitif,https://i.ytimg.com/vi/yJOQr80g5iQ/default.jpg,https://i.ytimg.com/vi/yJOQr80g5iQ/mqdefault.jpg,https://i.ytimg.com/vi/yJOQr80g5iQ/hqdefault.jpg
wNgaQR12Siw,Seberapa Penting Sih Pakai Sunscreen? Manfaat Dan Cara Menggunakan Sunscreen Yang Benar!,https://i.ytimg.com/vi/wNgaQR12Siw/default.jpg,https://i.ytimg.com/vi/wNgaQR12Siw/mqdefault.jpg,https://i.ytimg.com/vi/wNgaQR12Siw/hqdefault.jpg
vcYxWE_no3c,5 REKOMENDASI LIPSTICK TRANSFER PROOF ANTI NEMPEL DI MASKER || MASKER TETAP BERSIH DAN HIGENIS!!,https://i.ytimg.com/vi/vcYxWE_no3c/default.jpg,https://i.ytimg.com/vi/vcYxWE_no3c/mqdefault.jpg,https://i.ytimg.com/vi/vcYxWE_no3c/hqdefault.jpg
T1jS6_fuuUQ,5 REKOMENDASI SUNSCREEN STICK SUPER PRAKTIS DAN HIGIENIS || MUDAH DIPAKAI DAN SIMPEL BANGET!!!,https://i.ytimg.com/vi/T1jS6_fuuUQ/default.jpg,https://i.ytimg.com/vi/T1jS6_fuuUQ/mqdefault.jpg,https://i.ytimg.com/vi/T1jS6_fuuUQ/hqdefault.jpg
jmmy7t-Ja1w,"Review Maybelline Line Tattoo High Impact Liner, Beneran Hasilnya Waterproof?",https://i.ytimg.com/vi/jmmy7t-Ja1w/default.jpg,https://i.ytimg.com/vi/jmmy7t-Ja1w/mqdefault.jpg,https://i.ytimg.com/vi/jmmy7t-Ja1w/hqdefault.jpg
K9uVojynRu4,Cara Mudah Pasang dan Lepas Kuku Palsu Tanpa Rasa Sakit,https://i.ytimg.com/vi/K9uVojynRu4/default.jpg,https://i.ytimg.com/vi/K9uVojynRu4/mqdefault.jpg,https://i.ytimg.com/vi/K9uVojynRu4/hqdefault.jpg
c0HXf3vSTY4,3 Rekomendasi Lip Tint Dibawah 100 Ribu! Dijamin Tahan Lama & Tidak Menempel di Masker!,https://i.ytimg.com/vi/c0HXf3vSTY4/default.jpg,https://i.ytimg.com/vi/c0HXf3vSTY4/mqdefault.jpg,https://i.ytimg.com/vi/c0HXf3vSTY4/hqdefault.jpg
o8RMJHQ1cqI,"Review Mediheal x LINE Friends Collagen Essential Mask di Kulit Kering, Hasilnya Wow Banget!",https://i.ytimg.com/vi/o8RMJHQ1cqI/default.jpg,https://i.ytimg.com/vi/o8RMJHQ1cqI/mqdefault.jpg,https://i.ytimg.com/vi/o8RMJHQ1cqI/hqdefault.jpg
aEYaNxDE_AY,3 Trik Styling Sarung Menjadi Outfit yang Kekinian & Fashionable! || Fashion Hacks Sarung,https://i.ytimg.com/vi/aEYaNxDE_AY/default.jpg,https://i.ytimg.com/vi/aEYaNxDE_AY/mqdefault.jpg,https://i.ytimg.com/vi/aEYaNxDE_AY/hqdefault.jpg
bkLEz2BJAPw,5 REKOMENDASI MINUMAN COLLAGEN UNTUK KULIT KENYAL MULAI DARI 40 RIBU RUPIAH || MURAH BANGET!!!,https://i.ytimg.com/vi/bkLEz2BJAPw/default.jpg,https://i.ytimg.com/vi/bkLEz2BJAPw/mqdefault.jpg,https://i.ytimg.com/vi/bkLEz2BJAPw/hqdefault.jpg
GVky7acWDVw,Cobain Tren Menggunakan Lipstik Merah ke Seluruh Wajah!,https://i.ytimg.com/vi/GVky7acWDVw/default.jpg,https://i.ytimg.com/vi/GVky7acWDVw/mqdefault.jpg,https://i.ytimg.com/vi/GVky7acWDVw/hqdefault.jpg
G_Ub-HFrut0,"3 OOTD Menggunakan Rok Plisket, Kekinian dan Fashionable banget",https://i.ytimg.com/vi/G_Ub-HFrut0/default.jpg,https://i.ytimg.com/vi/G_Ub-HFrut0/mqdefault.jpg,https://i.ytimg.com/vi/G_Ub-HFrut0/hqdefault.jpg
pKM8PRr9Ozs,TIPS DAN TRIK MENGAKALI BLAZER YANG LENGANNYA KEPANJANGAN || GAK PERLU BELI BLAZER BARU!!!,https://i.ytimg.com/vi/pKM8PRr9Ozs/default.jpg,https://i.ytimg.com/vi/pKM8PRr9Ozs/mqdefault.jpg,https://i.ytimg.com/vi/pKM8PRr9Ozs/hqdefault.jpg
qV03FIclIks,5 REKOMENDASI MASKER CHARCOAL UNTUK KULIT BERMINYAK MULAI 30 RIBU RUPIAH || AMPUH SEMUANYA?!,https://i.ytimg.com/vi/qV03FIclIks/default.jpg,https://i.ytimg.com/vi/qV03FIclIks/mqdefault.jpg,https://i.ytimg.com/vi/qV03FIclIks/hqdefault.jpg
GpF6AU-T3n0,"TUTORIAL HALO EYE MAKEUP BUAT PEMULA, DIJAMIN PASTI BISA IKUTIN!",https://i.ytimg.com/vi/GpF6AU-T3n0/default.jpg,https://i.ytimg.com/vi/GpF6AU-T3n0/mqdefault.jpg,https://i.ytimg.com/vi/GpF6AU-T3n0/hqdefault.jpg
9gnjPNXPUzE,"Review Rollover Reaction BROWSWISH Eyebrow Definer, Lengkap Ada 3 Shade!",https://i.ytimg.com/vi/9gnjPNXPUzE/default.jpg,https://i.ytimg.com/vi/9gnjPNXPUzE/mqdefault.jpg,https://i.ytimg.com/vi/9gnjPNXPUzE/hqdefault.jpg
yyljahICtZM,REKOMENDASI SHAMPOO DENGAN WANGI YANG TAHAN LAMA SEHARIAN || BIKIN NYAMAN BERAKTIVITAS!!!,https://i.ytimg.com/vi/yyljahICtZM/default.jpg,https://i.ytimg.com/vi/yyljahICtZM/mqdefault.jpg,https://i.ytimg.com/vi/yyljahICtZM/hqdefault.jpg
1VcXox80g0U,Review Make Over Hydrastay Radiant Finishing Powder di Kulit Kering,https://i.ytimg.com/vi/1VcXox80g0U/default.jpg,https://i.ytimg.com/vi/1VcXox80g0U/mqdefault.jpg,https://i.ytimg.com/vi/1VcXox80g0U/hqdefault.jpg
bnWQbJJrUKk,Tips Membuat Bulu Mata Lentik Seperti Eyelash Extension,https://i.ytimg.com/vi/bnWQbJJrUKk/default.jpg,https://i.ytimg.com/vi/bnWQbJJrUKk/mqdefault.jpg,https://i.ytimg.com/vi/bnWQbJJrUKk/hqdefault.jpg
a34vjnWGFdo,Review Make Over Hydrastay Lite Glow Cushion di Kulit Kering,https://i.ytimg.com/vi/a34vjnWGFdo/default.jpg,https://i.ytimg.com/vi/a34vjnWGFdo/mqdefault.jpg,https://i.ytimg.com/vi/a34vjnWGFdo/hqdefault.jpg
Tc1Uyz6xD3Y,"3 Rekomendasi Cat Rambut Buat Pemula yang Tidak Bikin Rambut Rusak, Mulai dari 18 Ribuan!",https://i.ytimg.com/vi/Tc1Uyz6xD3Y/default.jpg,https://i.ytimg.com/vi/Tc1Uyz6xD3Y/mqdefault.jpg,https://i.ytimg.com/vi/Tc1Uyz6xD3Y/hqdefault.jpg
5sj2v5MunUM,5 REKOMENDASI SERUM PENUMBUH ALIS DARI BRAND LOKAL || TIDAK KALAH SAMA BRAND LUAR?!,https://i.ytimg.com/vi/5sj2v5MunUM/default.jpg,https://i.ytimg.com/vi/5sj2v5MunUM/mqdefault.jpg,https://i.ytimg.com/vi/5sj2v5MunUM/hqdefault.jpg
n7sabztRaK0,Cara Mengukur Kaki Agar Tidak Salah Pilih Size Sepatu Di Online Shop,https://i.ytimg.com/vi/n7sabztRaK0/default.jpg,https://i.ytimg.com/vi/n7sabztRaK0/mqdefault.jpg,https://i.ytimg.com/vi/n7sabztRaK0/hqdefault.jpg
kA264bEwF-E,"Cobain Teknik Contour Hidung yang Viral di TikTok, Beneran Bisa Berhasil?",https://i.ytimg.com/vi/kA264bEwF-E/default.jpg,https://i.ytimg.com/vi/kA264bEwF-E/mqdefault.jpg,https://i.ytimg.com/vi/kA264bEwF-E/hqdefault.jpg
5so7zcNUu0E,Makeup Hack! Cara Gampang Mengubah Coverage Foundation dari Medium ke Full,https://i.ytimg.com/vi/5so7zcNUu0E/default.jpg,https://i.ytimg.com/vi/5so7zcNUu0E/mqdefault.jpg,https://i.ytimg.com/vi/5so7zcNUu0E/hqdefault.jpg
LT0mAjkTBQE,"MINERAL BOTANICA THE GRAIL CC CREAM REVIEW, BAGUS BUAT JADI BASE MAKEUP! TAPI WARNANYA....",https://i.ytimg.com/vi/LT0mAjkTBQE/default.jpg,https://i.ytimg.com/vi/LT0mAjkTBQE/mqdefault.jpg,https://i.ytimg.com/vi/LT0mAjkTBQE/hqdefault.jpg
nBdtpmBTA3M,5 REKOMENDASI EXFOLIATING TONER UNTUK PEMULA || MANA PRODUK YANG BIASA KAMU PAKAI?,https://i.ytimg.com/vi/nBdtpmBTA3M/default.jpg,https://i.ytimg.com/vi/nBdtpmBTA3M/mqdefault.jpg,https://i.ytimg.com/vi/nBdtpmBTA3M/hqdefault.jpg
TNK6lw2LdQ8,BLEND FOUNDATION ANTI RIBET PAKAI INI!! REVIEW MASAMI SHOUKO 322 FLAT KABUKI BRUSH,https://i.ytimg.com/vi/TNK6lw2LdQ8/default.jpg,https://i.ytimg.com/vi/TNK6lw2LdQ8/mqdefault.jpg,https://i.ytimg.com/vi/TNK6lw2LdQ8/hqdefault.jpg
GLo-__YS3rI,membuat makeup full coverage,https://i.ytimg.com/vi/GLo-__YS3rI/default.jpg,https://i.ytimg.com/vi/GLo-__YS3rI/mqdefault.jpg,https://i.ytimg.com/vi/GLo-__YS3rI/hqdefault.jpg
Hcfy3TX7GGg,"REVIEW SUNSCREEN DHC PEANUTS SUNCUT Q10 EX GEL || ANTI LENGKET & MENGKILAP, BAGUS BANGET!!!",https://i.ytimg.com/vi/Hcfy3TX7GGg/default.jpg,https://i.ytimg.com/vi/Hcfy3TX7GGg/mqdefault.jpg,https://i.ytimg.com/vi/Hcfy3TX7GGg/hqdefault.jpg
rIven_x7N0U,REVIEW BIYU OIL CONTROL CLEANSER X GELANGELICA || GAK PERLU DOUBLE CLEANSING LAGI!?,https://i.ytimg.com/vi/rIven_x7N0U/default.jpg,https://i.ytimg.com/vi/rIven_x7N0U/mqdefault.jpg,https://i.ytimg.com/vi/rIven_x7N0U/hqdefault.jpg
jV2lMCeYEtY,REKOMENDASI BRAND MAKEUP LOKAL MILIK ARTIS INDONESIA,https://i.ytimg.com/vi/jV2lMCeYEtY/default.jpg,https://i.ytimg.com/vi/jV2lMCeYEtY/mqdefault.jpg,https://i.ytimg.com/vi/jV2lMCeYEtY/hqdefault.jpg
L43xiVxje6E,Fashion Hacks! 3 Cara Mengakali Baju Kekecilan Agar Bisa Terpakai Lagi || Dijamin Lebih Modis!,https://i.ytimg.com/vi/L43xiVxje6E/default.jpg,https://i.ytimg.com/vi/L43xiVxje6E/mqdefault.jpg,https://i.ytimg.com/vi/L43xiVxje6E/hqdefault.jpg
VaqzRoFzoh8,REVIEW WARDAH ALOE HYDRAMILD MULTIFUNCTION GEL || MURAH DAN KUALITASNYA JUARA!,https://i.ytimg.com/vi/VaqzRoFzoh8/default.jpg,https://i.ytimg.com/vi/VaqzRoFzoh8/mqdefault.jpg,https://i.ytimg.com/vi/VaqzRoFzoh8/hqdefault.jpg
9Hrlz4QS8v0,"SKIN DEWI HAZELNUT CLEANSING MILK REVIEW || 100% ORGANIK, KUALITASNYA?",https://i.ytimg.com/vi/9Hrlz4QS8v0/default.jpg,https://i.ytimg.com/vi/9Hrlz4QS8v0/mqdefault.jpg,https://i.ytimg.com/vi/9Hrlz4QS8v0/hqdefault.jpg
VyDS6-PepAg,REVIEW HAPLE ALMOND OIL UNTUK PERAWATAN RAMBUT KERING & RUSAK!,https://i.ytimg.com/vi/VyDS6-PepAg/default.jpg,https://i.ytimg.com/vi/VyDS6-PepAg/mqdefault.jpg,https://i.ytimg.com/vi/VyDS6-PepAg/hqdefault.jpg
EWr6FykftKI,Review Scarlett Whitening Body Lotion Varian Freshy,https://i.ytimg.com/vi/EWr6FykftKI/default.jpg,https://i.ytimg.com/vi/EWr6FykftKI/mqdefault.jpg,https://i.ytimg.com/vi/EWr6FykftKI/hqdefault.jpg
GHkukaokRgA,Kece Banget! Intip Penampilan Nia Ramadhani Saat Menjadi Host TikTok Awards,https://i.ytimg.com/vi/GHkukaokRgA/default.jpg,https://i.ytimg.com/vi/GHkukaokRgA/mqdefault.jpg,https://i.ytimg.com/vi/GHkukaokRgA/hqdefault.jpg
LUDjw-suiTY,REVIEW HOUSE OF HUR BY SUNNY DAHYE || GARDEN MULTI SLEEK POT!,https://i.ytimg.com/vi/LUDjw-suiTY/default.jpg,https://i.ytimg.com/vi/LUDjw-suiTY/mqdefault.jpg,https://i.ytimg.com/vi/LUDjw-suiTY/hqdefault.jpg
slC3gGtv8so,REVIEW L'OREAL ELSEVE FALL RESIST SHAMPOO || RAMBUT RONTOK LANGSUNG BERKURANG DRASTIS,https://i.ytimg.com/vi/slC3gGtv8so/default.jpg,https://i.ytimg.com/vi/slC3gGtv8so/mqdefault.jpg,https://i.ytimg.com/vi/slC3gGtv8so/hqdefault.jpg
mqvp3J6RQLM,"Cara Terbaru Contour Wajah Hanya Menggunakan Concealer, Mudah Banget!",https://i.ytimg.com/vi/mqvp3J6RQLM/default.jpg,https://i.ytimg.com/vi/mqvp3J6RQLM/mqdefault.jpg,https://i.ytimg.com/vi/mqvp3J6RQLM/hqdefault.jpg
CeuMXOs2MR8,5 REKOMENDASI SABUN PENCERAH BADAN || SEMUA ADA DI MINIMARKET!?,https://i.ytimg.com/vi/CeuMXOs2MR8/default.jpg,https://i.ytimg.com/vi/CeuMXOs2MR8/mqdefault.jpg,https://i.ytimg.com/vi/CeuMXOs2MR8/hqdefault.jpg
Vtp6OBYsRZI,3 CARA AMPUH MENGGUNAKAN TONER || SEPERTI INI!?,https://i.ytimg.com/vi/Vtp6OBYsRZI/default.jpg,https://i.ytimg.com/vi/Vtp6OBYsRZI/mqdefault.jpg,https://i.ytimg.com/vi/Vtp6OBYsRZI/hqdefault.jpg
wJ4H3DaKtaI,3 Rekomendasi Bahan Hijab yang Nyaman dan Bisa Bikin Pipi Terlihat Tirus!,https://i.ytimg.com/vi/wJ4H3DaKtaI/default.jpg,https://i.ytimg.com/vi/wJ4H3DaKtaI/mqdefault.jpg,https://i.ytimg.com/vi/wJ4H3DaKtaI/hqdefault.jpg
BaqZtJjGwrM,Cara Mudah Dan Akurat Mengukur Payudara Agar Tidak Salah Beli Bra!,https://i.ytimg.com/vi/BaqZtJjGwrM/default.jpg,https://i.ytimg.com/vi/BaqZtJjGwrM/mqdefault.jpg,https://i.ytimg.com/vi/BaqZtJjGwrM/hqdefault.jpg
OG_mqqQNN6Q,Review Marshwillow Melting Melt Lip Liquide Matte di Bibir Hitam + Uji Ketahanan,https://i.ytimg.com/vi/OG_mqqQNN6Q/default.jpg,https://i.ytimg.com/vi/OG_mqqQNN6Q/mqdefault.jpg,https://i.ytimg.com/vi/OG_mqqQNN6Q/hqdefault.jpg
tqnXMmrlD2g,Y.O.U COLORLAND JUICY POP LIPSTICK REVIEW & SWATCHES DI KULIT SAWO MATANG,https://i.ytimg.com/vi/tqnXMmrlD2g/default.jpg,https://i.ytimg.com/vi/tqnXMmrlD2g/mqdefault.jpg,https://i.ytimg.com/vi/tqnXMmrlD2g/hqdefault.jpg
u5z92hzCGfQ,3 Rekomendasi Lip Product Terbaik Sepanjang 2020! (Lipstick & Lip Gloss),https://i.ytimg.com/vi/u5z92hzCGfQ/default.jpg,https://i.ytimg.com/vi/u5z92hzCGfQ/mqdefault.jpg,https://i.ytimg.com/vi/u5z92hzCGfQ/hqdefault.jpg
-SOcf0F1eps,Review Wardah Roll On For Her Anti Perspirant Deodorant || Wanginya Bisa Tahan Seharian?!,https://i.ytimg.com/vi/-SOcf0F1eps/default.jpg,https://i.ytimg.com/vi/-SOcf0F1eps/mqdefault.jpg,https://i.ytimg.com/vi/-SOcf0F1eps/hqdefault.jpg
ucxHADWtEV4,REVIEW BUTUH DEODORANT SPRAY || AMPUH BUAT HILANGKAN BAU BADAN & 100% ALAMI,https://i.ytimg.com/vi/ucxHADWtEV4/default.jpg,https://i.ytimg.com/vi/ucxHADWtEV4/mqdefault.jpg,https://i.ytimg.com/vi/ucxHADWtEV4/hqdefault.jpg
QB7Dg8Tyqis,Review Senka Perfect Whip Collagen In Di Kulit Kering,https://i.ytimg.com/vi/QB7Dg8Tyqis/default.jpg,https://i.ytimg.com/vi/QB7Dg8Tyqis/mqdefault.jpg,https://i.ytimg.com/vi/QB7Dg8Tyqis/hqdefault.jpg
4Kqm51kiATE,Review Senka Perfect Whip Collagen In  Facial Foam Untuk Kulit Kering,https://i.ytimg.com/vi/4Kqm51kiATE/default.jpg,https://i.ytimg.com/vi/4Kqm51kiATE/mqdefault.jpg,https://i.ytimg.com/vi/4Kqm51kiATE/hqdefault.jpg
iXvG7tmvyz0,3 REKOMENDASI SERUM TER-VIRAL TAHUN 2020 || SEMUANYA DARI BRAND LOKAL,https://i.ytimg.com/vi/iXvG7tmvyz0/default.jpg,https://i.ytimg.com/vi/iXvG7tmvyz0/mqdefault.jpg,https://i.ytimg.com/vi/iXvG7tmvyz0/hqdefault.jpg
7MOoYMae3eE,Review Satin Seduction Lipstick Sada By Cathy Sharon || Lipstik + Anti Aging,https://i.ytimg.com/vi/7MOoYMae3eE/default.jpg,https://i.ytimg.com/vi/7MOoYMae3eE/mqdefault.jpg,https://i.ytimg.com/vi/7MOoYMae3eE/hqdefault.jpg
pyhFSlVS6Mc,Tutorial Makeup Mata Untuk Tahun Baru 2021 || New Year Eve Eye Makeup Idea,https://i.ytimg.com/vi/pyhFSlVS6Mc/default.jpg,https://i.ytimg.com/vi/pyhFSlVS6Mc/mqdefault.jpg,https://i.ytimg.com/vi/pyhFSlVS6Mc/hqdefault.jpg
pGkk2HRC57Q,REVIEW & SWATCHES NOTE COSMETICS MATTEMOIST LIPGLOSS || LIPGLOSS TAPI HASILNYA MATTE?,https://i.ytimg.com/vi/pGkk2HRC57Q/default.jpg,https://i.ytimg.com/vi/pGkk2HRC57Q/mqdefault.jpg,https://i.ytimg.com/vi/pGkk2HRC57Q/hqdefault.jpg
IjsqM7n3GDc,"REVIEW THE LIVING POTION NOIR - PARFUM LOKAL DUPE YSL, MURAH BANGET!!",https://i.ytimg.com/vi/IjsqM7n3GDc/default.jpg,https://i.ytimg.com/vi/IjsqM7n3GDc/mqdefault.jpg,https://i.ytimg.com/vi/IjsqM7n3GDc/hqdefault.jpg
07bDGcJPhBw,REKOMENDASI KRIM PEMUTIH KETIAK & SELANGKANGAN!,https://i.ytimg.com/vi/07bDGcJPhBw/default.jpg,https://i.ytimg.com/vi/07bDGcJPhBw/mqdefault.jpg,https://i.ytimg.com/vi/07bDGcJPhBw/hqdefault.jpg
wExUnLaJgHI,Tutorial Makeup Mata Menyambut Tahun Baru 2021 Di Masa Pandemi,https://i.ytimg.com/vi/wExUnLaJgHI/default.jpg,https://i.ytimg.com/vi/wExUnLaJgHI/mqdefault.jpg,https://i.ytimg.com/vi/wExUnLaJgHI/hqdefault.jpg
TG0Sg_-x90o,MAKE OVER BLOOM INFINITE EYESHADOW REVIEW (MEADOW & PRAIRE),https://i.ytimg.com/vi/TG0Sg_-x90o/default.jpg,https://i.ytimg.com/vi/TG0Sg_-x90o/mqdefault.jpg,https://i.ytimg.com/vi/TG0Sg_-x90o/hqdefault.jpg
UPjKEetMsp8,Sada By Cathy Sharon Velvet Passion Matte Lipstick || Review & Swatches,https://i.ytimg.com/vi/UPjKEetMsp8/default.jpg,https://i.ytimg.com/vi/UPjKEetMsp8/mqdefault.jpg,https://i.ytimg.com/vi/UPjKEetMsp8/hqdefault.jpg
XqPHoO1mFFI,BATTLE EYELASH CURLER : MASAMI SHOUKO VS KAY COLLECTION,https://i.ytimg.com/vi/XqPHoO1mFFI/default.jpg,https://i.ytimg.com/vi/XqPHoO1mFFI/mqdefault.jpg,https://i.ytimg.com/vi/XqPHoO1mFFI/hqdefault.jpg
IXctEiKNx1k,note cosmetics mattemoist lipstick review & swatches,https://i.ytimg.com/vi/IXctEiKNx1k/default.jpg,https://i.ytimg.com/vi/IXctEiKNx1k/mqdefault.jpg,https://i.ytimg.com/vi/IXctEiKNx1k/hqdefault.jpg
l9lfFdnIQtI,BREYLEE BLACKHEAD MASK REVIEW || MASKER KOMEDO PALING VIRAL!,https://i.ytimg.com/vi/l9lfFdnIQtI/default.jpg,https://i.ytimg.com/vi/l9lfFdnIQtI/mqdefault.jpg,https://i.ytimg.com/vi/l9lfFdnIQtI/hqdefault.jpg
wz-rKJpgR_M,"REVIEW REUSABLE COTTON PADS || KAPAS RAMAH LINGKUNGAN, BISA DIPAKE BERKALI-KALI",https://i.ytimg.com/vi/wz-rKJpgR_M/default.jpg,https://i.ytimg.com/vi/wz-rKJpgR_M/mqdefault.jpg,https://i.ytimg.com/vi/wz-rKJpgR_M/hqdefault.jpg
9znNyPoQbOs,REVIEW ST. IVES FRESH SKIN APRICOT SCRUB WAJAH LANGSUNG BERSIH & MULUS!,https://i.ytimg.com/vi/9znNyPoQbOs/default.jpg,https://i.ytimg.com/vi/9znNyPoQbOs/mqdefault.jpg,https://i.ytimg.com/vi/9znNyPoQbOs/hqdefault.jpg
mEx1ieq6qGI,Review & Swatches Make Over X Tities Sapoetra Bloom Infinite Lip Cream,https://i.ytimg.com/vi/mEx1ieq6qGI/default.jpg,https://i.ytimg.com/vi/mEx1ieq6qGI/mqdefault.jpg,https://i.ytimg.com/vi/mEx1ieq6qGI/hqdefault.jpg
_LHYO1C1oU8,REVIEW BREYLEE BLACKHEAD MASK,https://i.ytimg.com/vi/_LHYO1C1oU8/default.jpg,https://i.ytimg.com/vi/_LHYO1C1oU8/mqdefault.jpg,https://i.ytimg.com/vi/_LHYO1C1oU8/hqdefault.jpg
Lay4xcBa2Dw,Make over bloom infinite,https://i.ytimg.com/vi/Lay4xcBa2Dw/default.jpg,https://i.ytimg.com/vi/Lay4xcBa2Dw/mqdefault.jpg,https://i.ytimg.com/vi/Lay4xcBa2Dw/hqdefault.jpg
vJ2Gg7Slijk,"JANGAN SAMPAI SALAH, 2 TEKNIK MAKEUP INI BISA BUAT PIPI MENJADI TIRUS DAN CHUBBY",https://i.ytimg.com/vi/vJ2Gg7Slijk/default.jpg,https://i.ytimg.com/vi/vJ2Gg7Slijk/mqdefault.jpg,https://i.ytimg.com/vi/vJ2Gg7Slijk/hqdefault.jpg
T_Z5rpWKUP8,REVIEW EVOLUDERM EAU MICELLAR CLEANSING WIPES || TISU BASAH BISA HAPUS MAKEUP?!,https://i.ytimg.com/vi/T_Z5rpWKUP8/default.jpg,https://i.ytimg.com/vi/T_Z5rpWKUP8/mqdefault.jpg,https://i.ytimg.com/vi/T_Z5rpWKUP8/hqdefault.jpg
M9t1gtJQ1ao,REVIEW & SWATCHES MASAMI SHOUKO POWDER PUFF VELVET TINT!,https://i.ytimg.com/vi/M9t1gtJQ1ao/default.jpg,https://i.ytimg.com/vi/M9t1gtJQ1ao/mqdefault.jpg,https://i.ytimg.com/vi/M9t1gtJQ1ao/hqdefault.jpg
Tn_79pAIlFo,REVIEW BIOKOS VITAL NUTRITION PEEL OFF MASK || MELEMBAPKAN & MENGENCANGKAN WAJAH!,https://i.ytimg.com/vi/Tn_79pAIlFo/default.jpg,https://i.ytimg.com/vi/Tn_79pAIlFo/mqdefault.jpg,https://i.ytimg.com/vi/Tn_79pAIlFo/hqdefault.jpg
