ID,TITLE,THUMBNAIL1,THUMBNAIL2,THUMBNAIL3
AJAhQhy31mo,Natural Scrub For Dead Skin Cells Tamil | சருமத்தை அழகுபடுத்தும் Natural Scrub,https://i.ytimg.com/vi/AJAhQhy31mo/default.jpg,https://i.ytimg.com/vi/AJAhQhy31mo/mqdefault.jpg,https://i.ytimg.com/vi/AJAhQhy31mo/hqdefault.jpg
FfSSJMa7sKI,Hair Tonic For Health Hair Tamil | ஆரோக்கியமான கூந்தலை பெற என்ன செய்வது?,https://i.ytimg.com/vi/FfSSJMa7sKI/default.jpg,https://i.ytimg.com/vi/FfSSJMa7sKI/mqdefault.jpg,https://i.ytimg.com/vi/FfSSJMa7sKI/hqdefault.jpg
uRZ_hJlqg3E,Mango Face Pack For Young Tamil | நீக்க எப்பவும் இளமையா இருக்கணுமா?,https://i.ytimg.com/vi/uRZ_hJlqg3E/default.jpg,https://i.ytimg.com/vi/uRZ_hJlqg3E/mqdefault.jpg,https://i.ytimg.com/vi/uRZ_hJlqg3E/hqdefault.jpg
VDnpaSQUvTM,Rose Petals Pack For Skin Whitening | உங்களின் முகம் பளிச்சிட வேண்டுமா?,https://i.ytimg.com/vi/VDnpaSQUvTM/default.jpg,https://i.ytimg.com/vi/VDnpaSQUvTM/mqdefault.jpg,https://i.ytimg.com/vi/VDnpaSQUvTM/hqdefault.jpg
yuP75oK4NXk,Summer Face Pack For Young Skin | உங்க முகம் எப்பவும் இளமையா தெரியனுமா?,https://i.ytimg.com/vi/yuP75oK4NXk/default.jpg,https://i.ytimg.com/vi/yuP75oK4NXk/mqdefault.jpg,https://i.ytimg.com/vi/yuP75oK4NXk/hqdefault.jpg
3igP3S5vrgI,Carrot Oil & Toner For Soft Skin | சரும வெடிப்பை போக்கி மென்மையாக வைத்திருக்கும் கேரட்,https://i.ytimg.com/vi/3igP3S5vrgI/default.jpg,https://i.ytimg.com/vi/3igP3S5vrgI/mqdefault.jpg,https://i.ytimg.com/vi/3igP3S5vrgI/hqdefault.jpg
uaQZyEWdLqU,Hibiscus Face Pack For Skin Whitening | சிவப்பான முகத்தோற்றம் பெற வேண்டுமா?,https://i.ytimg.com/vi/uaQZyEWdLqU/default.jpg,https://i.ytimg.com/vi/uaQZyEWdLqU/mqdefault.jpg,https://i.ytimg.com/vi/uaQZyEWdLqU/hqdefault.jpg
gqp38xcXieM,Homemade Hair Serum Tamil | ஆரோக்கியமான கூந்தலை பெற சூப்பர் ஹேர் சீரம்,https://i.ytimg.com/vi/gqp38xcXieM/default.jpg,https://i.ytimg.com/vi/gqp38xcXieM/mqdefault.jpg,https://i.ytimg.com/vi/gqp38xcXieM/hqdefault.jpg
JmLK3y_bTCc,2 Easy Remedy For Acne And Pimples Tamil | உங்க முகப்பரு உடனே மறைய வேண்டுமா?,https://i.ytimg.com/vi/JmLK3y_bTCc/default.jpg,https://i.ytimg.com/vi/JmLK3y_bTCc/mqdefault.jpg,https://i.ytimg.com/vi/JmLK3y_bTCc/hqdefault.jpg
RIQCQbKx1Y4,"Night Cream For Dry & Oily Skin Tamil | சருமத்திலுள்ள வறட்சி, எண்ணெய் பசை போக வேண்டுமா?",https://i.ytimg.com/vi/RIQCQbKx1Y4/default.jpg,https://i.ytimg.com/vi/RIQCQbKx1Y4/mqdefault.jpg,https://i.ytimg.com/vi/RIQCQbKx1Y4/hqdefault.jpg
KxbTe8D08uU,Instant Foot Scrub For Tan Remove Tamil | பாதத்திலுள்ள சன் டேன் நீக்க வேண்டுமா?,https://i.ytimg.com/vi/KxbTe8D08uU/default.jpg,https://i.ytimg.com/vi/KxbTe8D08uU/mqdefault.jpg,https://i.ytimg.com/vi/KxbTe8D08uU/hqdefault.jpg
rMscm8rpJ5c,Homemade Night Serum | பளிச்சிடும் முகத்தோற்றத்தை தரும் நைட் ஃபேஸ் சீரம்,https://i.ytimg.com/vi/rMscm8rpJ5c/default.jpg,https://i.ytimg.com/vi/rMscm8rpJ5c/mqdefault.jpg,https://i.ytimg.com/vi/rMscm8rpJ5c/hqdefault.jpg
aV8cur2DshU,Almond Scrub For Healthy And Glowing Skin | உங்க முகம் தக தகன்னு ஜொலிக்க,https://i.ytimg.com/vi/aV8cur2DshU/default.jpg,https://i.ytimg.com/vi/aV8cur2DshU/mqdefault.jpg,https://i.ytimg.com/vi/aV8cur2DshU/hqdefault.jpg
ymIlkF7eQQI,Face Pack For Dry And Oily Skin | சருமத்தை பாதுகாக்கும் ஆரஞ்சு பீல் ஃபேஸ் பேக்,https://i.ytimg.com/vi/ymIlkF7eQQI/default.jpg,https://i.ytimg.com/vi/ymIlkF7eQQI/mqdefault.jpg,https://i.ytimg.com/vi/ymIlkF7eQQI/hqdefault.jpg
9A31yWSrIbE,Instant Face Pack For Dark Circle | கருவளையம் சீக்கிரம் மறைய வேண்டுமா?,https://i.ytimg.com/vi/9A31yWSrIbE/default.jpg,https://i.ytimg.com/vi/9A31yWSrIbE/mqdefault.jpg,https://i.ytimg.com/vi/9A31yWSrIbE/hqdefault.jpg
060zNg8vyT0,Herbal Oil For Hair Growth Tamil | அடர்த்தியான கூந்தலை பெற அற்புதமான எண்ணெய்,https://i.ytimg.com/vi/060zNg8vyT0/default.jpg,https://i.ytimg.com/vi/060zNg8vyT0/mqdefault.jpg,https://i.ytimg.com/vi/060zNg8vyT0/hqdefault.jpg
VRPC4pSzteQ,Easy Lip Care Methods At Home | கண்ணை கவரும் உதட்டை பெற வேண்டுமா?,https://i.ytimg.com/vi/VRPC4pSzteQ/default.jpg,https://i.ytimg.com/vi/VRPC4pSzteQ/mqdefault.jpg,https://i.ytimg.com/vi/VRPC4pSzteQ/hqdefault.jpg
vqfHEqWp_8E,Rice Flour Face Mask For Skin | சீக்கிரம் முகம் பளபளன்னு வெள்ளையாக வேண்டுமா?,https://i.ytimg.com/vi/vqfHEqWp_8E/default.jpg,https://i.ytimg.com/vi/vqfHEqWp_8E/mqdefault.jpg,https://i.ytimg.com/vi/vqfHEqWp_8E/hqdefault.jpg
c-TLgDJL3DY,Simple Secret Tips For Skin Care | சருமம் பளபளக்க எளிமையான குறிப்புகள்,https://i.ytimg.com/vi/c-TLgDJL3DY/default.jpg,https://i.ytimg.com/vi/c-TLgDJL3DY/mqdefault.jpg,https://i.ytimg.com/vi/c-TLgDJL3DY/hqdefault.jpg
4c4Iru6MwKM,Coffee Face Mask For Youthful Skin | சருமத்தை அழகு குறையாமல் பாதுகாக்க வேண்டுமா?,https://i.ytimg.com/vi/4c4Iru6MwKM/default.jpg,https://i.ytimg.com/vi/4c4Iru6MwKM/mqdefault.jpg,https://i.ytimg.com/vi/4c4Iru6MwKM/hqdefault.jpg
aS728Dp2pxU,Egg white Mask For Blackheads | முகத்தில் இருக்கும் கரும்புள்ளியை போக்குவது எப்படி?,https://i.ytimg.com/vi/aS728Dp2pxU/default.jpg,https://i.ytimg.com/vi/aS728Dp2pxU/mqdefault.jpg,https://i.ytimg.com/vi/aS728Dp2pxU/hqdefault.jpg
RHjPtos-EK4,3 Trending Short Hairstyle For Girls | பெண்களுக்கு பிடித்த புதுமையான ஹேர்ஸ்டைல் குறிப்புகள்,https://i.ytimg.com/vi/RHjPtos-EK4/default.jpg,https://i.ytimg.com/vi/RHjPtos-EK4/mqdefault.jpg,https://i.ytimg.com/vi/RHjPtos-EK4/hqdefault.jpg
y2bKM2tBGzA,Besan Face Mask For Pimples | முகப்பருவை உடனே போக்க சூப்பர் ஃபேஸ் டிப்ஸ்,https://i.ytimg.com/vi/y2bKM2tBGzA/default.jpg,https://i.ytimg.com/vi/y2bKM2tBGzA/mqdefault.jpg,https://i.ytimg.com/vi/y2bKM2tBGzA/hqdefault.jpg
ORLzxHg1OPI,Instant Multani Mitti Face Pack For Pimples | அழகான முகத்தை முகப்பரு பாதிக்கிறதா?,https://i.ytimg.com/vi/ORLzxHg1OPI/default.jpg,https://i.ytimg.com/vi/ORLzxHg1OPI/mqdefault.jpg,https://i.ytimg.com/vi/ORLzxHg1OPI/hqdefault.jpg
Cd2QbJAgct4,Onam Festival Makeup Look | Indian Festival | ஓணம் பண்டிகை 2021 | Samayam Tamil,https://i.ytimg.com/vi/Cd2QbJAgct4/default.jpg,https://i.ytimg.com/vi/Cd2QbJAgct4/mqdefault.jpg,https://i.ytimg.com/vi/Cd2QbJAgct4/hqdefault.jpg
bitFewGzjZc,Open Pores And Dry Skin Face Pack Tamil | முகக்குழிகளை நீக்கும் சூப்பர் ஃபேஸ் பேக்,https://i.ytimg.com/vi/bitFewGzjZc/default.jpg,https://i.ytimg.com/vi/bitFewGzjZc/mqdefault.jpg,https://i.ytimg.com/vi/bitFewGzjZc/hqdefault.jpg
yrJt44DYCkE,Healthy Hair Mask Tamil | முடி சார்ந்த பிரச்சனைக்கு உடனடி தீர்வு?,https://i.ytimg.com/vi/yrJt44DYCkE/default.jpg,https://i.ytimg.com/vi/yrJt44DYCkE/mqdefault.jpg,https://i.ytimg.com/vi/yrJt44DYCkE/hqdefault.jpg
l6vHD_QrRbc,Orange Oil For Face Massage Tamil | முக தழும்புகளை நீக்குவது எப்படி?,https://i.ytimg.com/vi/l6vHD_QrRbc/default.jpg,https://i.ytimg.com/vi/l6vHD_QrRbc/mqdefault.jpg,https://i.ytimg.com/vi/l6vHD_QrRbc/hqdefault.jpg
myOjJtG232g,Oil Skin Face Pack Tamil | உங்கள் முகத்தில்  எண்ணெய் வடிகிறதா?,https://i.ytimg.com/vi/myOjJtG232g/default.jpg,https://i.ytimg.com/vi/myOjJtG232g/mqdefault.jpg,https://i.ytimg.com/vi/myOjJtG232g/hqdefault.jpg
CQD8wSuhzpM,Ice Massage For Open Pores Tamil | முகத்தில் உள்ள பள்ளம் மறைய வேண்டுமா?,https://i.ytimg.com/vi/CQD8wSuhzpM/default.jpg,https://i.ytimg.com/vi/CQD8wSuhzpM/mqdefault.jpg,https://i.ytimg.com/vi/CQD8wSuhzpM/hqdefault.jpg
oW3U3DAubkk,Cucumber Serum For Open Pores Tamil | வெள்ளரி சீரம் வீட்டிலேயே செய்ய,https://i.ytimg.com/vi/oW3U3DAubkk/default.jpg,https://i.ytimg.com/vi/oW3U3DAubkk/mqdefault.jpg,https://i.ytimg.com/vi/oW3U3DAubkk/hqdefault.jpg
ViIehP3V62o,Shame Plants Leaves For Damaged Nail | நகச்சுத்திக்கு தீர்வு தரும் தொட்டால் சிணுங்கி இலை,https://i.ytimg.com/vi/ViIehP3V62o/default.jpg,https://i.ytimg.com/vi/ViIehP3V62o/mqdefault.jpg,https://i.ytimg.com/vi/ViIehP3V62o/hqdefault.jpg
W9ZQ0xh5BcI,Homemade Face Wash Powder At Home | பல்வேறு சரும பிச்சனைக்கு ஒரே ஃபேஸ் வாஷ் போதும்,https://i.ytimg.com/vi/W9ZQ0xh5BcI/default.jpg,https://i.ytimg.com/vi/W9ZQ0xh5BcI/mqdefault.jpg,https://i.ytimg.com/vi/W9ZQ0xh5BcI/hqdefault.jpg
rMAQF6eeFgE,Coconut Milk For Young Skin Always | சருமம் இளமைப் பொலிவுடன் எப்போதும் இருக்க வேண்டுமா?,https://i.ytimg.com/vi/rMAQF6eeFgE/default.jpg,https://i.ytimg.com/vi/rMAQF6eeFgE/mqdefault.jpg,https://i.ytimg.com/vi/rMAQF6eeFgE/hqdefault.jpg
ehB1Cn-TxyU,Body Polishing Mask Tamil | தோல் மினு மினுக்க வேண்டுமா?,https://i.ytimg.com/vi/ehB1Cn-TxyU/default.jpg,https://i.ytimg.com/vi/ehB1Cn-TxyU/mqdefault.jpg,https://i.ytimg.com/vi/ehB1Cn-TxyU/hqdefault.jpg
qyE3QTp-xnY,Sun Tan Removal Body Pack Tamil | சன் டேனை நீக்கும் ஃபேஸ் பேக் எப்படி செய்வது?,https://i.ytimg.com/vi/qyE3QTp-xnY/default.jpg,https://i.ytimg.com/vi/qyE3QTp-xnY/mqdefault.jpg,https://i.ytimg.com/vi/qyE3QTp-xnY/hqdefault.jpg
3BNWK2YG38w,Licorice Night Cream For Glowing Skin Tamil | முகத்தை பளபளப்பாக்கும் நைட் கிரீம் வேண்டுமா?,https://i.ytimg.com/vi/3BNWK2YG38w/default.jpg,https://i.ytimg.com/vi/3BNWK2YG38w/mqdefault.jpg,https://i.ytimg.com/vi/3BNWK2YG38w/hqdefault.jpg
6wlntFCsdgA,4 Remedies To Remove Dark Circle | கண் கருவளையத்தை நிரந்தரமாக போக்கும் இயற்கை குறிப்புகள்,https://i.ytimg.com/vi/6wlntFCsdgA/default.jpg,https://i.ytimg.com/vi/6wlntFCsdgA/mqdefault.jpg,https://i.ytimg.com/vi/6wlntFCsdgA/hqdefault.jpg
WUIPn2JOqqA,Sandal Face Pack To Remove Scars And Spots|பருக்களின் தழும்பு மற்றும் கரும்புள்ளியை நீக்குவது எப்படி,https://i.ytimg.com/vi/WUIPn2JOqqA/default.jpg,https://i.ytimg.com/vi/WUIPn2JOqqA/mqdefault.jpg,https://i.ytimg.com/vi/WUIPn2JOqqA/hqdefault.jpg
XsprW3St1BI,Beetroot Carrot Juice For Glowing Skin Tamil | ஜொலிக்கும் முகத்தை பெற டிப்ஸ்?,https://i.ytimg.com/vi/XsprW3St1BI/default.jpg,https://i.ytimg.com/vi/XsprW3St1BI/mqdefault.jpg,https://i.ytimg.com/vi/XsprW3St1BI/hqdefault.jpg
wVZIHg4cZPU,"Homemade Hair Serum For Hair Falls And Gray Hair | முடி கொட்டுதல், நரைமுடிக்கு Homemade ஹேர் சீரம்",https://i.ytimg.com/vi/wVZIHg4cZPU/default.jpg,https://i.ytimg.com/vi/wVZIHg4cZPU/mqdefault.jpg,https://i.ytimg.com/vi/wVZIHg4cZPU/hqdefault.jpg
h6ln-ZGgZiA,Remedy For Dry Hair Tamil | வறட்சியான கூந்தலுக்கு தீர்வு?,https://i.ytimg.com/vi/h6ln-ZGgZiA/default.jpg,https://i.ytimg.com/vi/h6ln-ZGgZiA/mqdefault.jpg,https://i.ytimg.com/vi/h6ln-ZGgZiA/hqdefault.jpg
tXYxvkirQBs,Home Remedy For Sun Tan Tamil | சருமத்தை பாதிக்கும் சன் டேன் போக்குவது எப்படி?,https://i.ytimg.com/vi/tXYxvkirQBs/default.jpg,https://i.ytimg.com/vi/tXYxvkirQBs/mqdefault.jpg,https://i.ytimg.com/vi/tXYxvkirQBs/hqdefault.jpg
f8sE1KCNgAo,Instant Facepack For Sun Tan | வெயில் தாக்கத்தால் கருமையான சருமத்தை நீக்க வேண்டுமா?,https://i.ytimg.com/vi/f8sE1KCNgAo/default.jpg,https://i.ytimg.com/vi/f8sE1KCNgAo/mqdefault.jpg,https://i.ytimg.com/vi/f8sE1KCNgAo/hqdefault.jpg
lIh8CzvDHP0,Aloe Vera Honey Pack Tamil | கற்றாழை ஜெல் ஃபேஸ் பேக்!,https://i.ytimg.com/vi/lIh8CzvDHP0/default.jpg,https://i.ytimg.com/vi/lIh8CzvDHP0/mqdefault.jpg,https://i.ytimg.com/vi/lIh8CzvDHP0/hqdefault.jpg
dHvvktG3dpk,Summer Face Pack Watermelon Tamil | சூப்பர் சம்மர் பேஸ் பேக்,https://i.ytimg.com/vi/dHvvktG3dpk/default.jpg,https://i.ytimg.com/vi/dHvvktG3dpk/mqdefault.jpg,https://i.ytimg.com/vi/dHvvktG3dpk/hqdefault.jpg
zdKwqtF28QM,Dry Skin Face Pack Tamil | சரும வறட்சியை போக்க உடனடி தீர்வு?,https://i.ytimg.com/vi/zdKwqtF28QM/default.jpg,https://i.ytimg.com/vi/zdKwqtF28QM/mqdefault.jpg,https://i.ytimg.com/vi/zdKwqtF28QM/hqdefault.jpg
H1uk2_XTPSI,"Orange Toner & Cream Tamil | ஆரஞ்சு டோனர், கிரீம் பயன்கள்",https://i.ytimg.com/vi/H1uk2_XTPSI/default.jpg,https://i.ytimg.com/vi/H1uk2_XTPSI/mqdefault.jpg,https://i.ytimg.com/vi/H1uk2_XTPSI/hqdefault.jpg
6tEJD-fDP98,Homemade Hair Pack For Shining And Soft HHair | தலைமுடி சார்ந்த பிரச்சனைக்கு தீர்வு தரும் ஹேர் பேக்,https://i.ytimg.com/vi/6tEJD-fDP98/default.jpg,https://i.ytimg.com/vi/6tEJD-fDP98/mqdefault.jpg,https://i.ytimg.com/vi/6tEJD-fDP98/hqdefault.jpg
McmrlP-2RhM,Guava Leaves For Pimples Remedy Tamil | முகப்பருவை முழுமையாக நீக்கும் கொய்யா இலை,https://i.ytimg.com/vi/McmrlP-2RhM/default.jpg,https://i.ytimg.com/vi/McmrlP-2RhM/mqdefault.jpg,https://i.ytimg.com/vi/McmrlP-2RhM/hqdefault.jpg
Y8pmnR-ka_w,Natural Face Pack For Acne Tamil | இயற்கையான முறையில் முகப்பரு மறைய வேண்டுமா?,https://i.ytimg.com/vi/Y8pmnR-ka_w/default.jpg,https://i.ytimg.com/vi/Y8pmnR-ka_w/mqdefault.jpg,https://i.ytimg.com/vi/Y8pmnR-ka_w/hqdefault.jpg
IPmCXXXR1rs,Green Gram Face Pack For Clear Skin Tamil | பச்சைபயிறு அழகு குறிப்புகள்?,https://i.ytimg.com/vi/IPmCXXXR1rs/default.jpg,https://i.ytimg.com/vi/IPmCXXXR1rs/mqdefault.jpg,https://i.ytimg.com/vi/IPmCXXXR1rs/hqdefault.jpg
6y4XnPzDg04,Remove Dark Spot Tamil | கரும்புள்ளி மறைய வேண்டுமா?,https://i.ytimg.com/vi/6y4XnPzDg04/default.jpg,https://i.ytimg.com/vi/6y4XnPzDg04/mqdefault.jpg,https://i.ytimg.com/vi/6y4XnPzDg04/hqdefault.jpg
TrAP_MUlooc,Green Grape 2 In 1 Face Mask Tamil | பச்சை திராட்சையின் பயன்கள்?,https://i.ytimg.com/vi/TrAP_MUlooc/default.jpg,https://i.ytimg.com/vi/TrAP_MUlooc/mqdefault.jpg,https://i.ytimg.com/vi/TrAP_MUlooc/hqdefault.jpg
6QhjOSoCf3c,Tomato Face Pack For Skin Tamil | முகம் பளிச்சுனு தெரிய தக்காளி ஃபேசியல்?,https://i.ytimg.com/vi/6QhjOSoCf3c/default.jpg,https://i.ytimg.com/vi/6QhjOSoCf3c/mqdefault.jpg,https://i.ytimg.com/vi/6QhjOSoCf3c/hqdefault.jpg
Jn1LXO6mVVY,Remove Dark Spots Permanently Tamil | முக அழகை பாதிக்கும் கரும்புள்ளியை நீக்க?,https://i.ytimg.com/vi/Jn1LXO6mVVY/default.jpg,https://i.ytimg.com/vi/Jn1LXO6mVVY/mqdefault.jpg,https://i.ytimg.com/vi/Jn1LXO6mVVY/hqdefault.jpg
dCtwSU4NuZA,Aathimathuram Face Pack Tamil | அதிமதுரம் அழகு குறிப்பு பயன்கள்?,https://i.ytimg.com/vi/dCtwSU4NuZA/default.jpg,https://i.ytimg.com/vi/dCtwSU4NuZA/mqdefault.jpg,https://i.ytimg.com/vi/dCtwSU4NuZA/hqdefault.jpg
5fs9k0UkHNc,"Nature Remedy For Pimples And Dark Spots | விரைவில் பருக்கள், கரும்புள்ளி மறைய வேண்டுமா?",https://i.ytimg.com/vi/5fs9k0UkHNc/default.jpg,https://i.ytimg.com/vi/5fs9k0UkHNc/mqdefault.jpg,https://i.ytimg.com/vi/5fs9k0UkHNc/hqdefault.jpg
1D0Txlik3d4,3 Easy home remedy for under eye dark circles | Samayam Tamil,https://i.ytimg.com/vi/1D0Txlik3d4/default.jpg,https://i.ytimg.com/vi/1D0Txlik3d4/mqdefault.jpg,https://i.ytimg.com/vi/1D0Txlik3d4/hqdefault.jpg
KX29Gu_qdMY,Poppy Seed Face Pack Tamil | பாப்பி விதை ஃபேஸ் பேக் குறிப்புகள்,https://i.ytimg.com/vi/KX29Gu_qdMY/default.jpg,https://i.ytimg.com/vi/KX29Gu_qdMY/mqdefault.jpg,https://i.ytimg.com/vi/KX29Gu_qdMY/hqdefault.jpg
Bia_Yay1KjM,Instant Face Hair Removing Mask Tamil | முகத்தில் இருக்கும் தேவையற்ற முடியை அகற்ற?,https://i.ytimg.com/vi/Bia_Yay1KjM/default.jpg,https://i.ytimg.com/vi/Bia_Yay1KjM/mqdefault.jpg,https://i.ytimg.com/vi/Bia_Yay1KjM/hqdefault.jpg
1Buh4_B6G8Y,"Homemade Health Drink For Skin, Body And Hair | சருமம், கூந்தலை ஆரோக்கியமாக வைத்திருக்க உதவும் ஜூஸ்",https://i.ytimg.com/vi/1Buh4_B6G8Y/default.jpg,https://i.ytimg.com/vi/1Buh4_B6G8Y/mqdefault.jpg,https://i.ytimg.com/vi/1Buh4_B6G8Y/hqdefault.jpg
E_9vmFjFetY,Eyelashes And Eyebrows Beauty Tips Tamil | புருவம் அழகாக வளர வேண்டுமா?,https://i.ytimg.com/vi/E_9vmFjFetY/default.jpg,https://i.ytimg.com/vi/E_9vmFjFetY/mqdefault.jpg,https://i.ytimg.com/vi/E_9vmFjFetY/hqdefault.jpg
3a5_xtD1TWk,Night Face Pack For Smooth Skin Tamil | இரவில் பயன்படுத்தும் ஃபேஸ் பேக் குறிப்புகள்?,https://i.ytimg.com/vi/3a5_xtD1TWk/default.jpg,https://i.ytimg.com/vi/3a5_xtD1TWk/mqdefault.jpg,https://i.ytimg.com/vi/3a5_xtD1TWk/hqdefault.jpg
FkxKM7DS1a0,Face Pack For Pimples Tamil | முகப்பருவை போக்குவது எப்படி?,https://i.ytimg.com/vi/FkxKM7DS1a0/default.jpg,https://i.ytimg.com/vi/FkxKM7DS1a0/mqdefault.jpg,https://i.ytimg.com/vi/FkxKM7DS1a0/hqdefault.jpg
rTf0s-6cR3A,Hair Gel For Dry And Damage Hair Tamil | தலைமுடியில் ஏற்படும் பிரச்சனைக்கு தீர்வு?,https://i.ytimg.com/vi/rTf0s-6cR3A/default.jpg,https://i.ytimg.com/vi/rTf0s-6cR3A/mqdefault.jpg,https://i.ytimg.com/vi/rTf0s-6cR3A/hqdefault.jpg
IHDstgOgm-M,Speedly Makeup With 4 Products | மேக்கப் போட இந்த 4 பொருள் போதும்,https://i.ytimg.com/vi/IHDstgOgm-M/default.jpg,https://i.ytimg.com/vi/IHDstgOgm-M/mqdefault.jpg,https://i.ytimg.com/vi/IHDstgOgm-M/hqdefault.jpg
nSrjIBas72I,Rice Moisturizing Cream Tamil | முகம் ஈரப்பதத்துடன் இருக்க,https://i.ytimg.com/vi/nSrjIBas72I/default.jpg,https://i.ytimg.com/vi/nSrjIBas72I/mqdefault.jpg,https://i.ytimg.com/vi/nSrjIBas72I/hqdefault.jpg
gZ8G9m41j34,Multani Mitti Face Pack For Acne Tamil | முல்தானி மெட்டி ஃபேஸ் பேக்,https://i.ytimg.com/vi/gZ8G9m41j34/default.jpg,https://i.ytimg.com/vi/gZ8G9m41j34/mqdefault.jpg,https://i.ytimg.com/vi/gZ8G9m41j34/hqdefault.jpg
FBv4O8362fY,Banana Face Pack At Home Tamil | வாழைப்பழ ஃபேஸ் பேக்,https://i.ytimg.com/vi/FBv4O8362fY/default.jpg,https://i.ytimg.com/vi/FBv4O8362fY/mqdefault.jpg,https://i.ytimg.com/vi/FBv4O8362fY/hqdefault.jpg
iL_ntbamDXo,Jasmine Rose Oil For Protect Skin Tamil | சுற்றுப்புறத்தில் இருந்து சருமத்தை பாதுகாப்பது எப்படி?,https://i.ytimg.com/vi/iL_ntbamDXo/default.jpg,https://i.ytimg.com/vi/iL_ntbamDXo/mqdefault.jpg,https://i.ytimg.com/vi/iL_ntbamDXo/hqdefault.jpg
KJHgoUePpe4,Besan Face Pack For Beauty Skin In Tamil | கடலை மாவு ஃபேஸ் பேக் | Samayam Tamil,https://i.ytimg.com/vi/KJHgoUePpe4/default.jpg,https://i.ytimg.com/vi/KJHgoUePpe4/mqdefault.jpg,https://i.ytimg.com/vi/KJHgoUePpe4/hqdefault.jpg
79n_9oWeM1s,Carrot Oil Serum For Dry Skin Tamil | சரும வறட்சியை போக்க,https://i.ytimg.com/vi/79n_9oWeM1s/default.jpg,https://i.ytimg.com/vi/79n_9oWeM1s/mqdefault.jpg,https://i.ytimg.com/vi/79n_9oWeM1s/hqdefault.jpg
kTtURVqxodQ,Egg White Face Mask For Skin Tightening | முக சுருக்கங்களை போக்கும் ஃபேஸ் மாஸ்க்,https://i.ytimg.com/vi/kTtURVqxodQ/default.jpg,https://i.ytimg.com/vi/kTtURVqxodQ/mqdefault.jpg,https://i.ytimg.com/vi/kTtURVqxodQ/hqdefault.jpg
wK7qg7VER3M,Sun Tan Face Pack Tamil | சன் டேன் சருமத்திற்கு தீர்வு?,https://i.ytimg.com/vi/wK7qg7VER3M/default.jpg,https://i.ytimg.com/vi/wK7qg7VER3M/mqdefault.jpg,https://i.ytimg.com/vi/wK7qg7VER3M/hqdefault.jpg
EQsX8poO-ak,Under Eye And Wrinkles Problem Tamil | அழகை பாதிக்கும் கண் கருவளையம்,https://i.ytimg.com/vi/EQsX8poO-ak/default.jpg,https://i.ytimg.com/vi/EQsX8poO-ak/mqdefault.jpg,https://i.ytimg.com/vi/EQsX8poO-ak/hqdefault.jpg
AroqkX7EmsE,"முகப்பரு, தழும்புகளை நீக்க வேண்டுமா? | Tulsi Homemade Face Pack For Pimples",https://i.ytimg.com/vi/AroqkX7EmsE/default.jpg,https://i.ytimg.com/vi/AroqkX7EmsE/mqdefault.jpg,https://i.ytimg.com/vi/AroqkX7EmsE/hqdefault.jpg
eso5eyYKPjk,2 Types Of Flax Drinks For Healthy Skin Tamil | சரும பிரச்சனையால் அவதியா?,https://i.ytimg.com/vi/eso5eyYKPjk/default.jpg,https://i.ytimg.com/vi/eso5eyYKPjk/mqdefault.jpg,https://i.ytimg.com/vi/eso5eyYKPjk/hqdefault.jpg
zw2L_6CrFdc,How To Get Soft Hands Tamil | மென்மையான கைகளை பெற வேண்டுமா?,https://i.ytimg.com/vi/zw2L_6CrFdc/default.jpg,https://i.ytimg.com/vi/zw2L_6CrFdc/mqdefault.jpg,https://i.ytimg.com/vi/zw2L_6CrFdc/hqdefault.jpg
fF5y33YVqDc,Exfoliator For Wrinkle Free Skin Tamil | சருமத்தில் இருக்கும் சுருக்கம் மறைய,https://i.ytimg.com/vi/fF5y33YVqDc/default.jpg,https://i.ytimg.com/vi/fF5y33YVqDc/mqdefault.jpg,https://i.ytimg.com/vi/fF5y33YVqDc/hqdefault.jpg
YtUAPdqnl5k,Papaya Face Cream For Charming Face Tamil | உங்க முகம் விரைவில் அழகாக வேண்டுமா?,https://i.ytimg.com/vi/YtUAPdqnl5k/default.jpg,https://i.ytimg.com/vi/YtUAPdqnl5k/mqdefault.jpg,https://i.ytimg.com/vi/YtUAPdqnl5k/hqdefault.jpg
0KmWvG3v95E,Amla Juice Face Massage Tamil | நெல்லிக்காய் ஜீஸ் அழகு குறிப்புகள்?,https://i.ytimg.com/vi/0KmWvG3v95E/default.jpg,https://i.ytimg.com/vi/0KmWvG3v95E/mqdefault.jpg,https://i.ytimg.com/vi/0KmWvG3v95E/hqdefault.jpg
qj6auYOQkn4,Fengreek Face Cream For Spotless Skin | வெந்தய ஃபேஸ் கிரீம் செய்வது எப்படி?,https://i.ytimg.com/vi/qj6auYOQkn4/default.jpg,https://i.ytimg.com/vi/qj6auYOQkn4/mqdefault.jpg,https://i.ytimg.com/vi/qj6auYOQkn4/hqdefault.jpg
AUN4-2mmJwo,"Toned Neck And Jawline Tamil | கழுத்து, தாடை பகுதி அழகாக வேண்டுமா?",https://i.ytimg.com/vi/AUN4-2mmJwo/default.jpg,https://i.ytimg.com/vi/AUN4-2mmJwo/mqdefault.jpg,https://i.ytimg.com/vi/AUN4-2mmJwo/hqdefault.jpg
s0sYzdlST7M,Black Gram & Amla Hair Pack Tamil | கருப்பு உளுந்து மற்றும் நெல்லிக்காய் ஹேர் பேக்,https://i.ytimg.com/vi/s0sYzdlST7M/default.jpg,https://i.ytimg.com/vi/s0sYzdlST7M/mqdefault.jpg,https://i.ytimg.com/vi/s0sYzdlST7M/hqdefault.jpg
tQArqtMXZCY,Onion Juice Remedy For Hair And Eyebrows Tamil | தலைமுடி வளர்ச்சிக்கு சிறந்த தீர்வு,https://i.ytimg.com/vi/tQArqtMXZCY/default.jpg,https://i.ytimg.com/vi/tQArqtMXZCY/mqdefault.jpg,https://i.ytimg.com/vi/tQArqtMXZCY/hqdefault.jpg
Y3Ir2MR1tvU,Oats Face Scrub For Clear Skin Tamil | ஓட்ஸ் ஃபேஸ் ஸ்க்ரப் குறிப்புகள்?,https://i.ytimg.com/vi/Y3Ir2MR1tvU/default.jpg,https://i.ytimg.com/vi/Y3Ir2MR1tvU/mqdefault.jpg,https://i.ytimg.com/vi/Y3Ir2MR1tvU/hqdefault.jpg
