ID,TITLE,THUMBNAIL1,THUMBNAIL2,THUMBNAIL3
sIeaLCNmXqk,"Christmas Photoshoot, Spend a Busy Morning With Me & Cauliflower Fried Rice",https://i.ytimg.com/vi/sIeaLCNmXqk/default.jpg,https://i.ytimg.com/vi/sIeaLCNmXqk/mqdefault.jpg,https://i.ytimg.com/vi/sIeaLCNmXqk/hqdefault.jpg
Ec5X1-6vcck,"Amazon & Etsy Unboxing's, Chicken Casserole Cook With Me, Staying Motivated & MORE",https://i.ytimg.com/vi/Ec5X1-6vcck/default.jpg,https://i.ytimg.com/vi/Ec5X1-6vcck/mqdefault.jpg,https://i.ytimg.com/vi/Ec5X1-6vcck/hqdefault.jpg
7wB_ZmZaqOc,Zane Cries About His New Dream Car (Type R) & CHRISTMAS SHOPPING!,https://i.ytimg.com/vi/7wB_ZmZaqOc/default.jpg,https://i.ytimg.com/vi/7wB_ZmZaqOc/mqdefault.jpg,https://i.ytimg.com/vi/7wB_ZmZaqOc/hqdefault.jpg
OBZHY90TfUo,"Thanksgiving Cook With Us, New Drink Recipe & Amazing Mac and Cheese",https://i.ytimg.com/vi/OBZHY90TfUo/default.jpg,https://i.ytimg.com/vi/OBZHY90TfUo/mqdefault.jpg,https://i.ytimg.com/vi/OBZHY90TfUo/hqdefault.jpg
Cbzsrlg0C5Q,"Pumpkin Pie Recipe, Family Game Night & Having A Chat With You",https://i.ytimg.com/vi/Cbzsrlg0C5Q/default.jpg,https://i.ytimg.com/vi/Cbzsrlg0C5Q/mqdefault.jpg,https://i.ytimg.com/vi/Cbzsrlg0C5Q/hqdefault.jpg
ZEqj-XdlflM,"HUGE Grocery Haul! Trader Joe's, Walmart & Lidl Shop With Us! (22 Year Old Couple)",https://i.ytimg.com/vi/ZEqj-XdlflM/default.jpg,https://i.ytimg.com/vi/ZEqj-XdlflM/mqdefault.jpg,https://i.ytimg.com/vi/ZEqj-XdlflM/hqdefault.jpg
aK-LUnS-rb0,"What I Eat In A Day, AMAZING Chicken Recipe & Cook With Me",https://i.ytimg.com/vi/aK-LUnS-rb0/default.jpg,https://i.ytimg.com/vi/aK-LUnS-rb0/mqdefault.jpg,https://i.ytimg.com/vi/aK-LUnS-rb0/hqdefault.jpg
LxdS8Z49Pms,"Recording A Christmas Song, Cheeseburger Dippers & Behind The Scenes",https://i.ytimg.com/vi/LxdS8Z49Pms/default.jpg,https://i.ytimg.com/vi/LxdS8Z49Pms/mqdefault.jpg,https://i.ytimg.com/vi/LxdS8Z49Pms/hqdefault.jpg
e7nNxGidzc0,"Prepping For Winter, How My Car Got Hit & Tuna Casserole",https://i.ytimg.com/vi/e7nNxGidzc0/default.jpg,https://i.ytimg.com/vi/e7nNxGidzc0/mqdefault.jpg,https://i.ytimg.com/vi/e7nNxGidzc0/hqdefault.jpg
ww42OS5x4rY,"Decorating For Christmas, Spiked Hot Chocolate & Matching PJS!",https://i.ytimg.com/vi/ww42OS5x4rY/default.jpg,https://i.ytimg.com/vi/ww42OS5x4rY/mqdefault.jpg,https://i.ytimg.com/vi/ww42OS5x4rY/hqdefault.jpg
o1-zwE0P1sY,"Organize With Us, Lidl Grocery Haul, Errands, Cooking & More",https://i.ytimg.com/vi/o1-zwE0P1sY/default.jpg,https://i.ytimg.com/vi/o1-zwE0P1sY/mqdefault.jpg,https://i.ytimg.com/vi/o1-zwE0P1sY/hqdefault.jpg
CRhmF4N7HL8,"Creamy Pasta Recipe, Mall Adventures & Starting Christmas Traditions",https://i.ytimg.com/vi/CRhmF4N7HL8/default.jpg,https://i.ytimg.com/vi/CRhmF4N7HL8/mqdefault.jpg,https://i.ytimg.com/vi/CRhmF4N7HL8/hqdefault.jpg
vj0QhgFtgEs,"Breakfast Fried Rice, Taking Down The Sail, Cream Spinach & MORE",https://i.ytimg.com/vi/vj0QhgFtgEs/default.jpg,https://i.ytimg.com/vi/vj0QhgFtgEs/mqdefault.jpg,https://i.ytimg.com/vi/vj0QhgFtgEs/hqdefault.jpg
L3GwRoHH81w,"Halloween Get Ready With Me, Making TikToks & Geri's Haunted House",https://i.ytimg.com/vi/L3GwRoHH81w/default.jpg,https://i.ytimg.com/vi/L3GwRoHH81w/mqdefault.jpg,https://i.ytimg.com/vi/L3GwRoHH81w/hqdefault.jpg
umb9EEz_4ww,"Giving Zane Gifts, Easy Air Fryer Chicken Thighs & Clean With Me",https://i.ytimg.com/vi/umb9EEz_4ww/default.jpg,https://i.ytimg.com/vi/umb9EEz_4ww/mqdefault.jpg,https://i.ytimg.com/vi/umb9EEz_4ww/hqdefault.jpg
mr_JRq0jLZw,Trying The TikTok Pumpkin Starbucks Drink & Weft Hair Extensions,https://i.ytimg.com/vi/mr_JRq0jLZw/default.jpg,https://i.ytimg.com/vi/mr_JRq0jLZw/mqdefault.jpg,https://i.ytimg.com/vi/mr_JRq0jLZw/hqdefault.jpg
-tMH_FkbuTY,"Walmart Shopping, Rice Ball Casserole & Hanging Our Photos",https://i.ytimg.com/vi/-tMH_FkbuTY/default.jpg,https://i.ytimg.com/vi/-tMH_FkbuTY/mqdefault.jpg,https://i.ytimg.com/vi/-tMH_FkbuTY/hqdefault.jpg
_yL-miVOm8A,"Trying New Hair Extensions, BJ's Shop With Me and My Parents, Ghosts & MORE",https://i.ytimg.com/vi/_yL-miVOm8A/default.jpg,https://i.ytimg.com/vi/_yL-miVOm8A/mqdefault.jpg,https://i.ytimg.com/vi/_yL-miVOm8A/hqdefault.jpg
Uo2V_fv1LwA,Hang Out With Me! Halloween Activities & Target Haul,https://i.ytimg.com/vi/Uo2V_fv1LwA/default.jpg,https://i.ytimg.com/vi/Uo2V_fv1LwA/mqdefault.jpg,https://i.ytimg.com/vi/Uo2V_fv1LwA/hqdefault.jpg
rw3nQsWeR7A,"Hobby Lobby Christmas Haul, Snickerdoodle Cookies & Family Fun",https://i.ytimg.com/vi/rw3nQsWeR7A/default.jpg,https://i.ytimg.com/vi/rw3nQsWeR7A/mqdefault.jpg,https://i.ytimg.com/vi/rw3nQsWeR7A/hqdefault.jpg
rSazPYXnDT4,"Homegoods Shop With Us, Easy Ramen Recipe & More",https://i.ytimg.com/vi/rSazPYXnDT4/default.jpg,https://i.ytimg.com/vi/rSazPYXnDT4/mqdefault.jpg,https://i.ytimg.com/vi/rSazPYXnDT4/hqdefault.jpg
hNwtOv-E1NM,"Our Cozy Backyard Photoshoot, Creamy Fajita Pasta & Floor Chats",https://i.ytimg.com/vi/hNwtOv-E1NM/default.jpg,https://i.ytimg.com/vi/hNwtOv-E1NM/mqdefault.jpg,https://i.ytimg.com/vi/hNwtOv-E1NM/hqdefault.jpg
ysH4nQCiJc4,How We Designed James Charles' LA Home,https://i.ytimg.com/vi/ysH4nQCiJc4/default.jpg,https://i.ytimg.com/vi/ysH4nQCiJc4/mqdefault.jpg,https://i.ytimg.com/vi/ysH4nQCiJc4/hqdefault.jpg
MTGVjyXsV3w,"When The Day Goes Wrong, Tortellini Soup & Pumpkin Cheesecake Bites",https://i.ytimg.com/vi/MTGVjyXsV3w/default.jpg,https://i.ytimg.com/vi/MTGVjyXsV3w/mqdefault.jpg,https://i.ytimg.com/vi/MTGVjyXsV3w/hqdefault.jpg
cFBmBHt7bvg,"Trader Joe's Shopping + Haul, Bailey Get's Surgery & Fancy Grilled Cheese Night",https://i.ytimg.com/vi/cFBmBHt7bvg/default.jpg,https://i.ytimg.com/vi/cFBmBHt7bvg/mqdefault.jpg,https://i.ytimg.com/vi/cFBmBHt7bvg/hqdefault.jpg
bTBrNWl8f0A,"HUGE Kitchen Clean Out! Declutter, Organize & Cook With Me",https://i.ytimg.com/vi/bTBrNWl8f0A/default.jpg,https://i.ytimg.com/vi/bTBrNWl8f0A/mqdefault.jpg,https://i.ytimg.com/vi/bTBrNWl8f0A/hqdefault.jpg
_Hmj3f5ijSM,"What I Eat In A Day, How I Count Calories & Homemade TikTok Burgers",https://i.ytimg.com/vi/_Hmj3f5ijSM/default.jpg,https://i.ytimg.com/vi/_Hmj3f5ijSM/mqdefault.jpg,https://i.ytimg.com/vi/_Hmj3f5ijSM/hqdefault.jpg
cHWAeI8ktU4,"Pumpkin Cream Cheese Roll, How I Deal With Stress/Anxiety & Lidl Haul",https://i.ytimg.com/vi/cHWAeI8ktU4/default.jpg,https://i.ytimg.com/vi/cHWAeI8ktU4/mqdefault.jpg,https://i.ytimg.com/vi/cHWAeI8ktU4/hqdefault.jpg
iqGYAlKa0OY,"Decorating For Fall, Buffalo Chicken Egg Rolls & Testing Pumpkin Drinks",https://i.ytimg.com/vi/iqGYAlKa0OY/default.jpg,https://i.ytimg.com/vi/iqGYAlKa0OY/mqdefault.jpg,https://i.ytimg.com/vi/iqGYAlKa0OY/hqdefault.jpg
dtoiLBiqaQM,"Easy Chili Dip, Mom's Birthday & Last Summer Festivities",https://i.ytimg.com/vi/dtoiLBiqaQM/default.jpg,https://i.ytimg.com/vi/dtoiLBiqaQM/mqdefault.jpg,https://i.ytimg.com/vi/dtoiLBiqaQM/hqdefault.jpg
OTgDVpe9RC0,"Flea Market Shop With Me, New Rug + Outdoor Table & Freezer Organization!",https://i.ytimg.com/vi/OTgDVpe9RC0/default.jpg,https://i.ytimg.com/vi/OTgDVpe9RC0/mqdefault.jpg,https://i.ytimg.com/vi/OTgDVpe9RC0/hqdefault.jpg
wd7hupGIR8I,"TikTok Taco Bell Quesadilla Recipe, TJ Maxx Haul & New Fav Amazon Purchases",https://i.ytimg.com/vi/wd7hupGIR8I/default.jpg,https://i.ytimg.com/vi/wd7hupGIR8I/mqdefault.jpg,https://i.ytimg.com/vi/wd7hupGIR8I/hqdefault.jpg
zL-ANF5gFpo,"Thrift Shop With Me, Testing New Drinks Adventure & Looking at Expensive Houses On Long Island",https://i.ytimg.com/vi/zL-ANF5gFpo/default.jpg,https://i.ytimg.com/vi/zL-ANF5gFpo/mqdefault.jpg,https://i.ytimg.com/vi/zL-ANF5gFpo/hqdefault.jpg
XINX9u18zcA,"Halloween Shopping With The Fam, Amazing Zucchini Noodle Recipe, Mental Health Update & MORE",https://i.ytimg.com/vi/XINX9u18zcA/default.jpg,https://i.ytimg.com/vi/XINX9u18zcA/mqdefault.jpg,https://i.ytimg.com/vi/XINX9u18zcA/hqdefault.jpg
D4uS6ys8y-A,"Exploring Out East Long Island, Surprise Date Day, Cute Lunch & How Many Kids We Want",https://i.ytimg.com/vi/D4uS6ys8y-A/default.jpg,https://i.ytimg.com/vi/D4uS6ys8y-A/mqdefault.jpg,https://i.ytimg.com/vi/D4uS6ys8y-A/hqdefault.jpg
RC-w0PlOBbk,"Tj Maxx Shop With Me & Haul, Air Fryer Chimichangas & Morning Get Ready With Me",https://i.ytimg.com/vi/RC-w0PlOBbk/default.jpg,https://i.ytimg.com/vi/RC-w0PlOBbk/mqdefault.jpg,https://i.ytimg.com/vi/RC-w0PlOBbk/hqdefault.jpg
1sAqijSUq1M,"Home Upgrades, Yogurt Blender Pancakes, My Parents Come For Dinner, Yoga & MORE",https://i.ytimg.com/vi/1sAqijSUq1M/default.jpg,https://i.ytimg.com/vi/1sAqijSUq1M/mqdefault.jpg,https://i.ytimg.com/vi/1sAqijSUq1M/hqdefault.jpg
eHFdDOhY060,"Stuffed Poblano Peppers, Easy Meal Prep Shredded Chicken, Cleaning & Explaining My Tattoo",https://i.ytimg.com/vi/eHFdDOhY060/default.jpg,https://i.ytimg.com/vi/eHFdDOhY060/mqdefault.jpg,https://i.ytimg.com/vi/eHFdDOhY060/hqdefault.jpg
C0bgHigAdJM,"Trying A Hair Waver, Lidl Grocery Haul/Organizing, Hilarious Cats On Catnip & How I Have Self Love",https://i.ytimg.com/vi/C0bgHigAdJM/default.jpg,https://i.ytimg.com/vi/C0bgHigAdJM/mqdefault.jpg,https://i.ytimg.com/vi/C0bgHigAdJM/hqdefault.jpg
t4iiwwsRn00,"Zane's Birthday Vlog, Renting a 2020 Corvette, Opening Gifts, Our Fun Dinner & Prep For The Storm",https://i.ytimg.com/vi/t4iiwwsRn00/default.jpg,https://i.ytimg.com/vi/t4iiwwsRn00/mqdefault.jpg,https://i.ytimg.com/vi/t4iiwwsRn00/hqdefault.jpg
J1ZoG0593l0,"Relaxing Sunday, Prepping For Zane's Birthday, Easy Enchilada Skillet & Home Upgrades",https://i.ytimg.com/vi/J1ZoG0593l0/default.jpg,https://i.ytimg.com/vi/J1ZoG0593l0/mqdefault.jpg,https://i.ytimg.com/vi/J1ZoG0593l0/hqdefault.jpg
gQyz5t4Rd6c,"Testing a TikTok Pasta Recipe, New Hair, Lidl Haul & Clean With Me",https://i.ytimg.com/vi/gQyz5t4Rd6c/default.jpg,https://i.ytimg.com/vi/gQyz5t4Rd6c/mqdefault.jpg,https://i.ytimg.com/vi/gQyz5t4Rd6c/hqdefault.jpg
MmR7V_JL1wk,"Starting DIY Dad's Channel, Behind The Scenes Vlog, Hilarious Moments & Fun Filming/Editing",https://i.ytimg.com/vi/MmR7V_JL1wk/default.jpg,https://i.ytimg.com/vi/MmR7V_JL1wk/mqdefault.jpg,https://i.ytimg.com/vi/MmR7V_JL1wk/hqdefault.jpg
09SFDDIYUt8,"Young Couple Shop With Us At Target, Starting A Journal, Easy Tilapia Recipe & MORE",https://i.ytimg.com/vi/09SFDDIYUt8/default.jpg,https://i.ytimg.com/vi/09SFDDIYUt8/mqdefault.jpg,https://i.ytimg.com/vi/09SFDDIYUt8/hqdefault.jpg
GBWg2m5mwZ4,"Meal Prepping, Fun Amazon Purchases, Apple Cinnamon Muffins, Eat Dinner With Us & MORE!",https://i.ytimg.com/vi/GBWg2m5mwZ4/default.jpg,https://i.ytimg.com/vi/GBWg2m5mwZ4/mqdefault.jpg,https://i.ytimg.com/vi/GBWg2m5mwZ4/hqdefault.jpg
yNSPyn8ioCA,"Yummy Burrito Bowls, Our Cute Beach Date Night & How I Easily Clean My Makeup Brushes",https://i.ytimg.com/vi/yNSPyn8ioCA/default.jpg,https://i.ytimg.com/vi/yNSPyn8ioCA/mqdefault.jpg,https://i.ytimg.com/vi/yNSPyn8ioCA/hqdefault.jpg
PQomePNcdZM,"Doing All The Things I've Been Avoiding, Organizing & Zucchini Enchilada Roll Ups",https://i.ytimg.com/vi/PQomePNcdZM/default.jpg,https://i.ytimg.com/vi/PQomePNcdZM/mqdefault.jpg,https://i.ytimg.com/vi/PQomePNcdZM/hqdefault.jpg
lXlOKd2zp3M,"First Time At Walmart in MONTHS Huge Haul, Trying a TikTok Buffalo Wrap Recipe & Clean With Me",https://i.ytimg.com/vi/lXlOKd2zp3M/default.jpg,https://i.ytimg.com/vi/lXlOKd2zp3M/mqdefault.jpg,https://i.ytimg.com/vi/lXlOKd2zp3M/hqdefault.jpg
yo96sqCDwi4,"Easy Tortellini Recipe + Cook With Me, Cutest TikTok Ever & Hurricane Isaias Hits NY",https://i.ytimg.com/vi/yo96sqCDwi4/default.jpg,https://i.ytimg.com/vi/yo96sqCDwi4/mqdefault.jpg,https://i.ytimg.com/vi/yo96sqCDwi4/hqdefault.jpg
js8qKOZknCM,Surprising My Dad With A Laptop & Camera To Start His YouTube Channel! + Funny Mask Night lol,https://i.ytimg.com/vi/js8qKOZknCM/default.jpg,https://i.ytimg.com/vi/js8qKOZknCM/mqdefault.jpg,https://i.ytimg.com/vi/js8qKOZknCM/hqdefault.jpg
YktQshZA-WI,"Building Our New Fire Pit Table, BWW Inspired Wedges & Bella's Birthday",https://i.ytimg.com/vi/YktQshZA-WI/default.jpg,https://i.ytimg.com/vi/YktQshZA-WI/mqdefault.jpg,https://i.ytimg.com/vi/YktQshZA-WI/hqdefault.jpg
ASAbKrR6RAk,"TJ Maxx + Five Below Shop With Me and Haul, Cook With Me & More",https://i.ytimg.com/vi/ASAbKrR6RAk/default.jpg,https://i.ytimg.com/vi/ASAbKrR6RAk/mqdefault.jpg,https://i.ytimg.com/vi/ASAbKrR6RAk/hqdefault.jpg
C3DxAzfz_S4,"Easy Delicious Chicken Wing Recipe, New Lounge Chair & Relationship Advice Dinner Chat",https://i.ytimg.com/vi/C3DxAzfz_S4/default.jpg,https://i.ytimg.com/vi/C3DxAzfz_S4/mqdefault.jpg,https://i.ytimg.com/vi/C3DxAzfz_S4/hqdefault.jpg
LbpafDIMtJ8,"Lidl Grocery Haul, Low Calorie Breakfast Tacos & Gnocchi Bolognese",https://i.ytimg.com/vi/LbpafDIMtJ8/default.jpg,https://i.ytimg.com/vi/LbpafDIMtJ8/mqdefault.jpg,https://i.ytimg.com/vi/LbpafDIMtJ8/hqdefault.jpg
SitKe0ZPS8I,"Spray Painting The Kitchen Handles, Tuna Buffalo Dip & Deck Box Struggles",https://i.ytimg.com/vi/SitKe0ZPS8I/default.jpg,https://i.ytimg.com/vi/SitKe0ZPS8I/mqdefault.jpg,https://i.ytimg.com/vi/SitKe0ZPS8I/hqdefault.jpg
9eplCK9Fu6A,"Opening Up About Your Questions, Easy Yummy Lo mein & More Backyard Progress",https://i.ytimg.com/vi/9eplCK9Fu6A/default.jpg,https://i.ytimg.com/vi/9eplCK9Fu6A/mqdefault.jpg,https://i.ytimg.com/vi/9eplCK9Fu6A/hqdefault.jpg
yDbWAdqdZ8I,"Starting to Decorate The Yard, Hilarious Family BBQ & Painting the Shingles",https://i.ytimg.com/vi/yDbWAdqdZ8I/default.jpg,https://i.ytimg.com/vi/yDbWAdqdZ8I/mqdefault.jpg,https://i.ytimg.com/vi/yDbWAdqdZ8I/hqdefault.jpg
ydCnssmcRoM,Backyard Renovation Series: Putting Up The Sail & Filling The Raised Garden,https://i.ytimg.com/vi/ydCnssmcRoM/default.jpg,https://i.ytimg.com/vi/ydCnssmcRoM/mqdefault.jpg,https://i.ytimg.com/vi/ydCnssmcRoM/hqdefault.jpg
WWXcA1pKR4g,"Building New Outdoor Furniture, Creamy Mushroom Chicken & Marriage Plans",https://i.ytimg.com/vi/WWXcA1pKR4g/default.jpg,https://i.ytimg.com/vi/WWXcA1pKR4g/mqdefault.jpg,https://i.ytimg.com/vi/WWXcA1pKR4g/hqdefault.jpg
GD4fHWtGhrw,Getting Supplies for The Backyard Project & Organizing/Decluttering My Closet,https://i.ytimg.com/vi/GD4fHWtGhrw/default.jpg,https://i.ytimg.com/vi/GD4fHWtGhrw/mqdefault.jpg,https://i.ytimg.com/vi/GD4fHWtGhrw/hqdefault.jpg
x_WBM5iVYwM,"Celebrating Sissy's Birthday, Cleaning The Bathroom Grout & Tuna Avocado Boats",https://i.ytimg.com/vi/x_WBM5iVYwM/default.jpg,https://i.ytimg.com/vi/x_WBM5iVYwM/mqdefault.jpg,https://i.ytimg.com/vi/x_WBM5iVYwM/hqdefault.jpg
a3rLwqbVFcQ,Building Our Custom Outdoor Deck & A Hard Vet Visit For Benji & Bailey,https://i.ytimg.com/vi/a3rLwqbVFcQ/default.jpg,https://i.ytimg.com/vi/a3rLwqbVFcQ/mqdefault.jpg,https://i.ytimg.com/vi/a3rLwqbVFcQ/hqdefault.jpg
k6dCBsxP8Gk,"Our First Date Night In 3 Months, Benji Lost His Meow & Getting My Nails Done",https://i.ytimg.com/vi/k6dCBsxP8Gk/default.jpg,https://i.ytimg.com/vi/k6dCBsxP8Gk/mqdefault.jpg,https://i.ytimg.com/vi/k6dCBsxP8Gk/hqdefault.jpg
IqPmTPD06Uo,"Trying To Start Building Our Deck, My Recent Lip Combo & Easy Quesadillas",https://i.ytimg.com/vi/IqPmTPD06Uo/default.jpg,https://i.ytimg.com/vi/IqPmTPD06Uo/mqdefault.jpg,https://i.ytimg.com/vi/IqPmTPD06Uo/hqdefault.jpg
TD4Nm0uRYaU,"Pool Day & Too Many Drinks, Kitten Update & Clean With Me",https://i.ytimg.com/vi/TD4Nm0uRYaU/default.jpg,https://i.ytimg.com/vi/TD4Nm0uRYaU/mqdefault.jpg,https://i.ytimg.com/vi/TD4Nm0uRYaU/hqdefault.jpg
GsEmNu5wGeo,Kitten Name Reveal! + Father's Day BBQ Surprise!,https://i.ytimg.com/vi/GsEmNu5wGeo/default.jpg,https://i.ytimg.com/vi/GsEmNu5wGeo/mqdefault.jpg,https://i.ytimg.com/vi/GsEmNu5wGeo/hqdefault.jpg
ilkNRkjdhB4,WE RESCUED AN ABANDONED KITTEN! (FOUND IN A BUSH),https://i.ytimg.com/vi/ilkNRkjdhB4/default.jpg,https://i.ytimg.com/vi/ilkNRkjdhB4/mqdefault.jpg,https://i.ytimg.com/vi/ilkNRkjdhB4/hqdefault.jpg
-qiXhU3Jm_0,"Summer Thrift Haul, The BEST Salad Recipe & Healthy Eggplant Parm",https://i.ytimg.com/vi/-qiXhU3Jm_0/default.jpg,https://i.ytimg.com/vi/-qiXhU3Jm_0/mqdefault.jpg,https://i.ytimg.com/vi/-qiXhU3Jm_0/hqdefault.jpg
idLPpzLoKW8,"First Beach Day, Caramelized Onion Burgers & Love Island Chats",https://i.ytimg.com/vi/idLPpzLoKW8/default.jpg,https://i.ytimg.com/vi/idLPpzLoKW8/mqdefault.jpg,https://i.ytimg.com/vi/idLPpzLoKW8/hqdefault.jpg
YQzaZFkRWeU,"Healthy Fried Chicken Sandwich, Grocery Haul & Mini Clothing Haul",https://i.ytimg.com/vi/YQzaZFkRWeU/default.jpg,https://i.ytimg.com/vi/YQzaZFkRWeU/mqdefault.jpg,https://i.ytimg.com/vi/YQzaZFkRWeU/hqdefault.jpg
R6x4UVG0yrY,"Get Ready With Me (GLAM), Photoshoot BTS & Getting a Ticket lol",https://i.ytimg.com/vi/R6x4UVG0yrY/default.jpg,https://i.ytimg.com/vi/R6x4UVG0yrY/mqdefault.jpg,https://i.ytimg.com/vi/R6x4UVG0yrY/hqdefault.jpg
XTlQ_LodY8I,"Current Amazon Favorites, My Mental Health & Taco Night",https://i.ytimg.com/vi/XTlQ_LodY8I/default.jpg,https://i.ytimg.com/vi/XTlQ_LodY8I/mqdefault.jpg,https://i.ytimg.com/vi/XTlQ_LodY8I/hqdefault.jpg
ck7FLYNS8gg,"Making a Difference, Organizing & Deep Cleaning The Bathroom & Zucchini Noodles",https://i.ytimg.com/vi/ck7FLYNS8gg/default.jpg,https://i.ytimg.com/vi/ck7FLYNS8gg/mqdefault.jpg,https://i.ytimg.com/vi/ck7FLYNS8gg/hqdefault.jpg
-ISwMINVR2U,"Air Fryer Buffalo Cauliflower, Roasted Chicken & New Bed Sheets",https://i.ytimg.com/vi/-ISwMINVR2U/default.jpg,https://i.ytimg.com/vi/-ISwMINVR2U/mqdefault.jpg,https://i.ytimg.com/vi/-ISwMINVR2U/hqdefault.jpg
YJdxdiZTIGk,"Memorial Day Activities, Behind The Scenes of Our 100th Podcast Episode & Easy Roasted Potatoes",https://i.ytimg.com/vi/YJdxdiZTIGk/default.jpg,https://i.ytimg.com/vi/YJdxdiZTIGk/mqdefault.jpg,https://i.ytimg.com/vi/YJdxdiZTIGk/hqdefault.jpg
hUgqkjhU31g,"Cook With Me! Healthy Nachos, Air Fryer Apple Crisp & Breakfast Taco",https://i.ytimg.com/vi/hUgqkjhU31g/default.jpg,https://i.ytimg.com/vi/hUgqkjhU31g/mqdefault.jpg,https://i.ytimg.com/vi/hUgqkjhU31g/hqdefault.jpg
ccnNXVAhR78,HUGE LIDL GROCERY HAUL VLOG (22 year old couple),https://i.ytimg.com/vi/ccnNXVAhR78/default.jpg,https://i.ytimg.com/vi/ccnNXVAhR78/mqdefault.jpg,https://i.ytimg.com/vi/ccnNXVAhR78/hqdefault.jpg
d-WdHL9XUGI,"DIY Crop Tops, How To Grow Your Lashes FAST & Backyard Renovation Plans",https://i.ytimg.com/vi/d-WdHL9XUGI/default.jpg,https://i.ytimg.com/vi/d-WdHL9XUGI/mqdefault.jpg,https://i.ytimg.com/vi/d-WdHL9XUGI/hqdefault.jpg
V6-fkBICVDs,"Amazon Clothing Haul, Car Mukbang Chats & The BEST Denim Shorts",https://i.ytimg.com/vi/V6-fkBICVDs/default.jpg,https://i.ytimg.com/vi/V6-fkBICVDs/mqdefault.jpg,https://i.ytimg.com/vi/V6-fkBICVDs/hqdefault.jpg
nZduUO0H7es,Make Chocolate Covered Strawberries With Us & BTS Of Live Cooking!,https://i.ytimg.com/vi/nZduUO0H7es/default.jpg,https://i.ytimg.com/vi/nZduUO0H7es/mqdefault.jpg,https://i.ytimg.com/vi/nZduUO0H7es/hqdefault.jpg
Ei9AcDrj1p8,"No Sew DIY Mask, Self Tanning & Easy Air Fried Peppers",https://i.ytimg.com/vi/Ei9AcDrj1p8/default.jpg,https://i.ytimg.com/vi/Ei9AcDrj1p8/mqdefault.jpg,https://i.ytimg.com/vi/Ei9AcDrj1p8/hqdefault.jpg
63kE-WY5cew,"MacBook Pro Unboxing, Cook With Me & Mini Morning Routine",https://i.ytimg.com/vi/63kE-WY5cew/default.jpg,https://i.ytimg.com/vi/63kE-WY5cew/mqdefault.jpg,https://i.ytimg.com/vi/63kE-WY5cew/hqdefault.jpg
JX6XcmMnfq4,"How I'm Staying Positive, Cinco De Mayo Celebration & Social Distancing",https://i.ytimg.com/vi/JX6XcmMnfq4/default.jpg,https://i.ytimg.com/vi/JX6XcmMnfq4/mqdefault.jpg,https://i.ytimg.com/vi/JX6XcmMnfq4/hqdefault.jpg
4bzqqmJgXjM,"Working Out, Steak BBQ Chats & Video Calling Viewers!",https://i.ytimg.com/vi/4bzqqmJgXjM/default.jpg,https://i.ytimg.com/vi/4bzqqmJgXjM/mqdefault.jpg,https://i.ytimg.com/vi/4bzqqmJgXjM/hqdefault.jpg
HuyM9EbUFHM,"Amazon Haul & Current Favs, Crock Pot Tikka Masala & Cutting My Hair AGAIN!",https://i.ytimg.com/vi/HuyM9EbUFHM/default.jpg,https://i.ytimg.com/vi/HuyM9EbUFHM/mqdefault.jpg,https://i.ytimg.com/vi/HuyM9EbUFHM/hqdefault.jpg
HuyM9EbUFHM,"Amazon Haul & Current Favs, Crock Pot Tikka Masala & Cutting My Hair AGAIN!",https://i.ytimg.com/vi/HuyM9EbUFHM/default.jpg,https://i.ytimg.com/vi/HuyM9EbUFHM/mqdefault.jpg,https://i.ytimg.com/vi/HuyM9EbUFHM/hqdefault.jpg
nuFEjKSYqH8,"My Go To Easy Drink Recipe, Backyard Spring Clean Up & BBQ Dinner Chats",https://i.ytimg.com/vi/nuFEjKSYqH8/default.jpg,https://i.ytimg.com/vi/nuFEjKSYqH8/mqdefault.jpg,https://i.ytimg.com/vi/nuFEjKSYqH8/hqdefault.jpg
40a7L0pOC3I,"Cutting My Own Hair, Doing My Nails & Alfredo Pizza",https://i.ytimg.com/vi/40a7L0pOC3I/default.jpg,https://i.ytimg.com/vi/40a7L0pOC3I/mqdefault.jpg,https://i.ytimg.com/vi/40a7L0pOC3I/hqdefault.jpg
Y1O2i_D8_hI,"COOK WITH ME! Crepes, Gyros and Air Fried Pickles",https://i.ytimg.com/vi/Y1O2i_D8_hI/default.jpg,https://i.ytimg.com/vi/Y1O2i_D8_hI/mqdefault.jpg,https://i.ytimg.com/vi/Y1O2i_D8_hI/hqdefault.jpg
4xB1r0n-QLs,My Boyfriend Removes My Hair Extensions! (Keratip),https://i.ytimg.com/vi/4xB1r0n-QLs/default.jpg,https://i.ytimg.com/vi/4xB1r0n-QLs/mqdefault.jpg,https://i.ytimg.com/vi/4xB1r0n-QLs/hqdefault.jpg
iYqK6kHQXeM,"Chicken Enchilada Mukbang & Cook With Me, Going Out & TikToks",https://i.ytimg.com/vi/iYqK6kHQXeM/default.jpg,https://i.ytimg.com/vi/iYqK6kHQXeM/mqdefault.jpg,https://i.ytimg.com/vi/iYqK6kHQXeM/hqdefault.jpg
ltr00wAYwjc,"My First Luxury Purchase, Low Cal Pizza Dough & Scallion Pancakes",https://i.ytimg.com/vi/ltr00wAYwjc/default.jpg,https://i.ytimg.com/vi/ltr00wAYwjc/mqdefault.jpg,https://i.ytimg.com/vi/ltr00wAYwjc/hqdefault.jpg
yP7G-78tDuU,"Easter At Home, New Bedroom Mirror & Penne Alla Vodka",https://i.ytimg.com/vi/yP7G-78tDuU/default.jpg,https://i.ytimg.com/vi/yP7G-78tDuU/mqdefault.jpg,https://i.ytimg.com/vi/yP7G-78tDuU/hqdefault.jpg
sjconZNM0ts,HUGE Grocery Haul! Fridge & Pantry Organization (lidl + walmart),https://i.ytimg.com/vi/sjconZNM0ts/default.jpg,https://i.ytimg.com/vi/sjconZNM0ts/mqdefault.jpg,https://i.ytimg.com/vi/sjconZNM0ts/hqdefault.jpg
cr6ef3Z9iyU,"My Current Makeup Routine, Philly Cheese Steak Quesadillas & Easy Monkey Bread!",https://i.ytimg.com/vi/cr6ef3Z9iyU/default.jpg,https://i.ytimg.com/vi/cr6ef3Z9iyU/mqdefault.jpg,https://i.ytimg.com/vi/cr6ef3Z9iyU/hqdefault.jpg
eaVoGYkk_XQ,"Clothing Haul FAIL, Kani Salad Recipe, TikTok Hair Hack & Hilarious FaceTime With My Parents",https://i.ytimg.com/vi/eaVoGYkk_XQ/default.jpg,https://i.ytimg.com/vi/eaVoGYkk_XQ/mqdefault.jpg,https://i.ytimg.com/vi/eaVoGYkk_XQ/hqdefault.jpg
2DppnLb04JQ,"Making BURGER BURRITOS! (cook with me, clean with me + making tiktoks)",https://i.ytimg.com/vi/2DppnLb04JQ/default.jpg,https://i.ytimg.com/vi/2DppnLb04JQ/mqdefault.jpg,https://i.ytimg.com/vi/2DppnLb04JQ/hqdefault.jpg
0VXJFfgWBlY,Backyard Renovation Plans + Having a Cute Barbecue!,https://i.ytimg.com/vi/0VXJFfgWBlY/default.jpg,https://i.ytimg.com/vi/0VXJFfgWBlY/mqdefault.jpg,https://i.ytimg.com/vi/0VXJFfgWBlY/hqdefault.jpg
QFHxp2Tz2eI,Making TikToks + Trying To Throw it Back 🤣,https://i.ytimg.com/vi/QFHxp2Tz2eI/default.jpg,https://i.ytimg.com/vi/QFHxp2Tz2eI/mqdefault.jpg,https://i.ytimg.com/vi/QFHxp2Tz2eI/hqdefault.jpg
TEZbXSppv1Y,Decorating & Organizing Our Bedroom! (amazon organizers & decor),https://i.ytimg.com/vi/TEZbXSppv1Y/default.jpg,https://i.ytimg.com/vi/TEZbXSppv1Y/mqdefault.jpg,https://i.ytimg.com/vi/TEZbXSppv1Y/hqdefault.jpg
KvSRCH0jKbs,"Quarantine MOTIVATION! (grocery haul, doing things I procrastinated, getting outside + more)",https://i.ytimg.com/vi/KvSRCH0jKbs/default.jpg,https://i.ytimg.com/vi/KvSRCH0jKbs/mqdefault.jpg,https://i.ytimg.com/vi/KvSRCH0jKbs/hqdefault.jpg
8FUXG7VSrow,"Cook & Drink With Me! The BEST Recipe I've Ever Made, Comfy Clothes Haul & Getting Emotional",https://i.ytimg.com/vi/8FUXG7VSrow/default.jpg,https://i.ytimg.com/vi/8FUXG7VSrow/mqdefault.jpg,https://i.ytimg.com/vi/8FUXG7VSrow/hqdefault.jpg
Zc_uRSReYeE,Deep Clean & Tidy Up With Me! (get it all done motivation),https://i.ytimg.com/vi/Zc_uRSReYeE/default.jpg,https://i.ytimg.com/vi/Zc_uRSReYeE/mqdefault.jpg,https://i.ytimg.com/vi/Zc_uRSReYeE/hqdefault.jpg
_FHZnC0V-p4,One of The Best Nights Was Taken Away From Me..,https://i.ytimg.com/vi/_FHZnC0V-p4/default.jpg,https://i.ytimg.com/vi/_FHZnC0V-p4/mqdefault.jpg,https://i.ytimg.com/vi/_FHZnC0V-p4/hqdefault.jpg
MLVFr-vieaI,Affordable Boohoo COMFY Neutrals Haul,https://i.ytimg.com/vi/MLVFr-vieaI/default.jpg,https://i.ytimg.com/vi/MLVFr-vieaI/mqdefault.jpg,https://i.ytimg.com/vi/MLVFr-vieaI/hqdefault.jpg
16kYVnumP7E,I Made an IMPULSE Amazon Purchase..,https://i.ytimg.com/vi/16kYVnumP7E/default.jpg,https://i.ytimg.com/vi/16kYVnumP7E/mqdefault.jpg,https://i.ytimg.com/vi/16kYVnumP7E/hqdefault.jpg
vOuF_arwaBM,Preparing For The Coronavirus... (this is getting serious),https://i.ytimg.com/vi/vOuF_arwaBM/default.jpg,https://i.ytimg.com/vi/vOuF_arwaBM/mqdefault.jpg,https://i.ytimg.com/vi/vOuF_arwaBM/hqdefault.jpg
8xLlwTv4zUA,"SPRING REFRESH! Decor Shopping, Cleaning & Haul! (also chopped my hair off oops)",https://i.ytimg.com/vi/8xLlwTv4zUA/default.jpg,https://i.ytimg.com/vi/8xLlwTv4zUA/mqdefault.jpg,https://i.ytimg.com/vi/8xLlwTv4zUA/hqdefault.jpg
KUUInJv9tIw,FULL DETAIL On What We're Working On!,https://i.ytimg.com/vi/KUUInJv9tIw/default.jpg,https://i.ytimg.com/vi/KUUInJv9tIw/mqdefault.jpg,https://i.ytimg.com/vi/KUUInJv9tIw/hqdefault.jpg
61SxlNTC2Qk,Trying ZERO Calorie PASTA! (Cook With Me),https://i.ytimg.com/vi/61SxlNTC2Qk/default.jpg,https://i.ytimg.com/vi/61SxlNTC2Qk/mqdefault.jpg,https://i.ytimg.com/vi/61SxlNTC2Qk/hqdefault.jpg
ZfokXlH9v3E,Something You've Been WAITING For Is Finally Happening TOMORROW!,https://i.ytimg.com/vi/ZfokXlH9v3E/default.jpg,https://i.ytimg.com/vi/ZfokXlH9v3E/mqdefault.jpg,https://i.ytimg.com/vi/ZfokXlH9v3E/hqdefault.jpg
-aPLD-3Ra-M,Making Homemade Sushi For The First Time! (SO EASY!),https://i.ytimg.com/vi/-aPLD-3Ra-M/default.jpg,https://i.ytimg.com/vi/-aPLD-3Ra-M/mqdefault.jpg,https://i.ytimg.com/vi/-aPLD-3Ra-M/hqdefault.jpg
7_x8kQj1uLc,My Mom Has Something To Tell You Guys...,https://i.ytimg.com/vi/7_x8kQj1uLc/default.jpg,https://i.ytimg.com/vi/7_x8kQj1uLc/mqdefault.jpg,https://i.ytimg.com/vi/7_x8kQj1uLc/hqdefault.jpg
aso8m6ivCTY,Trying Something New In Our Relationship,https://i.ytimg.com/vi/aso8m6ivCTY/default.jpg,https://i.ytimg.com/vi/aso8m6ivCTY/mqdefault.jpg,https://i.ytimg.com/vi/aso8m6ivCTY/hqdefault.jpg
