ID,TITLE,THUMBNAIL1,THUMBNAIL2,THUMBNAIL3
oJY7GDkWOr4,Review Geut Refine Intense Moisture di Kulit Berminyak dan Berjerawat,https://i.ytimg.com/vi/oJY7GDkWOr4/default.jpg,https://i.ytimg.com/vi/oJY7GDkWOr4/mqdefault.jpg,https://i.ytimg.com/vi/oJY7GDkWOr4/hqdefault.jpg
oFfionO_ZMk,Private video,https://i.ytimg.com/vi/oFfionO_ZMk/default.jpg,https://i.ytimg.com/vi/oFfionO_ZMk/mqdefault.jpg,https://i.ytimg.com/vi/oFfionO_ZMk/hqdefault.jpg
EEiDDlrjbYw,Review Geut By DR  T Reinforce Skin Barrier,https://i.ytimg.com/vi/EEiDDlrjbYw/default.jpg,https://i.ytimg.com/vi/EEiDDlrjbYw/mqdefault.jpg,https://i.ytimg.com/vi/EEiDDlrjbYw/hqdefault.jpg
vOVjdliAlxg,Review Geut Revitalize Vitamin C+ Serum Brightens & Tones di Jenis Kulit Kering dan Berjerawat,https://i.ytimg.com/vi/vOVjdliAlxg/default.jpg,https://i.ytimg.com/vi/vOVjdliAlxg/mqdefault.jpg,https://i.ytimg.com/vi/vOVjdliAlxg/hqdefault.jpg
gDs_ok4ffNQ,"Bersihin Makeup dengan Cleansing Balm dari LT PRO, Makeup Auto Lumer!",https://i.ytimg.com/vi/gDs_ok4ffNQ/default.jpg,https://i.ytimg.com/vi/gDs_ok4ffNQ/mqdefault.jpg,https://i.ytimg.com/vi/gDs_ok4ffNQ/hqdefault.jpg
Q8sSth0_mNM,Rekomendasi Body Oil Biar Kulit Lembap Seharian || Bye Kulit Kering!!,https://i.ytimg.com/vi/Q8sSth0_mNM/default.jpg,https://i.ytimg.com/vi/Q8sSth0_mNM/mqdefault.jpg,https://i.ytimg.com/vi/Q8sSth0_mNM/hqdefault.jpg
3fURqWd5xGg,"Hydrating Toner VS Exfoliating Toner, Apa Bedanya?!",https://i.ytimg.com/vi/3fURqWd5xGg/default.jpg,https://i.ytimg.com/vi/3fURqWd5xGg/mqdefault.jpg,https://i.ytimg.com/vi/3fURqWd5xGg/hqdefault.jpg
_AR6pHtQsPM,Review Essence Seharga Jutaan rupiah dari Fresh! || Fresh Kombucha Treatment Essence!,https://i.ytimg.com/vi/_AR6pHtQsPM/default.jpg,https://i.ytimg.com/vi/_AR6pHtQsPM/mqdefault.jpg,https://i.ytimg.com/vi/_AR6pHtQsPM/hqdefault.jpg
e_KI3xxRXKg,"Review Body Lotion Terbaru dari RANS Beauty, Hasilnya????",https://i.ytimg.com/vi/e_KI3xxRXKg/default.jpg,https://i.ytimg.com/vi/e_KI3xxRXKg/mqdefault.jpg,https://i.ytimg.com/vi/e_KI3xxRXKg/hqdefault.jpg
tUCmfU9FdF8,Tips Memilih Pakaian Biar Kelihatan Ramping! || Tetap Pede Hanya Dengan Pakaian!!,https://i.ytimg.com/vi/tUCmfU9FdF8/default.jpg,https://i.ytimg.com/vi/tUCmfU9FdF8/mqdefault.jpg,https://i.ytimg.com/vi/tUCmfU9FdF8/hqdefault.jpg
dKVpgzYNomw,Tips Berpakaian untuk Pemilik Tubuh Kurus || OOTD Untuk Sehari-hari,https://i.ytimg.com/vi/dKVpgzYNomw/default.jpg,https://i.ytimg.com/vi/dKVpgzYNomw/mqdefault.jpg,https://i.ytimg.com/vi/dKVpgzYNomw/hqdefault.jpg
9mrfhMr8mPU,Rekomendasi Sabun Mandi yang Bisa Menghilangkan Jerawat Punggung,https://i.ytimg.com/vi/9mrfhMr8mPU/default.jpg,https://i.ytimg.com/vi/9mrfhMr8mPU/mqdefault.jpg,https://i.ytimg.com/vi/9mrfhMr8mPU/hqdefault.jpg
JzizbgcI4X0,"Review + Swatches Produk YOU Colorland Soft Stroke Lip Clay, Lembut banget!",https://i.ytimg.com/vi/JzizbgcI4X0/default.jpg,https://i.ytimg.com/vi/JzizbgcI4X0/mqdefault.jpg,https://i.ytimg.com/vi/JzizbgcI4X0/hqdefault.jpg
hzJjiEfDZIg,Rekomendasi Produk Makeup Terbaru yang Wajib Dicoba,https://i.ytimg.com/vi/hzJjiEfDZIg/default.jpg,https://i.ytimg.com/vi/hzJjiEfDZIg/mqdefault.jpg,https://i.ytimg.com/vi/hzJjiEfDZIg/hqdefault.jpg
Z-BThVsueCI,"Review Labore Sensitive Skin Care, Sabun Cuci Muka untuk Kulit Sensitif",https://i.ytimg.com/vi/Z-BThVsueCI/default.jpg,https://i.ytimg.com/vi/Z-BThVsueCI/mqdefault.jpg,https://i.ytimg.com/vi/Z-BThVsueCI/hqdefault.jpg
QWdF_mJ-a90,Review Gentle Hour Late This Night Brightening Sleeping Mask,https://i.ytimg.com/vi/QWdF_mJ-a90/default.jpg,https://i.ytimg.com/vi/QWdF_mJ-a90/mqdefault.jpg,https://i.ytimg.com/vi/QWdF_mJ-a90/hqdefault.jpg
pRcZGvIPZdc,Review Fresh Vitamin Nectar Glow Juice Antioxidant Face Serum Selama 1 Minggu Pemakaian,https://i.ytimg.com/vi/pRcZGvIPZdc/default.jpg,https://i.ytimg.com/vi/pRcZGvIPZdc/mqdefault.jpg,https://i.ytimg.com/vi/pRcZGvIPZdc/hqdefault.jpg
qhzwmzdILnU,Review Fresh Rose Hydrating Eye Gel Cream Selama 1 Minggu Pemakaian,https://i.ytimg.com/vi/qhzwmzdILnU/default.jpg,https://i.ytimg.com/vi/qhzwmzdILnU/mqdefault.jpg,https://i.ytimg.com/vi/qhzwmzdILnU/hqdefault.jpg
2yg5SMnkll4,"Review Foundation Ivan Gunawan Cosmetics, Hasilnya Gak Nyangka Banget!!",https://i.ytimg.com/vi/2yg5SMnkll4/default.jpg,https://i.ytimg.com/vi/2yg5SMnkll4/mqdefault.jpg,https://i.ytimg.com/vi/2yg5SMnkll4/hqdefault.jpg
08iIpRsNcwg,"Review Ariul 7days Mask Tea Tree + M, Intip Kualitasnya!",https://i.ytimg.com/vi/08iIpRsNcwg/default.jpg,https://i.ytimg.com/vi/08iIpRsNcwg/mqdefault.jpg,https://i.ytimg.com/vi/08iIpRsNcwg/hqdefault.jpg
4rUPlQgX0AM,"Tips Menyimpan Hijab Saat Traveling, Gak Perlu Setrika Lagi!",https://i.ytimg.com/vi/4rUPlQgX0AM/default.jpg,https://i.ytimg.com/vi/4rUPlQgX0AM/mqdefault.jpg,https://i.ytimg.com/vi/4rUPlQgX0AM/hqdefault.jpg
D92ejphFVNY,"Cara Mudah Menghilangkan Bau Kaki dengan Alami, Hasilnya Permanen!",https://i.ytimg.com/vi/D92ejphFVNY/default.jpg,https://i.ytimg.com/vi/D92ejphFVNY/mqdefault.jpg,https://i.ytimg.com/vi/D92ejphFVNY/hqdefault.jpg
6guB_bG5se0,Review Make Up Korea - BNB Barenbliss Spark Tacular Party Blush,https://i.ytimg.com/vi/6guB_bG5se0/default.jpg,https://i.ytimg.com/vi/6guB_bG5se0/mqdefault.jpg,https://i.ytimg.com/vi/6guB_bG5se0/hqdefault.jpg
K60a4dH8ogw,Review Madame Gie Madame Juicy Cheek - Harganya Murah Banget!!,https://i.ytimg.com/vi/K60a4dH8ogw/default.jpg,https://i.ytimg.com/vi/K60a4dH8ogw/mqdefault.jpg,https://i.ytimg.com/vi/K60a4dH8ogw/hqdefault.jpg
-40BBTSLrn8,Review Risda Beauty Care Moisturizing Sunscreen with UV Protection untuk Semua Jenis Kulit,https://i.ytimg.com/vi/-40BBTSLrn8/default.jpg,https://i.ytimg.com/vi/-40BBTSLrn8/mqdefault.jpg,https://i.ytimg.com/vi/-40BBTSLrn8/hqdefault.jpg
-g_1rq0usnE,"3 Manfaat Mangga untuk Kecantikan Wajah, Salah Satunya Bikin Awet Muda",https://i.ytimg.com/vi/-g_1rq0usnE/default.jpg,https://i.ytimg.com/vi/-g_1rq0usnE/mqdefault.jpg,https://i.ytimg.com/vi/-g_1rq0usnE/hqdefault.jpg
SL2yKpXiuB4,2 Teknik Curly Rambut Anti Gagal dan Tahan Lama Hingga 5 Jam,https://i.ytimg.com/vi/SL2yKpXiuB4/default.jpg,https://i.ytimg.com/vi/SL2yKpXiuB4/mqdefault.jpg,https://i.ytimg.com/vi/SL2yKpXiuB4/hqdefault.jpg
gft5Divdrgc,Review NuFace Eyebrow Pencil,https://i.ytimg.com/vi/gft5Divdrgc/default.jpg,https://i.ytimg.com/vi/gft5Divdrgc/mqdefault.jpg,https://i.ytimg.com/vi/gft5Divdrgc/hqdefault.jpg
EionH_mCXJ4,Rekomendasi Serum Penghilang Bekas Jerawat  Wajah Auto Kinclong!,https://i.ytimg.com/vi/EionH_mCXJ4/default.jpg,https://i.ytimg.com/vi/EionH_mCXJ4/mqdefault.jpg,https://i.ytimg.com/vi/EionH_mCXJ4/hqdefault.jpg
JlOBmylmPSY,Review Anessa Perfect UV Sunscreen Skincare Milk: Mudah di Blend dan Water Resistant!,https://i.ytimg.com/vi/JlOBmylmPSY/default.jpg,https://i.ytimg.com/vi/JlOBmylmPSY/mqdefault.jpg,https://i.ytimg.com/vi/JlOBmylmPSY/hqdefault.jpg
x4TFcSfMD9c,"Review Blush Terbaru dari Luxcrime, Fresh dan Cocok Digunakan Sehari-hari!",https://i.ytimg.com/vi/x4TFcSfMD9c/default.jpg,https://i.ytimg.com/vi/x4TFcSfMD9c/mqdefault.jpg,https://i.ytimg.com/vi/x4TFcSfMD9c/hqdefault.jpg
9ADLLpxberk,Bersihin Makeup Mata dan Bibir Pakai Produk Korea || Review Missha Eye & Lip Makeup Remover,https://i.ytimg.com/vi/9ADLLpxberk/default.jpg,https://i.ytimg.com/vi/9ADLLpxberk/mqdefault.jpg,https://i.ytimg.com/vi/9ADLLpxberk/hqdefault.jpg
67k_8H6ulyI,Review Lip Mask Choosy Langsung Buat Bibir Jadi Pink!,https://i.ytimg.com/vi/67k_8H6ulyI/default.jpg,https://i.ytimg.com/vi/67k_8H6ulyI/mqdefault.jpg,https://i.ytimg.com/vi/67k_8H6ulyI/hqdefault.jpg
q5kDiPW0KhQ,Review Ellips Dry Shampoo untuk Hijaber! Gak Perlu Keramas Lagi!,https://i.ytimg.com/vi/q5kDiPW0KhQ/default.jpg,https://i.ytimg.com/vi/q5kDiPW0KhQ/mqdefault.jpg,https://i.ytimg.com/vi/q5kDiPW0KhQ/hqdefault.jpg
rjvpxn5MzGQ,Cobain Juicy Lip Mask The Aesthetics Skin x Tynakanna || Ampuh Melembabkan dan Melembutkan Bibir!,https://i.ytimg.com/vi/rjvpxn5MzGQ/default.jpg,https://i.ytimg.com/vi/rjvpxn5MzGQ/mqdefault.jpg,https://i.ytimg.com/vi/rjvpxn5MzGQ/hqdefault.jpg
vsDKpH2LOeg,"3 Cara Menghilangkan Jerawat Punggung, Dijamin Punggung Makin Mulus",https://i.ytimg.com/vi/vsDKpH2LOeg/default.jpg,https://i.ytimg.com/vi/vsDKpH2LOeg/mqdefault.jpg,https://i.ytimg.com/vi/vsDKpH2LOeg/hqdefault.jpg
BaONEMZqN-E,Review Madame Gie Madame to Go Face Palette Milik Gisella Anastasia!,https://i.ytimg.com/vi/BaONEMZqN-E/default.jpg,https://i.ytimg.com/vi/BaONEMZqN-E/mqdefault.jpg,https://i.ytimg.com/vi/BaONEMZqN-E/hqdefault.jpg
Mf3WQOZA47s,Bahaya Menggunakan Putih Telur untuk Masker Kecantikan!,https://i.ytimg.com/vi/Mf3WQOZA47s/default.jpg,https://i.ytimg.com/vi/Mf3WQOZA47s/mqdefault.jpg,https://i.ytimg.com/vi/Mf3WQOZA47s/hqdefault.jpg
jwJUSkuk6GU,Teknik Menggunakan Maskara dan Penjepit Bulu Mata Seperti Eyelash Extension,https://i.ytimg.com/vi/jwJUSkuk6GU/default.jpg,https://i.ytimg.com/vi/jwJUSkuk6GU/mqdefault.jpg,https://i.ytimg.com/vi/jwJUSkuk6GU/hqdefault.jpg
CToxmuUhkJQ,"Kurangi Ketombe Dengan Shampo Selsun, Emang Bisa? || Selsun Yellow Double Impact",https://i.ytimg.com/vi/CToxmuUhkJQ/default.jpg,https://i.ytimg.com/vi/CToxmuUhkJQ/mqdefault.jpg,https://i.ytimg.com/vi/CToxmuUhkJQ/hqdefault.jpg
lTwtuLwZhSs,Review Shu Uemura Unlimited Glow Fluid Foundation di Wajah Berminyak!!,https://i.ytimg.com/vi/lTwtuLwZhSs/default.jpg,https://i.ytimg.com/vi/lTwtuLwZhSs/mqdefault.jpg,https://i.ytimg.com/vi/lTwtuLwZhSs/hqdefault.jpg
sCVVMhC6VyQ,"Review Wardah UV Shield Light Matte Sun Stick SPF 50, Sunscreen yang Bisa Jadi Serum & Primer Juga?!",https://i.ytimg.com/vi/sCVVMhC6VyQ/default.jpg,https://i.ytimg.com/vi/sCVVMhC6VyQ/mqdefault.jpg,https://i.ytimg.com/vi/sCVVMhC6VyQ/hqdefault.jpg
xUNxR9XldGs,"Review Lip Gloss Esqa x Darbotz, Lip Gloss Lokal Udah Semakin Naik Level Nih!!",https://i.ytimg.com/vi/xUNxR9XldGs/default.jpg,https://i.ytimg.com/vi/xUNxR9XldGs/mqdefault.jpg,https://i.ytimg.com/vi/xUNxR9XldGs/hqdefault.jpg
aqnVKr2CZRA,"Rangkaian Skincare Routine Untuk Kulit Berminyak & Berjerawat, Wajib Punya Produk-Produk Ini!",https://i.ytimg.com/vi/aqnVKr2CZRA/default.jpg,https://i.ytimg.com/vi/aqnVKr2CZRA/mqdefault.jpg,https://i.ytimg.com/vi/aqnVKr2CZRA/hqdefault.jpg
1kVhwsw3G1E,Review Marshwillow Fairy Dust Face Pallete Milik Natasha Wilona,https://i.ytimg.com/vi/1kVhwsw3G1E/default.jpg,https://i.ytimg.com/vi/1kVhwsw3G1E/mqdefault.jpg,https://i.ytimg.com/vi/1kVhwsw3G1E/hqdefault.jpg
3RrsbWCizfw,Rekomendasi Setting Spray Biar Makeup Tahan Lama | Makeup Auto Flawless Seharian!,https://i.ytimg.com/vi/3RrsbWCizfw/default.jpg,https://i.ytimg.com/vi/3RrsbWCizfw/mqdefault.jpg,https://i.ytimg.com/vi/3RrsbWCizfw/hqdefault.jpg
UbxSwLLAz1c,"Battle Foundation Maybelline VS Shu Uemura, Serupa tapi Tidak Sama",https://i.ytimg.com/vi/UbxSwLLAz1c/default.jpg,https://i.ytimg.com/vi/UbxSwLLAz1c/mqdefault.jpg,https://i.ytimg.com/vi/UbxSwLLAz1c/hqdefault.jpg
ASBHFlIRcxc,"3 Jenis Sepatu yang Wajib Dimiliki Wanita Karier, Bikin Tampilan Lebih Feminin",https://i.ytimg.com/vi/ASBHFlIRcxc/default.jpg,https://i.ytimg.com/vi/ASBHFlIRcxc/mqdefault.jpg,https://i.ytimg.com/vi/ASBHFlIRcxc/hqdefault.jpg
SYYg4AGYzFo,3 Minuman Kolagen yang Bisa Bikin Awet Muda || Cara Mudah Awet Muda?!,https://i.ytimg.com/vi/SYYg4AGYzFo/default.jpg,https://i.ytimg.com/vi/SYYg4AGYzFo/mqdefault.jpg,https://i.ytimg.com/vi/SYYg4AGYzFo/hqdefault.jpg
aR12lVMI8mU,"Review Shu Uemura 3D Face Shaper, Powder + Highlighter Viral Langganan Artis",https://i.ytimg.com/vi/aR12lVMI8mU/default.jpg,https://i.ytimg.com/vi/aR12lVMI8mU/mqdefault.jpg,https://i.ytimg.com/vi/aR12lVMI8mU/hqdefault.jpg
ld6jspBRbf8,"Review PureHeals Centella 80 Eye Cream, Beneran Ampih Hilangin Kantung Mata dan Milia!",https://i.ytimg.com/vi/ld6jspBRbf8/default.jpg,https://i.ytimg.com/vi/ld6jspBRbf8/mqdefault.jpg,https://i.ytimg.com/vi/ld6jspBRbf8/hqdefault.jpg
7-R6RsYEa7E,Kesalahan Mengatasi Jerawat yang Bisa Bikin Tambah Parah || Jangan Sembarangan Melakukan Ini!!!,https://i.ytimg.com/vi/7-R6RsYEa7E/default.jpg,https://i.ytimg.com/vi/7-R6RsYEa7E/mqdefault.jpg,https://i.ytimg.com/vi/7-R6RsYEa7E/hqdefault.jpg
VI_krz0QP5M,Cara Mudah Mengukur Baju Wanita yang Benar agar Tidak Salah Beli Baju! Wajib Tahu!,https://i.ytimg.com/vi/VI_krz0QP5M/default.jpg,https://i.ytimg.com/vi/VI_krz0QP5M/mqdefault.jpg,https://i.ytimg.com/vi/VI_krz0QP5M/hqdefault.jpg
lGomkA-DozU,Pilihan Shampoo Terbaik Atasi Rambut Lepek!!!,https://i.ytimg.com/vi/lGomkA-DozU/default.jpg,https://i.ytimg.com/vi/lGomkA-DozU/mqdefault.jpg,https://i.ytimg.com/vi/lGomkA-DozU/hqdefault.jpg
N-T2si1kPeQ,3 TUTORIAL HIJAB PASHMINA SUPER SIMPLE DAN KEKINIAN UNTUK SEHARI-HARI!!,https://i.ytimg.com/vi/N-T2si1kPeQ/default.jpg,https://i.ytimg.com/vi/N-T2si1kPeQ/mqdefault.jpg,https://i.ytimg.com/vi/N-T2si1kPeQ/hqdefault.jpg
Hy9FKz-VHNQ,"3 Rekomendasi Sunscreen untuk Kulit Berminyak dan Berjerawat, Ringan Banget di Wajah!",https://i.ytimg.com/vi/Hy9FKz-VHNQ/default.jpg,https://i.ytimg.com/vi/Hy9FKz-VHNQ/mqdefault.jpg,https://i.ytimg.com/vi/Hy9FKz-VHNQ/hqdefault.jpg
GnOqYuKv-LQ,"3 Rekomendasi Lipstik Artis Berkualitas di Bawah 150 Ribu, Ada Punya Nagita Slavina!",https://i.ytimg.com/vi/GnOqYuKv-LQ/default.jpg,https://i.ytimg.com/vi/GnOqYuKv-LQ/mqdefault.jpg,https://i.ytimg.com/vi/GnOqYuKv-LQ/hqdefault.jpg
ztqcxpINi1A,"Review Skeeneeds Hyaluronic Acid Sunscreen Mist SPF 35, Suncreen Spray Wajib Punya Nih!!",https://i.ytimg.com/vi/ztqcxpINi1A/default.jpg,https://i.ytimg.com/vi/ztqcxpINi1A/mqdefault.jpg,https://i.ytimg.com/vi/ztqcxpINi1A/hqdefault.jpg
6GnWzkzNnb8,"Review & Swatches Lira Lip Matte Stick SADA By Cathy Sharon, Kaget Banget Sama Hasilnya!",https://i.ytimg.com/vi/6GnWzkzNnb8/default.jpg,https://i.ytimg.com/vi/6GnWzkzNnb8/mqdefault.jpg,https://i.ytimg.com/vi/6GnWzkzNnb8/hqdefault.jpg
aXpSU9FvtZU,"Review Lipstick Satin Nagita Slavina Cosmetics yang Lagi Viral, Bagaimana Sih Kualitasnya?!",https://i.ytimg.com/vi/aXpSU9FvtZU/default.jpg,https://i.ytimg.com/vi/aXpSU9FvtZU/mqdefault.jpg,https://i.ytimg.com/vi/aXpSU9FvtZU/hqdefault.jpg
CYJoK570Y2M,Review Gentle Hour Brighter Days Exfoliating Toner + Hasil Pemakaian 2 Minggu!,https://i.ytimg.com/vi/CYJoK570Y2M/default.jpg,https://i.ytimg.com/vi/CYJoK570Y2M/mqdefault.jpg,https://i.ytimg.com/vi/CYJoK570Y2M/hqdefault.jpg
w8tNdtMf6A8,"Review Herborist Aloe Vera di Kulit Sensitive, Cek Kualitasnya!",https://i.ytimg.com/vi/w8tNdtMf6A8/default.jpg,https://i.ytimg.com/vi/w8tNdtMf6A8/mqdefault.jpg,https://i.ytimg.com/vi/w8tNdtMf6A8/hqdefault.jpg
GXdtSzNZDyw,Review Jarte Cica Care Cream Moisturizer di Kulit Berminyak || Cocok Gak Sih???,https://i.ytimg.com/vi/GXdtSzNZDyw/default.jpg,https://i.ytimg.com/vi/GXdtSzNZDyw/mqdefault.jpg,https://i.ytimg.com/vi/GXdtSzNZDyw/hqdefault.jpg
wZi7DFEdRkg,"Review Serum True To Skin Bakuchiol di Kulit Berjerawat, Bisa Jadi Pengganti Retinol?!",https://i.ytimg.com/vi/wZi7DFEdRkg/default.jpg,https://i.ytimg.com/vi/wZi7DFEdRkg/mqdefault.jpg,https://i.ytimg.com/vi/wZi7DFEdRkg/hqdefault.jpg
m7oAWaZIZUc,"Cobain Sunscreen Viral! Review Sunscreen Carasun SPF 45, Harganya Dibawah 100 Ribu!!",https://i.ytimg.com/vi/m7oAWaZIZUc/default.jpg,https://i.ytimg.com/vi/m7oAWaZIZUc/mqdefault.jpg,https://i.ytimg.com/vi/m7oAWaZIZUc/hqdefault.jpg
BeF753p5Bys,Review Luxcrime Blur & Cover Two Way Cake Powder || Coveragenya Wow Banget!!!,https://i.ytimg.com/vi/BeF753p5Bys/default.jpg,https://i.ytimg.com/vi/BeF753p5Bys/mqdefault.jpg,https://i.ytimg.com/vi/BeF753p5Bys/hqdefault.jpg
FrrwJ_QCP6Y,3 Rekomendasi Sleeping Mask di Bawah 50 Ribu yang Bisa Menghilangkan Jerawat dan Bikin Awet Muda,https://i.ytimg.com/vi/FrrwJ_QCP6Y/default.jpg,https://i.ytimg.com/vi/FrrwJ_QCP6Y/mqdefault.jpg,https://i.ytimg.com/vi/FrrwJ_QCP6Y/hqdefault.jpg
Q7jEv3Em8ro,"3 Cara Mudah Menghilangkan Gigi Kuning agar Kembali Putih, Wajib Coba!",https://i.ytimg.com/vi/Q7jEv3Em8ro/default.jpg,https://i.ytimg.com/vi/Q7jEv3Em8ro/mqdefault.jpg,https://i.ytimg.com/vi/Q7jEv3Em8ro/hqdefault.jpg
s9ZPPGryLwc,Cara Tepat Merawat Rambut untuk Pengguna Hijab || Ternyata Begini Caranya !!!,https://i.ytimg.com/vi/s9ZPPGryLwc/default.jpg,https://i.ytimg.com/vi/s9ZPPGryLwc/mqdefault.jpg,https://i.ytimg.com/vi/s9ZPPGryLwc/hqdefault.jpg
ukaMRRfWwe8,3 Rekomendasi Cleansing Balm Lokal yang Ampuh Angkat Makeup,https://i.ytimg.com/vi/ukaMRRfWwe8/default.jpg,https://i.ytimg.com/vi/ukaMRRfWwe8/mqdefault.jpg,https://i.ytimg.com/vi/ukaMRRfWwe8/hqdefault.jpg
ba57AwcvFLc,"Battle Body Lotion Lokal  vs  Luar Negeri! Scarlett Whitening, Wardah, Cathy Doll, Nivea!!!",https://i.ytimg.com/vi/ba57AwcvFLc/default.jpg,https://i.ytimg.com/vi/ba57AwcvFLc/mqdefault.jpg,https://i.ytimg.com/vi/ba57AwcvFLc/hqdefault.jpg
uy7CXZDcEno,4 Rekomendasi Face Mist yang Ampuh Melembapkan Kulit dan Sudah Lulus Uji BPOM!,https://i.ytimg.com/vi/uy7CXZDcEno/default.jpg,https://i.ytimg.com/vi/uy7CXZDcEno/mqdefault.jpg,https://i.ytimg.com/vi/uy7CXZDcEno/hqdefault.jpg
BWAjtrbTaeM,Rekomendasi Sunscreen SPF 30 || Di Rumah Aja Harus Pakai Sunscreen?!,https://i.ytimg.com/vi/BWAjtrbTaeM/default.jpg,https://i.ytimg.com/vi/BWAjtrbTaeM/mqdefault.jpg,https://i.ytimg.com/vi/BWAjtrbTaeM/hqdefault.jpg
MygZVB-Aa7M,Trik Menggunakan Makeup untuk Kulit Berminyak agar Tahan Lama Seharian,https://i.ytimg.com/vi/MygZVB-Aa7M/default.jpg,https://i.ytimg.com/vi/MygZVB-Aa7M/mqdefault.jpg,https://i.ytimg.com/vi/MygZVB-Aa7M/hqdefault.jpg
97sKExF8VB4,Cara Menghilangkan Panu dengan Cepat Menggunakan Bahan Alami,https://i.ytimg.com/vi/97sKExF8VB4/default.jpg,https://i.ytimg.com/vi/97sKExF8VB4/mqdefault.jpg,https://i.ytimg.com/vi/97sKExF8VB4/hqdefault.jpg
Yz6o5KFVkQc,"Cara Melentikan Bulu Mata tanpa Menggunakan Maskara, Hasilnya Seperti Eyelash Extension",https://i.ytimg.com/vi/Yz6o5KFVkQc/default.jpg,https://i.ytimg.com/vi/Yz6o5KFVkQc/mqdefault.jpg,https://i.ytimg.com/vi/Yz6o5KFVkQc/hqdefault.jpg
eNEV1_0kSQE,Rekomendasi Serum AHA BHA PHA Mulai Rp 20 Ribuan untuk Eksfoliasi,https://i.ytimg.com/vi/eNEV1_0kSQE/default.jpg,https://i.ytimg.com/vi/eNEV1_0kSQE/mqdefault.jpg,https://i.ytimg.com/vi/eNEV1_0kSQE/hqdefault.jpg
Wz2Lbx8Jtl8,4 Pilihan Sunscreen Viral 2021 di Kalangan Skincare Junkie,https://i.ytimg.com/vi/Wz2Lbx8Jtl8/default.jpg,https://i.ytimg.com/vi/Wz2Lbx8Jtl8/mqdefault.jpg,https://i.ytimg.com/vi/Wz2Lbx8Jtl8/hqdefault.jpg
e9xXDJvocdc,Body Lotion untuk Menghilangkan Bekas Luka || Kok Bisa?!,https://i.ytimg.com/vi/e9xXDJvocdc/default.jpg,https://i.ytimg.com/vi/e9xXDJvocdc/mqdefault.jpg,https://i.ytimg.com/vi/e9xXDJvocdc/hqdefault.jpg
rRF2Pi0l8Vg,"Tips dan Teknik Membuat Foundation Tahan Lama dan Maskproof di Wajah, Mudah Banget!",https://i.ytimg.com/vi/rRF2Pi0l8Vg/default.jpg,https://i.ytimg.com/vi/rRF2Pi0l8Vg/mqdefault.jpg,https://i.ytimg.com/vi/rRF2Pi0l8Vg/hqdefault.jpg
scZitbo8brU,4 Rekomendasi Sunscreen SPF 50 di Bawah Rp 100 Ribu || Beneran Murah Meriah!,https://i.ytimg.com/vi/scZitbo8brU/default.jpg,https://i.ytimg.com/vi/scZitbo8brU/mqdefault.jpg,https://i.ytimg.com/vi/scZitbo8brU/hqdefault.jpg
0683fY55hCM,"Review Silkygirl No Sebum Blotting Pact, Bedak Ampuh Bisa Menghilangkan Minyak!",https://i.ytimg.com/vi/0683fY55hCM/default.jpg,https://i.ytimg.com/vi/0683fY55hCM/mqdefault.jpg,https://i.ytimg.com/vi/0683fY55hCM/hqdefault.jpg
4AzcI5eAkoI,Penyebab Kulit Sulit Glowing Karena Makan ini?! | Kok Bisa?!,https://i.ytimg.com/vi/4AzcI5eAkoI/default.jpg,https://i.ytimg.com/vi/4AzcI5eAkoI/mqdefault.jpg,https://i.ytimg.com/vi/4AzcI5eAkoI/hqdefault.jpg
Kp0HfVzIzRA,"Rekomendasi Highlighter Stick Murah || Harga Murah, Kualitasnya?!",https://i.ytimg.com/vi/Kp0HfVzIzRA/default.jpg,https://i.ytimg.com/vi/Kp0HfVzIzRA/mqdefault.jpg,https://i.ytimg.com/vi/Kp0HfVzIzRA/hqdefault.jpg
Yg8b5_yAU-Y,Review Esqa x Wonder Woman Confident Cheek Palette,https://i.ytimg.com/vi/Yg8b5_yAU-Y/default.jpg,https://i.ytimg.com/vi/Yg8b5_yAU-Y/mqdefault.jpg,https://i.ytimg.com/vi/Yg8b5_yAU-Y/hqdefault.jpg
Te0t8Z2aPJs,Body Serum untuk Mencerahkan Kulit Kusam || Ampuh Bikin Glowing?!,https://i.ytimg.com/vi/Te0t8Z2aPJs/default.jpg,https://i.ytimg.com/vi/Te0t8Z2aPJs/mqdefault.jpg,https://i.ytimg.com/vi/Te0t8Z2aPJs/hqdefault.jpg
gEWCn4QX1Hg,Trik Membuat Wajah Kencang dan Awet Muda Hanya Pakai Concealer,https://i.ytimg.com/vi/gEWCn4QX1Hg/default.jpg,https://i.ytimg.com/vi/gEWCn4QX1Hg/mqdefault.jpg,https://i.ytimg.com/vi/gEWCn4QX1Hg/hqdefault.jpg
LzAJ5bHBBYM,Rekomendasi Masker Rambut Fenomenal yang Bikin Halus Hingga ke Pangkalnya,https://i.ytimg.com/vi/LzAJ5bHBBYM/default.jpg,https://i.ytimg.com/vi/LzAJ5bHBBYM/mqdefault.jpg,https://i.ytimg.com/vi/LzAJ5bHBBYM/hqdefault.jpg
lFTDVp1FdM8,3 Rekomendasi Peeling Serum Lokal Viral || Ampuh Bikin Kulit Glowing,https://i.ytimg.com/vi/lFTDVp1FdM8/default.jpg,https://i.ytimg.com/vi/lFTDVp1FdM8/mqdefault.jpg,https://i.ytimg.com/vi/lFTDVp1FdM8/hqdefault.jpg
yqdVtyjkOtU,Viral 3 Beauty Hacks TikTok dari Melentikan Bulu Mata Hingga Contouring Wajah,https://i.ytimg.com/vi/yqdVtyjkOtU/default.jpg,https://i.ytimg.com/vi/yqdVtyjkOtU/mqdefault.jpg,https://i.ytimg.com/vi/yqdVtyjkOtU/hqdefault.jpg
ncPnrm3ftSQ,Rekomendasi Serum Alpha Arbutin untuk Mencerahkan Kulit,https://i.ytimg.com/vi/ncPnrm3ftSQ/default.jpg,https://i.ytimg.com/vi/ncPnrm3ftSQ/mqdefault.jpg,https://i.ytimg.com/vi/ncPnrm3ftSQ/hqdefault.jpg
jLUeVGG3uKY,Rekomendasi Concealer Bagus dan Tahan Lama di Bawah Rp 50 Ribu,https://i.ytimg.com/vi/jLUeVGG3uKY/default.jpg,https://i.ytimg.com/vi/jLUeVGG3uKY/mqdefault.jpg,https://i.ytimg.com/vi/jLUeVGG3uKY/hqdefault.jpg
iBfslZObIJc,"3 Inspirasi Gaya Hijab Syahrini yang Feminin, Simpel dan Elegan, Mudah Banget!",https://i.ytimg.com/vi/iBfslZObIJc/default.jpg,https://i.ytimg.com/vi/iBfslZObIJc/mqdefault.jpg,https://i.ytimg.com/vi/iBfslZObIJc/hqdefault.jpg
r0TRZCqrTxE,3 Rekomendasi Maskara di Bawah 100 Ribu Dijamin Lentik dan Waterproof,https://i.ytimg.com/vi/r0TRZCqrTxE/default.jpg,https://i.ytimg.com/vi/r0TRZCqrTxE/mqdefault.jpg,https://i.ytimg.com/vi/r0TRZCqrTxE/hqdefault.jpg
t0XhQPxOPTc,BIKIN ALIS ANTI TERLIHAT TUA! TUTORIAL GAMBAR ALIS TEBAL DAN NATURAL,https://i.ytimg.com/vi/t0XhQPxOPTc/default.jpg,https://i.ytimg.com/vi/t0XhQPxOPTc/mqdefault.jpg,https://i.ytimg.com/vi/t0XhQPxOPTc/hqdefault.jpg
dUen1YzW4T8,Rekomendasi Korset Langsing Pembakar Lemak || Cepat Langsing Cuma Pakai Korset?!,https://i.ytimg.com/vi/dUen1YzW4T8/default.jpg,https://i.ytimg.com/vi/dUen1YzW4T8/mqdefault.jpg,https://i.ytimg.com/vi/dUen1YzW4T8/hqdefault.jpg
Z8LY9jWrhyg,REVIEW SOJI NATURAL SUGAR WAX || TERNYATA BENERAN NATURAL GAK BIKIN IRITASI!,https://i.ytimg.com/vi/Z8LY9jWrhyg/default.jpg,https://i.ytimg.com/vi/Z8LY9jWrhyg/mqdefault.jpg,https://i.ytimg.com/vi/Z8LY9jWrhyg/hqdefault.jpg
9wIqRfp-mds,Rekomendasi 5 Obat Produk Panu untuk Di Tubuh dan Di Wajah || Di Wajah Juga Bisa?!,https://i.ytimg.com/vi/9wIqRfp-mds/default.jpg,https://i.ytimg.com/vi/9wIqRfp-mds/mqdefault.jpg,https://i.ytimg.com/vi/9wIqRfp-mds/hqdefault.jpg
nqp3YZNYTOA,Review Natur Aloe Vera Hair Tonic,https://i.ytimg.com/vi/nqp3YZNYTOA/default.jpg,https://i.ytimg.com/vi/nqp3YZNYTOA/mqdefault.jpg,https://i.ytimg.com/vi/nqp3YZNYTOA/hqdefault.jpg
vJWG77Wb2zo,"REVIEW HAND CREAM LOVE BEAUTY AND PLANET, CEPAT MERESAP & GAK LENGKET DI KULIT!",https://i.ytimg.com/vi/vJWG77Wb2zo/default.jpg,https://i.ytimg.com/vi/vJWG77Wb2zo/mqdefault.jpg,https://i.ytimg.com/vi/vJWG77Wb2zo/hqdefault.jpg
sl7zk63r7Sw,Inilah Pijatan di Wajah yang Bisa Membuat Wajah Selalu Awet Muda,https://i.ytimg.com/vi/sl7zk63r7Sw/default.jpg,https://i.ytimg.com/vi/sl7zk63r7Sw/mqdefault.jpg,https://i.ytimg.com/vi/sl7zk63r7Sw/hqdefault.jpg
aFF_a5WUVMM,KESALAHAN PENGGUNAAN CONCEALER DAN BLUSH ON + CARA APLIKASI YANG BENAR!,https://i.ytimg.com/vi/aFF_a5WUVMM/default.jpg,https://i.ytimg.com/vi/aFF_a5WUVMM/mqdefault.jpg,https://i.ytimg.com/vi/aFF_a5WUVMM/hqdefault.jpg
xuvRL2vO05Y,Serum Vitamin C Ampuh Menghilangkan Flek Hitam dan Kulit Kusam di Bawah 150 Ribu Rupiah,https://i.ytimg.com/vi/xuvRL2vO05Y/default.jpg,https://i.ytimg.com/vi/xuvRL2vO05Y/mqdefault.jpg,https://i.ytimg.com/vi/xuvRL2vO05Y/hqdefault.jpg
xRnxqpxbO8g,"CARA MUDAH STYLE CURTAIN BANGS, CUMA PERLU 2 ALAT!",https://i.ytimg.com/vi/xRnxqpxbO8g/default.jpg,https://i.ytimg.com/vi/xRnxqpxbO8g/mqdefault.jpg,https://i.ytimg.com/vi/xRnxqpxbO8g/hqdefault.jpg
3mw3zg-JnSs,"CARA MEMBUAT BLUSH ON DARI EYE SHADOW, CUMA BUTUH 2 BAHAN?! PRAKTIS BANGET!",https://i.ytimg.com/vi/3mw3zg-JnSs/default.jpg,https://i.ytimg.com/vi/3mw3zg-JnSs/mqdefault.jpg,https://i.ytimg.com/vi/3mw3zg-JnSs/hqdefault.jpg
aGSJ66vM5ro,5 REKOMENDASI FOUNDATION UNTUK KULIT BERJERAWAT || BISA MENGHILANGKAN JERAWAT?!,https://i.ytimg.com/vi/aGSJ66vM5ro/default.jpg,https://i.ytimg.com/vi/aGSJ66vM5ro/mqdefault.jpg,https://i.ytimg.com/vi/aGSJ66vM5ro/hqdefault.jpg
WoV9_VSmUjU,Review Sunscreen La Roche Posay Anthelios Dry Touch Finish Mattifying Effect untuk Kulit Berminyak,https://i.ytimg.com/vi/WoV9_VSmUjU/default.jpg,https://i.ytimg.com/vi/WoV9_VSmUjU/mqdefault.jpg,https://i.ytimg.com/vi/WoV9_VSmUjU/hqdefault.jpg
8-JKqzhE4IY,"Cara Mudah Membuat Produk Makeup yang Hancur Jadi Kembali Padat, Wajib Coba",https://i.ytimg.com/vi/8-JKqzhE4IY/default.jpg,https://i.ytimg.com/vi/8-JKqzhE4IY/mqdefault.jpg,https://i.ytimg.com/vi/8-JKqzhE4IY/hqdefault.jpg
g4micwvQW2Q,BATTLE HAND CREAM THE BODY SHOP VS LOVE BEAUTY AND PLANET,https://i.ytimg.com/vi/g4micwvQW2Q/default.jpg,https://i.ytimg.com/vi/g4micwvQW2Q/mqdefault.jpg,https://i.ytimg.com/vi/g4micwvQW2Q/hqdefault.jpg
MHYeprNXYPI,"CARA MUDAH BUAT WARNA BLUSH ON SESUAI TONE KULIT, CUMAN 2 MENIT AJA!",https://i.ytimg.com/vi/MHYeprNXYPI/default.jpg,https://i.ytimg.com/vi/MHYeprNXYPI/mqdefault.jpg,https://i.ytimg.com/vi/MHYeprNXYPI/hqdefault.jpg
MHUV0m02axk,Maskara Hacks dari TikTok! Teknik Menggunakan Maskara agar Terlihat Lentik dan Tebal,https://i.ytimg.com/vi/MHUV0m02axk/default.jpg,https://i.ytimg.com/vi/MHUV0m02axk/mqdefault.jpg,https://i.ytimg.com/vi/MHUV0m02axk/hqdefault.jpg
_7T3hRyguA8,"Jangan Asal Pakai, Inilah Perbedaan Powder Blush dan Cream Blush",https://i.ytimg.com/vi/_7T3hRyguA8/default.jpg,https://i.ytimg.com/vi/_7T3hRyguA8/mqdefault.jpg,https://i.ytimg.com/vi/_7T3hRyguA8/hqdefault.jpg
