ID,TITLE,THUMBNAIL1,THUMBNAIL2,THUMBNAIL3
ttcGZI8V2lk,VR roller coaster thrill ride,https://i.ytimg.com/vi/ttcGZI8V2lk/default.jpg,https://i.ytimg.com/vi/ttcGZI8V2lk/mqdefault.jpg,https://i.ytimg.com/vi/ttcGZI8V2lk/hqdefault.jpg
pf5xZilhJsg,VR Bask in the glory of Joshua Tree National Park,https://i.ytimg.com/vi/pf5xZilhJsg/default.jpg,https://i.ytimg.com/vi/pf5xZilhJsg/mqdefault.jpg,https://i.ytimg.com/vi/pf5xZilhJsg/hqdefault.jpg
8eRe921IGNM,VR Explore countless ways to get around Hong Kong,https://i.ytimg.com/vi/8eRe921IGNM/default.jpg,https://i.ytimg.com/vi/8eRe921IGNM/mqdefault.jpg,https://i.ytimg.com/vi/8eRe921IGNM/hqdefault.jpg
AZ7TzK1bbzI,Paraglide the Pacific Coast in VR,https://i.ytimg.com/vi/AZ7TzK1bbzI/default.jpg,https://i.ytimg.com/vi/AZ7TzK1bbzI/mqdefault.jpg,https://i.ytimg.com/vi/AZ7TzK1bbzI/hqdefault.jpg
thSyu6DzEcs,Explore Yosemite with Ken Burns in 360 degrees,https://i.ytimg.com/vi/thSyu6DzEcs/default.jpg,https://i.ytimg.com/vi/thSyu6DzEcs/mqdefault.jpg,https://i.ytimg.com/vi/thSyu6DzEcs/hqdefault.jpg
5fkUSp6OCg4,Ride the world's tallest roller coaster in 360 degrees,https://i.ytimg.com/vi/5fkUSp6OCg4/default.jpg,https://i.ytimg.com/vi/5fkUSp6OCg4/mqdefault.jpg,https://i.ytimg.com/vi/5fkUSp6OCg4/hqdefault.jpg
0R7Dsf2ylMQ,VR Explore Badlands National Park in 360 degrees,https://i.ytimg.com/vi/0R7Dsf2ylMQ/default.jpg,https://i.ytimg.com/vi/0R7Dsf2ylMQ/mqdefault.jpg,https://i.ytimg.com/vi/0R7Dsf2ylMQ/hqdefault.jpg
AgWx6QlgjvA,VR soar in a hot air balloon over New Mexico,https://i.ytimg.com/vi/AgWx6QlgjvA/default.jpg,https://i.ytimg.com/vi/AgWx6QlgjvA/mqdefault.jpg,https://i.ytimg.com/vi/AgWx6QlgjvA/hqdefault.jpg
2tj3CXEsmyY,VR highline over an Arizona canyon,https://i.ytimg.com/vi/2tj3CXEsmyY/default.jpg,https://i.ytimg.com/vi/2tj3CXEsmyY/mqdefault.jpg,https://i.ytimg.com/vi/2tj3CXEsmyY/hqdefault.jpg
YW2fXIb3pYY,Story from The 2017 Camry | Autumn adventures abound in New England,https://i.ytimg.com/vi/YW2fXIb3pYY/default.jpg,https://i.ytimg.com/vi/YW2fXIb3pYY/mqdefault.jpg,https://i.ytimg.com/vi/YW2fXIb3pYY/hqdefault.jpg
mSdiGi60svY,Story from The 2017 Camry | Estonia beckons the intrepid traveler,https://i.ytimg.com/vi/mSdiGi60svY/default.jpg,https://i.ytimg.com/vi/mSdiGi60svY/mqdefault.jpg,https://i.ytimg.com/vi/mSdiGi60svY/hqdefault.jpg
7cQqtJslTZ8,Story from The 2017 Camry | Western Australia is the bold destination you shouldn’t miss,https://i.ytimg.com/vi/7cQqtJslTZ8/default.jpg,https://i.ytimg.com/vi/7cQqtJslTZ8/mqdefault.jpg,https://i.ytimg.com/vi/7cQqtJslTZ8/hqdefault.jpg
BTfqKHy0F6E,Flights resume as Delta investigates computer glitch,https://i.ytimg.com/vi/BTfqKHy0F6E/default.jpg,https://i.ytimg.com/vi/BTfqKHy0F6E/mqdefault.jpg,https://i.ytimg.com/vi/BTfqKHy0F6E/hqdefault.jpg
CSZkcR3_DGA,360 video: Ride a mule down the Grand Canyon,https://i.ytimg.com/vi/CSZkcR3_DGA/default.jpg,https://i.ytimg.com/vi/CSZkcR3_DGA/mqdefault.jpg,https://i.ytimg.com/vi/CSZkcR3_DGA/hqdefault.jpg
JncuSTrx2p4,360 video: Experience the sights and sounds of Rio's Opening ceremony,https://i.ytimg.com/vi/JncuSTrx2p4/default.jpg,https://i.ytimg.com/vi/JncuSTrx2p4/mqdefault.jpg,https://i.ytimg.com/vi/JncuSTrx2p4/hqdefault.jpg
TyY2ZWrP2Ag,Take a piece of 'Star Wars' with you from Disney,https://i.ytimg.com/vi/TyY2ZWrP2Ag/default.jpg,https://i.ytimg.com/vi/TyY2ZWrP2Ag/mqdefault.jpg,https://i.ytimg.com/vi/TyY2ZWrP2Ag/hqdefault.jpg
otct7BFV8Js,Rescued sea lions find happy home at Georgia Aquarium,https://i.ytimg.com/vi/otct7BFV8Js/default.jpg,https://i.ytimg.com/vi/otct7BFV8Js/mqdefault.jpg,https://i.ytimg.com/vi/otct7BFV8Js/hqdefault.jpg
xfXIooXh6ow,‘Go-to-the-sun’ and climb mountains at Glacier National Park,https://i.ytimg.com/vi/xfXIooXh6ow/default.jpg,https://i.ytimg.com/vi/xfXIooXh6ow/mqdefault.jpg,https://i.ytimg.com/vi/xfXIooXh6ow/hqdefault.jpg
k6Cje514PZk,360 video: Sift through Death Valley's sand dunes in 360 degrees,https://i.ytimg.com/vi/k6Cje514PZk/default.jpg,https://i.ytimg.com/vi/k6Cje514PZk/mqdefault.jpg,https://i.ytimg.com/vi/k6Cje514PZk/hqdefault.jpg
KpF8O-0kGao,Watch Old Faithful's epic eruption in 360 degrees at Yellowstone National Park,https://i.ytimg.com/vi/KpF8O-0kGao/default.jpg,https://i.ytimg.com/vi/KpF8O-0kGao/mqdefault.jpg,https://i.ytimg.com/vi/KpF8O-0kGao/hqdefault.jpg
4vzyEWLj7vM,Puerto Vallarta's Malecon tour in 360,https://i.ytimg.com/vi/4vzyEWLj7vM/default.jpg,https://i.ytimg.com/vi/4vzyEWLj7vM/mqdefault.jpg,https://i.ytimg.com/vi/4vzyEWLj7vM/hqdefault.jpg
Vs0kqtiz3jY,Avoid hotel annoyances with these tips,https://i.ytimg.com/vi/Vs0kqtiz3jY/default.jpg,https://i.ytimg.com/vi/Vs0kqtiz3jY/mqdefault.jpg,https://i.ytimg.com/vi/Vs0kqtiz3jY/hqdefault.jpg
aDGSkmbrNJM,360-degree video of Philadelphia sledding after winter storm Jonas,https://i.ytimg.com/vi/aDGSkmbrNJM/default.jpg,https://i.ytimg.com/vi/aDGSkmbrNJM/mqdefault.jpg,https://i.ytimg.com/vi/aDGSkmbrNJM/hqdefault.jpg
kBT_55MAKdA,Experience Cuba in 360 degrees (Español),https://i.ytimg.com/vi/kBT_55MAKdA/default.jpg,https://i.ytimg.com/vi/kBT_55MAKdA/mqdefault.jpg,https://i.ytimg.com/vi/kBT_55MAKdA/hqdefault.jpg
9ZRkUAufZCY,Experience Cuba in 360-degrees (English),https://i.ytimg.com/vi/9ZRkUAufZCY/default.jpg,https://i.ytimg.com/vi/9ZRkUAufZCY/mqdefault.jpg,https://i.ytimg.com/vi/9ZRkUAufZCY/hqdefault.jpg
LvFgTPZ1Diw,Tearful flight attendant recalls time with US Airways,https://i.ytimg.com/vi/LvFgTPZ1Diw/default.jpg,https://i.ytimg.com/vi/LvFgTPZ1Diw/mqdefault.jpg,https://i.ytimg.com/vi/LvFgTPZ1Diw/hqdefault.jpg
qd0C5SODB5E,These 5 cities hate tourists the most,https://i.ytimg.com/vi/qd0C5SODB5E/default.jpg,https://i.ytimg.com/vi/qd0C5SODB5E/mqdefault.jpg,https://i.ytimg.com/vi/qd0C5SODB5E/hqdefault.jpg
rT_c5JHOKl8,Long flight? Tips to get your snacks through security,https://i.ytimg.com/vi/rT_c5JHOKl8/default.jpg,https://i.ytimg.com/vi/rT_c5JHOKl8/mqdefault.jpg,https://i.ytimg.com/vi/rT_c5JHOKl8/hqdefault.jpg
y6ZzcvKiqcQ,This is a marriage made in fried food heaven,https://i.ytimg.com/vi/y6ZzcvKiqcQ/default.jpg,https://i.ytimg.com/vi/y6ZzcvKiqcQ/mqdefault.jpg,https://i.ytimg.com/vi/y6ZzcvKiqcQ/hqdefault.jpg
XklAlNVYEoE,This is New York's version of Key West,https://i.ytimg.com/vi/XklAlNVYEoE/default.jpg,https://i.ytimg.com/vi/XklAlNVYEoE/mqdefault.jpg,https://i.ytimg.com/vi/XklAlNVYEoE/hqdefault.jpg
OAfoap8SJ3U,Go underwater on a shark tagging adventure!,https://i.ytimg.com/vi/OAfoap8SJ3U/default.jpg,https://i.ytimg.com/vi/OAfoap8SJ3U/mqdefault.jpg,https://i.ytimg.com/vi/OAfoap8SJ3U/hqdefault.jpg
SPhIDLmTrgc,Are you guilty of believing these 5 shark myths?,https://i.ytimg.com/vi/SPhIDLmTrgc/default.jpg,https://i.ytimg.com/vi/SPhIDLmTrgc/mqdefault.jpg,https://i.ytimg.com/vi/SPhIDLmTrgc/hqdefault.jpg
KlwPy1M5Ccc,Experience new T3 roller coaster at Kentucky Kingdom,https://i.ytimg.com/vi/KlwPy1M5Ccc/default.jpg,https://i.ytimg.com/vi/KlwPy1M5Ccc/mqdefault.jpg,https://i.ytimg.com/vi/KlwPy1M5Ccc/hqdefault.jpg
kVN4kBBFu-M,Awesome 4th of July Fireworks to watch this weekend,https://i.ytimg.com/vi/kVN4kBBFu-M/default.jpg,https://i.ytimg.com/vi/kVN4kBBFu-M/mqdefault.jpg,https://i.ytimg.com/vi/kVN4kBBFu-M/hqdefault.jpg
yq1nR6XurS8,The top gourmet products at the Summer Fancy Food Show,https://i.ytimg.com/vi/yq1nR6XurS8/default.jpg,https://i.ytimg.com/vi/yq1nR6XurS8/mqdefault.jpg,https://i.ytimg.com/vi/yq1nR6XurS8/hqdefault.jpg
x2SenZA73Ac,Watch Boeing 787-9 Dreamliner in aerial acrobatic display,https://i.ytimg.com/vi/x2SenZA73Ac/default.jpg,https://i.ytimg.com/vi/x2SenZA73Ac/mqdefault.jpg,https://i.ytimg.com/vi/x2SenZA73Ac/hqdefault.jpg
quzpDzrF0aU,Take a ride on the 'Jack Rabbit' at Seabreeze,https://i.ytimg.com/vi/quzpDzrF0aU/default.jpg,https://i.ytimg.com/vi/quzpDzrF0aU/mqdefault.jpg,https://i.ytimg.com/vi/quzpDzrF0aU/hqdefault.jpg
4RnBda4zrto,Flying five times the speed of sound? X-51 tests make it possible,https://i.ytimg.com/vi/4RnBda4zrto/default.jpg,https://i.ytimg.com/vi/4RnBda4zrto/mqdefault.jpg,https://i.ytimg.com/vi/4RnBda4zrto/hqdefault.jpg
VrQ685Xnox8,How to get a great view of NYC,https://i.ytimg.com/vi/VrQ685Xnox8/default.jpg,https://i.ytimg.com/vi/VrQ685Xnox8/mqdefault.jpg,https://i.ytimg.com/vi/VrQ685Xnox8/hqdefault.jpg
PS3qri9yeJA,Your next family trip needs a four-story water slide,https://i.ytimg.com/vi/PS3qri9yeJA/default.jpg,https://i.ytimg.com/vi/PS3qri9yeJA/mqdefault.jpg,https://i.ytimg.com/vi/PS3qri9yeJA/hqdefault.jpg
fuzcGlVrQLY,Daredevil Nik Wallenda snaps selfie atop Orlando Eye,https://i.ytimg.com/vi/fuzcGlVrQLY/default.jpg,https://i.ytimg.com/vi/fuzcGlVrQLY/mqdefault.jpg,https://i.ytimg.com/vi/fuzcGlVrQLY/hqdefault.jpg
GGRadwJV0SE,Time-lapse: Nik Wallenda walks spinning Orlando Eye,https://i.ytimg.com/vi/GGRadwJV0SE/default.jpg,https://i.ytimg.com/vi/GGRadwJV0SE/mqdefault.jpg,https://i.ytimg.com/vi/GGRadwJV0SE/hqdefault.jpg
heTefZcM5UU,Pearl Dive brings coastal flavor to capital,https://i.ytimg.com/vi/heTefZcM5UU/default.jpg,https://i.ytimg.com/vi/heTefZcM5UU/mqdefault.jpg,https://i.ytimg.com/vi/heTefZcM5UU/hqdefault.jpg
5BQ4Ua_QQVg,Raw: New Thunderbird coaster keeps riders screaming,https://i.ytimg.com/vi/5BQ4Ua_QQVg/default.jpg,https://i.ytimg.com/vi/5BQ4Ua_QQVg/mqdefault.jpg,https://i.ytimg.com/vi/5BQ4Ua_QQVg/hqdefault.jpg
1zn4ORkP7tc,Unlikely passenger helps break in new 0-60 mph coaster,https://i.ytimg.com/vi/1zn4ORkP7tc/default.jpg,https://i.ytimg.com/vi/1zn4ORkP7tc/mqdefault.jpg,https://i.ytimg.com/vi/1zn4ORkP7tc/hqdefault.jpg
4735djWrJ-0,Thunderbird is nation's first launched wing coaster,https://i.ytimg.com/vi/4735djWrJ-0/default.jpg,https://i.ytimg.com/vi/4735djWrJ-0/mqdefault.jpg,https://i.ytimg.com/vi/4735djWrJ-0/hqdefault.jpg
REIQUwfej8I,Harness new coaster's twisty ways with front seat view,https://i.ytimg.com/vi/REIQUwfej8I/default.jpg,https://i.ytimg.com/vi/REIQUwfej8I/mqdefault.jpg,https://i.ytimg.com/vi/REIQUwfej8I/hqdefault.jpg
L73XaAFKUO0,'Biggest Loser' chef has tips to stay thin on vacation,https://i.ytimg.com/vi/L73XaAFKUO0/default.jpg,https://i.ytimg.com/vi/L73XaAFKUO0/mqdefault.jpg,https://i.ytimg.com/vi/L73XaAFKUO0/hqdefault.jpg
MXwT3t1R92Y,Save money on the road with these gas-saving tips,https://i.ytimg.com/vi/MXwT3t1R92Y/default.jpg,https://i.ytimg.com/vi/MXwT3t1R92Y/mqdefault.jpg,https://i.ytimg.com/vi/MXwT3t1R92Y/hqdefault.jpg
GMGArmnQaBo,Sail onto the water on Anthem of the Seas in 30 seconds,https://i.ytimg.com/vi/GMGArmnQaBo/default.jpg,https://i.ytimg.com/vi/GMGArmnQaBo/mqdefault.jpg,https://i.ytimg.com/vi/GMGArmnQaBo/hqdefault.jpg
U4UgqKMJ0Hk,Soar above Anthem of the Seas as it sets sail,https://i.ytimg.com/vi/U4UgqKMJ0Hk/default.jpg,https://i.ytimg.com/vi/U4UgqKMJ0Hk/mqdefault.jpg,https://i.ytimg.com/vi/U4UgqKMJ0Hk/hqdefault.jpg
3LsQW4_juxg,Airport worker's 911 call: 'I'm trapped in this plane',https://i.ytimg.com/vi/3LsQW4_juxg/default.jpg,https://i.ytimg.com/vi/3LsQW4_juxg/mqdefault.jpg,https://i.ytimg.com/vi/3LsQW4_juxg/hqdefault.jpg
OxBFpQDuRUc,Don't fall for these expensive airport food traps,https://i.ytimg.com/vi/OxBFpQDuRUc/default.jpg,https://i.ytimg.com/vi/OxBFpQDuRUc/mqdefault.jpg,https://i.ytimg.com/vi/OxBFpQDuRUc/hqdefault.jpg
J9cd1TEv1L8,TSA agents fired for conspiring to fondle passengers,https://i.ytimg.com/vi/J9cd1TEv1L8/default.jpg,https://i.ytimg.com/vi/J9cd1TEv1L8/mqdefault.jpg,https://i.ytimg.com/vi/J9cd1TEv1L8/hqdefault.jpg
q18-xfw5YiY,Sail through TSA screenings with these travel tips,https://i.ytimg.com/vi/q18-xfw5YiY/default.jpg,https://i.ytimg.com/vi/q18-xfw5YiY/mqdefault.jpg,https://i.ytimg.com/vi/q18-xfw5YiY/hqdefault.jpg
75YUGeNAJiw,What you may not know about booking a hotel,https://i.ytimg.com/vi/75YUGeNAJiw/default.jpg,https://i.ytimg.com/vi/75YUGeNAJiw/mqdefault.jpg,https://i.ytimg.com/vi/75YUGeNAJiw/hqdefault.jpg
xyPHyDveBKM,Why a train may be the way to go for your next trip,https://i.ytimg.com/vi/xyPHyDveBKM/default.jpg,https://i.ytimg.com/vi/xyPHyDveBKM/mqdefault.jpg,https://i.ytimg.com/vi/xyPHyDveBKM/hqdefault.jpg
lJKWlJpBprk,You won't BELIEVE where this honky tonk is located!,https://i.ytimg.com/vi/lJKWlJpBprk/default.jpg,https://i.ytimg.com/vi/lJKWlJpBprk/mqdefault.jpg,https://i.ytimg.com/vi/lJKWlJpBprk/hqdefault.jpg
PwcgLw6z-H0,Which city has the longest commute to work?,https://i.ytimg.com/vi/PwcgLw6z-H0/default.jpg,https://i.ytimg.com/vi/PwcgLw6z-H0/mqdefault.jpg,https://i.ytimg.com/vi/PwcgLw6z-H0/hqdefault.jpg
5MAZZzQSaD0,Avoid vacation rental nightmares with these simple tips,https://i.ytimg.com/vi/5MAZZzQSaD0/default.jpg,https://i.ytimg.com/vi/5MAZZzQSaD0/mqdefault.jpg,https://i.ytimg.com/vi/5MAZZzQSaD0/hqdefault.jpg
xtaD2O7ELaw,Take a furious ride on 'Fury 325' roller coaster,https://i.ytimg.com/vi/xtaD2O7ELaw/default.jpg,https://i.ytimg.com/vi/xtaD2O7ELaw/mqdefault.jpg,https://i.ytimg.com/vi/xtaD2O7ELaw/hqdefault.jpg
GfmWgFf4dEE,When to say YES to travel insurance,https://i.ytimg.com/vi/GfmWgFf4dEE/default.jpg,https://i.ytimg.com/vi/GfmWgFf4dEE/mqdefault.jpg,https://i.ytimg.com/vi/GfmWgFf4dEE/hqdefault.jpg
PUf6W0nvnYQ,"Spring break deals so low, you'll just have to go!",https://i.ytimg.com/vi/PUf6W0nvnYQ/default.jpg,https://i.ytimg.com/vi/PUf6W0nvnYQ/mqdefault.jpg,https://i.ytimg.com/vi/PUf6W0nvnYQ/hqdefault.jpg
3wojHalXtA8,5 things you need to know BEFORE you rent a car,https://i.ytimg.com/vi/3wojHalXtA8/default.jpg,https://i.ytimg.com/vi/3wojHalXtA8/mqdefault.jpg,https://i.ytimg.com/vi/3wojHalXtA8/hqdefault.jpg
ME2_OklQfkM,Multivehicle crashes are on the rise,https://i.ytimg.com/vi/ME2_OklQfkM/default.jpg,https://i.ytimg.com/vi/ME2_OklQfkM/mqdefault.jpg,https://i.ytimg.com/vi/ME2_OklQfkM/hqdefault.jpg
YbKAoB5-pDU,Bacon-wrapped pizza latest offering in bacon craze,https://i.ytimg.com/vi/YbKAoB5-pDU/default.jpg,https://i.ytimg.com/vi/YbKAoB5-pDU/mqdefault.jpg,https://i.ytimg.com/vi/YbKAoB5-pDU/hqdefault.jpg
J2pgRdFWaIk,'No place to put it': Snow continues to pile on,https://i.ytimg.com/vi/J2pgRdFWaIk/default.jpg,https://i.ytimg.com/vi/J2pgRdFWaIk/mqdefault.jpg,https://i.ytimg.com/vi/J2pgRdFWaIk/hqdefault.jpg
bojT_LPUhIQ,Watch Jim Cantore flip out over thundersnow,https://i.ytimg.com/vi/bojT_LPUhIQ/default.jpg,https://i.ytimg.com/vi/bojT_LPUhIQ/mqdefault.jpg,https://i.ytimg.com/vi/bojT_LPUhIQ/hqdefault.jpg
2aLz5itVei0,Cirque du Soleil's Ka takes storytelling to new heights,https://i.ytimg.com/vi/2aLz5itVei0/default.jpg,https://i.ytimg.com/vi/2aLz5itVei0/mqdefault.jpg,https://i.ytimg.com/vi/2aLz5itVei0/hqdefault.jpg
xNxfvVQIBk0,Airplane lands on its nose when landing gear fails,https://i.ytimg.com/vi/xNxfvVQIBk0/default.jpg,https://i.ytimg.com/vi/xNxfvVQIBk0/mqdefault.jpg,https://i.ytimg.com/vi/xNxfvVQIBk0/hqdefault.jpg
z-4l2ufqE-4,'Serial stowaway' slips aboard flight to Florida,https://i.ytimg.com/vi/z-4l2ufqE-4/default.jpg,https://i.ytimg.com/vi/z-4l2ufqE-4/mqdefault.jpg,https://i.ytimg.com/vi/z-4l2ufqE-4/hqdefault.jpg
A-mt2BZehT4,"Watch: 'Crippling' storm hammers New England, Northeast",https://i.ytimg.com/vi/A-mt2BZehT4/default.jpg,https://i.ytimg.com/vi/A-mt2BZehT4/mqdefault.jpg,https://i.ytimg.com/vi/A-mt2BZehT4/hqdefault.jpg
ln-6VqHWq6w,Boston mayor: 'We're taking this storm very seriously',https://i.ytimg.com/vi/ln-6VqHWq6w/default.jpg,https://i.ytimg.com/vi/ln-6VqHWq6w/mqdefault.jpg,https://i.ytimg.com/vi/ln-6VqHWq6w/hqdefault.jpg
an_ItbRJAdE,New York Mayor: 'You can't underestimate this storm',https://i.ytimg.com/vi/an_ItbRJAdE/default.jpg,https://i.ytimg.com/vi/an_ItbRJAdE/mqdefault.jpg,https://i.ytimg.com/vi/an_ItbRJAdE/hqdefault.jpg
oxWnL3q43A4,#Blizzardof2015 could spell disaster for East Coast,https://i.ytimg.com/vi/oxWnL3q43A4/default.jpg,https://i.ytimg.com/vi/oxWnL3q43A4/mqdefault.jpg,https://i.ytimg.com/vi/oxWnL3q43A4/hqdefault.jpg
0bDdhzu5Z0o,Winter storm will intensify as it moves up East Coast,https://i.ytimg.com/vi/0bDdhzu5Z0o/default.jpg,https://i.ytimg.com/vi/0bDdhzu5Z0o/mqdefault.jpg,https://i.ytimg.com/vi/0bDdhzu5Z0o/hqdefault.jpg
cnQ6xOLzeEA,'The last beer before heaven' is in the Swiss Alps,https://i.ytimg.com/vi/cnQ6xOLzeEA/default.jpg,https://i.ytimg.com/vi/cnQ6xOLzeEA/mqdefault.jpg,https://i.ytimg.com/vi/cnQ6xOLzeEA/hqdefault.jpg
oSOTLM1alIA,"TSA found record guns, knife in enchilada in 2014",https://i.ytimg.com/vi/oSOTLM1alIA/default.jpg,https://i.ytimg.com/vi/oSOTLM1alIA/mqdefault.jpg,https://i.ytimg.com/vi/oSOTLM1alIA/hqdefault.jpg
snIjhk21WIM,"Regent Seven Seas Explorer boasts 4,000 sq. ft. suites",https://i.ytimg.com/vi/snIjhk21WIM/default.jpg,https://i.ytimg.com/vi/snIjhk21WIM/mqdefault.jpg,https://i.ytimg.com/vi/snIjhk21WIM/hqdefault.jpg
YvRGuR0vY6g,Watch Disney crew rescue man who fell off cruise ship,https://i.ytimg.com/vi/YvRGuR0vY6g/default.jpg,https://i.ytimg.com/vi/YvRGuR0vY6g/mqdefault.jpg,https://i.ytimg.com/vi/YvRGuR0vY6g/hqdefault.jpg
uR9M1lrbkzI,"Santa, I know him! Go inside NORAD's Santa tracking headquarters",https://i.ytimg.com/vi/uR9M1lrbkzI/default.jpg,https://i.ytimg.com/vi/uR9M1lrbkzI/mqdefault.jpg,https://i.ytimg.com/vi/uR9M1lrbkzI/hqdefault.jpg
zHvQ_i4EnFM,Santa's coming! See how air traffic control prepares,https://i.ytimg.com/vi/zHvQ_i4EnFM/default.jpg,https://i.ytimg.com/vi/zHvQ_i4EnFM/mqdefault.jpg,https://i.ytimg.com/vi/zHvQ_i4EnFM/hqdefault.jpg
0zhiFrXF_2w,Holiday travel emergency kits,https://i.ytimg.com/vi/0zhiFrXF_2w/default.jpg,https://i.ytimg.com/vi/0zhiFrXF_2w/mqdefault.jpg,https://i.ytimg.com/vi/0zhiFrXF_2w/hqdefault.jpg
pMCgWQDbiGw,North Pole meets Southern charm at this park,https://i.ytimg.com/vi/pMCgWQDbiGw/default.jpg,https://i.ytimg.com/vi/pMCgWQDbiGw/mqdefault.jpg,https://i.ytimg.com/vi/pMCgWQDbiGw/hqdefault.jpg
Jd-jygpV2cY,This is what you DON'T see when you fly for the holidays,https://i.ytimg.com/vi/Jd-jygpV2cY/default.jpg,https://i.ytimg.com/vi/Jd-jygpV2cY/mqdefault.jpg,https://i.ytimg.com/vi/Jd-jygpV2cY/hqdefault.jpg
X-RtAe8FtCM,NYC secrets: An underground lounge,https://i.ytimg.com/vi/X-RtAe8FtCM/default.jpg,https://i.ytimg.com/vi/X-RtAe8FtCM/mqdefault.jpg,https://i.ytimg.com/vi/X-RtAe8FtCM/hqdefault.jpg
KrxeuvVuQMo,NYC secrets: The Burger Joint behind a hotel lobby,https://i.ytimg.com/vi/KrxeuvVuQMo/default.jpg,https://i.ytimg.com/vi/KrxeuvVuQMo/mqdefault.jpg,https://i.ytimg.com/vi/KrxeuvVuQMo/hqdefault.jpg
7Y-R_jgCmYU,Dad breaks world record with Christmas light display,https://i.ytimg.com/vi/7Y-R_jgCmYU/default.jpg,https://i.ytimg.com/vi/7Y-R_jgCmYU/mqdefault.jpg,https://i.ytimg.com/vi/7Y-R_jgCmYU/hqdefault.jpg
2SSw46AntYE,"Holiday Lights Contest: Win $5,000 and bragging rights",https://i.ytimg.com/vi/2SSw46AntYE/default.jpg,https://i.ytimg.com/vi/2SSw46AntYE/mqdefault.jpg,https://i.ytimg.com/vi/2SSw46AntYE/hqdefault.jpg
SxWNxcKX6cs,Winter wonderland carved out of 2 million pounds of ice,https://i.ytimg.com/vi/SxWNxcKX6cs/default.jpg,https://i.ytimg.com/vi/SxWNxcKX6cs/mqdefault.jpg,https://i.ytimg.com/vi/SxWNxcKX6cs/hqdefault.jpg
XTYWZD1pb2M,"First look at 'Skyscraper,' the world's tallest coaster",https://i.ytimg.com/vi/XTYWZD1pb2M/default.jpg,https://i.ytimg.com/vi/XTYWZD1pb2M/mqdefault.jpg,https://i.ytimg.com/vi/XTYWZD1pb2M/hqdefault.jpg
8c6I8MnRO9g,Traveling during cold and flu season? Follow these tips,https://i.ytimg.com/vi/8c6I8MnRO9g/default.jpg,https://i.ytimg.com/vi/8c6I8MnRO9g/mqdefault.jpg,https://i.ytimg.com/vi/8c6I8MnRO9g/hqdefault.jpg
fYMzwNO6nC0,Quantum of the Seas' 'Two70' is transformative living room,https://i.ytimg.com/vi/fYMzwNO6nC0/default.jpg,https://i.ytimg.com/vi/fYMzwNO6nC0/mqdefault.jpg,https://i.ytimg.com/vi/fYMzwNO6nC0/hqdefault.jpg
mUxOMNLeSY8,Michael’s Genuine Pub brings artisan flavors to Quantum of the Seas,https://i.ytimg.com/vi/mUxOMNLeSY8/default.jpg,https://i.ytimg.com/vi/mUxOMNLeSY8/mqdefault.jpg,https://i.ytimg.com/vi/mUxOMNLeSY8/hqdefault.jpg
T28_e8dq31w,"Quantum of the Seas' SeaPlex feature bumper cars, more",https://i.ytimg.com/vi/T28_e8dq31w/default.jpg,https://i.ytimg.com/vi/T28_e8dq31w/mqdefault.jpg,https://i.ytimg.com/vi/T28_e8dq31w/hqdefault.jpg
mwwfM4_C7T8,"Wedding at 32,000 feet, first for Southwest Airlines",https://i.ytimg.com/vi/mwwfM4_C7T8/default.jpg,https://i.ytimg.com/vi/mwwfM4_C7T8/mqdefault.jpg,https://i.ytimg.com/vi/mwwfM4_C7T8/hqdefault.jpg
6eSfZNv0Rq0,Virtual balconies bring ocean views to interior state rooms,https://i.ytimg.com/vi/6eSfZNv0Rq0/default.jpg,https://i.ytimg.com/vi/6eSfZNv0Rq0/mqdefault.jpg,https://i.ytimg.com/vi/6eSfZNv0Rq0/hqdefault.jpg
tsnIcadoj8E,Jamie Oliver brings 'neighborhood' Italian to Quantum of the Seas,https://i.ytimg.com/vi/tsnIcadoj8E/default.jpg,https://i.ytimg.com/vi/tsnIcadoj8E/mqdefault.jpg,https://i.ytimg.com/vi/tsnIcadoj8E/hqdefault.jpg
_Hy7ZIslYQ0,"Quantum of the Seas suites 'wow' with space, epic views",https://i.ytimg.com/vi/_Hy7ZIslYQ0/default.jpg,https://i.ytimg.com/vi/_Hy7ZIslYQ0/mqdefault.jpg,https://i.ytimg.com/vi/_Hy7ZIslYQ0/hqdefault.jpg
4vJQpB1ZBeY,Quantum of the Seas sets sail for inaugural cruise,https://i.ytimg.com/vi/4vJQpB1ZBeY/default.jpg,https://i.ytimg.com/vi/4vJQpB1ZBeY/mqdefault.jpg,https://i.ytimg.com/vi/4vJQpB1ZBeY/hqdefault.jpg
PCQl5uZgg4I,"Bionic Bar mixes perfect, precise drinks",https://i.ytimg.com/vi/PCQl5uZgg4I/default.jpg,https://i.ytimg.com/vi/PCQl5uZgg4I/mqdefault.jpg,https://i.ytimg.com/vi/PCQl5uZgg4I/hqdefault.jpg
0LoeYRSPQhY,Quantum of the Seas' Bionic Bar mixes your drink in about a minute,https://i.ytimg.com/vi/0LoeYRSPQhY/default.jpg,https://i.ytimg.com/vi/0LoeYRSPQhY/mqdefault.jpg,https://i.ytimg.com/vi/0LoeYRSPQhY/hqdefault.jpg
wr5gYExQnTU,Get airborne on your next cruise,https://i.ytimg.com/vi/wr5gYExQnTU/default.jpg,https://i.ytimg.com/vi/wr5gYExQnTU/mqdefault.jpg,https://i.ytimg.com/vi/wr5gYExQnTU/hqdefault.jpg
JqkJ854OtaU,Quantum of the Seas ride gives 360-degree sea view,https://i.ytimg.com/vi/JqkJ854OtaU/default.jpg,https://i.ytimg.com/vi/JqkJ854OtaU/mqdefault.jpg,https://i.ytimg.com/vi/JqkJ854OtaU/hqdefault.jpg
PxX2HK9C50s,Celebrate Diwali with food from iconic Indian chef,https://i.ytimg.com/vi/PxX2HK9C50s/default.jpg,https://i.ytimg.com/vi/PxX2HK9C50s/mqdefault.jpg,https://i.ytimg.com/vi/PxX2HK9C50s/hqdefault.jpg
R7fQsqs7KYg,"Officials, travelers deal with Ebola threat",https://i.ytimg.com/vi/R7fQsqs7KYg/default.jpg,https://i.ytimg.com/vi/R7fQsqs7KYg/mqdefault.jpg,https://i.ytimg.com/vi/R7fQsqs7KYg/hqdefault.jpg
YqnwQD0dEOs,Navigate Portland's food truck scene,https://i.ytimg.com/vi/YqnwQD0dEOs/default.jpg,https://i.ytimg.com/vi/YqnwQD0dEOs/mqdefault.jpg,https://i.ytimg.com/vi/YqnwQD0dEOs/hqdefault.jpg
eKpBnnUePUA,Meet the masterminds behind Southwest Airlines' clever ads,https://i.ytimg.com/vi/eKpBnnUePUA/default.jpg,https://i.ytimg.com/vi/eKpBnnUePUA/mqdefault.jpg,https://i.ytimg.com/vi/eKpBnnUePUA/hqdefault.jpg
EIRjZERkmZs,"Robot roams airport, answers travelers' questions",https://i.ytimg.com/vi/EIRjZERkmZs/default.jpg,https://i.ytimg.com/vi/EIRjZERkmZs/mqdefault.jpg,https://i.ytimg.com/vi/EIRjZERkmZs/hqdefault.jpg
wGSJIKraKvg,Great American Beer Fest 'ground zero for beer geeks',https://i.ytimg.com/vi/wGSJIKraKvg/default.jpg,https://i.ytimg.com/vi/wGSJIKraKvg/mqdefault.jpg,https://i.ytimg.com/vi/wGSJIKraKvg/hqdefault.jpg
1t4YYosdgNU,Would you eat a deep-fried chocolate covered pickle?,https://i.ytimg.com/vi/1t4YYosdgNU/default.jpg,https://i.ytimg.com/vi/1t4YYosdgNU/mqdefault.jpg,https://i.ytimg.com/vi/1t4YYosdgNU/hqdefault.jpg
XMrKx-Pdz1c,Chefs compete for 'Spam Champion' title at cookoff,https://i.ytimg.com/vi/XMrKx-Pdz1c/default.jpg,https://i.ytimg.com/vi/XMrKx-Pdz1c/mqdefault.jpg,https://i.ytimg.com/vi/XMrKx-Pdz1c/hqdefault.jpg
O-07uWG1nho,Just try to stop staring at this mesmerizing sculpture,https://i.ytimg.com/vi/O-07uWG1nho/default.jpg,https://i.ytimg.com/vi/O-07uWG1nho/mqdefault.jpg,https://i.ytimg.com/vi/O-07uWG1nho/hqdefault.jpg
zp3ApOqF6VQ,Universal Orlando's Halloween Horror Nights biggest yet,https://i.ytimg.com/vi/zp3ApOqF6VQ/default.jpg,https://i.ytimg.com/vi/zp3ApOqF6VQ/mqdefault.jpg,https://i.ytimg.com/vi/zp3ApOqF6VQ/hqdefault.jpg
gDqmccOF4u8,Flight delay? Kill time with these airport attractions,https://i.ytimg.com/vi/gDqmccOF4u8/default.jpg,https://i.ytimg.com/vi/gDqmccOF4u8/mqdefault.jpg,https://i.ytimg.com/vi/gDqmccOF4u8/hqdefault.jpg
6FF8mx81dNo,iHeartRadio stars talk Vegas on the red carpet,https://i.ytimg.com/vi/6FF8mx81dNo/default.jpg,https://i.ytimg.com/vi/6FF8mx81dNo/mqdefault.jpg,https://i.ytimg.com/vi/6FF8mx81dNo/hqdefault.jpg
S1aRyr7W7FI,Meet Train and One Direction on the iHeartRadio red carpet,https://i.ytimg.com/vi/S1aRyr7W7FI/default.jpg,https://i.ytimg.com/vi/S1aRyr7W7FI/mqdefault.jpg,https://i.ytimg.com/vi/S1aRyr7W7FI/hqdefault.jpg
OYe8MlRg2Ss,Five little known airport services you should be using,https://i.ytimg.com/vi/OYe8MlRg2Ss/default.jpg,https://i.ytimg.com/vi/OYe8MlRg2Ss/mqdefault.jpg,https://i.ytimg.com/vi/OYe8MlRg2Ss/hqdefault.jpg
PdphQv-hr38,Swim with the stars of 'Dolphin Tale 2',https://i.ytimg.com/vi/PdphQv-hr38/default.jpg,https://i.ytimg.com/vi/PdphQv-hr38/mqdefault.jpg,https://i.ytimg.com/vi/PdphQv-hr38/hqdefault.jpg
iubiLr1jpyM,Five things families should look for in SUVs,https://i.ytimg.com/vi/iubiLr1jpyM/default.jpg,https://i.ytimg.com/vi/iubiLr1jpyM/mqdefault.jpg,https://i.ytimg.com/vi/iubiLr1jpyM/hqdefault.jpg
Kdq04-kCROM,10Best: U.S. city wins international skyline contest,https://i.ytimg.com/vi/Kdq04-kCROM/default.jpg,https://i.ytimg.com/vi/Kdq04-kCROM/mqdefault.jpg,https://i.ytimg.com/vi/Kdq04-kCROM/hqdefault.jpg
gFJ8GQ0TNaA,Brazilia Cafe brings seed-to-cup coffee to NYC,https://i.ytimg.com/vi/gFJ8GQ0TNaA/default.jpg,https://i.ytimg.com/vi/gFJ8GQ0TNaA/mqdefault.jpg,https://i.ytimg.com/vi/gFJ8GQ0TNaA/hqdefault.jpg
Q9FuXnTVJCQ,Seee Grand Central Station's hidden tennis courts,https://i.ytimg.com/vi/Q9FuXnTVJCQ/default.jpg,https://i.ytimg.com/vi/Q9FuXnTVJCQ/mqdefault.jpg,https://i.ytimg.com/vi/Q9FuXnTVJCQ/hqdefault.jpg
81v1nQL8t1Q,Southwest airlines unveils bold look for its planes,https://i.ytimg.com/vi/81v1nQL8t1Q/default.jpg,https://i.ytimg.com/vi/81v1nQL8t1Q/mqdefault.jpg,https://i.ytimg.com/vi/81v1nQL8t1Q/hqdefault.jpg
