ID,TITLE,THUMBNAIL1,THUMBNAIL2,THUMBNAIL3
-waMNjZMh0I,"Paralyzed man breaks down when a Secret Santa gives him and his dog, Buddy, a special surprise",https://i.ytimg.com/vi/-waMNjZMh0I/default.jpg,https://i.ytimg.com/vi/-waMNjZMh0I/mqdefault.jpg,https://i.ytimg.com/vi/-waMNjZMh0I/hqdefault.jpg
B8mXRe8mvpo,"FOX5 Surprise Squad - Waitress with Dying Husband Gets $12,000 Tip!",https://i.ytimg.com/vi/B8mXRe8mvpo/default.jpg,https://i.ytimg.com/vi/B8mXRe8mvpo/mqdefault.jpg,https://i.ytimg.com/vi/B8mXRe8mvpo/hqdefault.jpg
E443GYMZ-HQ,Police dispatcher breaks down after receiving special gifts from a Secret Santa,https://i.ytimg.com/vi/E443GYMZ-HQ/default.jpg,https://i.ytimg.com/vi/E443GYMZ-HQ/mqdefault.jpg,https://i.ytimg.com/vi/E443GYMZ-HQ/hqdefault.jpg
e5wUSorQUUE,A Secret Santa surprises family living in trailers after their house burned to the ground,https://i.ytimg.com/vi/e5wUSorQUUE/default.jpg,https://i.ytimg.com/vi/e5wUSorQUUE/mqdefault.jpg,https://i.ytimg.com/vi/e5wUSorQUUE/hqdefault.jpg
Ac-nVtJPOzM,Legally blind woman arrives home to find big surprise from Secret Santa,https://i.ytimg.com/vi/Ac-nVtJPOzM/default.jpg,https://i.ytimg.com/vi/Ac-nVtJPOzM/mqdefault.jpg,https://i.ytimg.com/vi/Ac-nVtJPOzM/hqdefault.jpg
TKRT5qa01cY,Former addict whose baby died can barely speak when Secret Santa gives him a life-changing gift,https://i.ytimg.com/vi/TKRT5qa01cY/default.jpg,https://i.ytimg.com/vi/TKRT5qa01cY/mqdefault.jpg,https://i.ytimg.com/vi/TKRT5qa01cY/hqdefault.jpg
oxe6jr5x7Ew,How To Get Rid Of A MUSTACHE/EYEBROW At HOME | VEET HAIR REMOVAL CREAM,https://i.ytimg.com/vi/oxe6jr5x7Ew/default.jpg,https://i.ytimg.com/vi/oxe6jr5x7Ew/mqdefault.jpg,https://i.ytimg.com/vi/oxe6jr5x7Ew/hqdefault.jpg
6NE-khbVXKg,McDojoNews: Martial Arts Child Molesters,https://i.ytimg.com/vi/6NE-khbVXKg/default.jpg,https://i.ytimg.com/vi/6NE-khbVXKg/mqdefault.jpg,https://i.ytimg.com/vi/6NE-khbVXKg/hqdefault.jpg
2pCdDC0Bads,Remembering Hamid Abd-Al-Jabbar and his impact on Milwaukee,https://i.ytimg.com/vi/2pCdDC0Bads/default.jpg,https://i.ytimg.com/vi/2pCdDC0Bads/mqdefault.jpg,https://i.ytimg.com/vi/2pCdDC0Bads/hqdefault.jpg
R07cF78_MSQ,#STORYTIME : I WAS #MOLESTED BY MY FATHER AND I'M FINALLY SPEAKING OUT AFTER 20+ YEARS,https://i.ytimg.com/vi/R07cF78_MSQ/default.jpg,https://i.ytimg.com/vi/R07cF78_MSQ/mqdefault.jpg,https://i.ytimg.com/vi/R07cF78_MSQ/hqdefault.jpg
BNdZZPCzZ8g,Parents race to save toddler’s life after rare genetic disease diagnosis | Nightline,https://i.ytimg.com/vi/BNdZZPCzZ8g/default.jpg,https://i.ytimg.com/vi/BNdZZPCzZ8g/mqdefault.jpg,https://i.ytimg.com/vi/BNdZZPCzZ8g/hqdefault.jpg
sLSXKqHyWcE,This Restaurant That Specializes in Duck Is Shaking Up the Baltimore Crab Scene,https://i.ytimg.com/vi/sLSXKqHyWcE/default.jpg,https://i.ytimg.com/vi/sLSXKqHyWcE/mqdefault.jpg,https://i.ytimg.com/vi/sLSXKqHyWcE/hqdefault.jpg
V8ncWRyVgb4,Patricia Jackson: Part 1 — FIRSTHAND: Living in Poverty,https://i.ytimg.com/vi/V8ncWRyVgb4/default.jpg,https://i.ytimg.com/vi/V8ncWRyVgb4/mqdefault.jpg,https://i.ytimg.com/vi/V8ncWRyVgb4/hqdefault.jpg
z67doq_XK9U,Surviving American High School: Becoming a Teen Father (Social Documentary) | Real Stories,https://i.ytimg.com/vi/z67doq_XK9U/default.jpg,https://i.ytimg.com/vi/z67doq_XK9U/mqdefault.jpg,https://i.ytimg.com/vi/z67doq_XK9U/hqdefault.jpg
EQ4qYcHXy0E,Vivica A. Fox on Why She Got Divorced: I Got Tired of Paying for Everything (Part 11),https://i.ytimg.com/vi/EQ4qYcHXy0E/default.jpg,https://i.ytimg.com/vi/EQ4qYcHXy0E/mqdefault.jpg,https://i.ytimg.com/vi/EQ4qYcHXy0E/hqdefault.jpg
17Drxe_dR8E,A woman cooks the last meals for death row inmates. But tonight's dish is her last. | Last Requests,https://i.ytimg.com/vi/17Drxe_dR8E/default.jpg,https://i.ytimg.com/vi/17Drxe_dR8E/mqdefault.jpg,https://i.ytimg.com/vi/17Drxe_dR8E/hqdefault.jpg
BE05h9vuD30,Last Year in My 20s | Birthday Photoshoot & Passion Twists,https://i.ytimg.com/vi/BE05h9vuD30/default.jpg,https://i.ytimg.com/vi/BE05h9vuD30/mqdefault.jpg,https://i.ytimg.com/vi/BE05h9vuD30/hqdefault.jpg
pSRgfSOjceA,Mediterranean Veggie Wrap Recipe ‣‣ How to Make a Healthy Wrap ‣‣ Greek Vegetarian Wrap Sandwich,https://i.ytimg.com/vi/pSRgfSOjceA/default.jpg,https://i.ytimg.com/vi/pSRgfSOjceA/mqdefault.jpg,https://i.ytimg.com/vi/pSRgfSOjceA/hqdefault.jpg
w2drHfuB7Vc,How to make Loaded Nachos Supreme,https://i.ytimg.com/vi/w2drHfuB7Vc/default.jpg,https://i.ytimg.com/vi/w2drHfuB7Vc/mqdefault.jpg,https://i.ytimg.com/vi/w2drHfuB7Vc/hqdefault.jpg
2WumL9jOOR8,How to survive as non gang member in Prison { Frans} Episode 4,https://i.ytimg.com/vi/2WumL9jOOR8/default.jpg,https://i.ytimg.com/vi/2WumL9jOOR8/mqdefault.jpg,https://i.ytimg.com/vi/2WumL9jOOR8/hqdefault.jpg
EhDJfAA-XEk,How to Survive a Bullet Wound,https://i.ytimg.com/vi/EhDJfAA-XEk/default.jpg,https://i.ytimg.com/vi/EhDJfAA-XEk/mqdefault.jpg,https://i.ytimg.com/vi/EhDJfAA-XEk/hqdefault.jpg
hExpXlf2rUs,How to Survive a Car Crash Through Ice (Episode 4),https://i.ytimg.com/vi/hExpXlf2rUs/default.jpg,https://i.ytimg.com/vi/hExpXlf2rUs/mqdefault.jpg,https://i.ytimg.com/vi/hExpXlf2rUs/hqdefault.jpg
ZFIjFvKq_So,How to Survive an Alien Invasion,https://i.ytimg.com/vi/ZFIjFvKq_So/default.jpg,https://i.ytimg.com/vi/ZFIjFvKq_So/mqdefault.jpg,https://i.ytimg.com/vi/ZFIjFvKq_So/hqdefault.jpg
g_3RQ0OSiIA,16 Survival Tricks to Get Out of Trouble Fast,https://i.ytimg.com/vi/g_3RQ0OSiIA/default.jpg,https://i.ytimg.com/vi/g_3RQ0OSiIA/mqdefault.jpg,https://i.ytimg.com/vi/g_3RQ0OSiIA/hqdefault.jpg
ceCiP4yvYPs,Armed! Are you ready- Hospital EP Training,https://i.ytimg.com/vi/ceCiP4yvYPs/default.jpg,https://i.ytimg.com/vi/ceCiP4yvYPs/mqdefault.jpg,https://i.ytimg.com/vi/ceCiP4yvYPs/hqdefault.jpg
DFQ-oxhdFjE,SURVIVING AN ACTIVE SHOOTER - LA County Sheriff,https://i.ytimg.com/vi/DFQ-oxhdFjE/default.jpg,https://i.ytimg.com/vi/DFQ-oxhdFjE/mqdefault.jpg,https://i.ytimg.com/vi/DFQ-oxhdFjE/hqdefault.jpg
GuUDovjR3fk,The Corner Episode 3 VOSTFR,https://i.ytimg.com/vi/GuUDovjR3fk/default.jpg,https://i.ytimg.com/vi/GuUDovjR3fk/mqdefault.jpg,https://i.ytimg.com/vi/GuUDovjR3fk/hqdefault.jpg
QmGAG6Y1KO0,"Man, 75, charged with murder in East Garfield Park shooting",https://i.ytimg.com/vi/QmGAG6Y1KO0/default.jpg,https://i.ytimg.com/vi/QmGAG6Y1KO0/mqdefault.jpg,https://i.ytimg.com/vi/QmGAG6Y1KO0/hqdefault.jpg
9zOVQZcn_dU,Sad death scenes in Movies be like...,https://i.ytimg.com/vi/9zOVQZcn_dU/default.jpg,https://i.ytimg.com/vi/9zOVQZcn_dU/mqdefault.jpg,https://i.ytimg.com/vi/9zOVQZcn_dU/hqdefault.jpg
iEdOKkKj3pM,Woman’s Intestines Infested with Worms from Prepackaged Salad?,https://i.ytimg.com/vi/iEdOKkKj3pM/default.jpg,https://i.ytimg.com/vi/iEdOKkKj3pM/mqdefault.jpg,https://i.ytimg.com/vi/iEdOKkKj3pM/hqdefault.jpg
B4E7j_J1ESU,Luenell on Bill & Melinda Gates Divorce: She Wants Back Blown Out by Jamaican Black Guy (Part 3),https://i.ytimg.com/vi/B4E7j_J1ESU/default.jpg,https://i.ytimg.com/vi/B4E7j_J1ESU/mqdefault.jpg,https://i.ytimg.com/vi/B4E7j_J1ESU/hqdefault.jpg
fnuHadJdzmc,10 Shocking Deathbed Murder Confessions,https://i.ytimg.com/vi/fnuHadJdzmc/default.jpg,https://i.ytimg.com/vi/fnuHadJdzmc/mqdefault.jpg,https://i.ytimg.com/vi/fnuHadJdzmc/hqdefault.jpg
UYGRTamhQEM,UPDATE: SOMEONE IN YOUR FAMILY ASSAULTED OUR DAUGHTER! | Steve Wilkos,https://i.ytimg.com/vi/UYGRTamhQEM/default.jpg,https://i.ytimg.com/vi/UYGRTamhQEM/mqdefault.jpg,https://i.ytimg.com/vi/UYGRTamhQEM/hqdefault.jpg
kyNP3s5mxI8,The Consequences of Marrying Your Cousin (Genetic Disorder Documentary) | Only Human,https://i.ytimg.com/vi/kyNP3s5mxI8/default.jpg,https://i.ytimg.com/vi/kyNP3s5mxI8/mqdefault.jpg,https://i.ytimg.com/vi/kyNP3s5mxI8/hqdefault.jpg
La__SRCNUz8,Benson Gets Justice for Simon with Stabler By Her Side - Law & Order: Organized Crime,https://i.ytimg.com/vi/La__SRCNUz8/default.jpg,https://i.ytimg.com/vi/La__SRCNUz8/mqdefault.jpg,https://i.ytimg.com/vi/La__SRCNUz8/hqdefault.jpg
CWGyLWifsmE,UPDATE! YOU MOLESTED OUR KIDS?! | Steve Wilkos,https://i.ytimg.com/vi/CWGyLWifsmE/default.jpg,https://i.ytimg.com/vi/CWGyLWifsmE/mqdefault.jpg,https://i.ytimg.com/vi/CWGyLWifsmE/hqdefault.jpg
9o0BFdrqZFk,"The Insane Story Behind the Movie ""Roar""",https://i.ytimg.com/vi/9o0BFdrqZFk/default.jpg,https://i.ytimg.com/vi/9o0BFdrqZFk/mqdefault.jpg,https://i.ytimg.com/vi/9o0BFdrqZFk/hqdefault.jpg
QKNHmUuUTV8,They Don’t Appreciate You Until It’s Too Late,https://i.ytimg.com/vi/QKNHmUuUTV8/default.jpg,https://i.ytimg.com/vi/QKNHmUuUTV8/mqdefault.jpg,https://i.ytimg.com/vi/QKNHmUuUTV8/hqdefault.jpg
H5ZyknClXzc,Vegan Lunch Wraps (Tortilla Wrap),https://i.ytimg.com/vi/H5ZyknClXzc/default.jpg,https://i.ytimg.com/vi/H5ZyknClXzc/mqdefault.jpg,https://i.ytimg.com/vi/H5ZyknClXzc/hqdefault.jpg
vD2vxcv5btI,"Roadside memorials-- Deston Bibbs-- Fort worth,Tx",https://i.ytimg.com/vi/vD2vxcv5btI/default.jpg,https://i.ytimg.com/vi/vD2vxcv5btI/mqdefault.jpg,https://i.ytimg.com/vi/vD2vxcv5btI/hqdefault.jpg
TWh6w-VmjO8,Das Rezept mit Wurst zum Mittag  oder Abendessen wird Sie mit seinem Geschmack überzeugen #356,https://i.ytimg.com/vi/TWh6w-VmjO8/default.jpg,https://i.ytimg.com/vi/TWh6w-VmjO8/mqdefault.jpg,https://i.ytimg.com/vi/TWh6w-VmjO8/hqdefault.jpg
Me7rxTL2x8g,Просто складываю все в ПАКЕТ и получается идеально вкусно. #689,https://i.ytimg.com/vi/Me7rxTL2x8g/default.jpg,https://i.ytimg.com/vi/Me7rxTL2x8g/mqdefault.jpg,https://i.ytimg.com/vi/Me7rxTL2x8g/hqdefault.jpg
5h974fXFFHE,THE BEST GRILLED CHICKEN I'VE EVER MADE? | SAM THE COOKING GUY 4K,https://i.ytimg.com/vi/5h974fXFFHE/default.jpg,https://i.ytimg.com/vi/5h974fXFFHE/mqdefault.jpg,https://i.ytimg.com/vi/5h974fXFFHE/hqdefault.jpg
3acjb93vVRc,Ranch Burgers,https://i.ytimg.com/vi/3acjb93vVRc/default.jpg,https://i.ytimg.com/vi/3acjb93vVRc/mqdefault.jpg,https://i.ytimg.com/vi/3acjb93vVRc/hqdefault.jpg
f8TjR4ChNEs,Feds: Female rappers bilked millions from IRS with tax fraud scheme,https://i.ytimg.com/vi/f8TjR4ChNEs/default.jpg,https://i.ytimg.com/vi/f8TjR4ChNEs/mqdefault.jpg,https://i.ytimg.com/vi/f8TjR4ChNEs/hqdefault.jpg
hg8nMV61nZI,"Diabetic told he's in the ""Last Stages"" - but turns it around in 6 mos.",https://i.ytimg.com/vi/hg8nMV61nZI/default.jpg,https://i.ytimg.com/vi/hg8nMV61nZI/mqdefault.jpg,https://i.ytimg.com/vi/hg8nMV61nZI/hqdefault.jpg
pvTgVwagxGk,I Feel Depressed & Defeated (A Response to DivaSlimsDown),https://i.ytimg.com/vi/pvTgVwagxGk/default.jpg,https://i.ytimg.com/vi/pvTgVwagxGk/mqdefault.jpg,https://i.ytimg.com/vi/pvTgVwagxGk/hqdefault.jpg
2Qmn-4ehmtU,Warum kannte ich dieses Rezept vorher nicht? Sehr lecker und gesund! Gemüseauflauf. Frische rezepte,https://i.ytimg.com/vi/2Qmn-4ehmtU/default.jpg,https://i.ytimg.com/vi/2Qmn-4ehmtU/mqdefault.jpg,https://i.ytimg.com/vi/2Qmn-4ehmtU/hqdefault.jpg
aCV1JmJB3jM,RWW News: Matt Walsh Believes 12-Year-Old Rape Victims Should Be Forced To Give Birth,https://i.ytimg.com/vi/aCV1JmJB3jM/default.jpg,https://i.ytimg.com/vi/aCV1JmJB3jM/mqdefault.jpg,https://i.ytimg.com/vi/aCV1JmJB3jM/hqdefault.jpg
Zdq9imX06fc,Crispy AF RANCH WINGS,https://i.ytimg.com/vi/Zdq9imX06fc/default.jpg,https://i.ytimg.com/vi/Zdq9imX06fc/mqdefault.jpg,https://i.ytimg.com/vi/Zdq9imX06fc/hqdefault.jpg
CcOe_LCeIhM,How to Make Shrimp Fried Rice EASY| Chinese Fried Rice Recipe| Better Than Take Out,https://i.ytimg.com/vi/CcOe_LCeIhM/default.jpg,https://i.ytimg.com/vi/CcOe_LCeIhM/mqdefault.jpg,https://i.ytimg.com/vi/CcOe_LCeIhM/hqdefault.jpg
xo_ZkhtpC4Q,Marine surprises wife at family game night | Militarykind,https://i.ytimg.com/vi/xo_ZkhtpC4Q/default.jpg,https://i.ytimg.com/vi/xo_ZkhtpC4Q/mqdefault.jpg,https://i.ytimg.com/vi/xo_ZkhtpC4Q/hqdefault.jpg
bcYzYiVDIlg,"""Daddy"" (Short Film)",https://i.ytimg.com/vi/bcYzYiVDIlg/default.jpg,https://i.ytimg.com/vi/bcYzYiVDIlg/mqdefault.jpg,https://i.ytimg.com/vi/bcYzYiVDIlg/hqdefault.jpg
x0Btkxg41xA,"Farmers markets kick off the season, welcoming shoppers | FOX6 News Milwaukee",https://i.ytimg.com/vi/x0Btkxg41xA/default.jpg,https://i.ytimg.com/vi/x0Btkxg41xA/mqdefault.jpg,https://i.ytimg.com/vi/x0Btkxg41xA/hqdefault.jpg
_FHye3nEUWA,Diabetes and Exercise,https://i.ytimg.com/vi/_FHye3nEUWA/default.jpg,https://i.ytimg.com/vi/_FHye3nEUWA/mqdefault.jpg,https://i.ytimg.com/vi/_FHye3nEUWA/hqdefault.jpg
UHMuKXuH7EM,70th Emmy Awards: Backstage LIVE! with Taraji P Henson,https://i.ytimg.com/vi/UHMuKXuH7EM/default.jpg,https://i.ytimg.com/vi/UHMuKXuH7EM/mqdefault.jpg,https://i.ytimg.com/vi/UHMuKXuH7EM/hqdefault.jpg
Du7Zt9pSZ1M,IS MY BOYFRIEND A CHILD MOLESTOR? | Steve Wilkos,https://i.ytimg.com/vi/Du7Zt9pSZ1M/default.jpg,https://i.ytimg.com/vi/Du7Zt9pSZ1M/mqdefault.jpg,https://i.ytimg.com/vi/Du7Zt9pSZ1M/hqdefault.jpg
qIQ8Tqhscv4,Positively Milwaukee: Pandemic Pivot,https://i.ytimg.com/vi/qIQ8Tqhscv4/default.jpg,https://i.ytimg.com/vi/qIQ8Tqhscv4/mqdefault.jpg,https://i.ytimg.com/vi/qIQ8Tqhscv4/hqdefault.jpg
85HGDHKiplM,9 Early Signs of Diabetes: The Symptoms In Adults and Children,https://i.ytimg.com/vi/85HGDHKiplM/default.jpg,https://i.ytimg.com/vi/85HGDHKiplM/mqdefault.jpg,https://i.ytimg.com/vi/85HGDHKiplM/hqdefault.jpg
BiPyR8DCYEs,Man celebrating job interview killed following fatal punch in Ybor City,https://i.ytimg.com/vi/BiPyR8DCYEs/default.jpg,https://i.ytimg.com/vi/BiPyR8DCYEs/mqdefault.jpg,https://i.ytimg.com/vi/BiPyR8DCYEs/hqdefault.jpg
RmOtF4t5-5I,"6-year-old girl fatally shot at car club meetup on west side, police say",https://i.ytimg.com/vi/RmOtF4t5-5I/default.jpg,https://i.ytimg.com/vi/RmOtF4t5-5I/mqdefault.jpg,https://i.ytimg.com/vi/RmOtF4t5-5I/hqdefault.jpg
si-pGoNdT0Q,"Woman Was 'Stumbling Drunk' Before Crashing, Killing Teens in North Miami: Prosecutor | NBC 6",https://i.ytimg.com/vi/si-pGoNdT0Q/default.jpg,https://i.ytimg.com/vi/si-pGoNdT0Q/mqdefault.jpg,https://i.ytimg.com/vi/si-pGoNdT0Q/hqdefault.jpg
cKeiltJj0LQ,Another chaotic airport fight caught on camera in Miami,https://i.ytimg.com/vi/cKeiltJj0LQ/default.jpg,https://i.ytimg.com/vi/cKeiltJj0LQ/mqdefault.jpg,https://i.ytimg.com/vi/cKeiltJj0LQ/hqdefault.jpg
PD5fRoecRJI,Man accused of assaulting woman on golf course,https://i.ytimg.com/vi/PD5fRoecRJI/default.jpg,https://i.ytimg.com/vi/PD5fRoecRJI/mqdefault.jpg,https://i.ytimg.com/vi/PD5fRoecRJI/hqdefault.jpg
uL2BRZPaeTU,His Cop Buddies Thought It Was Funny...Until He Was Fired And Sued,https://i.ytimg.com/vi/uL2BRZPaeTU/default.jpg,https://i.ytimg.com/vi/uL2BRZPaeTU/mqdefault.jpg,https://i.ytimg.com/vi/uL2BRZPaeTU/hqdefault.jpg
yOROpxfRfTg,Milwaukee gymnast has Olympic dreams | FOX6 News Milwaukee,https://i.ytimg.com/vi/yOROpxfRfTg/default.jpg,https://i.ytimg.com/vi/yOROpxfRfTg/mqdefault.jpg,https://i.ytimg.com/vi/yOROpxfRfTg/hqdefault.jpg
zhX8niZe7eI,Smoked Chicken Cheese Quesadilla Recipe ~ CiNcO De MaYo Baby!!!,https://i.ytimg.com/vi/zhX8niZe7eI/default.jpg,https://i.ytimg.com/vi/zhX8niZe7eI/mqdefault.jpg,https://i.ytimg.com/vi/zhX8niZe7eI/hqdefault.jpg
meVGACGC6uE,"THIS WILL MAKE YOU CRY FUNERAL CEREMONY FULL VIDEO,REST IN PEACE💔😭😭",https://i.ytimg.com/vi/meVGACGC6uE/default.jpg,https://i.ytimg.com/vi/meVGACGC6uE/mqdefault.jpg,https://i.ytimg.com/vi/meVGACGC6uE/hqdefault.jpg
GLG4cG_NzIE,Serving 17 Years in Solitary Confinement...,https://i.ytimg.com/vi/GLG4cG_NzIE/default.jpg,https://i.ytimg.com/vi/GLG4cG_NzIE/mqdefault.jpg,https://i.ytimg.com/vi/GLG4cG_NzIE/hqdefault.jpg
I9i36w6p564,How to Survive With No Food or Water,https://i.ytimg.com/vi/I9i36w6p564/default.jpg,https://i.ytimg.com/vi/I9i36w6p564/mqdefault.jpg,https://i.ytimg.com/vi/I9i36w6p564/hqdefault.jpg
EKzEB5txpWg,How to Survive a Helicopter Crash,https://i.ytimg.com/vi/EKzEB5txpWg/default.jpg,https://i.ytimg.com/vi/EKzEB5txpWg/mqdefault.jpg,https://i.ytimg.com/vi/EKzEB5txpWg/hqdefault.jpg
P8Naa4pzDdo,How to Survive a Burning High-Rise,https://i.ytimg.com/vi/P8Naa4pzDdo/default.jpg,https://i.ytimg.com/vi/P8Naa4pzDdo/mqdefault.jpg,https://i.ytimg.com/vi/P8Naa4pzDdo/hqdefault.jpg
mzc_onVvWT0,How to Survive in the Most Dangerous Prison,https://i.ytimg.com/vi/mzc_onVvWT0/default.jpg,https://i.ytimg.com/vi/mzc_onVvWT0/mqdefault.jpg,https://i.ytimg.com/vi/mzc_onVvWT0/hqdefault.jpg
11UD9gLNlHs,How to Survive Alone in the Forest,https://i.ytimg.com/vi/11UD9gLNlHs/default.jpg,https://i.ytimg.com/vi/11UD9gLNlHs/mqdefault.jpg,https://i.ytimg.com/vi/11UD9gLNlHs/hqdefault.jpg
dPwp-r6Mcng,What If You Spent 24 Hours Lost at Sea?,https://i.ytimg.com/vi/dPwp-r6Mcng/default.jpg,https://i.ytimg.com/vi/dPwp-r6Mcng/mqdefault.jpg,https://i.ytimg.com/vi/dPwp-r6Mcng/hqdefault.jpg
rQVF4G7sxY0,How to Survive Being Lost in the Amazon,https://i.ytimg.com/vi/rQVF4G7sxY0/default.jpg,https://i.ytimg.com/vi/rQVF4G7sxY0/mqdefault.jpg,https://i.ytimg.com/vi/rQVF4G7sxY0/hqdefault.jpg
__FkUtvu57U,How to Survive Being Trapped Underwater,https://i.ytimg.com/vi/__FkUtvu57U/default.jpg,https://i.ytimg.com/vi/__FkUtvu57U/mqdefault.jpg,https://i.ytimg.com/vi/__FkUtvu57U/hqdefault.jpg
tYlWmqspb5E,The Horrific Torture and Murder of Courtney Palmer,https://i.ytimg.com/vi/tYlWmqspb5E/default.jpg,https://i.ytimg.com/vi/tYlWmqspb5E/mqdefault.jpg,https://i.ytimg.com/vi/tYlWmqspb5E/hqdefault.jpg
LtX6j10bZUg,Several vacant properties sit untouched years after Katrina,https://i.ytimg.com/vi/LtX6j10bZUg/default.jpg,https://i.ytimg.com/vi/LtX6j10bZUg/mqdefault.jpg,https://i.ytimg.com/vi/LtX6j10bZUg/hqdefault.jpg
nwusb8De7Js,"BONANZA s. 10, ep. 23 / EN - whole series",https://i.ytimg.com/vi/nwusb8De7Js/default.jpg,https://i.ytimg.com/vi/nwusb8De7Js/mqdefault.jpg,https://i.ytimg.com/vi/nwusb8De7Js/hqdefault.jpg
JdaidXcd_bs,Prison Bullies. Watch out for the quiet guy.,https://i.ytimg.com/vi/JdaidXcd_bs/default.jpg,https://i.ytimg.com/vi/JdaidXcd_bs/mqdefault.jpg,https://i.ytimg.com/vi/JdaidXcd_bs/hqdefault.jpg
X_lO3YrI4Y0,morray - kingdom (official music video),https://i.ytimg.com/vi/X_lO3YrI4Y0/default.jpg,https://i.ytimg.com/vi/X_lO3YrI4Y0/mqdefault.jpg,https://i.ytimg.com/vi/X_lO3YrI4Y0/hqdefault.jpg
bmBNUIYFEzQ,CJ So Cool on meeting Royalty in the club.. cheated on her baby daddy to get with CJ (Part 4),https://i.ytimg.com/vi/bmBNUIYFEzQ/default.jpg,https://i.ytimg.com/vi/bmBNUIYFEzQ/mqdefault.jpg,https://i.ytimg.com/vi/bmBNUIYFEzQ/hqdefault.jpg
9IiGExOoW-w,"Phase 6: ""Friend•tervention""  | Episode 2 | LGBT Webseries",https://i.ytimg.com/vi/9IiGExOoW-w/default.jpg,https://i.ytimg.com/vi/9IiGExOoW-w/mqdefault.jpg,https://i.ytimg.com/vi/9IiGExOoW-w/hqdefault.jpg
wGgKK4U7LKE,SHORT FILM - Asking for it,https://i.ytimg.com/vi/wGgKK4U7LKE/default.jpg,https://i.ytimg.com/vi/wGgKK4U7LKE/mqdefault.jpg,https://i.ytimg.com/vi/wGgKK4U7LKE/hqdefault.jpg
K7Dmej0BaA8,"RNM with Musa & Mama9, the stud! Is she being forced?Will she end up being one of NatureBoy’s wives?",https://i.ytimg.com/vi/K7Dmej0BaA8/default.jpg,https://i.ytimg.com/vi/K7Dmej0BaA8/mqdefault.jpg,https://i.ytimg.com/vi/K7Dmej0BaA8/hqdefault.jpg
NeK9oUeNYAk,Wednesdays (Woensdagen) - short film about sexual abuse,https://i.ytimg.com/vi/NeK9oUeNYAk/default.jpg,https://i.ytimg.com/vi/NeK9oUeNYAk/mqdefault.jpg,https://i.ytimg.com/vi/NeK9oUeNYAk/hqdefault.jpg
wz-BmX-9xDs,Baytown doctor facing accusations of inappropriate behavior with female patients,https://i.ytimg.com/vi/wz-BmX-9xDs/default.jpg,https://i.ytimg.com/vi/wz-BmX-9xDs/mqdefault.jpg,https://i.ytimg.com/vi/wz-BmX-9xDs/hqdefault.jpg
meAIYnoPsuw,"A Mother's Struggle to Save Her Homeless, Drug-Addicted Son",https://i.ytimg.com/vi/meAIYnoPsuw/default.jpg,https://i.ytimg.com/vi/meAIYnoPsuw/mqdefault.jpg,https://i.ytimg.com/vi/meAIYnoPsuw/hqdefault.jpg
4LxuWP_DFr8,Celebrating Mental Health Awareness Month with Dr. Faith Brown,https://i.ytimg.com/vi/4LxuWP_DFr8/default.jpg,https://i.ytimg.com/vi/4LxuWP_DFr8/mqdefault.jpg,https://i.ytimg.com/vi/4LxuWP_DFr8/hqdefault.jpg
LVqYyf7UQmw,Driver Facing Multiple Charges In Officer Tsakos' Death,https://i.ytimg.com/vi/LVqYyf7UQmw/default.jpg,https://i.ytimg.com/vi/LVqYyf7UQmw/mqdefault.jpg,https://i.ytimg.com/vi/LVqYyf7UQmw/hqdefault.jpg
Z3vUhbtEtyw,Memorial service held for Milwaukee law enforcement killed in line of duty,https://i.ytimg.com/vi/Z3vUhbtEtyw/default.jpg,https://i.ytimg.com/vi/Z3vUhbtEtyw/mqdefault.jpg,https://i.ytimg.com/vi/Z3vUhbtEtyw/hqdefault.jpg
ZhcQ8AFwpiI,Men of Honor |  A SON NEVER FORGETS,https://i.ytimg.com/vi/ZhcQ8AFwpiI/default.jpg,https://i.ytimg.com/vi/ZhcQ8AFwpiI/mqdefault.jpg,https://i.ytimg.com/vi/ZhcQ8AFwpiI/hqdefault.jpg
NIEjBhA-dVU,Arrest made in murder of St. Pete mother who was shot in front of kids,https://i.ytimg.com/vi/NIEjBhA-dVU/default.jpg,https://i.ytimg.com/vi/NIEjBhA-dVU/mqdefault.jpg,https://i.ytimg.com/vi/NIEjBhA-dVU/hqdefault.jpg
LIUjRV5zAuk,This Lunch Lady Quit Her Job After She Had to Take a Student's Lunch Away,https://i.ytimg.com/vi/LIUjRV5zAuk/default.jpg,https://i.ytimg.com/vi/LIUjRV5zAuk/mqdefault.jpg,https://i.ytimg.com/vi/LIUjRV5zAuk/hqdefault.jpg
cDgukBLXnFE,Aunt Bee's Dying Words to Andy Griffith,https://i.ytimg.com/vi/cDgukBLXnFE/default.jpg,https://i.ytimg.com/vi/cDgukBLXnFE/mqdefault.jpg,https://i.ytimg.com/vi/cDgukBLXnFE/hqdefault.jpg
hU-jgS6AuKE,Purple Heart recipient gets new home,https://i.ytimg.com/vi/hU-jgS6AuKE/default.jpg,https://i.ytimg.com/vi/hU-jgS6AuKE/mqdefault.jpg,https://i.ytimg.com/vi/hU-jgS6AuKE/hqdefault.jpg
IJKJgsMWWNA,Man With Same Disease Pleads With 14-Year-Old Girl Not To Her End Her Life,https://i.ytimg.com/vi/IJKJgsMWWNA/default.jpg,https://i.ytimg.com/vi/IJKJgsMWWNA/mqdefault.jpg,https://i.ytimg.com/vi/IJKJgsMWWNA/hqdefault.jpg
KZDfd9ijDFI,Segregated America: A High School in South Carolina (Education Documentary) | Real Stories,https://i.ytimg.com/vi/KZDfd9ijDFI/default.jpg,https://i.ytimg.com/vi/KZDfd9ijDFI/mqdefault.jpg,https://i.ytimg.com/vi/KZDfd9ijDFI/hqdefault.jpg
IUu9F4wIG-0,Phoenix Suns Invite 6-Year-Old to Game After No One Showed Up at Birthday Party,https://i.ytimg.com/vi/IUu9F4wIG-0/default.jpg,https://i.ytimg.com/vi/IUu9F4wIG-0/mqdefault.jpg,https://i.ytimg.com/vi/IUu9F4wIG-0/hqdefault.jpg
-rY0lsiCFJY,12-Year-Old Sees Jimmy John's Delivery Man Put Lips on Drink,https://i.ytimg.com/vi/-rY0lsiCFJY/default.jpg,https://i.ytimg.com/vi/-rY0lsiCFJY/mqdefault.jpg,https://i.ytimg.com/vi/-rY0lsiCFJY/hqdefault.jpg
G0FMzcMuqJg,"Buying A Chick Fil A Franchise | Pros and Cons | Is It Worth it | Its Only $10,000",https://i.ytimg.com/vi/G0FMzcMuqJg/default.jpg,https://i.ytimg.com/vi/G0FMzcMuqJg/mqdefault.jpg,https://i.ytimg.com/vi/G0FMzcMuqJg/hqdefault.jpg
EhZZ0r5y6eE,Asian Woman Describes Hammer Attack in NYC,https://i.ytimg.com/vi/EhZZ0r5y6eE/default.jpg,https://i.ytimg.com/vi/EhZZ0r5y6eE/mqdefault.jpg,https://i.ytimg.com/vi/EhZZ0r5y6eE/hqdefault.jpg
NeGUIwcKcgE,"Man killed girlfriend to 'shut her up,' prosecutors say",https://i.ytimg.com/vi/NeGUIwcKcgE/default.jpg,https://i.ytimg.com/vi/NeGUIwcKcgE/mqdefault.jpg,https://i.ytimg.com/vi/NeGUIwcKcgE/hqdefault.jpg
4SyEaSbbzaU,Goldstein Investigates: Trailers Meant To Shelter Homeless Residents Sitting Unused In Parking Lots,https://i.ytimg.com/vi/4SyEaSbbzaU/default.jpg,https://i.ytimg.com/vi/4SyEaSbbzaU/mqdefault.jpg,https://i.ytimg.com/vi/4SyEaSbbzaU/hqdefault.jpg
ZB8s_Yqp3ko,Marshall Islands: A third of the nation has left for the US,https://i.ytimg.com/vi/ZB8s_Yqp3ko/default.jpg,https://i.ytimg.com/vi/ZB8s_Yqp3ko/mqdefault.jpg,https://i.ytimg.com/vi/ZB8s_Yqp3ko/hqdefault.jpg
WaaQAHAGTaM,Dying WWII vet asks to meet someone from same battlefield,https://i.ytimg.com/vi/WaaQAHAGTaM/default.jpg,https://i.ytimg.com/vi/WaaQAHAGTaM/mqdefault.jpg,https://i.ytimg.com/vi/WaaQAHAGTaM/hqdefault.jpg
JSGftZKrL7M,Toddler has perfect response for cashier who questioned black doll,https://i.ytimg.com/vi/JSGftZKrL7M/default.jpg,https://i.ytimg.com/vi/JSGftZKrL7M/mqdefault.jpg,https://i.ytimg.com/vi/JSGftZKrL7M/hqdefault.jpg
4aco80OebuE,I Am A Fairy Tale Princess For A Living | Refinery29,https://i.ytimg.com/vi/4aco80OebuE/default.jpg,https://i.ytimg.com/vi/4aco80OebuE/mqdefault.jpg,https://i.ytimg.com/vi/4aco80OebuE/hqdefault.jpg
lOfGhpiqz14,How This Restaurant Worker Saved a Kid From Alleged Child Abuse,https://i.ytimg.com/vi/lOfGhpiqz14/default.jpg,https://i.ytimg.com/vi/lOfGhpiqz14/mqdefault.jpg,https://i.ytimg.com/vi/lOfGhpiqz14/hqdefault.jpg
HNziOoXDBeg,"Scammers Wanted $3,000 - They Watched Me Spend It All",https://i.ytimg.com/vi/HNziOoXDBeg/default.jpg,https://i.ytimg.com/vi/HNziOoXDBeg/mqdefault.jpg,https://i.ytimg.com/vi/HNziOoXDBeg/hqdefault.jpg
1MPU8Qfyr64,“EBG” member shot and killed in Memphis,https://i.ytimg.com/vi/1MPU8Qfyr64/default.jpg,https://i.ytimg.com/vi/1MPU8Qfyr64/mqdefault.jpg,https://i.ytimg.com/vi/1MPU8Qfyr64/hqdefault.jpg
He1bgJ0sqtw,"The Multilevel Marketing Cults: Lies, Pyramid Schemes, and the Pursuit of Financial Freedom.",https://i.ytimg.com/vi/He1bgJ0sqtw/default.jpg,https://i.ytimg.com/vi/He1bgJ0sqtw/mqdefault.jpg,https://i.ytimg.com/vi/He1bgJ0sqtw/hqdefault.jpg
HRQy91ML_P4,Milwaukee leaders set emergency meeting to discuss violence | FOX6 News Milwaukee,https://i.ytimg.com/vi/HRQy91ML_P4/default.jpg,https://i.ytimg.com/vi/HRQy91ML_P4/mqdefault.jpg,https://i.ytimg.com/vi/HRQy91ML_P4/hqdefault.jpg
AICTyEoj_fQ,Military Family is latest victim of AZ Dept. of Ed,https://i.ytimg.com/vi/AICTyEoj_fQ/default.jpg,https://i.ytimg.com/vi/AICTyEoj_fQ/mqdefault.jpg,https://i.ytimg.com/vi/AICTyEoj_fQ/hqdefault.jpg
k-eWt_52oxU,Vandergrift police confrontation caught on camera,https://i.ytimg.com/vi/k-eWt_52oxU/default.jpg,https://i.ytimg.com/vi/k-eWt_52oxU/mqdefault.jpg,https://i.ytimg.com/vi/k-eWt_52oxU/hqdefault.jpg
vbPLri_o9XM,IHOP Host Doesn’t Realize Adam Sandler Is Who Wants a Table,https://i.ytimg.com/vi/vbPLri_o9XM/default.jpg,https://i.ytimg.com/vi/vbPLri_o9XM/mqdefault.jpg,https://i.ytimg.com/vi/vbPLri_o9XM/hqdefault.jpg
gpalMj_FAsQ,Research reveals world's glaciers melting faster than expected,https://i.ytimg.com/vi/gpalMj_FAsQ/default.jpg,https://i.ytimg.com/vi/gpalMj_FAsQ/mqdefault.jpg,https://i.ytimg.com/vi/gpalMj_FAsQ/hqdefault.jpg
