ID,TITLE,THUMBNAIL1,THUMBNAIL2,THUMBNAIL3
_xQAeKT2Mo8,ชาเลนจ์แม่ครัว แม่ค้าใจดี VS แม่ค้าใจร้าย ตลกๆ #Mukbang Good Chef vs Bad Chef FOOD:ขันติ,https://i.ytimg.com/vi/_xQAeKT2Mo8/default.jpg,https://i.ytimg.com/vi/_xQAeKT2Mo8/mqdefault.jpg,https://i.ytimg.com/vi/_xQAeKT2Mo8/hqdefault.jpg
piFLL6hz_fU,ชาเลนจ์สีฟ้า VS สีชมพู #Mukbang​ #ASMR PINK FOOD vs BLUE FOOD Challenge 핑크색 푸른 디저트 챌린지 :ขันติ,https://i.ytimg.com/vi/piFLL6hz_fU/default.jpg,https://i.ytimg.com/vi/piFLL6hz_fU/mqdefault.jpg,https://i.ytimg.com/vi/piFLL6hz_fU/hqdefault.jpg
OWLwABmT7yI,ชาเลนจ์ชานมไข่มุก ชานมไข่มุกยักษ์ แก้วชานมกินได้ #Mukbang Edible Pearl Tea Glass Challenge:ขันติ,https://i.ytimg.com/vi/OWLwABmT7yI/default.jpg,https://i.ytimg.com/vi/OWLwABmT7yI/mqdefault.jpg,https://i.ytimg.com/vi/OWLwABmT7yI/hqdefault.jpg
Z0Uy1hHdx8Y,หม้อกินได้ กินช้อน กุ้งค็อกเทลสีรุ้ง ล็อบสเตอร์ยักษ์ ต้มยำ #Mukbang Edible Hot Pot Lobster:ขันติ,https://i.ytimg.com/vi/Z0Uy1hHdx8Y/default.jpg,https://i.ytimg.com/vi/Z0Uy1hHdx8Y/mqdefault.jpg,https://i.ytimg.com/vi/Z0Uy1hHdx8Y/hqdefault.jpg
Z0Uy1hHdx8Y,หม้อกินได้ กินช้อน กุ้งค็อกเทลสีรุ้ง ล็อบสเตอร์ยักษ์ ต้มยำ #Mukbang Edible Hot Pot Lobster:ขันติ,https://i.ytimg.com/vi/Z0Uy1hHdx8Y/default.jpg,https://i.ytimg.com/vi/Z0Uy1hHdx8Y/mqdefault.jpg,https://i.ytimg.com/vi/Z0Uy1hHdx8Y/hqdefault.jpg
XO89BbFYUfo,แปรงทาสีกินได้ กินสีทาบ้าน (ปลอม) พร้อมวิธีทำ #Mukbang #ASMR Edible Paint Brush:ขันติ,https://i.ytimg.com/vi/XO89BbFYUfo/default.jpg,https://i.ytimg.com/vi/XO89BbFYUfo/mqdefault.jpg,https://i.ytimg.com/vi/XO89BbFYUfo/hqdefault.jpg
-eGwzsrCgp4,รองเท้ากินได้ กินรองเท้าส้นสูง พร้อมวิธีทำ ถามตอบQ&A #Mukbang EDIBLE SHOES High Heels:ขันติ,https://i.ytimg.com/vi/-eGwzsrCgp4/default.jpg,https://i.ytimg.com/vi/-eGwzsrCgp4/mqdefault.jpg,https://i.ytimg.com/vi/-eGwzsrCgp4/hqdefault.jpg
-QhbN-aAjgA,ชาเลนจ์สีฟ้า VS สีเขียว ทะเลกินได้ #Mukbang Edible Sea Blue Food VS Green Food Challenge:ขันติ,https://i.ytimg.com/vi/-QhbN-aAjgA/default.jpg,https://i.ytimg.com/vi/-QhbN-aAjgA/mqdefault.jpg,https://i.ytimg.com/vi/-QhbN-aAjgA/hqdefault.jpg
cFFNrT9qVIc,#ASMR eating เสียงกิน กาวกินได้ สอนทำ กาวแท่งกินได้ Edible GLUE Stick 식용 접착제 #Mukbang :ขันติ,https://i.ytimg.com/vi/cFFNrT9qVIc/default.jpg,https://i.ytimg.com/vi/cFFNrT9qVIc/mqdefault.jpg,https://i.ytimg.com/vi/cFFNrT9qVIc/hqdefault.jpg
8oKiXexHe-s,ชาเลนจ์คนโชคดี vs คนโชคไม่ดี อาหาร คนจน VS คนรวย #Mukbang LUCKY VS UNLUCKY FOOD CHALLENGE:ขันติ,https://i.ytimg.com/vi/8oKiXexHe-s/default.jpg,https://i.ytimg.com/vi/8oKiXexHe-s/mqdefault.jpg,https://i.ytimg.com/vi/8oKiXexHe-s/hqdefault.jpg
pvGCI8xeBpY,ดอกกุหลาบกินได้ กินดอกไม้🌹 วันวาเลนไทน์ ขอให้คนดูสมหวัง #Mukbang #ASMR Edible Roses Valentine:ขันติ,https://i.ytimg.com/vi/pvGCI8xeBpY/default.jpg,https://i.ytimg.com/vi/pvGCI8xeBpY/mqdefault.jpg,https://i.ytimg.com/vi/pvGCI8xeBpY/hqdefault.jpg
N5mAz21Ubrk,#ASMR eating เสียงกิน สตอเบอรี่กรอบ ส้ม กีวี่ สอนทำผลไม้เคลือบน้ำตาล Candied fruit #Mukbang :ขันติ,https://i.ytimg.com/vi/N5mAz21Ubrk/default.jpg,https://i.ytimg.com/vi/N5mAz21Ubrk/mqdefault.jpg,https://i.ytimg.com/vi/N5mAz21Ubrk/hqdefault.jpg
ld7wSK5UcFk,กิน หวย ล็อตตารี่ กินได้ ก่อนที่มันจะกินเรา! งวดนี้ ขอให้ทุกคนโชคดี #Mukbang :ขันติ,https://i.ytimg.com/vi/ld7wSK5UcFk/default.jpg,https://i.ytimg.com/vi/ld7wSK5UcFk/mqdefault.jpg,https://i.ytimg.com/vi/ld7wSK5UcFk/hqdefault.jpg
yEJV_JHNP1o,ชาเลนจ์คนจน VS คนจนมาก อาหารถูก กระบองเพชรกินได้ #Mukbang​ VERY POOR vs POOR FOOD CHALLENGE:ขันติ,https://i.ytimg.com/vi/yEJV_JHNP1o/default.jpg,https://i.ytimg.com/vi/yEJV_JHNP1o/mqdefault.jpg,https://i.ytimg.com/vi/yEJV_JHNP1o/hqdefault.jpg
_5IhYi1kNFA,แซลมอน 5 กิโล มาทำ ก๋วยเตี๋ยว แซลมอนสด ญี่ปุ่น #Mukbang #ASMR Raw Salmon Noodles :ขันติ,https://i.ytimg.com/vi/_5IhYi1kNFA/default.jpg,https://i.ytimg.com/vi/_5IhYi1kNFA/mqdefault.jpg,https://i.ytimg.com/vi/_5IhYi1kNFA/hqdefault.jpg
6kMP9fUBRJs,เด็ก VS คนแก่ ชาเลนจ์ตลกๆ คุณยาย #Mukbang​ Kid vs Old Man FOOD CHALLENGE:ขันติ,https://i.ytimg.com/vi/6kMP9fUBRJs/default.jpg,https://i.ytimg.com/vi/6kMP9fUBRJs/mqdefault.jpg,https://i.ytimg.com/vi/6kMP9fUBRJs/hqdefault.jpg
w1UIXpBlPOA,#ASMR eating เสียงกิน ไข่กุ้ง กรุบกรอบ! TOBIKO Eggs Shrimp Eggs 새우 계란 虾蛋 :ขันติ,https://i.ytimg.com/vi/w1UIXpBlPOA/default.jpg,https://i.ytimg.com/vi/w1UIXpBlPOA/mqdefault.jpg,https://i.ytimg.com/vi/w1UIXpBlPOA/hqdefault.jpg
7sEO3pkHIh4,กิน พวงมาลัยวันแม่ แม่ทำไมทำแบบนี้! #Mukbang #ASMR :ขันติ,https://i.ytimg.com/vi/7sEO3pkHIh4/default.jpg,https://i.ytimg.com/vi/7sEO3pkHIh4/mqdefault.jpg,https://i.ytimg.com/vi/7sEO3pkHIh4/hqdefault.jpg
-3xK2RHrDxE,#Mukbang eating กิน ปลาหมึกสด ปลาหมึกสายย่าง น้ำจิ้มซีฟู้ด octopus 오징어 #ASMR :ขันติ,https://i.ytimg.com/vi/-3xK2RHrDxE/default.jpg,https://i.ytimg.com/vi/-3xK2RHrDxE/mqdefault.jpg,https://i.ytimg.com/vi/-3xK2RHrDxE/hqdefault.jpg
_aQvKYMC7XU,แกล้งแม่ แอบกิน ยําทูน่าสูตรอาฟเตอร์ยํา ตอนตี3 #Mukbang #ASMR Eating SEALECT X AFTER YUM:ขันติ,https://i.ytimg.com/vi/_aQvKYMC7XU/default.jpg,https://i.ytimg.com/vi/_aQvKYMC7XU/mqdefault.jpg,https://i.ytimg.com/vi/_aQvKYMC7XU/hqdefault.jpg
-d0u_B5Oi6E,#ASMR eating เสียงกิน ไข่กุ้ง เยอะมาก เสียงกรอบสุดๆ TOBIKO Eggs Shrimp Eggs 새우 계란 虾蛋 :ขันติ,https://i.ytimg.com/vi/-d0u_B5Oi6E/default.jpg,https://i.ytimg.com/vi/-d0u_B5Oi6E/mqdefault.jpg,https://i.ytimg.com/vi/-d0u_B5Oi6E/hqdefault.jpg
IZHKjnLagfQ,ภาพวาดกินได้ กินพู่กัน จานสี 🎨 งานศิลปะ (ปลอม) #Mukbang #ASMR Edible Paintings Brushes:ขันติ,https://i.ytimg.com/vi/IZHKjnLagfQ/default.jpg,https://i.ytimg.com/vi/IZHKjnLagfQ/mqdefault.jpg,https://i.ytimg.com/vi/IZHKjnLagfQ/hqdefault.jpg
_YMw-cZr8KU,โอริโอ้สีสายรุ้ง โอริโอ้ยักษ์ ไอศกรีมโอริโอ้ #Mukbang Giant Oreo Oreo Challenge:ขันติ,https://i.ytimg.com/vi/_YMw-cZr8KU/default.jpg,https://i.ytimg.com/vi/_YMw-cZr8KU/mqdefault.jpg,https://i.ytimg.com/vi/_YMw-cZr8KU/hqdefault.jpg
xlKet1HJD5Y,มาม่าเผ็ดมาเลเชีย มาม่าเผ็ดเกาหลี ลูกอมเผ็ดที่สุดในโลก #Mukbang Spicy Noodles CHALLENGE:ขันติ,https://i.ytimg.com/vi/xlKet1HJD5Y/default.jpg,https://i.ytimg.com/vi/xlKet1HJD5Y/mqdefault.jpg,https://i.ytimg.com/vi/xlKet1HJD5Y/hqdefault.jpg
YWpv7Y4nsqI,กล่องของขวัญกินได้ เสี่ยงดวง กินหลอดไฟ! พร้อมวิธีทำ #Mukbang Edible Gift box Light bulb:ขันติ,https://i.ytimg.com/vi/YWpv7Y4nsqI/default.jpg,https://i.ytimg.com/vi/YWpv7Y4nsqI/mqdefault.jpg,https://i.ytimg.com/vi/YWpv7Y4nsqI/hqdefault.jpg
w5VaVuF3Cpg,โทรศัพท์บ้านกินได้ กินเครื่องคิดเลข ปากกา #Mukbang #ASMR Edible Landline Phone Calculator:ขันติ,https://i.ytimg.com/vi/w5VaVuF3Cpg/default.jpg,https://i.ytimg.com/vi/w5VaVuF3Cpg/mqdefault.jpg,https://i.ytimg.com/vi/w5VaVuF3Cpg/hqdefault.jpg
PlwxVu65Kuk,เยลลี่เคียวโฮ รสโคล่า VS เยลลี่องุ่นเคียวโฮยักษ์ #Mukbang Giant Kyoho Jelly Grape Cola Kyoho:ขันติ,https://i.ytimg.com/vi/PlwxVu65Kuk/default.jpg,https://i.ytimg.com/vi/PlwxVu65Kuk/mqdefault.jpg,https://i.ytimg.com/vi/PlwxVu65Kuk/hqdefault.jpg
545ufLTLctc,ชาเลนจ์คิทแคท ช็อคโกแลต KITKAT #Mukbang KitKat Chocolate Challenge 초콜릿 챌린지:ขันติ,https://i.ytimg.com/vi/545ufLTLctc/default.jpg,https://i.ytimg.com/vi/545ufLTLctc/mqdefault.jpg,https://i.ytimg.com/vi/545ufLTLctc/hqdefault.jpg
RIpqNbiDiok,แกล้งกินไก่เผ็ดเกาหลี แย่งในTV #Mukbang #ASMR Korean Spicy Chicken How to watch Mukbang Cinema:ขันติ,https://i.ytimg.com/vi/RIpqNbiDiok/default.jpg,https://i.ytimg.com/vi/RIpqNbiDiok/mqdefault.jpg,https://i.ytimg.com/vi/RIpqNbiDiok/hqdefault.jpg
ZfF5ZKzspsY,ชาเลนจ์อ้วน VS ผอม พี่กับน้อง อ้วนแล้วไง? #Mukbang​ FAT VS SKINNY FOOD CHALLENGE:ขันติ,https://i.ytimg.com/vi/ZfF5ZKzspsY/default.jpg,https://i.ytimg.com/vi/ZfF5ZKzspsY/mqdefault.jpg,https://i.ytimg.com/vi/ZfF5ZKzspsY/hqdefault.jpg
tHiVLf4IYNA,ลองกิน แมงป่อง ทะเลทราย เกือบต่อยปาก! #Mukbang #ASMR Scorpion 투석기 :ขันติ,https://i.ytimg.com/vi/tHiVLf4IYNA/default.jpg,https://i.ytimg.com/vi/tHiVLf4IYNA/mqdefault.jpg,https://i.ytimg.com/vi/tHiVLf4IYNA/hqdefault.jpg
hIVj7lmRXtY,ชาเลนจ์สิ่งที่คิด VS ความเป็นจริง อาหารถูก vs แพง #Mukbang What I think vs reality CHALLENGE:ขันติ,https://i.ytimg.com/vi/hIVj7lmRXtY/default.jpg,https://i.ytimg.com/vi/hIVj7lmRXtY/mqdefault.jpg,https://i.ytimg.com/vi/hIVj7lmRXtY/hqdefault.jpg
Q9u2RqBLhgE,เครื่องมือทำสวนกินได้ กินไส้เดือนยักษ์ กินดิน #Mukbang #ASMR EDIBLE WORMS GARDEN TOOLS SOIL:ขันติ,https://i.ytimg.com/vi/Q9u2RqBLhgE/default.jpg,https://i.ytimg.com/vi/Q9u2RqBLhgE/mqdefault.jpg,https://i.ytimg.com/vi/Q9u2RqBLhgE/hqdefault.jpg
Ma7zvPxDgfw,#ASMR eating เสียงกิน เหล็ก กรรไกร น็อต ประแจ เครื่องมือช่าง He's Eating WHAT? STEEL #Mukbang :ขันติ,https://i.ytimg.com/vi/Ma7zvPxDgfw/default.jpg,https://i.ytimg.com/vi/Ma7zvPxDgfw/mqdefault.jpg,https://i.ytimg.com/vi/Ma7zvPxDgfw/hqdefault.jpg
CCMODltCdMI,#ASMR eating เสียงกิน สาหร่ายพวงองุ่น ปลาหมึกย่าง Seagrapes + Grilled octopus 씨리얼 오징어 乌贼:ขันติ,https://i.ytimg.com/vi/CCMODltCdMI/default.jpg,https://i.ytimg.com/vi/CCMODltCdMI/mqdefault.jpg,https://i.ytimg.com/vi/CCMODltCdMI/hqdefault.jpg
9-Gi8N1JvAQ,ชาเลนจ์คนมีเงิน VS คนไม่มีเงิน ธรรมดา VS จน น่าสงสาร #Mukbang​ RICH vs POOR FOOD CHALLENGE:ขันติ,https://i.ytimg.com/vi/9-Gi8N1JvAQ/default.jpg,https://i.ytimg.com/vi/9-Gi8N1JvAQ/mqdefault.jpg,https://i.ytimg.com/vi/9-Gi8N1JvAQ/hqdefault.jpg
OqsMDpSGg-w,#Mukbang eating กิน ปลาหมึกสายรุ้ง ย่าง! สีสายรุ้ง สอนทำด้วย #ASMR Rainbow Octopus 무지개 낙지 :ขันติ,https://i.ytimg.com/vi/OqsMDpSGg-w/default.jpg,https://i.ytimg.com/vi/OqsMDpSGg-w/mqdefault.jpg,https://i.ytimg.com/vi/OqsMDpSGg-w/hqdefault.jpg
7-zIrSjbc-o,ชาเลนจ์อาหารสีดำ VS สีขาว #Mukbang #ASMR BLACK VS WHITE COLOR CHALLENGE 흑인 대 백인의 도전:ขันติ,https://i.ytimg.com/vi/7-zIrSjbc-o/default.jpg,https://i.ytimg.com/vi/7-zIrSjbc-o/mqdefault.jpg,https://i.ytimg.com/vi/7-zIrSjbc-o/hqdefault.jpg
nC6fVrIU7c0,ชาเลนจ์คน VS สัตว์ อาหาร มนุษย์กับสัตว์ #Mukbang People vs Animals FOOD 사람 대 동물 음식:ขันติ,https://i.ytimg.com/vi/nC6fVrIU7c0/default.jpg,https://i.ytimg.com/vi/nC6fVrIU7c0/mqdefault.jpg,https://i.ytimg.com/vi/nC6fVrIU7c0/hqdefault.jpg
C56ii2GytKY,ส้มตำสาหร่ายพวงองุ่น พริก300 เม็ด🔥 พร้อมวิธีทำ #Mukbang #ASMR SEA GRAPES Chilli:ขันติ,https://i.ytimg.com/vi/C56ii2GytKY/default.jpg,https://i.ytimg.com/vi/C56ii2GytKY/mqdefault.jpg,https://i.ytimg.com/vi/C56ii2GytKY/hqdefault.jpg
wAJMfSC55Kc,ต้นคริสต์มาสกินได้ กินหมวกซานตาคลอส พร้อมวิธีทำ #Mukbang #ASMR Edible Christmas Tree:ขันติ,https://i.ytimg.com/vi/wAJMfSC55Kc/default.jpg,https://i.ytimg.com/vi/wAJMfSC55Kc/mqdefault.jpg,https://i.ytimg.com/vi/wAJMfSC55Kc/hqdefault.jpg
Eq0LeOew2v4,#Mukbang eating กิน โทรศัพท์ กินได้ มีจริง #ASMR Edible Phone 전화를 먹는 :ขันติ,https://i.ytimg.com/vi/Eq0LeOew2v4/default.jpg,https://i.ytimg.com/vi/Eq0LeOew2v4/mqdefault.jpg,https://i.ytimg.com/vi/Eq0LeOew2v4/hqdefault.jpg
523rgO35tHA,ชาเลนจ์กินอาหารสุดฮิต ตามTikTok เยลลี่น้ำผึ้ง ผักอบกรอบ #Mukbang HONEY JELLY POPULAR FOOD:ขันติ,https://i.ytimg.com/vi/523rgO35tHA/default.jpg,https://i.ytimg.com/vi/523rgO35tHA/mqdefault.jpg,https://i.ytimg.com/vi/523rgO35tHA/hqdefault.jpg
ER-YGGcTnBo,แกล้งน้อง! กิน ชีส 100แผ่น ต๊อกโบกี ใส่วาซาบิ ไฟเกือบไหม้! #Mukbang :ขันติ,https://i.ytimg.com/vi/ER-YGGcTnBo/default.jpg,https://i.ytimg.com/vi/ER-YGGcTnBo/mqdefault.jpg,https://i.ytimg.com/vi/ER-YGGcTnBo/hqdefault.jpg
tTPjCMQ_wfc,ซูชิเสี่ยงดวง 🍣 ปลาร้า แมงกุ๊ดจี่ ไข่ปลาแซลมอน ปูเค็ม มะระขี้นก แมลงดา #Mukbang #ASMR Sushi:ขันติ,https://i.ytimg.com/vi/tTPjCMQ_wfc/default.jpg,https://i.ytimg.com/vi/tTPjCMQ_wfc/mqdefault.jpg,https://i.ytimg.com/vi/tTPjCMQ_wfc/hqdefault.jpg
jo3Q0KwdtLk,#ASMR eating เสียงกิน ไอติมมินเนี่ยน ไอศกรีม รสกล้วย Ice cream Minions Banana #Mukbang :ขันติ,https://i.ytimg.com/vi/jo3Q0KwdtLk/default.jpg,https://i.ytimg.com/vi/jo3Q0KwdtLk/mqdefault.jpg,https://i.ytimg.com/vi/jo3Q0KwdtLk/hqdefault.jpg
XxlP7ee6r7Q,ชาเลนจ์อาหาร คนท้อง VS ไม่ท้อง #Mukbang PREGNANT vs NOT PREGNANT FOOD:ขันติ,https://i.ytimg.com/vi/XxlP7ee6r7Q/default.jpg,https://i.ytimg.com/vi/XxlP7ee6r7Q/mqdefault.jpg,https://i.ytimg.com/vi/XxlP7ee6r7Q/hqdefault.jpg
auyhIwXyps0,#Mukbang eating กิน ลิปสติกยักษ์ กินได้ สอนทำด้วย #ASMR Edible Giant Lipstick 립스틱 :ขันติ ครูจูนเอง,https://i.ytimg.com/vi/auyhIwXyps0/default.jpg,https://i.ytimg.com/vi/auyhIwXyps0/mqdefault.jpg,https://i.ytimg.com/vi/auyhIwXyps0/hqdefault.jpg
yGx9OmtF6zI,ชาเลนจ์อาหารสีชมพู วาเลนไทน์ Pink Food Valentine Challenge #Mukbang #ASMR 핑크 발렌타인 음식 챌린지:ขันติ,https://i.ytimg.com/vi/yGx9OmtF6zI/default.jpg,https://i.ytimg.com/vi/yGx9OmtF6zI/mqdefault.jpg,https://i.ytimg.com/vi/yGx9OmtF6zI/hqdefault.jpg
WtMAVDUhm98,อิฐบล็อกกินได้ กินปูน ก่อสร้างเสี่ยงดวง! วันแรงงาน #Mukbang #ASMR Edible Brick Blocks Cement:ขันติ,https://i.ytimg.com/vi/WtMAVDUhm98/default.jpg,https://i.ytimg.com/vi/WtMAVDUhm98/mqdefault.jpg,https://i.ytimg.com/vi/WtMAVDUhm98/hqdefault.jpg
z8LFlgPXq4Q,แว่นตากินได้ 👓 กินผ้าเช็ดแว่น พร้อมวิธีทำ ฉลอง 1ล้านซัพ #Mukbang #ASMR Edible Eyeglasses:ขันติ,https://i.ytimg.com/vi/z8LFlgPXq4Q/default.jpg,https://i.ytimg.com/vi/z8LFlgPXq4Q/mqdefault.jpg,https://i.ytimg.com/vi/z8LFlgPXq4Q/hqdefault.jpg
pb6zfHXov4A,มาการองเสี่ยงดวง กิน! ยาสีฟัน วาซาบิ ชีส มายองเนส โคซูจัง #Mukbang Macaron:ขันติ,https://i.ytimg.com/vi/pb6zfHXov4A/default.jpg,https://i.ytimg.com/vi/pb6zfHXov4A/mqdefault.jpg,https://i.ytimg.com/vi/pb6zfHXov4A/hqdefault.jpg
3UhL6yG7Xxw,#ASMR eating เสียงกิน ยางลบ สอนทำ ยางลบกินได้ Edible Eraser DIY 식용 지우개#Mukbang :ขันติ,https://i.ytimg.com/vi/3UhL6yG7Xxw/default.jpg,https://i.ytimg.com/vi/3UhL6yG7Xxw/mqdefault.jpg,https://i.ytimg.com/vi/3UhL6yG7Xxw/hqdefault.jpg
Go0cNkMKvq0,สตอเบอรี่กรอบ ช็อคโกแลต พร้อมวิธีทำ #Mukbang Crispy Strawberries Chocolate Bark:ขันติ,https://i.ytimg.com/vi/Go0cNkMKvq0/default.jpg,https://i.ytimg.com/vi/Go0cNkMKvq0/mqdefault.jpg,https://i.ytimg.com/vi/Go0cNkMKvq0/hqdefault.jpg
Go0cNkMKvq0,สตอเบอรี่กรอบ ช็อคโกแลต พร้อมวิธีทำ #Mukbang Crispy Strawberries Chocolate Bark:ขันติ,https://i.ytimg.com/vi/Go0cNkMKvq0/default.jpg,https://i.ytimg.com/vi/Go0cNkMKvq0/mqdefault.jpg,https://i.ytimg.com/vi/Go0cNkMKvq0/hqdefault.jpg
Go0cNkMKvq0,สตอเบอรี่กรอบ ช็อคโกแลต พร้อมวิธีทำ #Mukbang Crispy Strawberries Chocolate Bark:ขันติ,https://i.ytimg.com/vi/Go0cNkMKvq0/default.jpg,https://i.ytimg.com/vi/Go0cNkMKvq0/mqdefault.jpg,https://i.ytimg.com/vi/Go0cNkMKvq0/hqdefault.jpg
TQ78hHcpXbA,กินชาไข่มุก Bear House ทำไข่มุกโมจิ สูตรแบร์เฮาร์ ไอติมชาไข่มุก  #Mukbang #ASMR Bubble Tea:ขันติ,https://i.ytimg.com/vi/TQ78hHcpXbA/default.jpg,https://i.ytimg.com/vi/TQ78hHcpXbA/mqdefault.jpg,https://i.ytimg.com/vi/TQ78hHcpXbA/hqdefault.jpg
TQ78hHcpXbA,กินชาไข่มุก Bear House ทำไข่มุกโมจิ สูตรแบร์เฮาร์ ไอติมชาไข่มุก  #Mukbang #ASMR Bubble Tea:ขันติ,https://i.ytimg.com/vi/TQ78hHcpXbA/default.jpg,https://i.ytimg.com/vi/TQ78hHcpXbA/mqdefault.jpg,https://i.ytimg.com/vi/TQ78hHcpXbA/hqdefault.jpg
MJiyHH__KQY,กิน ดอกกล้วยไม้! ครั้งแรก สอนทำด้วย #Mukbang #ASMR Eating Orchid :ขันติ,https://i.ytimg.com/vi/MJiyHH__KQY/default.jpg,https://i.ytimg.com/vi/MJiyHH__KQY/mqdefault.jpg,https://i.ytimg.com/vi/MJiyHH__KQY/hqdefault.jpg
xjFK9Y8XuJk,บิงซูปูไข่ดอง ปูไข่นึ่งนมสด กุ้งสด กั้งไข่ กุ้งแม่น้ำ น้ำจิ้มซีฟู้ด #Mukbang #ASMR Seafood:ขันติ,https://i.ytimg.com/vi/xjFK9Y8XuJk/default.jpg,https://i.ytimg.com/vi/xjFK9Y8XuJk/mqdefault.jpg,https://i.ytimg.com/vi/xjFK9Y8XuJk/hqdefault.jpg
khqmmRkUTa4,#ASMR eating เสียงกิน รังผึ้ง + ว่านหางจระเข้  ALOE VERA + HONEYCOMB #Mukbang 알로에 베라 + 허니 콤 :ขันติ,https://i.ytimg.com/vi/khqmmRkUTa4/default.jpg,https://i.ytimg.com/vi/khqmmRkUTa4/mqdefault.jpg,https://i.ytimg.com/vi/khqmmRkUTa4/hqdefault.jpg
DwWcsn0W0Nw,เยลลี่ vs อาหารจริง ชาเลนจ์อาหาร vs กัมมี่ #Mukbang Food vs Gummy Challenge 음식 vs 젤리 챌린지:ขันติ,https://i.ytimg.com/vi/DwWcsn0W0Nw/default.jpg,https://i.ytimg.com/vi/DwWcsn0W0Nw/mqdefault.jpg,https://i.ytimg.com/vi/DwWcsn0W0Nw/hqdefault.jpg
_NX4KzfX6y0,เซอร์ไพรส์แม่ กินปูไข่ดองครั้งแรก ปูดองปลาร้านัวๆ #Mukbang RAW Marinated pickled CRAB :ขันติ,https://i.ytimg.com/vi/_NX4KzfX6y0/default.jpg,https://i.ytimg.com/vi/_NX4KzfX6y0/mqdefault.jpg,https://i.ytimg.com/vi/_NX4KzfX6y0/hqdefault.jpg
8bOZerpvn4Q,ชาเลนจ์เชฟกระทะเหล็ก VS คนธรรมดา มารยาทบนโต๊ะอาหาร #Mukbang​ Food chef vs normal person:ขันติ,https://i.ytimg.com/vi/8bOZerpvn4Q/default.jpg,https://i.ytimg.com/vi/8bOZerpvn4Q/mqdefault.jpg,https://i.ytimg.com/vi/8bOZerpvn4Q/hqdefault.jpg
EZDvt0xSDnQ,เคียวโฮรสโคล่า พร้อมวิธีทำ จากเยลลี่เจเล่ ฟรุ้ตตี้และโซดามิกซ์ #Mukbang Cola Kyoho Jelly Jele:ขันติ,https://i.ytimg.com/vi/EZDvt0xSDnQ/default.jpg,https://i.ytimg.com/vi/EZDvt0xSDnQ/mqdefault.jpg,https://i.ytimg.com/vi/EZDvt0xSDnQ/hqdefault.jpg
bd1Zu0f3KKM,ตู้ไขขนมคิตตี้ กินทุกอย่างที่เป็น เฮลโลคิตตี้ #Mukbang Hello Kitty Challenges 헬로 키티 챌린지:ขันติ,https://i.ytimg.com/vi/bd1Zu0f3KKM/default.jpg,https://i.ytimg.com/vi/bd1Zu0f3KKM/mqdefault.jpg,https://i.ytimg.com/vi/bd1Zu0f3KKM/hqdefault.jpg
ZOuDoyOllCE,ขวดน้ำกินได้ เยลลี่ลูกส้ม รถน้ำแข็ง บิงซูจากน้ำผลไม้ดีโด้ พร้อมวิธีทำ #Mukbang Edible Bottle:ขันติ,https://i.ytimg.com/vi/ZOuDoyOllCE/default.jpg,https://i.ytimg.com/vi/ZOuDoyOllCE/mqdefault.jpg,https://i.ytimg.com/vi/ZOuDoyOllCE/hqdefault.jpg
YBtTFCm2fXk,เหล็กกินได้ กินเครื่องมือช่าง 🔧 ประแจ หัวเทียน คีมตัดเหล็ก พร้อมวิธีทำ #Mukbang Edible Steel:ขันติ,https://i.ytimg.com/vi/YBtTFCm2fXk/default.jpg,https://i.ytimg.com/vi/YBtTFCm2fXk/mqdefault.jpg,https://i.ytimg.com/vi/YBtTFCm2fXk/hqdefault.jpg
gGZA_RORMwk,#Mukbang eating กิน รังผึ้ง ว่านหางจระเข้ กระบองเพชรกินได้ #ASMR Honeycomb Aloe Vera Cactus :ขันติ,https://i.ytimg.com/vi/gGZA_RORMwk/default.jpg,https://i.ytimg.com/vi/gGZA_RORMwk/mqdefault.jpg,https://i.ytimg.com/vi/gGZA_RORMwk/hqdefault.jpg
eaSX_xtyP34,#ASMR eating เสียงกิน กุ้งแช่น้ำปลา สาหร่ายพวงองุ่น Shrimp in fish sauce SEA GRAPES #Mukbang :ขันติ,https://i.ytimg.com/vi/eaSX_xtyP34/default.jpg,https://i.ytimg.com/vi/eaSX_xtyP34/mqdefault.jpg,https://i.ytimg.com/vi/eaSX_xtyP34/hqdefault.jpg
SjpgbnAcAtU,กินอาหารสีรุ้ง เยลลี่แก้ว หลอดกัมมี่กินได้ #Mukbang #ASMR Rainbow Food EDIBLE JELLY CUPS:ขันติ,https://i.ytimg.com/vi/SjpgbnAcAtU/default.jpg,https://i.ytimg.com/vi/SjpgbnAcAtU/mqdefault.jpg,https://i.ytimg.com/vi/SjpgbnAcAtU/hqdefault.jpg
UwcUqsDske4,กินหนังสือ เรียนมันยาก! ปากกากินได้ จำสอบ📖 #Mukbang edible Book Pen :ขันติ หนูหรี่ เม่ามอย,https://i.ytimg.com/vi/UwcUqsDske4/default.jpg,https://i.ytimg.com/vi/UwcUqsDske4/mqdefault.jpg,https://i.ytimg.com/vi/UwcUqsDske4/hqdefault.jpg
YpffWNXVlGw,ชาเลนจ์เค้กวันเกิด เป่าเค้ก สุขสันต์วันเกิด #Mukbang BIRTHDAY CAKE CHALLENGE 생일 케이크 챌린지:ขันติ,https://i.ytimg.com/vi/YpffWNXVlGw/default.jpg,https://i.ytimg.com/vi/YpffWNXVlGw/mqdefault.jpg,https://i.ytimg.com/vi/YpffWNXVlGw/hqdefault.jpg
AgezsIy96CY,กินหมูกระทะ กว่าจะมาเป็นช่องขันติ กินจนเข้าโรงพยาบาล ดูคลิปแรกตัวเอง #Mukbang :ขันติ,https://i.ytimg.com/vi/AgezsIy96CY/default.jpg,https://i.ytimg.com/vi/AgezsIy96CY/mqdefault.jpg,https://i.ytimg.com/vi/AgezsIy96CY/hqdefault.jpg
zmRBQgsHnXM,#ASMR eating เสียงกิน ปืนฉีดน้ำ กินได้ สงกรานต์ 2019 Edible Water Gun 물총 #Mukbang :ขันติ,https://i.ytimg.com/vi/zmRBQgsHnXM/default.jpg,https://i.ytimg.com/vi/zmRBQgsHnXM/mqdefault.jpg,https://i.ytimg.com/vi/zmRBQgsHnXM/hqdefault.jpg
