ID,TITLE,THUMBNAIL1,THUMBNAIL2,THUMBNAIL3
_imDI2ASzy0,Ben Simmons’ family denies abuse claims made by sister Olivia,https://i.ytimg.com/vi/_imDI2ASzy0/default.jpg,https://i.ytimg.com/vi/_imDI2ASzy0/mqdefault.jpg,https://i.ytimg.com/vi/_imDI2ASzy0/hqdefault.jpg
jSEg9UzbQM0,Celebs skip queue with Aussies stranded,https://i.ytimg.com/vi/jSEg9UzbQM0/default.jpg,https://i.ytimg.com/vi/jSEg9UzbQM0/mqdefault.jpg,https://i.ytimg.com/vi/jSEg9UzbQM0/hqdefault.jpg
_BgjDjXkkro,Travel blogger couple Lauren Bullen and Jack Morris split,https://i.ytimg.com/vi/_BgjDjXkkro/default.jpg,https://i.ytimg.com/vi/_BgjDjXkkro/mqdefault.jpg,https://i.ytimg.com/vi/_BgjDjXkkro/hqdefault.jpg
9XdyoTL1Z7M,Star Wars: What is the future of the franchise?,https://i.ytimg.com/vi/9XdyoTL1Z7M/default.jpg,https://i.ytimg.com/vi/9XdyoTL1Z7M/mqdefault.jpg,https://i.ytimg.com/vi/9XdyoTL1Z7M/hqdefault.jpg
R58DCR5b4O4,Neighbours star alleges ‘multiple racist traumas’,https://i.ytimg.com/vi/R58DCR5b4O4/default.jpg,https://i.ytimg.com/vi/R58DCR5b4O4/mqdefault.jpg,https://i.ytimg.com/vi/R58DCR5b4O4/hqdefault.jpg
hhQ8walL1gE,"MAFS brides: Nine ""promoting domestic violence""",https://i.ytimg.com/vi/hhQ8walL1gE/default.jpg,https://i.ytimg.com/vi/hhQ8walL1gE/mqdefault.jpg,https://i.ytimg.com/vi/hhQ8walL1gE/hqdefault.jpg
Ad9lWhz9jVU,Kylie Jenner accused of ‘editing her waist’,https://i.ytimg.com/vi/Ad9lWhz9jVU/default.jpg,https://i.ytimg.com/vi/Ad9lWhz9jVU/mqdefault.jpg,https://i.ytimg.com/vi/Ad9lWhz9jVU/hqdefault.jpg
p4V6diBKwdI,Yellow Wiggle Emma Watkins announces engagement,https://i.ytimg.com/vi/p4V6diBKwdI/default.jpg,https://i.ytimg.com/vi/p4V6diBKwdI/mqdefault.jpg,https://i.ytimg.com/vi/p4V6diBKwdI/hqdefault.jpg
D3hpyJZeymU,"Carla Zampatti: Legendary Australian fashion designer dies, aged 78",https://i.ytimg.com/vi/D3hpyJZeymU/default.jpg,https://i.ytimg.com/vi/D3hpyJZeymU/mqdefault.jpg,https://i.ytimg.com/vi/D3hpyJZeymU/hqdefault.jpg
SH4Xy3N8yy4,Hidden iPhone tricks to try today,https://i.ytimg.com/vi/SH4Xy3N8yy4/default.jpg,https://i.ytimg.com/vi/SH4Xy3N8yy4/mqdefault.jpg,https://i.ytimg.com/vi/SH4Xy3N8yy4/hqdefault.jpg
PPvBZgekX-0,Bluesfest Byron Bay cancellation leaves fans and artists outraged,https://i.ytimg.com/vi/PPvBZgekX-0/default.jpg,https://i.ytimg.com/vi/PPvBZgekX-0/mqdefault.jpg,https://i.ytimg.com/vi/PPvBZgekX-0/hqdefault.jpg
JKRlDvHgXCA,#FreeBritney: Britney Spears theory escalates,https://i.ytimg.com/vi/JKRlDvHgXCA/default.jpg,https://i.ytimg.com/vi/JKRlDvHgXCA/mqdefault.jpg,https://i.ytimg.com/vi/JKRlDvHgXCA/hqdefault.jpg
ByUjRbfap-0,Seth Rogen issues public apology to former co-star Emma Watson,https://i.ytimg.com/vi/ByUjRbfap-0/default.jpg,https://i.ytimg.com/vi/ByUjRbfap-0/mqdefault.jpg,https://i.ytimg.com/vi/ByUjRbfap-0/hqdefault.jpg
IEWigEvaDO0,Byron Bay Bluesfest cancelled due to COVID-19,https://i.ytimg.com/vi/IEWigEvaDO0/default.jpg,https://i.ytimg.com/vi/IEWigEvaDO0/mqdefault.jpg,https://i.ytimg.com/vi/IEWigEvaDO0/hqdefault.jpg
fyoKiyc3Stw,Top 10 most OUTRAGEOUS red carpet looks,https://i.ytimg.com/vi/fyoKiyc3Stw/default.jpg,https://i.ytimg.com/vi/fyoKiyc3Stw/mqdefault.jpg,https://i.ytimg.com/vi/fyoKiyc3Stw/hqdefault.jpg
WdTL6kQEVKc,AI influencers are taking over,https://i.ytimg.com/vi/WdTL6kQEVKc/default.jpg,https://i.ytimg.com/vi/WdTL6kQEVKc/mqdefault.jpg,https://i.ytimg.com/vi/WdTL6kQEVKc/hqdefault.jpg
RtdjfbdqXGY,Russell Crowe’s father dies aged 85 after Qantas mid-air emergency,https://i.ytimg.com/vi/RtdjfbdqXGY/default.jpg,https://i.ytimg.com/vi/RtdjfbdqXGY/mqdefault.jpg,https://i.ytimg.com/vi/RtdjfbdqXGY/hqdefault.jpg
s2jKtvRzDMQ,Farmer discovers massive mice infestation,https://i.ytimg.com/vi/s2jKtvRzDMQ/default.jpg,https://i.ytimg.com/vi/s2jKtvRzDMQ/mqdefault.jpg,https://i.ytimg.com/vi/s2jKtvRzDMQ/hqdefault.jpg
m7fK4XL94Bc,Intuitive eating: The non-diet that lets you eat anything you want,https://i.ytimg.com/vi/m7fK4XL94Bc/default.jpg,https://i.ytimg.com/vi/m7fK4XL94Bc/mqdefault.jpg,https://i.ytimg.com/vi/m7fK4XL94Bc/hqdefault.jpg
nGtJfHJZxv4,The Queen's favourites cause the biggest scandals,https://i.ytimg.com/vi/nGtJfHJZxv4/default.jpg,https://i.ytimg.com/vi/nGtJfHJZxv4/mqdefault.jpg,https://i.ytimg.com/vi/nGtJfHJZxv4/hqdefault.jpg
d-4HA-aT8sY,"Is Australia too 'woke' or was 'Hey, Hey It's Saturday' a joke?",https://i.ytimg.com/vi/d-4HA-aT8sY/default.jpg,https://i.ytimg.com/vi/d-4HA-aT8sY/mqdefault.jpg,https://i.ytimg.com/vi/d-4HA-aT8sY/hqdefault.jpg
1azsq8ySN6g,The most popular recipes on TikTok,https://i.ytimg.com/vi/1azsq8ySN6g/default.jpg,https://i.ytimg.com/vi/1azsq8ySN6g/mqdefault.jpg,https://i.ytimg.com/vi/1azsq8ySN6g/hqdefault.jpg
O9tuY3zhYEo,‘I lost my legs and fingers to a flesh-eating bug after developing sepsis’,https://i.ytimg.com/vi/O9tuY3zhYEo/default.jpg,https://i.ytimg.com/vi/O9tuY3zhYEo/mqdefault.jpg,https://i.ytimg.com/vi/O9tuY3zhYEo/hqdefault.jpg
qOkXEIb0-ds,Emma Stone reportedly gives birth to first child,https://i.ytimg.com/vi/qOkXEIb0-ds/default.jpg,https://i.ytimg.com/vi/qOkXEIb0-ds/mqdefault.jpg,https://i.ytimg.com/vi/qOkXEIb0-ds/hqdefault.jpg
f0EGaQVbxP4,6kg Violet Crumble Easter Egg!,https://i.ytimg.com/vi/f0EGaQVbxP4/default.jpg,https://i.ytimg.com/vi/f0EGaQVbxP4/mqdefault.jpg,https://i.ytimg.com/vi/f0EGaQVbxP4/hqdefault.jpg
JCs4PXdHLak,Arrested Development star Jessica Walter dead at 80,https://i.ytimg.com/vi/JCs4PXdHLak/default.jpg,https://i.ytimg.com/vi/JCs4PXdHLak/mqdefault.jpg,https://i.ytimg.com/vi/JCs4PXdHLak/hqdefault.jpg
uMRQgj9_32o,Talladega Nights actor Houston Tumlin dead at 28,https://i.ytimg.com/vi/uMRQgj9_32o/default.jpg,https://i.ytimg.com/vi/uMRQgj9_32o/mqdefault.jpg,https://i.ytimg.com/vi/uMRQgj9_32o/hqdefault.jpg
1uEZSH6NHH4,$900 million pay day: Richest Kardashians revealed,https://i.ytimg.com/vi/1uEZSH6NHH4/default.jpg,https://i.ytimg.com/vi/1uEZSH6NHH4/mqdefault.jpg,https://i.ytimg.com/vi/1uEZSH6NHH4/hqdefault.jpg
uN-Vq9uhgDg,Actor George Segal dies aged 87 following heart surgery,https://i.ytimg.com/vi/uN-Vq9uhgDg/default.jpg,https://i.ytimg.com/vi/uN-Vq9uhgDg/mqdefault.jpg,https://i.ytimg.com/vi/uN-Vq9uhgDg/hqdefault.jpg
fFDfDWnuH9I,These Bondi babes got plenty of compliments after offering help in the NSW floods,https://i.ytimg.com/vi/fFDfDWnuH9I/default.jpg,https://i.ytimg.com/vi/fFDfDWnuH9I/mqdefault.jpg,https://i.ytimg.com/vi/fFDfDWnuH9I/hqdefault.jpg
x7CveLK6nrg,Must have Kmart buys under $50,https://i.ytimg.com/vi/x7CveLK6nrg/default.jpg,https://i.ytimg.com/vi/x7CveLK6nrg/mqdefault.jpg,https://i.ytimg.com/vi/x7CveLK6nrg/hqdefault.jpg
qIFCER9BGc4,'Raised like Dingoes': what you don't know about the Hemsworth bros,https://i.ytimg.com/vi/qIFCER9BGc4/default.jpg,https://i.ytimg.com/vi/qIFCER9BGc4/mqdefault.jpg,https://i.ytimg.com/vi/qIFCER9BGc4/hqdefault.jpg
zRjWWc8tbww,Down Syndrome doll mistake: Bachelor winner Laura Byrne sorry,https://i.ytimg.com/vi/zRjWWc8tbww/default.jpg,https://i.ytimg.com/vi/zRjWWc8tbww/mqdefault.jpg,https://i.ytimg.com/vi/zRjWWc8tbww/hqdefault.jpg
a54V_OSXhg4,'On STRIKE!': Wife's brilliant response to lazy husband,https://i.ytimg.com/vi/a54V_OSXhg4/default.jpg,https://i.ytimg.com/vi/a54V_OSXhg4/mqdefault.jpg,https://i.ytimg.com/vi/a54V_OSXhg4/hqdefault.jpg
KsYVdALyBw8,'Purge mask' comparisons after $50k plastic surgery,https://i.ytimg.com/vi/KsYVdALyBw8/default.jpg,https://i.ytimg.com/vi/KsYVdALyBw8/mqdefault.jpg,https://i.ytimg.com/vi/KsYVdALyBw8/hqdefault.jpg
Gz2rzg70-K4,Kids aged 8 and 13 ‘stage marriage MOVE IN together’,https://i.ytimg.com/vi/Gz2rzg70-K4/default.jpg,https://i.ytimg.com/vi/Gz2rzg70-K4/mqdefault.jpg,https://i.ytimg.com/vi/Gz2rzg70-K4/hqdefault.jpg
3834bjGfR4o,Billie Eilish switches out iconic look and stuns fans,https://i.ytimg.com/vi/3834bjGfR4o/default.jpg,https://i.ytimg.com/vi/3834bjGfR4o/mqdefault.jpg,https://i.ytimg.com/vi/3834bjGfR4o/hqdefault.jpg
h7AYcjif5Rw,Top Gear star Sabine Schmitz dead at 51,https://i.ytimg.com/vi/h7AYcjif5Rw/default.jpg,https://i.ytimg.com/vi/h7AYcjif5Rw/mqdefault.jpg,https://i.ytimg.com/vi/h7AYcjif5Rw/hqdefault.jpg
54GfxZLYT6M,Zendaya recalls Giuliana Rancic’s ‘outrageously offensive’ remarks at 2015 Oscars,https://i.ytimg.com/vi/54GfxZLYT6M/default.jpg,https://i.ytimg.com/vi/54GfxZLYT6M/mqdefault.jpg,https://i.ytimg.com/vi/54GfxZLYT6M/hqdefault.jpg
5mAnAxc_b0o,Bizarre road rules: WTF is 'limb protrude'?,https://i.ytimg.com/vi/5mAnAxc_b0o/default.jpg,https://i.ytimg.com/vi/5mAnAxc_b0o/mqdefault.jpg,https://i.ytimg.com/vi/5mAnAxc_b0o/hqdefault.jpg
B0BodjzaWBk,Milk bags? Leaving babies outside? Bizarre traditions.,https://i.ytimg.com/vi/B0BodjzaWBk/default.jpg,https://i.ytimg.com/vi/B0BodjzaWBk/mqdefault.jpg,https://i.ytimg.com/vi/B0BodjzaWBk/hqdefault.jpg
eajfh8R4RRg,'Don't touch the purse!' Crazy Royal Family rules,https://i.ytimg.com/vi/eajfh8R4RRg/default.jpg,https://i.ytimg.com/vi/eajfh8R4RRg/mqdefault.jpg,https://i.ytimg.com/vi/eajfh8R4RRg/hqdefault.jpg
tcMPW3ZVZzQ,Couple shares tooth floss to save money,https://i.ytimg.com/vi/tcMPW3ZVZzQ/default.jpg,https://i.ytimg.com/vi/tcMPW3ZVZzQ/mqdefault.jpg,https://i.ytimg.com/vi/tcMPW3ZVZzQ/hqdefault.jpg
cppqkHdgotg,Halsey updates Instagram bio with new pronouns,https://i.ytimg.com/vi/cppqkHdgotg/default.jpg,https://i.ytimg.com/vi/cppqkHdgotg/mqdefault.jpg,https://i.ytimg.com/vi/cppqkHdgotg/hqdefault.jpg
bVk46gN-U1o,Top 5 venomous animals in Australia,https://i.ytimg.com/vi/bVk46gN-U1o/default.jpg,https://i.ytimg.com/vi/bVk46gN-U1o/mqdefault.jpg,https://i.ytimg.com/vi/bVk46gN-U1o/hqdefault.jpg
IGTq4raxzzs,"Grammys 2021 Red Carpet: Looks, shocks and frocks",https://i.ytimg.com/vi/IGTq4raxzzs/default.jpg,https://i.ytimg.com/vi/IGTq4raxzzs/mqdefault.jpg,https://i.ytimg.com/vi/IGTq4raxzzs/hqdefault.jpg
g8Xexzo70DI,Man's intense back pain is stage-four cancer,https://i.ytimg.com/vi/g8Xexzo70DI/default.jpg,https://i.ytimg.com/vi/g8Xexzo70DI/mqdefault.jpg,https://i.ytimg.com/vi/g8Xexzo70DI/hqdefault.jpg
80pSqvyn1No,Jennifer Lopez and Alex Rodriguez break up,https://i.ytimg.com/vi/80pSqvyn1No/default.jpg,https://i.ytimg.com/vi/80pSqvyn1No/mqdefault.jpg,https://i.ytimg.com/vi/80pSqvyn1No/hqdefault.jpg
EL80TtGoo5Y,"Lindsay, Mischa, Aaron: When Child Stars Go Bad",https://i.ytimg.com/vi/EL80TtGoo5Y/default.jpg,https://i.ytimg.com/vi/EL80TtGoo5Y/mqdefault.jpg,https://i.ytimg.com/vi/EL80TtGoo5Y/hqdefault.jpg
iK9wfjHptjI,‘It's aristocrats blaming servants for their misery!’,https://i.ytimg.com/vi/iK9wfjHptjI/default.jpg,https://i.ytimg.com/vi/iK9wfjHptjI/mqdefault.jpg,https://i.ytimg.com/vi/iK9wfjHptjI/hqdefault.jpg
byVAz8FguU0,Aussie restaurant road trips,https://i.ytimg.com/vi/byVAz8FguU0/default.jpg,https://i.ytimg.com/vi/byVAz8FguU0/mqdefault.jpg,https://i.ytimg.com/vi/byVAz8FguU0/hqdefault.jpg
ju7WP606Qjo,Naomi Osaka sizzles in red bikini,https://i.ytimg.com/vi/ju7WP606Qjo/default.jpg,https://i.ytimg.com/vi/ju7WP606Qjo/mqdefault.jpg,https://i.ytimg.com/vi/ju7WP606Qjo/hqdefault.jpg
eRlaH5_tPvQ,Lara Worthington stuns in rare red carpet appearance,https://i.ytimg.com/vi/eRlaH5_tPvQ/default.jpg,https://i.ytimg.com/vi/eRlaH5_tPvQ/mqdefault.jpg,https://i.ytimg.com/vi/eRlaH5_tPvQ/hqdefault.jpg
dABKF24cpsk,Emily Ratajkowski gives birth to first child,https://i.ytimg.com/vi/dABKF24cpsk/default.jpg,https://i.ytimg.com/vi/dABKF24cpsk/mqdefault.jpg,https://i.ytimg.com/vi/dABKF24cpsk/hqdefault.jpg
3wpbfALsaxQ,The five red flags that signal your relationship is over,https://i.ytimg.com/vi/3wpbfALsaxQ/default.jpg,https://i.ytimg.com/vi/3wpbfALsaxQ/mqdefault.jpg,https://i.ytimg.com/vi/3wpbfALsaxQ/hqdefault.jpg
9cWLsMFpzoo,Network shares plummet as Piers quits Good Morning Britain,https://i.ytimg.com/vi/9cWLsMFpzoo/default.jpg,https://i.ytimg.com/vi/9cWLsMFpzoo/mqdefault.jpg,https://i.ytimg.com/vi/9cWLsMFpzoo/hqdefault.jpg
IfGcEL98jcQ,Mia Fevola's new romance with Bulldogs Jamarra Ugle-Hagan,https://i.ytimg.com/vi/IfGcEL98jcQ/default.jpg,https://i.ytimg.com/vi/IfGcEL98jcQ/mqdefault.jpg,https://i.ytimg.com/vi/IfGcEL98jcQ/hqdefault.jpg
-EN4VwrasPo,Cut from the family: What did Diana leave for Prince Harry?,https://i.ytimg.com/vi/-EN4VwrasPo/default.jpg,https://i.ytimg.com/vi/-EN4VwrasPo/mqdefault.jpg,https://i.ytimg.com/vi/-EN4VwrasPo/hqdefault.jpg
ovgv03mZktk,Life-changing endometriosis drug offers hope to millions,https://i.ytimg.com/vi/ovgv03mZktk/default.jpg,https://i.ytimg.com/vi/ovgv03mZktk/mqdefault.jpg,https://i.ytimg.com/vi/ovgv03mZktk/hqdefault.jpg
YFrIsEkQhO8,Michael Gudinski's star studded funeral,https://i.ytimg.com/vi/YFrIsEkQhO8/default.jpg,https://i.ytimg.com/vi/YFrIsEkQhO8/mqdefault.jpg,https://i.ytimg.com/vi/YFrIsEkQhO8/hqdefault.jpg
KvSxA3F_Gtk,How to get an apprenticeship,https://i.ytimg.com/vi/KvSxA3F_Gtk/default.jpg,https://i.ytimg.com/vi/KvSxA3F_Gtk/mqdefault.jpg,https://i.ytimg.com/vi/KvSxA3F_Gtk/hqdefault.jpg
n7KxS03zM1A,3 sexual kinks you won't believe are real,https://i.ytimg.com/vi/n7KxS03zM1A/default.jpg,https://i.ytimg.com/vi/n7KxS03zM1A/mqdefault.jpg,https://i.ytimg.com/vi/n7KxS03zM1A/hqdefault.jpg
oCBLHVqU2V8,Vicar of Dibley star Trevor Peacock dead at 89,https://i.ytimg.com/vi/oCBLHVqU2V8/default.jpg,https://i.ytimg.com/vi/oCBLHVqU2V8/mqdefault.jpg,https://i.ytimg.com/vi/oCBLHVqU2V8/hqdefault.jpg
l98IdBSvda0,Former Hawk Joshua Gibson is expecting his first child,https://i.ytimg.com/vi/l98IdBSvda0/default.jpg,https://i.ytimg.com/vi/l98IdBSvda0/mqdefault.jpg,https://i.ytimg.com/vi/l98IdBSvda0/hqdefault.jpg
4CiFXrAAauE,The most Australian things you've ever seen on TikTok,https://i.ytimg.com/vi/4CiFXrAAauE/default.jpg,https://i.ytimg.com/vi/4CiFXrAAauE/mqdefault.jpg,https://i.ytimg.com/vi/4CiFXrAAauE/hqdefault.jpg
xj12xQSSFTc,Sam quits: can Today take advantage?,https://i.ytimg.com/vi/xj12xQSSFTc/default.jpg,https://i.ytimg.com/vi/xj12xQSSFTc/mqdefault.jpg,https://i.ytimg.com/vi/xj12xQSSFTc/hqdefault.jpg
uKtm1WuNpng,"SAS Australia: Pete Evans, Michael Clarke 'in talks'",https://i.ytimg.com/vi/uKtm1WuNpng/default.jpg,https://i.ytimg.com/vi/uKtm1WuNpng/mqdefault.jpg,https://i.ytimg.com/vi/uKtm1WuNpng/hqdefault.jpg
33U3svG2k-s,Is there ANOTHER Harry Potter movie in the works?,https://i.ytimg.com/vi/33U3svG2k-s/default.jpg,https://i.ytimg.com/vi/33U3svG2k-s/mqdefault.jpg,https://i.ytimg.com/vi/33U3svG2k-s/hqdefault.jpg
vQZlsErYvyU,Human Ken doll’s $30k X-rated offer,https://i.ytimg.com/vi/vQZlsErYvyU/default.jpg,https://i.ytimg.com/vi/vQZlsErYvyU/mqdefault.jpg,https://i.ytimg.com/vi/vQZlsErYvyU/hqdefault.jpg
LBfNIM6tcTg,Channel 10 have revealed their Bachelor for 2021,https://i.ytimg.com/vi/LBfNIM6tcTg/default.jpg,https://i.ytimg.com/vi/LBfNIM6tcTg/mqdefault.jpg,https://i.ytimg.com/vi/LBfNIM6tcTg/hqdefault.jpg
sUBFX0sqQGU,Miranda Kerr reveals she lost her grandmother weeks after her grandfather,https://i.ytimg.com/vi/sUBFX0sqQGU/default.jpg,https://i.ytimg.com/vi/sUBFX0sqQGU/mqdefault.jpg,https://i.ytimg.com/vi/sUBFX0sqQGU/hqdefault.jpg
yIT6NQJvPDI,These sex positions can help you sleep better,https://i.ytimg.com/vi/yIT6NQJvPDI/default.jpg,https://i.ytimg.com/vi/yIT6NQJvPDI/mqdefault.jpg,https://i.ytimg.com/vi/yIT6NQJvPDI/hqdefault.jpg
SaL0knZhURg,Zoom fails: 'I seem to be upside down',https://i.ytimg.com/vi/SaL0knZhURg/default.jpg,https://i.ytimg.com/vi/SaL0knZhURg/mqdefault.jpg,https://i.ytimg.com/vi/SaL0knZhURg/hqdefault.jpg
UWxV8NovxfI,Secret Bunnings hack that'll save you money,https://i.ytimg.com/vi/UWxV8NovxfI/default.jpg,https://i.ytimg.com/vi/UWxV8NovxfI/mqdefault.jpg,https://i.ytimg.com/vi/UWxV8NovxfI/hqdefault.jpg
q2ZFpM0HFJg,Aussie music mogul Michael Gudinski dead at 68,https://i.ytimg.com/vi/q2ZFpM0HFJg/default.jpg,https://i.ytimg.com/vi/q2ZFpM0HFJg/mqdefault.jpg,https://i.ytimg.com/vi/q2ZFpM0HFJg/hqdefault.jpg
_JPiG7NKAGM,Anya Taylor-Joy wears Dior Haute Couture over $2.3m in Tiffany diamonds to the Golden Globes,https://i.ytimg.com/vi/_JPiG7NKAGM/default.jpg,https://i.ytimg.com/vi/_JPiG7NKAGM/mqdefault.jpg,https://i.ytimg.com/vi/_JPiG7NKAGM/hqdefault.jpg
EcmaD6NCFYc,"Virtual Golden Globes 2021 recap: Wins, bloopers & shocks",https://i.ytimg.com/vi/EcmaD6NCFYc/default.jpg,https://i.ytimg.com/vi/EcmaD6NCFYc/mqdefault.jpg,https://i.ytimg.com/vi/EcmaD6NCFYc/hqdefault.jpg
kqJA5_VJBVI,Golden Globes 2021 virtual red carpet: best & worst dressed stars,https://i.ytimg.com/vi/kqJA5_VJBVI/default.jpg,https://i.ytimg.com/vi/kqJA5_VJBVI/mqdefault.jpg,https://i.ytimg.com/vi/kqJA5_VJBVI/hqdefault.jpg
iSZ6IxmOFiU,Netflix leads in 2021 Golden Globes nominations,https://i.ytimg.com/vi/iSZ6IxmOFiU/default.jpg,https://i.ytimg.com/vi/iSZ6IxmOFiU/mqdefault.jpg,https://i.ytimg.com/vi/iSZ6IxmOFiU/hqdefault.jpg
6OonMJy45nk,Disturbing video of gunmen opening fire on Lady Gaga’s dog walker,https://i.ytimg.com/vi/6OonMJy45nk/default.jpg,https://i.ytimg.com/vi/6OonMJy45nk/mqdefault.jpg,https://i.ytimg.com/vi/6OonMJy45nk/hqdefault.jpg
1TE-Ux1xGbo,Police audio reveals moments following shooting of Lady Gaga’s dog walker Ryan Fischer,https://i.ytimg.com/vi/1TE-Ux1xGbo/default.jpg,https://i.ytimg.com/vi/1TE-Ux1xGbo/mqdefault.jpg,https://i.ytimg.com/vi/1TE-Ux1xGbo/hqdefault.jpg
XO16sbnYdlk,Actor Gerard Depardieu charged with 2018 rape,https://i.ytimg.com/vi/XO16sbnYdlk/default.jpg,https://i.ytimg.com/vi/XO16sbnYdlk/mqdefault.jpg,https://i.ytimg.com/vi/XO16sbnYdlk/hqdefault.jpg
eOdfnM2EhSY,Australians outraged as Zac Efron's brother arrives in Sydney,https://i.ytimg.com/vi/eOdfnM2EhSY/default.jpg,https://i.ytimg.com/vi/eOdfnM2EhSY/mqdefault.jpg,https://i.ytimg.com/vi/eOdfnM2EhSY/hqdefault.jpg
FPXJd5cLLFY,TV star Amanda Kloots slams 'early COVID vaccine' backlash,https://i.ytimg.com/vi/FPXJd5cLLFY/default.jpg,https://i.ytimg.com/vi/FPXJd5cLLFY/mqdefault.jpg,https://i.ytimg.com/vi/FPXJd5cLLFY/hqdefault.jpg
ON9FhCnVWbA,"Kim Kardashian-West said to have “divorce plan in place""",https://i.ytimg.com/vi/ON9FhCnVWbA/default.jpg,https://i.ytimg.com/vi/ON9FhCnVWbA/mqdefault.jpg,https://i.ytimg.com/vi/ON9FhCnVWbA/hqdefault.jpg
qQXyHCl481k,31-year-old reality star ‘too old’ for work: Love Island's Laura Anderson blasts age discrimination,https://i.ytimg.com/vi/qQXyHCl481k/default.jpg,https://i.ytimg.com/vi/qQXyHCl481k/mqdefault.jpg,https://i.ytimg.com/vi/qQXyHCl481k/hqdefault.jpg
rCzy2mt1UqA,Dancing with the Stars - All Stars: First celebs announced,https://i.ytimg.com/vi/rCzy2mt1UqA/default.jpg,https://i.ytimg.com/vi/rCzy2mt1UqA/mqdefault.jpg,https://i.ytimg.com/vi/rCzy2mt1UqA/hqdefault.jpg
ClCQQr2PI_k,Isabel Lucas compares anti-vaxxer Pete Evans to Jesus,https://i.ytimg.com/vi/ClCQQr2PI_k/default.jpg,https://i.ytimg.com/vi/ClCQQr2PI_k/mqdefault.jpg,https://i.ytimg.com/vi/ClCQQr2PI_k/hqdefault.jpg
BYixDxQqGf8,The controversial life of Shia LaBeouf,https://i.ytimg.com/vi/BYixDxQqGf8/default.jpg,https://i.ytimg.com/vi/BYixDxQqGf8/mqdefault.jpg,https://i.ytimg.com/vi/BYixDxQqGf8/hqdefault.jpg
FWbl7lKpmVI,Things foreigners hate about Australia,https://i.ytimg.com/vi/FWbl7lKpmVI/default.jpg,https://i.ytimg.com/vi/FWbl7lKpmVI/mqdefault.jpg,https://i.ytimg.com/vi/FWbl7lKpmVI/hqdefault.jpg
eJdtfwwn3AM,Paris Hilton is engaged to Carter Reum,https://i.ytimg.com/vi/eJdtfwwn3AM/default.jpg,https://i.ytimg.com/vi/eJdtfwwn3AM/mqdefault.jpg,https://i.ytimg.com/vi/eJdtfwwn3AM/hqdefault.jpg
DZ9ct2yLywk,3 steps to help beat loneliness,https://i.ytimg.com/vi/DZ9ct2yLywk/default.jpg,https://i.ytimg.com/vi/DZ9ct2yLywk/mqdefault.jpg,https://i.ytimg.com/vi/DZ9ct2yLywk/hqdefault.jpg
w39p8nu_Fvg,Ayesha Curry fires back at online trolls after sharing nude photo,https://i.ytimg.com/vi/w39p8nu_Fvg/default.jpg,https://i.ytimg.com/vi/w39p8nu_Fvg/mqdefault.jpg,https://i.ytimg.com/vi/w39p8nu_Fvg/hqdefault.jpg
5R2jWz2tEvg,Revealing upside down bikini trend takes over social media,https://i.ytimg.com/vi/5R2jWz2tEvg/default.jpg,https://i.ytimg.com/vi/5R2jWz2tEvg/mqdefault.jpg,https://i.ytimg.com/vi/5R2jWz2tEvg/hqdefault.jpg
ZqKFX6NJ07g,Meghan Markle and Prince Harry set for Oprah interview,https://i.ytimg.com/vi/ZqKFX6NJ07g/default.jpg,https://i.ytimg.com/vi/ZqKFX6NJ07g/mqdefault.jpg,https://i.ytimg.com/vi/ZqKFX6NJ07g/hqdefault.jpg
QQdwnkGFxWI,Mum of 11 wants 100 children using surrogates,https://i.ytimg.com/vi/QQdwnkGFxWI/default.jpg,https://i.ytimg.com/vi/QQdwnkGFxWI/mqdefault.jpg,https://i.ytimg.com/vi/QQdwnkGFxWI/hqdefault.jpg
OjQ8y5CDo3I,Stars slam 'toxic' Buffy creator Joss Whedon,https://i.ytimg.com/vi/OjQ8y5CDo3I/default.jpg,https://i.ytimg.com/vi/OjQ8y5CDo3I/mqdefault.jpg,https://i.ytimg.com/vi/OjQ8y5CDo3I/hqdefault.jpg
CO1DTP9YC9M,The A-List stars and films shooting Down Under in 2021,https://i.ytimg.com/vi/CO1DTP9YC9M/default.jpg,https://i.ytimg.com/vi/CO1DTP9YC9M/mqdefault.jpg,https://i.ytimg.com/vi/CO1DTP9YC9M/hqdefault.jpg
D9BPKuDlJZ8,The best commercials of Super Bowl 2021,https://i.ytimg.com/vi/D9BPKuDlJZ8/default.jpg,https://i.ytimg.com/vi/D9BPKuDlJZ8/mqdefault.jpg,https://i.ytimg.com/vi/D9BPKuDlJZ8/hqdefault.jpg
CNULSgpieIk,Vegan compares eating animals to Holocaust,https://i.ytimg.com/vi/CNULSgpieIk/default.jpg,https://i.ytimg.com/vi/CNULSgpieIk/mqdefault.jpg,https://i.ytimg.com/vi/CNULSgpieIk/hqdefault.jpg
TPpE7Jn2O34,Kylie Minogue reportedly engaged to boyfriend of three years,https://i.ytimg.com/vi/TPpE7Jn2O34/default.jpg,https://i.ytimg.com/vi/TPpE7Jn2O34/mqdefault.jpg,https://i.ytimg.com/vi/TPpE7Jn2O34/hqdefault.jpg
a5idDNI1hVk,Laura Byrne and Matty J have welcomed their second child,https://i.ytimg.com/vi/a5idDNI1hVk/default.jpg,https://i.ytimg.com/vi/a5idDNI1hVk/mqdefault.jpg,https://i.ytimg.com/vi/a5idDNI1hVk/hqdefault.jpg
YpJwSRURjRk,"When nasty windshield notes backfire: ""fat piece of sh*t”",https://i.ytimg.com/vi/YpJwSRURjRk/default.jpg,https://i.ytimg.com/vi/YpJwSRURjRk/mqdefault.jpg,https://i.ytimg.com/vi/YpJwSRURjRk/hqdefault.jpg
3B27u29HDWs,Trey Songz reacts to leaked sex tape,https://i.ytimg.com/vi/3B27u29HDWs/default.jpg,https://i.ytimg.com/vi/3B27u29HDWs/mqdefault.jpg,https://i.ytimg.com/vi/3B27u29HDWs/hqdefault.jpg
7sQ3LvDDjwQ,From new Meryl Streep to a poignant Aussie dramedy,https://i.ytimg.com/vi/7sQ3LvDDjwQ/default.jpg,https://i.ytimg.com/vi/7sQ3LvDDjwQ/mqdefault.jpg,https://i.ytimg.com/vi/7sQ3LvDDjwQ/hqdefault.jpg
JtXooQCSgbI,OnlyFans: The highest earners on the NSFW site,https://i.ytimg.com/vi/JtXooQCSgbI/default.jpg,https://i.ytimg.com/vi/JtXooQCSgbI/mqdefault.jpg,https://i.ytimg.com/vi/JtXooQCSgbI/hqdefault.jpg
V9qTsEvC67I,3 TV shows we should NEVER reboot!,https://i.ytimg.com/vi/V9qTsEvC67I/default.jpg,https://i.ytimg.com/vi/V9qTsEvC67I/mqdefault.jpg,https://i.ytimg.com/vi/V9qTsEvC67I/hqdefault.jpg
WN2L5zJmyYE,The alcoholic drink with more calories than a cheeseburger,https://i.ytimg.com/vi/WN2L5zJmyYE/default.jpg,https://i.ytimg.com/vi/WN2L5zJmyYE/mqdefault.jpg,https://i.ytimg.com/vi/WN2L5zJmyYE/hqdefault.jpg
3KVGIVp44Cw,3 TV shows that need a reboot,https://i.ytimg.com/vi/3KVGIVp44Cw/default.jpg,https://i.ytimg.com/vi/3KVGIVp44Cw/mqdefault.jpg,https://i.ytimg.com/vi/3KVGIVp44Cw/hqdefault.jpg
gHGtR5SNgls,"Armie Hammer: Allegations of cannibalism, assault and abuse",https://i.ytimg.com/vi/gHGtR5SNgls/default.jpg,https://i.ytimg.com/vi/gHGtR5SNgls/mqdefault.jpg,https://i.ytimg.com/vi/gHGtR5SNgls/hqdefault.jpg
J9AroTQAquY,Larry King dead: Legendary TV host dies at 87,https://i.ytimg.com/vi/J9AroTQAquY/default.jpg,https://i.ytimg.com/vi/J9AroTQAquY/mqdefault.jpg,https://i.ytimg.com/vi/J9AroTQAquY/hqdefault.jpg
K33vD_tpK6k,Super: How much do you need?,https://i.ytimg.com/vi/K33vD_tpK6k/default.jpg,https://i.ytimg.com/vi/K33vD_tpK6k/mqdefault.jpg,https://i.ytimg.com/vi/K33vD_tpK6k/hqdefault.jpg
Z-fbf5DSDiQ,J Lo performs at the Biden-Harris US Inauguration,https://i.ytimg.com/vi/Z-fbf5DSDiQ/default.jpg,https://i.ytimg.com/vi/Z-fbf5DSDiQ/mqdefault.jpg,https://i.ytimg.com/vi/Z-fbf5DSDiQ/hqdefault.jpg
hA4U6nqYX4U,US Inauguration: Lady Gaga performs the National Anthem,https://i.ytimg.com/vi/hA4U6nqYX4U/default.jpg,https://i.ytimg.com/vi/hA4U6nqYX4U/mqdefault.jpg,https://i.ytimg.com/vi/hA4U6nqYX4U/hqdefault.jpg
zSRkETBUU4o,"Tiger King star Joe Exotic hires limo to escort him from prison, confident of Trump pardon",https://i.ytimg.com/vi/zSRkETBUU4o/default.jpg,https://i.ytimg.com/vi/zSRkETBUU4o/mqdefault.jpg,https://i.ytimg.com/vi/zSRkETBUU4o/hqdefault.jpg
HkWTny9d0hI,The healthiest ice-cream to eat this summer,https://i.ytimg.com/vi/HkWTny9d0hI/default.jpg,https://i.ytimg.com/vi/HkWTny9d0hI/mqdefault.jpg,https://i.ytimg.com/vi/HkWTny9d0hI/hqdefault.jpg
-n78MPK5o7o,Harry Styles couples up with Olivia Wilde!,https://i.ytimg.com/vi/-n78MPK5o7o/default.jpg,https://i.ytimg.com/vi/-n78MPK5o7o/mqdefault.jpg,https://i.ytimg.com/vi/-n78MPK5o7o/hqdefault.jpg
mcGYePWkNrE,Weird Christmas traditions from around the world,https://i.ytimg.com/vi/mcGYePWkNrE/default.jpg,https://i.ytimg.com/vi/mcGYePWkNrE/mqdefault.jpg,https://i.ytimg.com/vi/mcGYePWkNrE/hqdefault.jpg
CQVCQLsfhFw,The biggest entertainment moments of 2020,https://i.ytimg.com/vi/CQVCQLsfhFw/default.jpg,https://i.ytimg.com/vi/CQVCQLsfhFw/mqdefault.jpg,https://i.ytimg.com/vi/CQVCQLsfhFw/hqdefault.jpg
Qj7pTNjyPjI,Holiday opening hours of major Aussie retailers,https://i.ytimg.com/vi/Qj7pTNjyPjI/default.jpg,https://i.ytimg.com/vi/Qj7pTNjyPjI/mqdefault.jpg,https://i.ytimg.com/vi/Qj7pTNjyPjI/hqdefault.jpg
BglEzYasdNE,Meghan and Harry's awkward Netflix dilemma,https://i.ytimg.com/vi/BglEzYasdNE/default.jpg,https://i.ytimg.com/vi/BglEzYasdNE/mqdefault.jpg,https://i.ytimg.com/vi/BglEzYasdNE/hqdefault.jpg
ipfzGhMa7Kw,"Wonder Woman 1984: Gal Gadot, Pedro Pascal and Patty Jenkins unpack DC’s epic 80s throwback",https://i.ytimg.com/vi/ipfzGhMa7Kw/default.jpg,https://i.ytimg.com/vi/ipfzGhMa7Kw/mqdefault.jpg,https://i.ytimg.com/vi/ipfzGhMa7Kw/hqdefault.jpg
HsUXRhpXYDE,Lotto: Tips and tricks that could win you millions,https://i.ytimg.com/vi/HsUXRhpXYDE/default.jpg,https://i.ytimg.com/vi/HsUXRhpXYDE/mqdefault.jpg,https://i.ytimg.com/vi/HsUXRhpXYDE/hqdefault.jpg
