ID,TITLE,THUMBNAIL1,THUMBNAIL2,THUMBNAIL3
JjVFjD8Xf6g,AYLA'S BIRTHDAY PARTY GOT DESTROYED **BAD IDEA**,https://i.ytimg.com/vi/JjVFjD8Xf6g/default.jpg,https://i.ytimg.com/vi/JjVFjD8Xf6g/mqdefault.jpg,https://i.ytimg.com/vi/JjVFjD8Xf6g/hqdefault.jpg
7pYs3Ph7HYY,AYLA'S 1ST BIRTHDAY PARTY 💕,https://i.ytimg.com/vi/7pYs3Ph7HYY/default.jpg,https://i.ytimg.com/vi/7pYs3Ph7HYY/mqdefault.jpg,https://i.ytimg.com/vi/7pYs3Ph7HYY/hqdefault.jpg
FxRMoPClofE,THE PRINCE FAMILY GOT SCAMMED **SHE FREAKED OUT**,https://i.ytimg.com/vi/FxRMoPClofE/default.jpg,https://i.ytimg.com/vi/FxRMoPClofE/mqdefault.jpg,https://i.ytimg.com/vi/FxRMoPClofE/hqdefault.jpg
qIiAmu0eX3s,OUR DAUGHTER AYLA HAD AN ALLERGIC BREAKOUT **CRAZY REACTION**,https://i.ytimg.com/vi/qIiAmu0eX3s/default.jpg,https://i.ytimg.com/vi/qIiAmu0eX3s/mqdefault.jpg,https://i.ytimg.com/vi/qIiAmu0eX3s/hqdefault.jpg
30Ln5OutgSg,EATING DOLLAR STORE FOODS FOR 24 HOURS CHALLENGE **BAD IDEA**,https://i.ytimg.com/vi/30Ln5OutgSg/default.jpg,https://i.ytimg.com/vi/30Ln5OutgSg/mqdefault.jpg,https://i.ytimg.com/vi/30Ln5OutgSg/hqdefault.jpg
29snHtUxiH0,POTTY TRAINING MY 2 YEAR OLD DAUGHTER NOVA **BAD IDEA**,https://i.ytimg.com/vi/29snHtUxiH0/default.jpg,https://i.ytimg.com/vi/29snHtUxiH0/mqdefault.jpg,https://i.ytimg.com/vi/29snHtUxiH0/hqdefault.jpg
MmCbxmyUMmw,SHAMPOO PRANK ON WIFE **BAD IDEA**,https://i.ytimg.com/vi/MmCbxmyUMmw/default.jpg,https://i.ytimg.com/vi/MmCbxmyUMmw/mqdefault.jpg,https://i.ytimg.com/vi/MmCbxmyUMmw/hqdefault.jpg
ekZN2jYTr6c,THE PRINCE FAMILY MORNING ROUTINE!!,https://i.ytimg.com/vi/ekZN2jYTr6c/default.jpg,https://i.ytimg.com/vi/ekZN2jYTr6c/mqdefault.jpg,https://i.ytimg.com/vi/ekZN2jYTr6c/hqdefault.jpg
ScuK5XZN-VE,HOW TO MAKE OUR FAMOUS NACHOS & CHICKEN WINGS RECIPE | COOKING WITH THE PRINCE FAMILY,https://i.ytimg.com/vi/ScuK5XZN-VE/default.jpg,https://i.ytimg.com/vi/ScuK5XZN-VE/mqdefault.jpg,https://i.ytimg.com/vi/ScuK5XZN-VE/hqdefault.jpg
GjioNMynzSg,OUR 2 YEAR OLD DAUGHTER NOVA HAD SURGERY 🥺💔 **NOT LOOKING GOOD**,https://i.ytimg.com/vi/GjioNMynzSg/default.jpg,https://i.ytimg.com/vi/GjioNMynzSg/mqdefault.jpg,https://i.ytimg.com/vi/GjioNMynzSg/hqdefault.jpg
NxSwLgacRFI,HOW TO MAKE OREO DOUGHNUTS | COOKING WITH THE PRINCE FAMILY,https://i.ytimg.com/vi/NxSwLgacRFI/default.jpg,https://i.ytimg.com/vi/NxSwLgacRFI/mqdefault.jpg,https://i.ytimg.com/vi/NxSwLgacRFI/hqdefault.jpg
NTDIHr8s0z0,DAMIEN GOT A NEW TATTOO FROM THE WORST REVIEWED TATTOO ARTIST IN THE CITY **HE INSTANTLY REGRET**,https://i.ytimg.com/vi/NTDIHr8s0z0/default.jpg,https://i.ytimg.com/vi/NTDIHr8s0z0/mqdefault.jpg,https://i.ytimg.com/vi/NTDIHr8s0z0/hqdefault.jpg
QqJ_gBpwPyg,THE PRINCE FAMILY GOT INTO A VERY BAD CAR ACCIDENT **COPS PULLED UP**,https://i.ytimg.com/vi/QqJ_gBpwPyg/default.jpg,https://i.ytimg.com/vi/QqJ_gBpwPyg/mqdefault.jpg,https://i.ytimg.com/vi/QqJ_gBpwPyg/hqdefault.jpg
4XkJMmnb3l4,THE REVEAL OF DAMIEN'S SURGICAL HAIRLINE **SHOCKING RESULTS**,https://i.ytimg.com/vi/4XkJMmnb3l4/default.jpg,https://i.ytimg.com/vi/4XkJMmnb3l4/mqdefault.jpg,https://i.ytimg.com/vi/4XkJMmnb3l4/hqdefault.jpg
zJmtTBMJHHs,WHO KNOWS ME BETTER!? My HUSBAND Or My MOM! *Challenge* | The Prince Family,https://i.ytimg.com/vi/zJmtTBMJHHs/default.jpg,https://i.ytimg.com/vi/zJmtTBMJHHs/mqdefault.jpg,https://i.ytimg.com/vi/zJmtTBMJHHs/hqdefault.jpg
rxVbx8Zr9G0,SURPRISING OUR 2 YEAR OLD DAUGHTER NOVA WITH AN EXTREME ROOM MAKEOVER **CRAZY RESULTS**,https://i.ytimg.com/vi/rxVbx8Zr9G0/default.jpg,https://i.ytimg.com/vi/rxVbx8Zr9G0/mqdefault.jpg,https://i.ytimg.com/vi/rxVbx8Zr9G0/hqdefault.jpg
aA1tC8YkkC4,SURPRISING MY WIFE WITH A NEW PET **SHE DON’T LIKE IT**,https://i.ytimg.com/vi/aA1tC8YkkC4/default.jpg,https://i.ytimg.com/vi/aA1tC8YkkC4/mqdefault.jpg,https://i.ytimg.com/vi/aA1tC8YkkC4/hqdefault.jpg
6FbiK-S6B5c,MY DREAM CAR GOT REPOSSESSED **I'M GOING BROKE**,https://i.ytimg.com/vi/6FbiK-S6B5c/default.jpg,https://i.ytimg.com/vi/6FbiK-S6B5c/mqdefault.jpg,https://i.ytimg.com/vi/6FbiK-S6B5c/hqdefault.jpg
BgdYbIqqnUg,BIANNCA TOOK THE KIDS & LEFT ME **PLEASE COME BACK**,https://i.ytimg.com/vi/BgdYbIqqnUg/default.jpg,https://i.ytimg.com/vi/BgdYbIqqnUg/mqdefault.jpg,https://i.ytimg.com/vi/BgdYbIqqnUg/hqdefault.jpg
9uIi1daE_lI,1 VS 1 BASKETBALL GAME AGAINST MY 13 YEAR OLD BROTHER DARION **SOMEONE GOT EXPOSED**,https://i.ytimg.com/vi/9uIi1daE_lI/default.jpg,https://i.ytimg.com/vi/9uIi1daE_lI/mqdefault.jpg,https://i.ytimg.com/vi/9uIi1daE_lI/hqdefault.jpg
wK15uxGezTU,MY 13 YEAR OLD BROTHER DARION BROKE MY LITTLE SISTER JANELLE HEART **SHE HATES HIM NOW**,https://i.ytimg.com/vi/wK15uxGezTU/default.jpg,https://i.ytimg.com/vi/wK15uxGezTU/mqdefault.jpg,https://i.ytimg.com/vi/wK15uxGezTU/hqdefault.jpg
BxdKokJElGM,KIDS ARE PICKING ON OUR 6 YEAR OLD SON DJ AT SCHOOL **WE'RE PULLING HIM OUT**,https://i.ytimg.com/vi/BxdKokJElGM/default.jpg,https://i.ytimg.com/vi/BxdKokJElGM/mqdefault.jpg,https://i.ytimg.com/vi/BxdKokJElGM/hqdefault.jpg
4OWFIOcOXIs,EXPOSING MY MOM & DAD SECRET RELATIONSHIP BEHIND MARVIN'S BACK 💔😭 (KING CRAB SEAFOOD BOIL MUKBANG),https://i.ytimg.com/vi/4OWFIOcOXIs/default.jpg,https://i.ytimg.com/vi/4OWFIOcOXIs/mqdefault.jpg,https://i.ytimg.com/vi/4OWFIOcOXIs/hqdefault.jpg
5aUgvOCvPFw,1 VS 1 BOXING MATCH MY STEPDAD MARVIN VS MY 51 YEAR OLD DAD DAMION **THIS DIDN'T END WELL**,https://i.ytimg.com/vi/5aUgvOCvPFw/default.jpg,https://i.ytimg.com/vi/5aUgvOCvPFw/mqdefault.jpg,https://i.ytimg.com/vi/5aUgvOCvPFw/hqdefault.jpg
9AO5gVnCoVI,MY REAL DAD & STEPDAD MEETS FACE TO FACE ABOUT DARION & JANELLE **VERY BAD IDEA**,https://i.ytimg.com/vi/9AO5gVnCoVI/default.jpg,https://i.ytimg.com/vi/9AO5gVnCoVI/mqdefault.jpg,https://i.ytimg.com/vi/9AO5gVnCoVI/hqdefault.jpg
KLXyxUdJFDE,MY 13 YEAR OLD BROTHER DARION MADE A LOVE SONG FOR HIS CRUSH JANELLE **HE REALLY LIKES HER**,https://i.ytimg.com/vi/KLXyxUdJFDE/default.jpg,https://i.ytimg.com/vi/KLXyxUdJFDE/mqdefault.jpg,https://i.ytimg.com/vi/KLXyxUdJFDE/hqdefault.jpg
oxDOf_cFAHg,MY 13 YEAR OLD BROTHER DARION SHAVED HIS CRUSH'S DAD HEAD  **HE'S BIG MAD**,https://i.ytimg.com/vi/oxDOf_cFAHg/default.jpg,https://i.ytimg.com/vi/oxDOf_cFAHg/mqdefault.jpg,https://i.ytimg.com/vi/oxDOf_cFAHg/hqdefault.jpg
MzzryPJKm_8,MY 13 YEAR OLD BROTHER DARION WENT ON A DATE WITH HIS CRUSH JANELLE LEADS TO SOMETHING ELSE 🌹,https://i.ytimg.com/vi/MzzryPJKm_8/default.jpg,https://i.ytimg.com/vi/MzzryPJKm_8/mqdefault.jpg,https://i.ytimg.com/vi/MzzryPJKm_8/hqdefault.jpg
vhRQC-bXX70,1 VS 1 BASKETBALL GAME MY 13 YEAR OLD BROTHER DARION VS MY STEP DAD MARVIN 💔😭 *WINNER GETS JANELLE*,https://i.ytimg.com/vi/vhRQC-bXX70/default.jpg,https://i.ytimg.com/vi/vhRQC-bXX70/mqdefault.jpg,https://i.ytimg.com/vi/vhRQC-bXX70/hqdefault.jpg
y9yawyQcf6g,MY REAL DAD PULLED UP ON MY STEP DAD **COPS ALMOST CALLED**,https://i.ytimg.com/vi/y9yawyQcf6g/default.jpg,https://i.ytimg.com/vi/y9yawyQcf6g/mqdefault.jpg,https://i.ytimg.com/vi/y9yawyQcf6g/hqdefault.jpg
qlq0fW-PRJA,MY STEP DAD MARVIN CONFRONTS MY 13 YEAR OLD BROTHER DARION ABOUT HIS CRUSH JANELLE 😭💔 **BAD IDEA**,https://i.ytimg.com/vi/qlq0fW-PRJA/default.jpg,https://i.ytimg.com/vi/qlq0fW-PRJA/mqdefault.jpg,https://i.ytimg.com/vi/qlq0fW-PRJA/hqdefault.jpg
rVx0OI8dPsI,"MY 13 YEAR OLD BROTHER DARION TOLD HIS CRUSH JANELLE ""I LIKE YOU"" TO SEE HOW SHE REACTS!!",https://i.ytimg.com/vi/rVx0OI8dPsI/default.jpg,https://i.ytimg.com/vi/rVx0OI8dPsI/mqdefault.jpg,https://i.ytimg.com/vi/rVx0OI8dPsI/hqdefault.jpg
1ryrVBGrnqY,I CAUGHT MY 13 YEAR OLD BROTHER DARION TEXTING MY 12 YEAR OLD SISTER JANELLE *THEY MUST BE STOPPED*,https://i.ytimg.com/vi/1ryrVBGrnqY/default.jpg,https://i.ytimg.com/vi/1ryrVBGrnqY/mqdefault.jpg,https://i.ytimg.com/vi/1ryrVBGrnqY/hqdefault.jpg
h1PHQPT9BcQ,MY 13 YEAR OLD BROTHER DARION HAS A CRUSH ON MY LITTLE SISTER JANELLE **HE MUST BE STOPPED**,https://i.ytimg.com/vi/h1PHQPT9BcQ/default.jpg,https://i.ytimg.com/vi/h1PHQPT9BcQ/mqdefault.jpg,https://i.ytimg.com/vi/h1PHQPT9BcQ/hqdefault.jpg
AAAPhAI_LUc,SURPRISING DJ WITH A BACK TO SCHOOL SHOPPING SPREE | THE PRINCE FAMILY CLUBHOUSE,https://i.ytimg.com/vi/AAAPhAI_LUc/default.jpg,https://i.ytimg.com/vi/AAAPhAI_LUc/mqdefault.jpg,https://i.ytimg.com/vi/AAAPhAI_LUc/hqdefault.jpg
AAAPhAI_LUc,SURPRISING DJ WITH A BACK TO SCHOOL SHOPPING SPREE | THE PRINCE FAMILY CLUBHOUSE,https://i.ytimg.com/vi/AAAPhAI_LUc/default.jpg,https://i.ytimg.com/vi/AAAPhAI_LUc/mqdefault.jpg,https://i.ytimg.com/vi/AAAPhAI_LUc/hqdefault.jpg
AAAPhAI_LUc,SURPRISING DJ WITH A BACK TO SCHOOL SHOPPING SPREE | THE PRINCE FAMILY CLUBHOUSE,https://i.ytimg.com/vi/AAAPhAI_LUc/default.jpg,https://i.ytimg.com/vi/AAAPhAI_LUc/mqdefault.jpg,https://i.ytimg.com/vi/AAAPhAI_LUc/hqdefault.jpg
VCYucKh65WE,MY DAD & 13 YEAR OLD BROTHER DARION PULLED UP TO OUR HOUSE TO CONFRONT BIANNCA 😭💔 **BAD IDEA**,https://i.ytimg.com/vi/VCYucKh65WE/default.jpg,https://i.ytimg.com/vi/VCYucKh65WE/mqdefault.jpg,https://i.ytimg.com/vi/VCYucKh65WE/hqdefault.jpg
VCYucKh65WE,MY DAD & 13 YEAR OLD BROTHER DARION PULLED UP TO OUR HOUSE TO CONFRONT BIANNCA 😭💔 **BAD IDEA**,https://i.ytimg.com/vi/VCYucKh65WE/default.jpg,https://i.ytimg.com/vi/VCYucKh65WE/mqdefault.jpg,https://i.ytimg.com/vi/VCYucKh65WE/hqdefault.jpg
SXhAP0hIlr8,SURPRISING OUR KIDS WITH AN EXTREME ROOM MAKEOVER | THE PRINCE FAMILY CLUBHOUSE,https://i.ytimg.com/vi/SXhAP0hIlr8/default.jpg,https://i.ytimg.com/vi/SXhAP0hIlr8/mqdefault.jpg,https://i.ytimg.com/vi/SXhAP0hIlr8/hqdefault.jpg
STl-gl2y8PI,FACE TO FACE WITH MY 13 YEAR OLD BROTHER DARION **ENDED BADLY**,https://i.ytimg.com/vi/STl-gl2y8PI/default.jpg,https://i.ytimg.com/vi/STl-gl2y8PI/mqdefault.jpg,https://i.ytimg.com/vi/STl-gl2y8PI/hqdefault.jpg
Rn_XLAXdd40,FACE TO FACE WITH MY DAD FOR THE FIRST TIME **IT'S NOT LOOKING GOOD**,https://i.ytimg.com/vi/Rn_XLAXdd40/default.jpg,https://i.ytimg.com/vi/Rn_XLAXdd40/mqdefault.jpg,https://i.ytimg.com/vi/Rn_XLAXdd40/hqdefault.jpg
mhslvo6lDmg,"SURPRISING HER WITH A $10,000,000 LUXURY BOAT IN HAWAII ❤️",https://i.ytimg.com/vi/mhslvo6lDmg/default.jpg,https://i.ytimg.com/vi/mhslvo6lDmg/mqdefault.jpg,https://i.ytimg.com/vi/mhslvo6lDmg/hqdefault.jpg
qLHkJzyRpK4,"LAST TO LEAVE THE OCEAN WINS $10,000 CHALLENGE!!",https://i.ytimg.com/vi/qLHkJzyRpK4/default.jpg,https://i.ytimg.com/vi/qLHkJzyRpK4/mqdefault.jpg,https://i.ytimg.com/vi/qLHkJzyRpK4/hqdefault.jpg
cYMJpi_DwlI,BIANNCA FELL OFF A MOUNTAIN IN HAWAII ROCK CLIMBING **BAD IDEA**,https://i.ytimg.com/vi/cYMJpi_DwlI/default.jpg,https://i.ytimg.com/vi/cYMJpi_DwlI/mqdefault.jpg,https://i.ytimg.com/vi/cYMJpi_DwlI/hqdefault.jpg
MzekU9EKLNk,SHE GOT REALLY SICK IN HAWAII **BAD NEWS**,https://i.ytimg.com/vi/MzekU9EKLNk/default.jpg,https://i.ytimg.com/vi/MzekU9EKLNk/mqdefault.jpg,https://i.ytimg.com/vi/MzekU9EKLNk/hqdefault.jpg
wdfN1qXR36I,STAYING AT THE WORST REVIEWED HOTEL IN HAWAII **BAD IDEA**,https://i.ytimg.com/vi/wdfN1qXR36I/default.jpg,https://i.ytimg.com/vi/wdfN1qXR36I/mqdefault.jpg,https://i.ytimg.com/vi/wdfN1qXR36I/hqdefault.jpg
4d3zYmdx_J4,WE PAID FOR THE MOST EXPENSIVE PLANE TICKETS IN THE WORLD **FIRST CLASS SEATS**,https://i.ytimg.com/vi/4d3zYmdx_J4/default.jpg,https://i.ytimg.com/vi/4d3zYmdx_J4/mqdefault.jpg,https://i.ytimg.com/vi/4d3zYmdx_J4/hqdefault.jpg
hRPbVhVzZjo,I GOT INFECTED FROM GOING OUT THE COUNTRY **BAD EXPERIENCE**,https://i.ytimg.com/vi/hRPbVhVzZjo/default.jpg,https://i.ytimg.com/vi/hRPbVhVzZjo/mqdefault.jpg,https://i.ytimg.com/vi/hRPbVhVzZjo/hqdefault.jpg
5NdENzcqXq0,HORSEBACK RIDING IN ST. LUCIA WITH THE PRINCE FAMILY 🥰,https://i.ytimg.com/vi/5NdENzcqXq0/default.jpg,https://i.ytimg.com/vi/5NdENzcqXq0/mqdefault.jpg,https://i.ytimg.com/vi/5NdENzcqXq0/hqdefault.jpg
Hs8VKayP38A,VOLCANIC MUD BATH IN ST. LUCIA WITH THE PRINCE FAMILY ❤️,https://i.ytimg.com/vi/Hs8VKayP38A/default.jpg,https://i.ytimg.com/vi/Hs8VKayP38A/mqdefault.jpg,https://i.ytimg.com/vi/Hs8VKayP38A/hqdefault.jpg
tMN-5w5lmQk,WE WENT ON THE WORLDS SCARIEST ZIPLINE IN ST. LUCIA **BAD IDEA**,https://i.ytimg.com/vi/tMN-5w5lmQk/default.jpg,https://i.ytimg.com/vi/tMN-5w5lmQk/mqdefault.jpg,https://i.ytimg.com/vi/tMN-5w5lmQk/hqdefault.jpg
Ni9nZ26t6xI,DAMIEN'S LEG GOT BURNED RIDING ATV'S IN ST. LUCIA **BAD IDEA**,https://i.ytimg.com/vi/Ni9nZ26t6xI/default.jpg,https://i.ytimg.com/vi/Ni9nZ26t6xI/mqdefault.jpg,https://i.ytimg.com/vi/Ni9nZ26t6xI/hqdefault.jpg
HLZgmoyd3i4,I CAUGHT BIANNCA FLIRTING WITH SOMEONE ELSE IN ST. LUCIA 💔,https://i.ytimg.com/vi/HLZgmoyd3i4/default.jpg,https://i.ytimg.com/vi/HLZgmoyd3i4/mqdefault.jpg,https://i.ytimg.com/vi/HLZgmoyd3i4/hqdefault.jpg
bLUs0UWkcJg,OUR ST. LUCIA LUXURY HOTEL ROOM TOUR | THE PRINCE FAMILY,https://i.ytimg.com/vi/bLUs0UWkcJg/default.jpg,https://i.ytimg.com/vi/bLUs0UWkcJg/mqdefault.jpg,https://i.ytimg.com/vi/bLUs0UWkcJg/hqdefault.jpg
UYlQo-3Gxto,OUR FIRST VACATION AFTER LOCKDOWN 😍 ✈️,https://i.ytimg.com/vi/UYlQo-3Gxto/default.jpg,https://i.ytimg.com/vi/UYlQo-3Gxto/mqdefault.jpg,https://i.ytimg.com/vi/UYlQo-3Gxto/hqdefault.jpg
5a7ddjE6P2o,TESTING VIRAL TIK TOK STARBUCKS SECRET DRINKS **SHOCKING**,https://i.ytimg.com/vi/5a7ddjE6P2o/default.jpg,https://i.ytimg.com/vi/5a7ddjE6P2o/mqdefault.jpg,https://i.ytimg.com/vi/5a7ddjE6P2o/hqdefault.jpg
-3w7YwDOUJc,NOVA LOST HER HEARING **WE'RE BAD PARENTS**,https://i.ytimg.com/vi/-3w7YwDOUJc/default.jpg,https://i.ytimg.com/vi/-3w7YwDOUJc/mqdefault.jpg,https://i.ytimg.com/vi/-3w7YwDOUJc/hqdefault.jpg
kcvOB1fj3cI,THE PRINCE FAMILY IS FORCED TO EVACUATE THIER HOUSE **SPIDER PROBLEMS**,https://i.ytimg.com/vi/kcvOB1fj3cI/default.jpg,https://i.ytimg.com/vi/kcvOB1fj3cI/mqdefault.jpg,https://i.ytimg.com/vi/kcvOB1fj3cI/hqdefault.jpg
xqdjckLI3GI,THE WORST MOTHER'S DAY EVER!!,https://i.ytimg.com/vi/xqdjckLI3GI/default.jpg,https://i.ytimg.com/vi/xqdjckLI3GI/mqdefault.jpg,https://i.ytimg.com/vi/xqdjckLI3GI/hqdefault.jpg
lnf_178MpEA,KYRIE'S AFRAID TO GO TO THE HOSPITAL **ALLERGIC REACTION**,https://i.ytimg.com/vi/lnf_178MpEA/default.jpg,https://i.ytimg.com/vi/lnf_178MpEA/mqdefault.jpg,https://i.ytimg.com/vi/lnf_178MpEA/hqdefault.jpg
EXJUWm0TQ58,AYLA GOT HER EARS PIERCED FOR HER 6TH MONTH BIRTHDAY **SHE CRIED**,https://i.ytimg.com/vi/EXJUWm0TQ58/default.jpg,https://i.ytimg.com/vi/EXJUWm0TQ58/mqdefault.jpg,https://i.ytimg.com/vi/EXJUWm0TQ58/hqdefault.jpg
iWz9RS0oQHM,MY FATHER WANTS NOTHING TO DO WITH OUR KIDS **HEART BREAKING**,https://i.ytimg.com/vi/iWz9RS0oQHM/default.jpg,https://i.ytimg.com/vi/iWz9RS0oQHM/mqdefault.jpg,https://i.ytimg.com/vi/iWz9RS0oQHM/hqdefault.jpg
RpJLDuGZKBE,WE PULLED UP ON MY 50 YEAR OLD DAD TO CONFRONT HIM **BAD IDEA**,https://i.ytimg.com/vi/RpJLDuGZKBE/default.jpg,https://i.ytimg.com/vi/RpJLDuGZKBE/mqdefault.jpg,https://i.ytimg.com/vi/RpJLDuGZKBE/hqdefault.jpg
VEmaJQw-tfg,WHY WE DIDN'T INVITE MY DAD & 12 YEAR OLD BROTHER DARION TO NOVA'S BIRTHDAY PARTY **THE TRUTH**,https://i.ytimg.com/vi/VEmaJQw-tfg/default.jpg,https://i.ytimg.com/vi/VEmaJQw-tfg/mqdefault.jpg,https://i.ytimg.com/vi/VEmaJQw-tfg/hqdefault.jpg
LEew46JN81I,MY CAR GOT REPOED **WE'RE GOING BROKE**,https://i.ytimg.com/vi/LEew46JN81I/default.jpg,https://i.ytimg.com/vi/LEew46JN81I/mqdefault.jpg,https://i.ytimg.com/vi/LEew46JN81I/hqdefault.jpg
j5l6CH9RvDU,NOVA'S 2ND BIRTHDAY PARTY 💕,https://i.ytimg.com/vi/j5l6CH9RvDU/default.jpg,https://i.ytimg.com/vi/j5l6CH9RvDU/mqdefault.jpg,https://i.ytimg.com/vi/j5l6CH9RvDU/hqdefault.jpg
UMDLt9Ww528,THE PRINCE FAMILY CAR COLLECTION **SUPERCAR TOUR**,https://i.ytimg.com/vi/UMDLt9Ww528/default.jpg,https://i.ytimg.com/vi/UMDLt9Ww528/mqdefault.jpg,https://i.ytimg.com/vi/UMDLt9Ww528/hqdefault.jpg
fw08Xg4k0uc,HOW TO MAKE BANANA SPILT | COOKING WITH THE PRINCE FAMILY,https://i.ytimg.com/vi/fw08Xg4k0uc/default.jpg,https://i.ytimg.com/vi/fw08Xg4k0uc/mqdefault.jpg,https://i.ytimg.com/vi/fw08Xg4k0uc/hqdefault.jpg
Fbkn92-w1eM,THE PRINCE FAMILY IS OFFICIALLY BANNED FROM TIK TOK **SHE CRIED**,https://i.ytimg.com/vi/Fbkn92-w1eM/default.jpg,https://i.ytimg.com/vi/Fbkn92-w1eM/mqdefault.jpg,https://i.ytimg.com/vi/Fbkn92-w1eM/hqdefault.jpg
hjDG_PBSjY8,THE DOCTOR RUINED MY HAIRLINE FOREVER **BAD IDEA**,https://i.ytimg.com/vi/hjDG_PBSjY8/default.jpg,https://i.ytimg.com/vi/hjDG_PBSjY8/mqdefault.jpg,https://i.ytimg.com/vi/hjDG_PBSjY8/hqdefault.jpg
Y70dADKZN7I,BABY NOVA CHOOSES WHAT WE EAT FOR 24 HOURS!!,https://i.ytimg.com/vi/Y70dADKZN7I/default.jpg,https://i.ytimg.com/vi/Y70dADKZN7I/mqdefault.jpg,https://i.ytimg.com/vi/Y70dADKZN7I/hqdefault.jpg
t65iO8At8t4,Testing Viral TikTok SECRET Drinks! **MUST HAVE**,https://i.ytimg.com/vi/t65iO8At8t4/default.jpg,https://i.ytimg.com/vi/t65iO8At8t4/mqdefault.jpg,https://i.ytimg.com/vi/t65iO8At8t4/hqdefault.jpg
QqrumgmeJQ8,"WHATEVER YOU PAINT, I'LL BUY IT CHALLENGE",https://i.ytimg.com/vi/QqrumgmeJQ8/default.jpg,https://i.ytimg.com/vi/QqrumgmeJQ8/mqdefault.jpg,https://i.ytimg.com/vi/QqrumgmeJQ8/hqdefault.jpg
ePypksbN_Nk,HOW TO COOK OREO RICE KRISPY TREATS  | COOKING WITH THE PRINCE FAMILY,https://i.ytimg.com/vi/ePypksbN_Nk/default.jpg,https://i.ytimg.com/vi/ePypksbN_Nk/mqdefault.jpg,https://i.ytimg.com/vi/ePypksbN_Nk/hqdefault.jpg
LfybVBfdges,THE WORST EASTER EVER **EVERYTHING RUINED**,https://i.ytimg.com/vi/LfybVBfdges/default.jpg,https://i.ytimg.com/vi/LfybVBfdges/mqdefault.jpg,https://i.ytimg.com/vi/LfybVBfdges/hqdefault.jpg
uGf_FNS9E38,THE REVEAL OF DAMIEN'S NEW HAIRLINE **SHE FREAKED OUT**,https://i.ytimg.com/vi/uGf_FNS9E38/default.jpg,https://i.ytimg.com/vi/uGf_FNS9E38/mqdefault.jpg,https://i.ytimg.com/vi/uGf_FNS9E38/hqdefault.jpg
rFDFdyex-sg,HE GOT EMERGENCY SURGERY **PLEASE PRAY**,https://i.ytimg.com/vi/rFDFdyex-sg/default.jpg,https://i.ytimg.com/vi/rFDFdyex-sg/mqdefault.jpg,https://i.ytimg.com/vi/rFDFdyex-sg/hqdefault.jpg
d08DcmPrYc8,WE FINALLY GOT OUR DREAM HOME **EMPTY HOUSE TOUR**,https://i.ytimg.com/vi/d08DcmPrYc8/default.jpg,https://i.ytimg.com/vi/d08DcmPrYc8/mqdefault.jpg,https://i.ytimg.com/vi/d08DcmPrYc8/hqdefault.jpg
RQyamFRJLJM,A DAY IN THE LIFE WITH BIANNCA | AFTER PREGNANCY WORKOUT | MOM OF 4 KIDS | COOKING VLOG | STORY TIME,https://i.ytimg.com/vi/RQyamFRJLJM/default.jpg,https://i.ytimg.com/vi/RQyamFRJLJM/mqdefault.jpg,https://i.ytimg.com/vi/RQyamFRJLJM/hqdefault.jpg
UuY1u6ZH-4o,OUR SON DJ GOT HIS HAIR CUT FOR THE FIRST TIME **CRAZY REACTION**,https://i.ytimg.com/vi/UuY1u6ZH-4o/default.jpg,https://i.ytimg.com/vi/UuY1u6ZH-4o/mqdefault.jpg,https://i.ytimg.com/vi/UuY1u6ZH-4o/hqdefault.jpg
U4XwhKJ7KtE,THIS FAMILY CHANNEL MUST BE STOPPED,https://i.ytimg.com/vi/U4XwhKJ7KtE/default.jpg,https://i.ytimg.com/vi/U4XwhKJ7KtE/mqdefault.jpg,https://i.ytimg.com/vi/U4XwhKJ7KtE/hqdefault.jpg
RD7n9boESoY,DAMIEN GOT ATTACKED BY ANIMALS AT THE ZOO **BAD IDEA**,https://i.ytimg.com/vi/RD7n9boESoY/default.jpg,https://i.ytimg.com/vi/RD7n9boESoY/mqdefault.jpg,https://i.ytimg.com/vi/RD7n9boESoY/hqdefault.jpg
oxA7oaeQT1Q,SHE WANTS TO MAKE ANOTHER BABY IN MIAMI 🌴👶🏽 **TRAVEL VLOG**,https://i.ytimg.com/vi/oxA7oaeQT1Q/default.jpg,https://i.ytimg.com/vi/oxA7oaeQT1Q/mqdefault.jpg,https://i.ytimg.com/vi/oxA7oaeQT1Q/hqdefault.jpg
FF4JDq9s75A,WE MOVED OUT OF STATE **NEW HOUSE TOUR**,https://i.ytimg.com/vi/FF4JDq9s75A/default.jpg,https://i.ytimg.com/vi/FF4JDq9s75A/mqdefault.jpg,https://i.ytimg.com/vi/FF4JDq9s75A/hqdefault.jpg
F2VGTSbw4s8,We Broke Up **Goodbye**,https://i.ytimg.com/vi/F2VGTSbw4s8/default.jpg,https://i.ytimg.com/vi/F2VGTSbw4s8/mqdefault.jpg,https://i.ytimg.com/vi/F2VGTSbw4s8/hqdefault.jpg
BzZ0Y1fCn4o,THE PRINCE FAMILY KIDS GOT STUCK IN THE SNOW STORM 🥶 **THEY FROZE**,https://i.ytimg.com/vi/BzZ0Y1fCn4o/default.jpg,https://i.ytimg.com/vi/BzZ0Y1fCn4o/mqdefault.jpg,https://i.ytimg.com/vi/BzZ0Y1fCn4o/hqdefault.jpg
PFySpwGir88,I SPENT MY BIRTHDAY ALONE **WORST DAY EVER**,https://i.ytimg.com/vi/PFySpwGir88/default.jpg,https://i.ytimg.com/vi/PFySpwGir88/mqdefault.jpg,https://i.ytimg.com/vi/PFySpwGir88/hqdefault.jpg
XcGyv99D3uw,WE LOST ALL POWER **PLEASE HELP**,https://i.ytimg.com/vi/XcGyv99D3uw/default.jpg,https://i.ytimg.com/vi/XcGyv99D3uw/mqdefault.jpg,https://i.ytimg.com/vi/XcGyv99D3uw/hqdefault.jpg
D_pz_3EFmfQ,AYLA'S 3RD MONTH BIRTHDAY PARTY 💕,https://i.ytimg.com/vi/D_pz_3EFmfQ/default.jpg,https://i.ytimg.com/vi/D_pz_3EFmfQ/mqdefault.jpg,https://i.ytimg.com/vi/D_pz_3EFmfQ/hqdefault.jpg
07QS2edOsss,WE'RE MAKING BABY #5 **PREGNANCY UPDATE**,https://i.ytimg.com/vi/07QS2edOsss/default.jpg,https://i.ytimg.com/vi/07QS2edOsss/mqdefault.jpg,https://i.ytimg.com/vi/07QS2edOsss/hqdefault.jpg
bjWVhLSchXM,DJ's 6TH BIRTHDAY PARTY ❤️,https://i.ytimg.com/vi/bjWVhLSchXM/default.jpg,https://i.ytimg.com/vi/bjWVhLSchXM/mqdefault.jpg,https://i.ytimg.com/vi/bjWVhLSchXM/hqdefault.jpg
VISRUQyzQZU,I DROPPED BABY AYLA PRANK **BAD IDEA**,https://i.ytimg.com/vi/VISRUQyzQZU/default.jpg,https://i.ytimg.com/vi/VISRUQyzQZU/mqdefault.jpg,https://i.ytimg.com/vi/VISRUQyzQZU/hqdefault.jpg
K0sFQ9gIxA0,THE PRINCE FAMILY OFFICIAL NEW HOUSE TOUR,https://i.ytimg.com/vi/K0sFQ9gIxA0/default.jpg,https://i.ytimg.com/vi/K0sFQ9gIxA0/mqdefault.jpg,https://i.ytimg.com/vi/K0sFQ9gIxA0/hqdefault.jpg
r5NHmo4G2vI,AYLA CAN HEAR FOR THE FIRST TIME **SHOCKING REACTION**,https://i.ytimg.com/vi/r5NHmo4G2vI/default.jpg,https://i.ytimg.com/vi/r5NHmo4G2vI/mqdefault.jpg,https://i.ytimg.com/vi/r5NHmo4G2vI/hqdefault.jpg
3JjTrQ7-ej8,AYLA LOST HER HEARING...,https://i.ytimg.com/vi/3JjTrQ7-ej8/default.jpg,https://i.ytimg.com/vi/3JjTrQ7-ej8/mqdefault.jpg,https://i.ytimg.com/vi/3JjTrQ7-ej8/hqdefault.jpg
7h5LyN4UFSw,AYLA'S 2ND MONTH BIRTHDAY PARTY 💕,https://i.ytimg.com/vi/7h5LyN4UFSw/default.jpg,https://i.ytimg.com/vi/7h5LyN4UFSw/mqdefault.jpg,https://i.ytimg.com/vi/7h5LyN4UFSw/hqdefault.jpg
GjflLGzoUoY,1 VS 1 AGAINST MY 12 YEAR OLD BROTHER DARION THE TIE BREAKER BASKETBALL GAME 💔😭 **WINNER GETS CAR**,https://i.ytimg.com/vi/GjflLGzoUoY/default.jpg,https://i.ytimg.com/vi/GjflLGzoUoY/mqdefault.jpg,https://i.ytimg.com/vi/GjflLGzoUoY/hqdefault.jpg
oA9LeQGVFdw,FACE TO FACE WITH MY 12 YEAR OLD BROTHER DARION **I REPOED MY DADS CAR**,https://i.ytimg.com/vi/oA9LeQGVFdw/default.jpg,https://i.ytimg.com/vi/oA9LeQGVFdw/mqdefault.jpg,https://i.ytimg.com/vi/oA9LeQGVFdw/hqdefault.jpg
PJ3XjHtgFoA,The Prince Family - 12 Year Old Brother Diss Track (Official Music Video),https://i.ytimg.com/vi/PJ3XjHtgFoA/default.jpg,https://i.ytimg.com/vi/PJ3XjHtgFoA/mqdefault.jpg,https://i.ytimg.com/vi/PJ3XjHtgFoA/hqdefault.jpg
ko53epwrCFE,I MADE A DISS TRACK ON MY 12 YEAR OLD BROTHER DARION & MY DAD **CAREER ENDING**,https://i.ytimg.com/vi/ko53epwrCFE/default.jpg,https://i.ytimg.com/vi/ko53epwrCFE/mqdefault.jpg,https://i.ytimg.com/vi/ko53epwrCFE/hqdefault.jpg
-hLNtphiBdA,REACTING TO THE PRINCE FAMILY - DISS TRACK (OFFICIAL MUSIC VIDEO),https://i.ytimg.com/vi/-hLNtphiBdA/default.jpg,https://i.ytimg.com/vi/-hLNtphiBdA/mqdefault.jpg,https://i.ytimg.com/vi/-hLNtphiBdA/hqdefault.jpg
Fi8-J-PDREk,THE PRINCE FAMILY'S NEW INTRO VIDEO!!!,https://i.ytimg.com/vi/Fi8-J-PDREk/default.jpg,https://i.ytimg.com/vi/Fi8-J-PDREk/mqdefault.jpg,https://i.ytimg.com/vi/Fi8-J-PDREk/hqdefault.jpg
1gP5_3sMCMY,OPENING PRESENTS ON CHRISTMAS MORNING WITH THE PRINCE FAMILY!!,https://i.ytimg.com/vi/1gP5_3sMCMY/default.jpg,https://i.ytimg.com/vi/1gP5_3sMCMY/mqdefault.jpg,https://i.ytimg.com/vi/1gP5_3sMCMY/hqdefault.jpg
Ub-MJE9FC24,WE CAUGHT OUR KIDS OPENING CHRISTMAS PRESENTS EARLY **THEY'RE IN TROUBLE**,https://i.ytimg.com/vi/Ub-MJE9FC24/default.jpg,https://i.ytimg.com/vi/Ub-MJE9FC24/mqdefault.jpg,https://i.ytimg.com/vi/Ub-MJE9FC24/hqdefault.jpg
A-q6dmjSUl0,SHE HAD AN ALLERGIC REACTION **PERMANENT VENEERS**,https://i.ytimg.com/vi/A-q6dmjSUl0/default.jpg,https://i.ytimg.com/vi/A-q6dmjSUl0/mqdefault.jpg,https://i.ytimg.com/vi/A-q6dmjSUl0/hqdefault.jpg
aSMaKwfn-JA,I PROPOSED TO DAMIEN FOR CHRISTMAS ❤️,https://i.ytimg.com/vi/aSMaKwfn-JA/default.jpg,https://i.ytimg.com/vi/aSMaKwfn-JA/mqdefault.jpg,https://i.ytimg.com/vi/aSMaKwfn-JA/hqdefault.jpg
8YRbIqFSncA,COOKING BREAKFAST WITH THE PRINCE FAMILY,https://i.ytimg.com/vi/8YRbIqFSncA/default.jpg,https://i.ytimg.com/vi/8YRbIqFSncA/mqdefault.jpg,https://i.ytimg.com/vi/8YRbIqFSncA/hqdefault.jpg
f7OzJBRz140,I'M NOT THE FATHER,https://i.ytimg.com/vi/f7OzJBRz140/default.jpg,https://i.ytimg.com/vi/f7OzJBRz140/mqdefault.jpg,https://i.ytimg.com/vi/f7OzJBRz140/hqdefault.jpg
SN3yyp4UsUU,"DON’T CRUSH THE WRONG MYSTERY PRESENT (PS5, iPHONE)",https://i.ytimg.com/vi/SN3yyp4UsUU/default.jpg,https://i.ytimg.com/vi/SN3yyp4UsUU/mqdefault.jpg,https://i.ytimg.com/vi/SN3yyp4UsUU/hqdefault.jpg
6RUWjZemIjg,SURPRISING BIANNCA WITH HER DREAM CAR + THE PRINCE FAMILY CHRISTMAS PHOTOSHOOT,https://i.ytimg.com/vi/6RUWjZemIjg/default.jpg,https://i.ytimg.com/vi/6RUWjZemIjg/mqdefault.jpg,https://i.ytimg.com/vi/6RUWjZemIjg/hqdefault.jpg
isLC6LjToFI,SHE CAUGHT ME TEXTING ANOTHER FEMALE **I'M SORRY**,https://i.ytimg.com/vi/isLC6LjToFI/default.jpg,https://i.ytimg.com/vi/isLC6LjToFI/mqdefault.jpg,https://i.ytimg.com/vi/isLC6LjToFI/hqdefault.jpg
mVK0MMpxbp0,AYLA'S NIGHT ROUTINE **NEWBORN BABY**,https://i.ytimg.com/vi/mVK0MMpxbp0/default.jpg,https://i.ytimg.com/vi/mVK0MMpxbp0/mqdefault.jpg,https://i.ytimg.com/vi/mVK0MMpxbp0/hqdefault.jpg
7PibaG5H7A8,this video will get deleted at the end of 2020,https://i.ytimg.com/vi/7PibaG5H7A8/default.jpg,https://i.ytimg.com/vi/7PibaG5H7A8/mqdefault.jpg,https://i.ytimg.com/vi/7PibaG5H7A8/hqdefault.jpg
1Agthk4iECk,BIANNCA SAVED KYRIE FROM DROWNING **FIRST SWIMMING LESSON**,https://i.ytimg.com/vi/1Agthk4iECk/default.jpg,https://i.ytimg.com/vi/1Agthk4iECk/mqdefault.jpg,https://i.ytimg.com/vi/1Agthk4iECk/hqdefault.jpg
djkWMbRTR0o,HEALTHY VS JUNK FOOD CHALLENGE,https://i.ytimg.com/vi/djkWMbRTR0o/default.jpg,https://i.ytimg.com/vi/djkWMbRTR0o/mqdefault.jpg,https://i.ytimg.com/vi/djkWMbRTR0o/hqdefault.jpg
E3zFKpZ5614,KYRIE'S 4TH BIRTHDAY PARTY 💙,https://i.ytimg.com/vi/E3zFKpZ5614/default.jpg,https://i.ytimg.com/vi/E3zFKpZ5614/mqdefault.jpg,https://i.ytimg.com/vi/E3zFKpZ5614/hqdefault.jpg
_p2sBKgwZWw,WE'RE GOING BROKE **THE TRUTH**,https://i.ytimg.com/vi/_p2sBKgwZWw/default.jpg,https://i.ytimg.com/vi/_p2sBKgwZWw/mqdefault.jpg,https://i.ytimg.com/vi/_p2sBKgwZWw/hqdefault.jpg
